"topic","date"," time","place","url","date published","article text"
"assassination","2023-05-09","Not Discerned","{""Islamabad"", ""FederalCapitalArea"", ""Pakistan""}","https://news.google.com/rss/articles/CBMimAFodHRwczovL3d3dy5tc24uY29tL2VuLWluL25ld3Mvb3RoZXIvcGFraXN0YW4taXMtdGVldGVyaW5nLW9uLXRoZS1lZGdlLW9mLWEtY3ljbGljYWwtcGhlbm9tZW5vbi1idXQtdGhpcy10aW1lLXN0YWtlcy1hcmUtdG9vLWhpZ2gvYXItQUExYmw5VFk_bGk9QUFnZ2VzMdIBAA?oc=5&hl=en-US&gl=US&ceid=US:en","Thu 18 May 2023 05:16:25","© Provided by Firstpost Pakistan is teetering on the edge of a cyclical phenomenon, but this time stakes are too high  High-voltage spectacle leading to the arrest of former Pakistan prime minister Imran Khan by the Rangers on 9 May 2023 at the Court House in Islamabad resulted in turmoil across the country. The intensity of violence unleashed by the workers of Imran’s party, Pakistan Tehreek-e-Insaf (PTI), was well beyond expectations. The rampage resulted in the loss of over a dozen lives and colossal damage to the property, including that of military establishments. Despite the ruthless crackdown by security forces, the environment continues to be volatile.  The explosive situation took another dramatic turn two days later when on 11 May, the Supreme Court of Pakistan (SC) ordered Imran Khan’s immediate release, calling his arrest to be illegal. While Imran’s followers rejoiced, the government accused the judiciary of acting politically and favouring the former prime minister. The SC decision came as a jolt even for the army. The next very day, Islamabad High Court granted bail to Imran Khan along with two weeks’ reprieve from arrest in the Al-Qadir trust case. It also provided him immunity from arrest in any case filed after 9 May. Immediately on his release, Imran Khan went ballistic, squarely blaming the Army Chief General Asim Munir for destroying the nation and creating chaos.  The gravity of the prevailing situation reverberates the outrage that followed former prime minister Benazir Bhutto’s assassination in 2007. Ongoing unrest probably is the worst since 1971, which ended up in the dismemberment of Pakistan. The current political calamity could not have come at the worst time when Pakistan is in the grip of a serious economic crisis, almost on the verge of bankruptcy.  In its 75 years of existence, for half the time Pakistan has been ruled by army generals. Even during the times, the civilian government was in place, the army continued to exercise effective control by proxy. For that matter, Imran Khan also wears the tag of the selected prime minister as the army played a key role in his coming to power in 2018, orchestrating the dismissal of the Nawaz Sharif government on corruption charges.  Going by the history of civil-military relations in Pakistan, no civilian government has been able to complete its full term. So was the case with Imran Khan who fell out of favour with the then Army Chief General Qamar Bajwa, his benefactor, over the appointment of DG ISI (Director General Inter Service Intelligence). While Imran Khan wanted Lt Gen Faiz Hameed to continue as the head of ISI and subsequently take over as the Chief, General Bajwa overruled the prime minister and appointed Lt Gen Nadeem Anjum as the DG.  The army ultimately got rid of Imran Khan last April, by engineering his toppling through a ‘no confidence motion’ paving the way for Shehbaz Sharif to become the prime minister. After his ouster, Imran Khan vociferously took up an anti-army stance, gaining considerable public popularity in the process. He went on to level allegations against Major General Faisal Nasser, head of counter-intelligence in ISI for an attempt on his life. Imran Khan has been demanding early elections in a bid to cash in the favourable public sentiments. However, his coming to power is not in the army’s interest. General Asim Munir, in fact, has a personal grudge against Imran Khan for removing him from the post of DG ISI prematurely when he reportedly initiated an investigation of corruption charges against Bushra Bibi-Imran’s wife.  Unprecedented public anger is directed against the Pakistan Army (Chief) fueled by hardships faced by the common person in the wake of harsh economic conditions, given that military continues to maintain a lavish lifestyle. There are also reports about dissidence within the army, evident from a major military reshuffle wherein Lt Gen Salman Ghani commander of the Lahore-based Corps stands replaced by Lt Gen Fayyaz Shah. Reports of purges against the pro-Imran elements in the army have also surfaced."
"assassination","1964-05-19","Not Discerned","Not Discerned","https://news.google.com/rss/articles/CBMicGh0dHBzOi8vbmV3cy53Z2N1Lm9yZy9hcnRzLWFuZC1jdWx0dXJlLzIwMjMtMDUtMTcvaGFwcHktYmlydGhkYXktbWFyaWx5bi1tb25yb2Utc3R5bGUtc29uZy1vZi10aGUtZGF5LWZvci1tYXktMTnSAQA?oc=5&hl=en-US&gl=US&ceid=US:en","Wed 17 May 2023 20:41:00","Ella Fitzgerald, Harry Belafonte, Bobby Darin and Maria Callas sang. Shirley McClain, Jimmy Durante, Jack Benny, and Henry Fonda entertained. But it was Marilyn Monroe who didn't just steal the show, she made John F. Kennedy's 45th birthday celebration on May 19, 1964 a part of presidential lore when she sang, ""Happy Birthday.""  Fifteen thousand people attended. Actor Peter Lawford, the president's brother-in-law, was the MC and made a running joke of Monroe's reputation for tardiness. He would announce her entrance, and there would be no Marilyn. Finally, she came out in a white stole and a $12,000 dress. When she removed the stole the audience gasped.  Time magazine wrote, ""the figure was famous. And for one breathless moment 15,000 people in Madison Square Garden thought they were going to see all of it."" A Canadian billionaire purchased that dress in 2016 for $4.8 million.  Jackie Kennedy wasn't at the televised party. She was livid the next day, blaming Robert Kennedy for inviting Monroe to sing. The event only raised more rumors of an affair between Kennedy and Monroe.  Did they have an affair? Historians are divided on the question.  Kennedy and Monroe would never see each other again after his birthday serenade. She died that August from a drug overdose. He would be assassinated three months later.  Song of the Day is created by Sheldon Zoldan, and produced by Pam James for WGCU."
"assassination","2023-05-17","17:00:00","{""Bombay"", ""Maharashtra"", ""India""}","https://news.google.com/rss/articles/CBMirgFodHRwczovL3d3dy5sYXRlc3RseS5jb20vd29ybGQvdmxhZGltaXItcHV0aW4tc2lnbmVkLWRlY3JlZS10by1ncmFudC1xdWljay1jaXRpemVuc2hpcC10by1mb3JlaWduLW5hdGlvbmFscy13aG8td2lsbC1maWdodC1mb3ItcnVzc2lhLWFnYWluc3QtdWtyYWluZS1zYXlzLXJlcG9ydC01MTMzOTgyLmh0bWzSAbIBaHR0cHM6Ly93d3cubGF0ZXN0bHkuY29tL3dvcmxkL3ZsYWRpbWlyLXB1dGluLXNpZ25lZC1kZWNyZWUtdG8tZ3JhbnQtcXVpY2stY2l0aXplbnNoaXAtdG8tZm9yZWlnbi1uYXRpb25hbHMtd2hvLXdpbGwtZmlnaHQtZm9yLXJ1c3NpYS1hZ2FpbnN0LXVrcmFpbmUtc2F5cy1yZXBvcnQtNTEzMzk4Mi5odG1sL2FtcA?oc=5&hl=en-US&gl=US&ceid=US:en","Wed 17 May 2023 11:53:28","Mumbai, May 17: Amid the ongoing war between Russia and Ukraine, Russian President Vladimir Putin's new plan involves providing quick citizenship to foreigners who fight for Russia against Ukraine. If reports are to be believed, Vladimir Putin has reportedly signed a decree which will make obtaining Russian citizenship for foreign nationals easy and quick.  The decree, which is signed by the Russian President is likely to simplify the process of obtaining Russian citizenship for those foreign nationals, who will serve in Russia's army against Ukraine. As per a report in the Hindustan Times, the decree will apply only to foreign nations who will sign contracts with the Russian army to serve in the military for a period of one year. Vladimir Putin Survived Assassination Attempt? Kremlin Says Ukraine Attempted To Kill Russian President.  Who Will Get Russian Citizenship?  As per the report, only those individuals and their family members who serve in the army will be eligible to apply for Russian citizenship. These individuals will not be required to obtain a residence permit. Reportedly, the move by Russian President Vladimir Putin comes after the counteroffensive by Ukraine against Russia's invasion.  Several reports also claim that Vladimir Putin has signed a number of decrees in a bid to boost the number of his troops as Russia faces loss amid the ongoing war. The move to grant Russian citizenship to foreign nationals comes a year after the Russian government last year approved legislation to remove the upper age limit for contractual service in the Russian army. Vladimir Putin Health Update: Russian President Receiving Chemotherapy for Cancer, Confirm Leaked US Documents.  Last year in August, the Russian President signed a decree to increase the size of his army. The move by Putin comes a few days after the Kremlin alleged that Kyiv tried to kill the Russian President. On May 3, Moscow said that they shot down two drones launched by Ukraine. The Kremlin has also accused Kyiv of attempting to kill Russian President Vladimir Putin in the alleged drone attack.  (The above story first appeared on LatestLY on May 17, 2023 05:23 PM IST. For more news and updates on politics, world, sports, entertainment and lifestyle, log on to our website latestly.com)."
"assassination","1963-11-22","12:30:00","{""Dallas"", ""Texas"", ""UnitedStates""}","https://news.google.com/rss/articles/CBMiKWh0dHBzOi8vd3d3Lmdkbm9ubGluZS5jb20vRGV0YWlscy8xMjQxOTE00gEA?oc=5&hl=en-US&gl=US&ceid=US:en","Wed 17 May 2023 09:46:11","Defamation on social media is a deliberate attempt to tarnish the image of an individual or individuals by propagating false or malicious information about them and thereby involving in character assassination. Social dignity and self-respect lost at the altar of social media abuse can never ever be compensated by any means ."
"assassination","2023-02-18","Not Discerned","{""Keene"", ""NewHampshire"", ""UnitedStates""}","https://news.google.com/rss/articles/CBMiZWh0dHBzOi8vcGtibmV3cy5pbi9tYXR0aGV3LWRhdmlzLWRlYXRoLWNhc2UtMTIteWVhci1vbGQtYW5nZWwtZ29tZXotYXJyZXN0ZWQtYW5kLWNoYXJnZWQtd2l0aC1tdXJkZXIv0gEA?oc=5&hl=en-US&gl=US&ceid=US:en","Wed 17 May 2023 10:47:39","How can someone easily kill a person? This kind of thought surely came into your mind whenever you hear any murder news. However, the reason for taking the life of someone might be different but it is a sin in every nature. And that is why the punishment for this crime is quite serious but still such cases are not taking the name to stop. This time as well, we all came here to talk about the murder of Matthew Davis whose killer identification is recently disclosed. People are quite furious with this murder and want to know why the killer killed him. You all will be get shocked after hearing that the murderer is just 12 years old and he is currently facing charges of murder in connection with the assassination of a Sonic restaurant team member.  Matthew Davis Death Case  As per authorities, the 12-year-old boy who has been charged with the murder is a citizen of Texas. This incident occurred last weekend and since then police was looking for the suspect. As per the reports, the 20-year-old, Angel Gomez was warned by the 32-year-old Matthew Davis for being unruly in the parking lot of the Keene, Texas restaurant at 09:40 PM last Saturday. After a physical struggle, the teen suspect allegedly shoot Davis several times from the back seat of the vehicle of Gomez, as shared by the Keene Police Department. However, the identification of the juvenile suspect has not been shared by the police due to the order of the court.  As soon as the victim was hit with a gun, he was instantly admitted to the hospital but unfortunately, he was not survived and lost his life. As per homicide officers, officers rushed to the 300 block of South Old Betsy Road at around 09:40 AM and found the dead body of the sufferer lying in the parking lot. As per police 20-year-old, Angel Gomez who hails from Fort Worth was becoming disorderly in the parking lot when Davis “confronted” him, and the “argument soon became physical.” As per investigators, the teen who was with Gomez then proceeded to the van, took out the gun, and shot Davis multiple times.  As per the reports, a 20-year-old male and a 12-year-old are presently in police custody after the shooting and killing of the Sonic worker in Keene have been reported. One witness has shared the details of the entire horrifying scene and stated that “How could a 12-year-old kill someone in such a brutal manner? The most shocking thing is how he can get access to the gun at this age. It breaks my heart and still in a shock state.”"
"assassination","2020-05-01","Not Discerned","{""Blackburn"", ""BlackburnWithDarwen"", ""UnitedKingdom""}","https://news.google.com/rss/articles/CBMifGh0dHBzOi8vd3d3LmxhbmNhc2hpcmV0ZWxlZ3JhcGguY28udWsvbmV3cy9jcmltZS8yMzUyNzcyMi5heWEtaGFjaGVtLWZhbWlseS1tYXJrLXRocmVlLXllYXJzLXNpbmNlLWJsYWNrYnVybi1zdHVkZW50cy1kZWF0aC_SAQA?oc=5&hl=en-US&gl=US&ceid=US:en","Wed 17 May 2023 15:00:00","Today (May 17), the family were joined by people from across the local community on the third anniversary of her death.  They visited the spot where Aya was tragically shot to lay flowers and to remember her life.  Aspiring law student Aya, 19, was murdered during the month of Ramadan on Sunday, May 17, 2020, as she walked by Quick Shine Car Wash on Whalley Banks.  She was struck by a stray bullet, shot from a passing Toyota Avensis.  Aya’s mum, Samar Salame visited Blackburn and was joined by some of Aya’s friends.  New pictures were also released of the student by the family.  The family have said it is very difficult to return to the town following the events of 2020, having since moved to London.  Mrs Salame spent time putting flowers around a pole which has become a focal point for commemorations each year.  She had to be supported by friends who had come to pay their own respects to Aya.  On occasions passers-by would stop to say dua (prayers) and others came to lay their own flowers at the spot.  Aya’s mum, Samar Salame visited Blackburn on the anniversary of the death  Speaking today Mrs Salame said found it hard to return to the town since the death of her daughter.  Holding back tears she had to be comforted by Aya’s friends as she spoke.  She said: “It is not fair. For those people to be breathing and alive and my daughter she under the soil in her grave.  “Still her brothers and sisters are suffering. Our life is damaged. They smashed us. They killed us.  “I hope their prisons will be their graves.”  New pictures of Aya have been released on the third anniversary of her death (NQ/Aya Hachem Family)  Permanent memorial to remember Aya  It has also been revealed there are plans to make a permanent memorial at the site where Aya was killed.  This will be in the form of a plaque on the pole, which would be painted the colour green.  The family are said to be looking at producing their own plaque which would be a permanent reminder of that fateful day and also celebrate the life of Aya.  The pole is owned by broadband company 6G Internet and the firm said they would work with the family in ‘whatever way they could’.  Simon Jones from 6G Internet said: “This is an extremely sombre time for the family, the local community and the whole town.  “If the family wish to commemorate the life of Aya Hachem at the site with a permanent memorial we will do whatever we can to assist them.”  The company also said it would pay for any costs incurred for the memorial.  Who was Aya Hachem?  Aya was an aspiring lawyer who was studying at the University of Salford, and her family had moved to Blackburn 10 years before her death, fleeing from violence in Lebanon.  Five years after arriving in the country, a 14-year-old Aya Hachem and her parents went to a charity event to help traumatised refugees settle into life in the county.  In the decade she lived in the town, Aya thrust herself into British life, learning English and excelling at school. She became one of the Children’s Society’s youngest ever trustees at 16.  Aya started at the University of Salford when she was 18 and was in her second year when she was murdered.  What happened on the day  Aya Hachem was walking home from Lidl, passing Quick Shine Tyres in Blackburn on May 17, 2020, when a hit which had been organised to kill the business owner, Pachah Khan, tragically saw her shot and killed.  The assassination attempt was organised by one of the owners of RI Tyres, Quick Shine’s neighbouring business, because they were angry about the fact Quick Shine had started to sell tyres.  Feroz Suleman masterminded a plan to have Mr Khan killed, bringing in trusted friends and allies to help carry out the shooting.  Feroz Suleman, Zamir Raja, Anthony Ennis, Louis Otway, Ayaz Hussain, Kashim Manzoor, Uthman Satia and Abubakr Satia have all been found guilty of murder and attempted murder.  Judy Chapman was found guilty of manslaughter.  Suhayl Suleman, brother of Feroz stood trial for the murder of Aya and attempted murder of Pachah Khan but was acquitted."
"assassination","1990-04-05","Not Discerned","{""Srinagar"", ""JammuAndKashmir"", ""India""}","https://news.google.com/rss/articles/CBMiXGh0dHBzOi8vZ29hY2hyb25pY2xlLmNvbS9rYXNobWlyaS1wYW5kaXQtZmFtaWx5LXdhbnRzLWZhdGhlci1zb24tZHVvcy1raWxsaW5nLWNhc2UtcmVvcGVuZWQv0gEA?oc=5&hl=en-US&gl=US&ceid=US:en","Wed 17 May 2023 10:28:54","Srinagar: A day after J&K police announced the arrest of two absconding assassins of Moulvi Mohammad Farooq, the family of Sarwanand Koul Premi, a well-known Kashmiri Pandit writer who was killed along with his son allegedly by militants in April 1990 has sought reopening of the case.  Farooq had been killed 33 years back.  The family has asked the J&K government to take the case of the father-son duo’s killing to a logical conclusion.  “We praise the J&K police for cracking the assassination case of Moulvi Mohammad Farooq after 33 years… We once again urge upon the J&K Lt Governor as well Government of India for not only reopening of this case and taking this case to a logical conclusion, so as to bring the culprits of this whole conspiracy to justice,” Rajinder Premi, son of Sarwanand Koul Premi said.  The family said Sarwanand Premi, 65, and his younger son Verinder Koul, 27, were killed by the militants in April 1990 after they were kidnapped from their home at native village in South Kashmir’s Anantnag district. Within a week after the incident, the Premi family left Kashmir.  The family said an FIR was registered in police station Dooru Anantnag, but this case was closed as untraced after a brief period, as no effective and expeditious investigation was done, The Family said the Police had arrested eight suspects involved, but later the case was closed as untraced.  Rajinder Premi said the family had approached the authorities with the request of handing this case to CBI for an expeditious and effective investigation, but due to unknown reasons was not allowed by the then J&K government.  They said the case of the father-son killing was not reopened despite the recommendations of the state Human Rights Commission (SHRC) in 2012.  Last year, the Jammu and Kashmir government recognised the literary contribution of Sarwanand Premi, who was conferred the lifetime achievement award posthumously on Republic Day. Sarwanand Premi authored more than three dozen books, which include translations of the “Bhagavad Gita” into Urdu and ‘Ramayana’ into Kashmir. He also translated into Kashmiri Rabindranath Tagore’s ‘Geetanjali’."
"assassination","1865-04-14","Not Discerned","Not Discerned","https://news.google.com/rss/articles/CBMiTmh0dHBzOi8vd3d3Lm55dGltZXMuY29tLzIwMjMvMDUvMTcvYm9va3MvcmV2aWV3L2xpbmNvbG5zLWdvZC1qb3NodWEtemVpdHouaHRtbNIBAA?oc=5&hl=en-US&gl=US&ceid=US:en","Wed 17 May 2023 09:00:20","His second Inaugural Address remains a towering achievement. Lincoln’s attempt to comprehend divine purpose in the tragedy of “American Slavery” and the war that ended it remains a work of bracing spiritual honesty, all the more surprising for the fact that its author had once had to print a handbill assuring the public that he was not an “open scoffer” at religion.  Tackling this paradox is the challenge before Joshua Zeitz, a biographer of Lincoln’s two secretaries, John Hay and John Nicolay, who now turns his lens on the president himself.  Lincoln’s religion has been treated before, in the hagiographies that followed his assassination, when “Americans needed to memorialize Lincoln as a Christian martyr,” as Zeitz puts it, and in the writings of his former law partner, William Herndon, who set out to define him as an “un-believer.” Zeitz weaves between the dogmas, revealing a complex thinker who deftly merged religious language with political goals and underwent a “spiritual renewal” during the Civil War, especially after the death of his son Willie in 1862.  Zeitz adds meaningful context to the story, examining the ways in which soldiers experienced religion in the field; both sides held revival meetings. Above and below the Mason-Dixon line, religious leaders leaned into the conflict and found reasons to believe they enjoyed a special relationship with the Almighty. The Confederacy claimed God’s support in its Constitution and motto (“Deo vindice”). Southern leaders denounced Northerners as “infidels,” a word that was sometimes applied to Lincoln, and claimed that the Bible justified slavery.  Lincoln, of course, disagreed with that selective reading, and as he moved decisively against slavery in the final years of the war, he often claimed a spiritual justification. His speeches drew heavily on Scripture, including, in 1858, the “house divided” (Matthew 12:25); then, at Gettysburg, “four score and seven years ago” (paraphrasing Psalm 90); the second Inaugural Address, with its readings from Matthew 18:7 (“woe unto the world because of offenses …”); and Psalm 19 (“the judgments of the Lord are true and righteous altogether”). Frederick Douglass, who was present at the second inauguration, called it “more like a sermon than a state paper.” One scholar estimated that “266 of its 702 words were quoted verbatim from the word of God.”"
