"topic","date"," time","place","url","date published","article text"
"assassination","1963-11-01","Not Discerned","{""Sarajevo"", ""FederacijaBosnaIHercegovina"", ""BosniaHerzegovina""}","https://news.google.com/rss/articles/CBMiYmh0dHBzOi8vcGxhbmV0cmFkaW8uY28udWsva2VycmFuZy9lbnRlcnRhaW5tZW50L211c2ljL2Zvby1maWdodGVycy1zdGVhbWluZy1ldmVudC1idXQtaGVyZS13ZS1hcmUv0gEA?oc=5&hl=en-US&gl=US&ceid=US:en","Wed 17 May 2023 15:51:33","Foo Fighters announce FREE streaming event for this Sunday  They have also premiered new track 'Under You'  Foo Fighters in August 2022 Author: Scott Colothan Published 17th May 2023    Foo Fighters have announced a completely free global streaming event for this weekend called Foo Fighters: Preparing Music for Concerts.  Available to watch in the UK at 8pm on Sunday night (21st May) on streaming app Veeps, Foo Fighters will be giving tracks from their upcoming 11th studio album ‘But Here We Are’ their live debut during the event.  Preparing Music for Concerts will be filmed at Foo Fighters’ own 606 Studios in California, and alongside the live music there will be behind the scenes footage, and a few surprises.  If you can’t watch the stream at the time, on-demand repeat viewing is enabled until Wednesday 24th May via Veeps HERE.  ‘Whether you’ve got tickets for an upcoming Foo Fighters show or not, don’t miss this chance to get intimate—and LOUD—with the last great American rock band,” a statement promoting the global stream event reads.  Foo Fighters streaming event  Joel Madden, CEO and Founder, Veeps said: ""Shows like this don't happen every day. To take this moment to gather fans worldwide, to give people an opportunity to share in the experience no matter where they are, is a gift.  “Having a place to make these moments accessible is why we built Veeps and we're honoured to be trusted with delivering this incredible show for Foo Fighters and all of their fans.”  The streaming event takes place just three days before Foo Fighters play their first headline show since Taylor Hawkins' death at at the Bank of New Hampshire Pavilion in Gilford, NH on 24th May.  Alongside announcing Foo Fighters: Preparing Music for Concerts, the band have also premiered the second single from ‘But Here We Are’ called ‘Under You.’  Written about the tragic passing of Taylor Hawkins, poignant lyrics include: “Someone said I’ll never see your face again / Part of me just can’t believe it’s true / Pictures of us sharing songs and cigarettes / This is how I’ll always picture you.”  Dave Grohl adds: “Over it / Think I’m getting over it / There’s no getting over It.”  Foo Fighters’ upcoming new album ‘But Here We Are’ is dedicated to Taylor Hawkins, and Dave Grohl’s late mum Virginia Hanlon Grohl.  Last week it was revealed that Foo Fighters will be announcing UK dates soon.  29 rock bands named after real people:  Pink Floyd Rock legends Pink Floyd took their moniker from the given names of two Piedmont blues artists that Syd Barrett had in his record collection, Pink Anderson and Floyd Council.  Pink Floyd - Pink Anderson and Floyd Council Photos of Pink Anderson and Floyd Council at the Pink Floyd exhibition Their Mortal Remains at London's Victoria and Albert Museum in 2017.  Lynyrd Skynyrd Southern rockers Lynyrd Skynyrd are named after high school gym teacher Leonard Skinner who taught Ronnie Van Zant, Gary Rossington, and Bob Burns at Robert E. Lee High School in Florida in the 1960s. Skinner was reportedly notorious for enforcing the school's policy against boys having long hair, and the Lynyrd Skynyrd band name was seen as an act of rebellion against him.  Lynyrd Skynyrd - Leonard Skinner A high school yearbook photos of Leonard Skinner in 1969. He died in 2010 aged 77.  The Yardbirds The influential British band's name was partially inspired by the nickname of American jazz saxophonist Charlie 'Yardbird' Parker. It's also the name given to rail yard hobos in Jack Kerouac's 1957 novel On the Road.  The Yardbirds - Charlie 'Yardbird' Parker Jazz musician Charlie 'Yardbird' Parker in 1955 – the year of his death aged just 34.  Ramones New York punk trailblazers Ramones were named by Dee Dee Ramone (Douglas Glenn Colvin) after Paul McCartney's briefly adopted pseudonym Paul Ramon in his Silver Beetles days in 1960.  Ramones - Paul Ramon with The Silver Beetles Paul McCartney (aka Paul Ramon) performs with The Silver Beetles in 1960. John Lennon and George Harrison were also in the group.  The Hollies The Hollies' co-founder Graham Nash revealed in a 2009 interview that they coined their band just moments before they were due to step on stage at the Oasis Club in Manchester in December 1962. The name comes from their admiration for Buddy Holly.  The Hollies - Buddy Holly Rock legend Buddy Holly in the late 1950s who inspired The Hollies band name. He died aged just 22 in the 3rd February 1959 plane crash that also claimed the lives of Ritchie Valens, ""The Big Bopper"" J. P. Richardson and their pilot Roger Peterson. It was later known as 'The Day the Music Died.'  Tesla Previously called City Kidd, the Sacramento rockers renamed themselves Tesla in homage to inventor and electrical engineer Nikola Tesla during the recording of their debut album 'Mechanical Resonance' in 1986. Some of the band's song and album titles nod towards Nikola Tesla too.  Tesla - Nikola Tesla An 1890 photo of 34-year-old inventor Nikola Tesla. He lived until he was 84 and was famously portrayed by David Bowie in the 2006 movie The Prestige.  Jethro Tull With Ian Anderson struggling to settle on a name for his band in the late 1960s (names included Navy Blue, Ian Henderson's Bag o' Nails, and Candy Coloured Rain), a member of the band's booking agent's staff christened them Jethro Tull after the 18th-century agriculturist.  Jethro Tull Jethro Tull, who helped to bring about the British Agricultural Revolution of the 18th century. He perfected a horse-drawn seed drill in 1701 that economically sowed the seeds in neat rows, and later developed a horse-drawn hoe. What a guy!  Creedence Clearwater Revival In 1967 the band toyed with renaming themselves Muddy Rabbit, Gossamer Wump, and Creedence Nuball and the Ruby, however they settled on Creedence Clearwater Revival with the 'Creedence' a nod towards guitarist Tom Fogerty's friend Credence Newball.  Crazy Horse Formerly known as The Rockets, the American band became known as Crazy Horse in 1969 when they first teamed up with Neil Young. The band was named after the 19th Century Sioux Tribe leader Crazy Horse.  Crazy Horse The Crazy Horse Memorial in the Black Hills of South Dakota. Work began on the sculpture in 1948 and it's still unfinished.  ZZ Top Billy Gibbons took direct inspiration from blues artists BB King and ZZ Hill as he liked the way the initials sounded in their stage names. He was initially going to call his band ZZ King but became concerned it sounded to similar to the original artist. Gibbons ultimately settled on ZZ Top as he remarked the ""king is at the top.""  ZZ Top - BB King and ZZ Hill Late blues icons BB King and ZZ Hill.  Greta Van Fleet The retrogressive rockers are named after a bluegrass musician called Gretna VanFleet, who hails from their home town of Frankenmuth, Michigan. Although Greta Van Fleet didn't initially ask her for permission, the 93-year-old subsequently gave them her blessing.  Molly Hatchet Just like their fellow Jacksonville rockers Lynyrd Skynyrd, Molly Hatchet were named after a real person. Molly Hatchet's moniker is more steeped in history, however, as they're named after an infamous 17th-century axe murderess dubbed 'hatchet molly'.  Kasabian Leicester indie rockers Kasabian take their name from Linda Kasabian who was a member of Charles Manson's cult, the Manson Family, in the late 1960s and 1970s. Linda Kasabian was present at both the Tate and LaBianca murders committed by the cult in 1969, but received immunity for her testimony as a key witness in the trial of Manson.  Kasabia - Linda Kasabian Linda Kasabian at a press conference in 1970. She passed away on 21st January 2023 aged 73.  Mookie Blaylock (Pearl Jam) Huge fans of the New York Jets basketball player Mookie Blaylock, the Seattle rockers decided to name their band in his honour. After playing a series of shows as Mookie Blaylock, they renamed themselves Pearl Jam in October '90 after signing to Epic Records.  Mookie Blaylock (Pearl Jam) - Mookie Blaylock Basketball player Mookie Blaylock when he played for Golden State Warriors  Franz Ferdinand Scottish indie rockers Franz Ferdinand are named after Archduke Franz Ferdinand of Austria whose assassination in Sarajevo in June 1914 sparked World War I.  Franz Ferdinand - Archduke Franz Ferdinand A portrait of Archduke Franz Ferdinand of Austria.  Dead Kennedys The politicised punk rockers' somewhat controversial name references the deceased members of the Kennedy family, including the assassinated President John F. Kennedy. Guitarist East Bay Ray said they weren't trying to insult the Kennedys. ""The assassinations were in much more poor taste than our band,"" he argued. ""We actually respect the Kennedy family. When JFK was assassinated, when Martin Luther King was assassinated, when RFK was assassinated, the American Dream was assassinated. Our name is actually homage to the American Dream.""  Dead Kennedys - John F Kennedy The 35th president of the United States, John F. Kennedy, who was assassinated in November 1963.  Kings of Leon The three Followill brothers (Caleb, Jared and Nathan) and their cousin Matthew named Kings of Leon after their grandfather Leon Followill, who died in January 2014.  The Brian Jonestown Massacre Founder and leader Anton Newcombe named his band after late-great Rolling Stones founder Brian Jones and the 1978 Jonestown Massacre.  The Brian Jonestown Massacre - Brian Jones Late-great Rolling Stones guitarist, founder and original leader Brian Jones in 1964.  Jimmy Eat World Jimmy Eat World indirectly take their moniker from guitarist Tom Linton's brother Jim. He explained in 1999: ""My brother Jim beat up my younger brother Ed, and Jim ran into his room and locked his door, and Ed drew this picture that said 'Jimmy Eat World', and it was a picture of him eating the world. My brother Jim is kind of a big guy. A stupid name.""  The Dandy Warhols The Oregon alt-rockers' name is a play on the name of revered American pop artist Andy Warhol.  The Dandy Warhols - Andy Warhol Andy Warhol (1928-1987) was an artist and experimental filmmaker and one of the founders of the Pop Art movement.  Melvins Melvins are named after a man called Melvin who was frontman Buzz Osborne's supervisor when he worked at a supermarket in Montesano, Washington. The real Melvin was widely disliked by staff and Osborne thought it would be a gloriously ridiculous name for his band.  James Gang James Gang are named after the 19th-century gang of American outlaws led by Jesse James. The band's final album 'Jesse Comes Home' references Jesse James and the artwork features a painting of the folk hero riding off into the sunset.  James Gang - Jesse James Jesse James (5th September 1847 to 3rd April 1882) was an American outlaw, gang leader, bank robber, train robber, and murderer from the state of Missouri and the most famous member of the James-Younger Gang.  The Dillinger Escape Plan Morris Plains metalcore merchants The Dillinger Escape Plan were christened by their friend Matt Makowski after he watched a documentary about 1930s bank robber John Dillinger, who made multiple escapes from jail.  The Dillinger Escape Plan - John Dillinger Bank robber John Herbert Dillinger in a colourised photo from 1933. He was shot dead while running from police the following year aged just 31.  Hootie and the Blowfish In 1986, American soft rockers Hootie and the Blowfish named themselves after the nicknames of two friends from college – 'Hootie' was Ervin Harris, and 'Blowfish' was Donald Feaster. ·  Van Der Graaf Generator A few months after the death of pioneering American physicist Robert J. Van de Graaff in January 1967, Chris Judge Smith paid homage by christening his and Peter Hammill's newly formed band Van Der Graaf Generator after the scientist's famous high-voltage generators.  Van Der Graaf Generator - Robert J. Van de Graaff Robert J. Van de Graaff with a spherical atom-bursting terminal in 1933.  Jane’s Addiction Jane's Addiction's name honours Perry Farrell's housemate, Jane Bainter, who was their muse and inspiration. Farrell's then girlfriend Casey Niccoli initially suggested the name 'Jane's Heroin Experience' but Farrell decided to tweak the idea.  Dropkick Murphys The American Celtic punk band are named after professional wrestler and sanatorium owner John 'Dropkick' Murphy, who died age 66 in 1977.  The Marshall Tucker Band South Carolina rockers The Marshall Tucker Band are named after a blind piano tuner from Columbia, South Carolina. While rehearsing in a warehouse in their embryonic days, the fledgling band saw the name 'Marshall Tucker' inscribed on a key. They dubbed themselves The Marshall Tucker Band and later discovered the real Marshall Tucker had previously hired the rehearsal space. Marshall Tucker died in January 2023 at the ripe old age of 99.  Frankie Goes to Hollywood Liverpool 80s pop icons Frankie Goes to Hollywood take their indirectly name from legendary crooner Frank Sinatra. The moniker is lifted from the words 'Frankie goes to Hollywood' on a 1940s billboard poster announcing a Frank Sinatra movie.  Frankie Goes to Hollywood Ol' Blue Eyes himself Frank Sinatra in 1945.    Listen to Everything That Rocks on Kerrang! Radio. Download our free app, listen online, via your smart speaker (“play Kerrang! Radio”) and on Freeview TV channel 717."
"assassination","2020-12-01","22:00:00","{""Cannes"", ""ProvenceAlpesCoteDAzur"", ""France""}","https://news.google.com/rss/articles/CBMiNWh0dHBzOi8vZmlsbXRocmVhdC5jb20vcmV2aWV3cy9raWxsaW5nLWJvcmlzLWpvaG5zb24v0gEA?oc=5&hl=en-US&gl=US&ceid=US:en","Wed 17 May 2023 17:01:09","CANNES FILM FESTIVAL 2023 REVIEW! The pitfalls of self-expression through political assassination are on display in writer/director Musa Alderson-Clarke’s provocative and gritty short Killing Boris Johnson. Chas (Shadrach Agozino) is falling apart over the suicide of his mother. Suffering from seasonal depression, she counted on family gatherings during the holiday to get through. However, when Prime Minister Boris Johnson declared a lockdown in December 2020 and banned all get-togethers, Chas’ mom took her own life. He’s enraged because while his mother died and he was in isolation, Johnson secretly held his own private Christmas party, violating his own rules.  So now Chas has decided to kill Boris Johnson. There is an event at a children’s school the prime minister is scheduled to appear at, and he plans to go there and shoot him. Unfortunately, Chas soon discovers that there are no gun shops in England, so he is at the mercy of whatever homemade goods are available on the black market. His sister, Maia (Jesse Akele), tries to reach out to him, but Chas won’t let her into his flat. That may be because she would see his rubber Boris Johnson mask, the one that Chas puts on at night and looks in the mirror while punching himself in the head.  The frustration of the decisions made for you gets an escapist valve through dreams of dead monarchs and legislators. Killing Boris Johnson engages in this impulse but also shows how futile it is to dare follow it. Alderson-Clarke’s script walks the same path Taxi Driver does, except the concept here walks a little further. The filmmaker first sets up the emotional reason that Johnson is targeted for slaughter. Then, by bringing it from the political to the personal, the short connects the viewer to Chas’s emotional state instead of keeping him behind glass in an insane aquarium.  “…Chas has decided to kill Boris Johnson.”  This also allows Alderson-Clarke to explore the emotional agony of loss from suicide through excellent expressionistic set pieces that comment on vengeance. One particularly vivid example is Chas attacking himself wearing his Boris Johnson mask. His fury is directed outwards but is only causing him harm. This is crystalized in the squirm-inducing climax, which is thankfully left ambiguous.  Agozino gives an outstanding performance, pulling off the challenging trick of giving us relatable alienation. He slowly boils the watcher in his craziness instead of letting loose with a full-throttle nutter. Akele provides a well-grounded counter-balance to ensure everyone isn’t heading down Derangement Lane.  The production quality is excellent and very polished. It manages a lot of grit without getting pulpy, making the intensity of the viewing experience all the more genuine. Alderson-Clarke’s got the directing skills to pay the bills while also sporting fresh storytelling talent. Killing Boris Johnson will drop jaws and land inside your mind like a bolt of clever lightning."
"assassination","2021-10-12","Not Discerned","{""Gonaives"", ""Artibonite"", ""Haiti""}","https://news.google.com/rss/articles/CBMiVmh0dHBzOi8vbGl2aW5nY2h1cmNoLm9yZy8yMDIzLzA1LzE3L2Rpb2Nlc2Utb2YtaGFpdGktY29udGludWVzLWl0cy1kZXNjZW50LWludG8tY2hhb3Mv0gEA?oc=5&hl=en-US&gl=US&ceid=US:en","Thu 18 May 2023 04:11:53","By Kirk Petersen  The recent arrest of a former top official of the Diocese of Haiti is just the latest sign of catastrophic dysfunction in the largest diocese of the Episcopal Church.  Haiti has not been led by a bishop for nearly five years, because the outgoing bishop was credibly accused of manipulating an election to install his preferred successor.  In the absence of a bishop diocesan, the ecclesiastical authority of any diocese passes to the diocesan Standing Committee. The Rev. Mardoché Vil, who heads that committee in Haiti, is a fugitive, accused by Haitian police of trafficking weapons into a country where murderous gangs are better armed than the police.  The previous president of the Standing Committee, the Rev. Fritz Désiré, was arrested May 9 on similar charges.  Still being sought for arms trafficking is Vundla Sikhumbuzo, a Zimbabwean who worked as chief of operations for the diocese from 2011 until 2018. Vundla, who has been identified in multiple news reports as an international arms trafficker, was dismissed in 2018 after he allegedly attacked his wife with acid, leaving her disfigured. However, Vundla allegedly received several deposits of US$30,000 or more from the diocese as late as 2021.  These allegations began coming to light in August 2022, when the diocesan executive secretary and an accountant working for the diocese were arrested on arms-trafficking charges.  Virtually none of this has been reported in American news media. Most of the information comes from articles on Haitian news websites, some of them machine-translated from French.  Bishop Todd Ousley of the Office of Pastoral Development is the Church Center’s liaison with the Diocese of Haiti. In an email addressed to Vil on May 7, Ousley supported plans for a diocesan synod, or convention, to elect new members of the Standing Committee.  Ousley’s expression of support was denounced as “immoral and unacceptable” by the director general of the well-respected St. Vincent’s Center, an Episcopal institution that has provided educational opportunities and job training to children with disabilities since 1945.  “In encouraging President Vil to organize the Synod, [Ousley] did not underline anything about the current context in which Father Mardoché Vil is up to now being sought and pursued by the National Police of Haiti,” wrote the Rev. Irnel Duveaux in a letter to the St. Vincent’s board, which was forwarded to TLC by a priest in the diocese. Duveaux did not respond to a request for comment.  Ousley declined to be interviewed for this article. Public Affairs Officer Amanda Skofstad released a copy of the May 7 email, which appears at the bottom of this article. ”  “The point of the letter was to address the need for a synod to elect or re-elect members of the standing committee,” Skofstad said. “Since the current occupant of the office of president of the standing committee is Vil, the letter could only be addressed to him. Any use of the letter to promote political agendas within the Diocese of Haiti would be a misuse of the letter.”  She also released the following statement from Ousley:  “To the best of our knowledge, Père Jean Mardoché Vil is the duly elected standing committee president for the Episcopal Diocese of Haiti, and the validity of his service in that office is a matter to be determined by the diocese through its synod. As always, the clergy and people of the Diocese of Haiti are being held in prayer as they face various challenges within the church and Haitian society.”  However, two senior priests in the diocese have written to the national Department of Religious Affairs to say that a rival Provisional Standing Committee was elected by the clergy of the diocese in April. The six-person ad hoc committee was created to provide “honest and credible interlocutors without criminal records, capable of ensuring a responsible transition and doing everything possible to restore the image of this institution tarnished by the actions of a group of mercenaries.”  The letter, which also appears at the bottom of this article, names Duveaux, two other priests, and three lay people as members of the ad hoc committee. The letter provides an accounting, by name, of the votes cast for and against the committee by 59 priests in the diocese, and reports that 54 percent of the priests approved the committee.  Unsafe conditions have deteriorated in Haiti since the June 2021 assassination of President Jovenal Moïse. Prime Minister Ariel Henry, who was allegedly involved in the assassination, has since served as acting president.  “Violent gangs have effectively seized control of large swathes of the country,” according to a recent United Nations report, and rival gangs have engaged in armed combat, sexual violence, and kidnapping. Vigilantes have recently begun targeting the gangs. The BBC reports that 13 suspected gang members were beaten and burned to death in Port-au-Prince, the capital, in April.  The Diocese of Haiti reports nearly 98,000 baptized members, making it more than 30 percent larger by that measure than the Diocese of Texas, which ranks second. Because of societal violence and diocesan infighting, Haiti has had virtually no influence in recent years in the governance of the broader church.  The diocese has, however, had a remarkably broad role in Haitian society. The diocese owns more than 250 schools, as well as hospitals and higher-education facilities. L’Université Episcopale d’Haïti (UNEPH) educates about 2,500 students.  Haiti Letter to Pere Vil 5.7.23 by Kirk Petersen on Scribd  Ad Hoc Committee by Kirk Petersen on Scribd"
