"topic","date"," time","place","url","date published","article text"
"assassination","2023-05-15","Not Discerned","{""PortAuPrince"", ""Ouest"", ""Haiti""}","https://news.google.com/rss/articles/CBMiVGh0dHBzOi8vd3d3LmphbWFpY2FvYnNlcnZlci5jb20vZWRpdG9yaWFsL3RoaXMtZGlyZS1zaXR1YXRpb24taW4taGFpdGktaXMtdW50ZW5hYmxlL9IBWGh0dHBzOi8vd3d3LmphbWFpY2FvYnNlcnZlci5jb20vZWRpdG9yaWFsL3RoaXMtZGlyZS1zaXR1YXRpb24taW4taGFpdGktaXMtdW50ZW5hYmxlL2FtcC8?oc=5&hl=en-US&gl=US&ceid=US:en","Wed 17 May 2023 05:01:39","News emerging on Monday that the Haitian Government has now turned to Africa and Latin America for help to deal with the security crisis there is further indication of that Caribbean nation's dire need for assistance.  A Caribbean Media Corporation story reports Haiti's Foreign Affairs Minister Mr Jean Généus as saying that Prime Minister Ariel Henry recently spoke with Senegalese President Macky Sall, and talks are being held with other African and Latin American countries.  The Haitian Government has apparently come to the conclusion that there is a lack of interest on the part of Western states to provide military assistance to Haiti, which has been gripped by political and economic crises since the assassination of President Jovenel Moise in July 2021.  Rival gangs have taken control of up to 80 per cent of the capital, Port-au-Prince, and have continued a deadly fight for more territory.  The UN reports that more than 840 people were killed in the first three months of this year, while over 600 people have been slain in April alone. Also, more than 400 people have been kidnapped so far this year.  And, if that were not bad enough, the United Nations Children's Fund (UNICEF) has reported that the gang violence has placed more than 115,000 children at the risk of starving to death this year, an increase from the near 86,000 last year.  Adding to the Haitian people's woes is the more than 41,000 suspected cases of cholera reported since the resurgence of the acute diarrhoeal illness in October, with children under the age of 14 making up almost half of the cases, UNICEF has told us.  The UN agency says it urgently needs US$17 million to help detect malnutrition and purchase food and medicine. If that support does not become available, more children will die.  There are people in Haiti who are strongly opposed to the international community sending help in the form of police or military personnel. At the same time, as we have pointed out in this space before the obvious hesitance by some countries to offer help is most likely fuelled by the fact that Haiti hasn't been able to shake instability, and previous attempts at military aid in the form of boots on the ground have not gone well.  However, the situation there, correctly described as ""tragic"" by UN Secretary General Antonio Guterres during a joint news conference with Jamaica's Prime Minister Andrew Holness on Monday at Jamaica House is untenable and has the potential of spilling over into the wider region.  Mr Holness also explained that it's not that the pleas from the UN and the Caribbean for help have fallen on deaf ears. ""The question,"" he said, ""is the pace of action, and countries who would want to support would also want to be assured that there is a political process in place that could yield an end result in a time frame that makes sense.""  That is not an unreasonable position.  A possible solution, we believe, is for a mediation team to get all players in the political conflict in Haiti involved in talks aimed at holding elections to install a legitimate Government. Naturally, those polls would require international observers to ensure transparency and acceptance of the results.  Additionally, a strategy to confront and dismantle the gangs is necessary."
"assassination","2023-05-20","Not Discerned","{""Atlanta"", ""Georgia"", ""UnitedStates""}","https://news.google.com/rss/articles/CBMibWh0dHBzOi8vd3d3LndhYmUub3JnLzMybmQtYW5udWFsLW1hbGNvbG0teC1mZXN0aXZhbC1ob25vcnMtdGhlLWh1bWFuLXJpZ2h0cy1sZWFkZXItYXQtaGlzdG9yaWMtd2VzdC1lbmQtcGFyay_SAQA?oc=5&hl=en-US&gl=US&ceid=US:en","Tue 16 May 2023 13:57:47","32nd annual Malcolm X Festival honors the human rights leader at historic West End Park  Hip-Hop group Dead Prez performing at the Malcolm X Festival at West End Park in Atlanta. (Courtesy of Watani Tyehimba)  Muslim leader and human rights leader Malcolm X was an unwavering advocate for Black empowerment throughout his adult life. His posthumous autobiography, written by Alex Haley, and published after X’s assassination in 1965, was used as the basis for director Spike Lee’s 1992 film “Malcolm X” starring Denzel Washington.  Since the early 90s, the annual “Malcolm X Festival” in Atlanta’s West End Park has sought to honor the civil rights icon around the time of his birthday, which was May 19.  This year the 32nd annual festival takes place May 20-21 from 12 pm- 8 pm. In this interview, “City Lights” host Lois Reitez speaks with Watani Tyehimba, founder of the Malcolm X Festival, about the event."
"assassination","2023-05-13","22:00:00","Not Discerned","https://news.google.com/rss/articles/CBMiaWh0dHBzOi8vZW5nbGlzaC5hbG1heWFkZWVuLm5ldC9uZXdzL3BvbGl0aWNzL2dhemEtcmlzZXMtdG8tdmljdG9yeS1ieS1zbWFzaGluZy1pc3JhZWxpLWRpa3RhdHMtaW50by1zbWl0aNIBAA?oc=5&hl=en-US&gl=US&ceid=US:en","Tue 16 May 2023 21:15:24","Al Mayadeen analyst for Arab and regional affairs says despite the great wounds as a result of the Israeli aggression, Gazans decided to maintain steadfastness.  On Saturday at 10 pm Al-Quds time, an Egyptian-brokered ceasefire between the Palestinian Resistance and the Israeli occupation took effect following a five-day Israeli aggression against the Gaza Strip, which led to the martyrdom of 33 Palestinian and the injury of 100, in addition to huge material losses.  Immediately after the ceasefire was announced and took effect, Gazans took to the streets to celebrate victory in Operation Avenging the Free, which the Palestinian Resistance launched against the Israeli occupation in response to the latter's assassination of commanders and the brutal killing of civilians.  In conjunction with the celebrations, the Joint Operations Room of the Palestinian Resistance Factions in Gaza said Operation Avenging the Free is a new chapter of glory that the Resistance fought as a unified structure, warning that although the operation has ended, the banners of Resistance will not and shall not be lowered and the will to fight will not and shall not ever dwindle.  On his part, the Secretary-General of the Palestinian Islamic Jihad (PIJ) movement, Ziad Al-Nakhalah, said the Palestinian people, despite the pain, came out with their heads held high everywhere, in Gaza, the West Bank, and across the world, in support of the Resistance, describing these days as ""days of honor and dignity for our people, who, with simple resources, are facing all this aggression.""  One might wonder how the Palestinian Resistance and Gazans claimed a victory over the Israeli aggression, despite all the assassinations, killings, and destruction caused by the occupation.  Touching on the matter, Al Mayadeen analyst for Arab and regional affairs, Abdelrahman Nassar, pointed out that the main idea is to break the Israeli dictates, because ""Israel's"" goal behind the assassinations was to break the morale of the people.  Nassar explained that when Gazans witnessed the Resistance continuously bombing Israeli military sites, settlements, and cities and causing casualties among the Israelis until the last moment before the ceasefire entered into force, they considered the ceasefire a victory, steadfastness, and perseverance.  ""Simply rejecting Israeli dictates in this way is a victory,"" Nassar told Al Mayadeen English.  The Palestinian analyst indicated that despite the great wounds, Gazans decided to remain steadfast for many reasons, the most important of which is that they do not like to display their suffering in front of the Israeli occupation, considering all the difficult circumstances they have been under as part of the ongoing 15-year blockade on the Strip.  An upcoming assassination at any moment  Asked about the reason why “Israel” launched its heinous aggression against Gaza at this particular time, Nassar considered that the decision on the timing of the aggression was taken in 2022. He cited an Israeli Channel 14 report as saying that the security establishment confirmed the aggression on Gaza was not a response to the firing of 104 rockets toward ""Sderot"" in retaliation to Sheikh Khader Adnan’s martyrdom in Israeli occupation prisons, but rather a settling of accounts with the PIJ for each rocket launched since the beginning of the year and the movement’s role in Resistance operations in the occupied West Bank.  Nassar considered that ""Israel's"" concern is not the rocket firing from Gaza, since this matter is still unsolvable to the occupation, nor is it the PIJ's influential commanders, as there are similar influential leaders in other Palestinian factions. Rather, according to Nassar, ""Israel's"" problem is that the PIJ is at the forefront of the Resistance’s acts in the West Bank, and hence, the occupation tried to pressure the PIJ to prevent it from pursuing this progress. Therefore, the timing is just a factor related to field conditions and is mainly linked to the occupied West Bank, he noted.  Nassar cited another reason for the aggression -- a political factor related to the internal Israeli crisis over the judicial overhaul.  According to Nassar, ""Israel"" also tried to create a rift between the Palestinian Resistance factions and failed miserably as coordination between the factions was apparent during the aggression, and this is another aspect that boosted the morale of the people.  However, Nassar believed that from the present moment, ""Israel"" will continue to focus on the PIJ, predicting an upcoming assassination at any moment or a coming battle this year or the following.  Read more: Assassination of Resistance commanders not to end struggle: PIJ spox  Resistance rockets put “Israel” under constant anxiety  Militarily, Al Mayadeen analyst for Arab and regional affairs acknowledged that it would be unfair to compare the capabilities of the Israeli occupation and those of the Palestinian Resistance.  Nevertheless, he pointed out that were it not for the Resistance's rockets, ""the media would have broadcast the images of our martyrs, wounded, and destroyed homes from one side only, just as the situation was in 2010 and before.""  ""After 2012, when the Resistance began to put Israel under constant anxiety, the situation changed.""  He added that despite the Resistance not being able to inflict huge casualties, Israeli settlers assert that they ""love life"" and disrupting their daily lives and spreading fear among them through rocket firing is enough in the meantime.  According to Nassar, the Israelis are infamous for keeping secret their casualties in all confrontations against Lebanon and Palestine, be they military or not.  Read more: PIJ can manage the battle for long days: Israeli media  Israeli media admits no solution to Gaza challenge  Touching on the Israeli media's feedback on the recent aggression, Nassar pointed out that the media will not attack the occupation army directly. He mentioned that the Israeli media praised the army's performance but criticized that of the political establishment. However, he noted that the media admitted that ""Israel"" has not been able to find a solution to the Gaza challenge.  Nassar had previously touched on the path that was followed to reach a ceasefire. He asserted that the Palestinian Resistance's position was clear from the beginning, which is that it will not end this round unless it forces the Israeli occupation to stop the assassinations and targeting of its leaders and the bombing of homes and civilians.  Read more: Resistance source to Al Mayadeen: Missiles locally manufactured"
"assassination","2023-05-16","Not Discerned","{""Washington"", ""DistrictOfColumbia"", ""UnitedStates""}","https://news.google.com/rss/articles/CBMiXWh0dHBzOi8vZmluYW5jZS55YWhvby5jb20vbmV3cy9kb2N1bWVudGFyeS1jaHJvbmljbGVzLWJsYWNrLWV4cGVyaWVuY2UtZWZmb3J0cy0xNzM3MDAyMTYuaHRtbNIBZWh0dHBzOi8vZmluYW5jZS55YWhvby5jb20vYW1waHRtbC9uZXdzL2RvY3VtZW50YXJ5LWNocm9uaWNsZXMtYmxhY2stZXhwZXJpZW5jZS1lZmZvcnRzLTE3MzcwMDIxNi5odG1s?oc=5&hl=en-US&gl=US&ceid=US:en","Tue 16 May 2023 17:37:00","Film celebrates 50th anniversary of the first graduating class of the University’s Partnership Program  Washington, D. C., May 16, 2023 (GLOBE NEWSWIRE) -- A documentary has been released telling the stories of Catholic University’s efforts to recruit and welcome Black students, especially from the Washington, D.C. area through its “Partnership Program.” Fifty years after the University’s first graduates of the Partnership Program — created in the wake of the assassination of the Rev. Martin Luther King Jr. — the documentary examines its founding, its struggles, and the progress being made to create a more diverse campus community.  Catholic University admitted 30 Black students mainly from the local area through the Partnership Program. To mark its success and the work that has been done, the University bestowed honorary doctoral degrees to the program's first directors, Leon LeBuffe and Thaddeus Aubry at the University-wide Commencement ceremony on May 13.  The documentary, No Longer Out of Reach, was directed and produced by award-winning filmmaker and journalist Chris Jenkins. The documentary features four of the program’s first participants along with Aubry and LeBuffe, both alumni, telling their stories. Additional voices from former students and archival footage complete the narrative about how Black students first faced significant struggles to get an education and how the University has been supporting the program since its founding in 1969. To screen the documentary, visit here .  “I can think of no better way to mark the 50th anniversary of the Partnership Program than to shine a light on its history, celebrate its accomplishments, and award honorary degrees to the program’s first directors, Leon LeBuffe and Thaddeus Aubry,” said Dr. Peter K. Kilpatrick, president of Catholic University. “Both of these extraordinary gentlemen offered their offices, homes, and time to students and were dedicated and welcoming.”  The Partnership Program has helped scores of Black students from the Washington metropolitan area attend Catholic University. In 1968, the year before the program started, there were seven Black undergraduates on campus. Now total undergraduate and graduate enrollment of Black students accounts for approximately 10% of the total student body.  Story continues  During LeBuffe and Aubry’s tenure, they personally mentored every matriculating program student — from their first days on campus through graduation. Even the few who ultimately did not complete the program benefited from their attention. This impact was felt so strongly and had such a profound impact on program graduates that the group established an endowed scholarship — the Thaddeus F. Aubry Jr. and Leon LeBuffe Scholarship — to honor their legacy and help current and future Black students at Catholic University through financial grants.  No Longer Out of Reach features four of the original 30 Black students admitted in 1969: Elvira Wise Smith, Ronny B. Lancaster, Andrea Cullins, and Kenneth Walker. The partners recount their experiences and journeys as Black students on Catholic University’s campus in the 70s. LeBuffe and Aubry discuss the role they played to bridge the gap and help students acclimate to the almost entirely white, and frequently unwelcoming, environment in which they found themselves.  ABOUT: The Catholic University of America is the national university of the Catholic Church and the only higher education institution founded by the U.S. bishops. Established in 1887 as a papally chartered graduate and research center, the University comprises 12 schools and 31 research facilities and is home to 5,000 undergraduate and graduate students.  Division of University Communications • Washington, D.C. 20064  communications@cua.edu • www.catholic.edu • 202-319-5600  CONTACT: Nicole Germain The Catholic University of America 202-319-5786 germainn@cua.edu    "
"assassination","2023-06-04","10:00:00","{""Vicksburg"", ""Mississippi"", ""UnitedStates""}","https://news.google.com/rss/articles/CBMifWh0dHBzOi8vd3d3LnZpY2tzYnVyZ3Bvc3QuY29tLzIwMjMvMDUvMTYvbWF5b3ItcHJlc2VudHMtdm9pY2VzLW9mLWNvdXJhZ2UtanVzdGljZS1ob25vcmluZy1tZWRnYXItYW5kLW15cmxpZS1ldmVycy1vbi1qdW5lLTQv0gEA?oc=5&hl=en-US&gl=US&ceid=US:en","Tue 16 May 2023 16:02:17","Mayor presents ‘Voices of Courage & Justice: Honoring Medgar and Myrlie Evers’ on June 4 Published 10:59 am Tuesday, May 16, 2023  Mayor George Flaggs, Jr. and The City of Vicksburg will present “Voices of Courage & Justice: Honoring Medgar and Myrlie Evers” on June 4 at 10 a.m.  Former Vicksburg Mayor Robert M. Walker will be the keynote speaker. Medgar and Myrlie Evers were partners in the Civil Rights struggle. The assassination of Medgar Evers on June 12, 1963, was the first murder of a nationally significant leader of the American Civil Rights Movement, and it became a catalyst for the passage of the Civil Rights Act of 1964. His widow, Myrlie Evers-Williams, a Vicksburg native, continues to promote issues of racial equality and social justice.  Their daughter, Reena Evers-Everette, also continues their legacy through social justice activism.  Email newsletter signup  The event will take place at the Ardis Williams Sr. City Auditorium, 901 Monroe St."
"assassination","2023-05-14","Not Discerned","{""Jerusalem"", ""Jerusalem"", ""Israel""}","https://news.google.com/rss/articles/CBMibGh0dHBzOi8vd3d3LnRhc25pbW5ld3MuY29tL2VuL25ld3MvMjAyMy8wNS8xNy8yODk1OTY0L2lyYW4tcy1wcmVzaWRlbnQtYnJhbmRzLW5ha2JhLWRheS1hLXRyYWdlZHktaW4taGlzdG9yedIBcGh0dHBzOi8vd3d3LnRhc25pbW5ld3MuY29tL2VuL25ld3MvMjAyMy8wNS8xNy8yODk1OTY0L2lyYW4tcy1wcmVzaWRlbnQtYnJhbmRzLW5ha2JhLWRheS1hLXRyYWdlZHktaW4taGlzdG9yeS9hbXA?oc=5&hl=en-US&gl=US&ceid=US:en","Wed 17 May 2023 06:18:00","In a message released on Tuesday on the occasion of the 75th anniversary of the Nakba Day, the Iranian president called it one of the most painful tragedies in human history.  The text of the message is as follows:  In the name of Allah, the Most Beneficent, the Most Merciful  May 14, 1948 is a reminder of one of the most painful tragedies in human history. This ominous phenomenon caused the longest and saddest political and human crisis in the last one hundred years in the world and widespread insecurity in the West Asian region, the organized occupation and cruel usurpation of the Palestinian land, the killing of the oppressed Palestinians and the violation of the most obvious human rights of the original inhabitants of this holy land in 75 years.  Since the day that has been rightly named ""Nakba Day"", the Zionist regime has caused the displacement of millions of Palestinians, the targeted assassinations of Palestinian activists and ordinary people, the destruction of their homes, farms, and places of business and the violation of fundamental principles of international law, and it is obvious that the western supporters of this regime, especially the United States of America, are complicit in its crimes.  The Zionist regime continues its extreme and inhumane actions against the Palestinian people in the West Bank and the desecration of Islamic sanctities in the holy Quds in recent months, and in recent days, with a large-scale attack on various areas of the Gaza Strip, especially residential buildings, and targeted assassination of Palestinian citizens to escape from increasing and multi-layered internal crises.  These crimes, which have led to the martyrdom of dozens of civilians, including Palestinian women and children, are the concrete manifestation of state terrorism and mass murder, which has been the constant approach of this regime for the past 75 years.  For more than 18 years, the residents of the Gaza Strip have been living in the world's largest natural prison under cruel siege in a major humanitarian crisis. The continuation of the illegal and inhumane siege of the Gaza Strip and the ongoing crimes of the Zionist regime against the people of this region is a gross and obvious violation of the fundamental principles of international law, human rights and humanitarian rights, and unfortunately, the silence and inaction of the self-proclaimed human rights activists only lead to the arrogance of more than apartheid regime has been done before.  While strongly condemning the crimes of the Zionist apartheid regime against the Palestinian nation and the nations of the region, and while emphasizing the need for immediate, effective and deterrent action by the responsible international institutions, led by the United Nations, to stop the crimes of the Zionist regime and support the Palestinian nation, the Islamic Republic of Iran reiterates its solidity with this oppressed nation and emphasizes on supporting the cause and legitimate resistance of the Palestinian people in the path of liberating the occupied territories and forming an independent and unified government in the entire historical land of Palestine with the capital of the holy Quds.  At the end, I re-emphasize the Islamic Republic of Iran's democratic plan for the political solution of the Palestinian occupation crisis based on holding a public referendum with the participation of all the main inhabitants of the Palestinian land, including Muslims, Christians and Jews, in order to exercise the right to self-determination and to determine the type of political system."
