"topic","date"," time","place","url","date published","article text"
"assassination","2022-04-05","Not Discerned","{""Tehran"", ""Tehran"", ""Iran""}","https://news.google.com/rss/articles/CBMif2h0dHBzOi8vdGhlcHJpbnQuaW4vZGVmZW5jZS9mcmllbmRzLXRoYXQtYmVhdC1zYW5jdGlvbnMtdG9nZXRoZXItcnVzc2lhcy1hZXJvZmxvdC1zZW5kcy1haXJidXMtYTMzMC1mb3ItcmVwYWlyLXRvLWlyYW4vMTU3NzMxNy_SAYMBaHR0cHM6Ly90aGVwcmludC5pbi9kZWZlbmNlL2ZyaWVuZHMtdGhhdC1iZWF0LXNhbmN0aW9ucy10b2dldGhlci1ydXNzaWFzLWFlcm9mbG90LXNlbmRzLWFpcmJ1cy1hMzMwLWZvci1yZXBhaXItdG8taXJhbi8xNTc3MzE3Lz9hbXA?oc=5&hl=en-US&gl=US&ceid=US:en","Tue 16 May 2023 13:54:02","New Delhi: Russia’s largest airline Aeroflot has sent an Airbus A330 for maintenance to Iran’s largest airline Mahan Air, the Islamic Republic News Agency (IRNA) reported Monday.  In a two-minute video filmed at Mahan Air’s maintenance hangar in the Imam Khomeini International Airport outside Tehran and released on IRNA’s social media platforms, a reporter can be heard saying that repair work on the Aeroflot aircraft, originally built in 2011, has commenced.  “The market for commercial aircraft repair and maintenance services is as valuable and extensive as the commercial aircraft’s sales market itself. Accordingly, for years, we have been witnessing the achievements and capabilities of [Iran] to localise the needs of this industry,” the IRNA reporter says, labelling Mahan Air’s maintenance hangar as “one of the most well-known and strategic centres” serving Iranian and foreign customers.  According to aviation news platform Simply Flying, the Airbus A330 had departed Moscow’s Sheremetyevo International Airport on 5 April and arrived at the Imam Khomeini International Airport the following morning.  This development comes amid US-led sanctions on both Aeroflot and Mahan Air due to Russia’s invasion of Ukraine in 2022 and an alleged plot to assassinate Saudi Arabia’s ambassador to America in 2011.  The engagement between Aeroflot and Mahan Air also serves as an example of the strengthening of relations between Iran and Russia, following such sanctions.  In August 2022, Simply Flying reported that the two nations had signed a cooperation agreement for Iranian-made equipment and aircraft parts as well as carrying out “repair and maintenance services and technical support” of Russian aircraft.  This year has seen the relationship between Iran and Russia evolve further, with Tehran inking a deal to buy Sukhoi Su-35 fighter jets from Moscow in March. The two countries also linked their interbank communication and transfer systems to facilitate trade and transactions in the light of US sanctions.  Also read: ‘Need to develop weapons for short & long-term conflicts’: CDS on lesson for India from Ukraine war"
"assassination","2023-05-15","Not Discerned","Not Discerned","https://news.google.com/rss/articles/CBMiS2h0dHBzOi8vdGhlZGlwbG9tYXQuY29tLzIwMjMvMDUvcGFraXN0YW4taW4tdGhlLWV5ZS1vZi10aGUtcG9saXRpY2FsLXN0b3JtL9IBAA?oc=5&hl=en-US&gl=US&ceid=US:en","Tue 16 May 2023 14:14:08","Chaos erupted after Imran Khan’s arrest. His release brought an uneasy calm, but the stage is set for a more serious clash.  Security escort a vehicle carrying Pakistan’s former Prime Minister Imran Khan and his wife Bushra Bibi after their court appearance, in Lahore, Pakistan, May 15, 2023.  Advertisement  Pakistanis could be forgiven for waking up on Tuesday morning and questioning whether the previous week’s events were an unnerving nightmare.  The world’s fifth most populous country is no stranger to political unrest. No prime minister has ever completed their tenure in Pakistan’s history, but never before has a politician challenging the country’s all-powerful military and intelligence services, known as the establishment, enjoyed such public support.  One week ago, on May 9, former Prime Minister Imran Khan was violently beaten and then detained by the country’s paramilitary. This led to several days of rioting across Pakistan.  While he has since been released – after Pakistan’s Supreme Court ruled that his detention on an alleged land fraud charge was “invalid” and “unlawful” – the current stalemate will be temporary, not permanent.  Diplomat Brief Weekly Newsletter N Get briefed on the story of the week, and developing stories to watch across the Asia-Pacific. Get the Newsletter  Khan, who narrowly survived an assassination attempt in November, plans to resume his campaigning for early elections in Pakistan on Wednesday.  Enjoying this article? Click here to subscribe for full access. Just $5 a month.  Ousted from power in April 2022 in a no confidence vote after falling out with the country’s establishment, Khan’s popularity is now at an all-time high. There is little doubt that if free elections are held, as planned, in the autumn, he will return as prime minister. The Pakistani people are seemingly prepared to take on the country’s establishment, for the first time in history, in an attempt to ensure that happens.  With neither side backing down, what comes next is likely to involve serious unrest. Things are sure to get worse before they get better in Pakistan, which is also already enduring the gravest economic crisis in the country’s history.  It was unsurprising to see Khan in the dock last week. Pakistan’s establishment and the ruling Pakistan Muslim League-Nawaz (PML-N) party – headed by Prime Minister Shehbaz Sharif – seeks to disqualify Khan from politics.  Advertisement  The former international cricket captain is facing more than 140 criminal cases. In the latest, it was alleged that Khan and his wife, the Sufi mystic Bushra Wattoo, secured lucrative real estate in exchange for carrying out favors for Malik Riaz Hussain, one of Pakistan’s wealthiest businessmen, while Khan was prime minister.  Khan and his Pakistan Tehreek-e-Insaf (PTI) party said the case was politically motivated. The PML-N said Khan should face trial. On Friday, after the country’s Supreme Court sided with the former premier, Khan was released and returned to his home in Lahore.  It seems certain, though, that Khan will be arrested again. He has only been granted bail until Wednesday and Sharif and his allies have suggested he will be detained again this week.  On Sunday, Khan himself suggested he would be jailed for 10 years for sedition after his supporters had rioted following his arrest.  “Absolutely, Mr. Khan will be arrested again. We are looking at a judiciary in Pakistan which is fragmented and can be influenced,” argued Dr. Avinash Paliwal, associate professor in International Relations at the School of Oriental and African Studies (SOAS).  “The ruling [on Friday] was made by pro-Khan judges within the Supreme Court and now the Army will try to fix that. It will 100 percent happen at some point that he will be behind bars and charges will be brought against him that no court can overrule.”  In many ways, Khan, a populist politician, is a victim of his own success. Since his ousting, in April 2022, which directly followed a spectacular falling out with the military, his popularity has surged.  Enjoying this article? Click here to subscribe for full access. Just $5 a month.  Khan has been able to successfully exploit growing frustration among the Pakistani public towards Sharif for his inability to address the country’s economic woes and the Army’s continued meddling in public policy.  Food inflation is running at 40 percent, the highest in Asia, and approximately 70 million Pakistanis are going hungry, as per a March study by the Wilson Center, a leading U.S. think tank.  Hospitals have run out of many life-saving medicines, including those used in diabetes, heart and kidney disease treatment, while a lack of funding meant Khyber Pakhtunkhwa, one of Pakistan’s four provinces, suspended free medical care on May 2.  Advertisement  Relief does not seem imminent, either. Negotiations with the International Monetary Fund for over $1.1 billion in funding have broken down – in part due to Sharif’s reluctance to impose further unpopular austerity measures on the population as an election draws near.  Certainly, there have been decades of economic mismanagement in Pakistan. The country has consistently borrowed beyond its means and failed to diversify its tax base. And Khan’s detractors argue that he engaged in corruption, as have the Sharifs and Pakistan’s other political dynasty, the Bhuttos.  Nevertheless, Khan has carefully crafted a victim narrative since he was removed from power and has convinced a significant majority of Pakistanis that only he can reform the country’s stagnant political and economic apparatus.  His approval rating in February was 61 percent, according to a Gallup Pakistan survey, with Shehbaz Sharif trailing far behind at 32 percent.  “Imran Khan, politically, has captured the imagination of most of the country, certainly in Punjab and that is not going to go down. The people’s power is with him,” said Paliwal.  “He wants an early election and if the authorities give him an honest vote, then he will win.”  The establishment will do anything they can to stop him. Khan would fail to do their bidding; he could strip them of their power and even seek to jail senior military or political figures in revenge.  Khan has accused Major General Faisal Naseer, a senior military figure and Sharif of being behind an assassination attempt in November in which he was shot in the legs four times. While on his release from prison, he accused the country’s new chief of army staff, General Asim Munir, of being behind his arrest.  Khan and Munir have a long-standing feud. While he was prime minister, Khan removed Munir as the head of Pakistan’s intelligence services after the latter began allegedly investigating his third wife, Wattoo, for corruption.  We are now likely to see Sharif and his establishment allies take further action against the judiciary and the PTI’s leadership to weaken protection of Khan.  On Monday, hundreds of members of the PML-N, armed with sticks, broke into the country’s Supreme Court to threaten its judges.  Pakistan’s parliament further announced it would set up a committee to prepare a case against the judge, Chief Justice Umar Ata Bandial, who had ordered Khan’s release.  Advertisement  Enjoying this article? Click here to subscribe for full access. Just $5 a month.  Following Khan’s arrest, the PTI called on Pakistanis to take to the streets and it is certain to do so again if Khan is re-arrested. The violence that followed was unprecedented in the country’s history, as large swathes of angry protesters torched military buildings, including the army’s headquarters in Rawalpindi.  Only when Khan was released on Friday did unrest subside. The PTI claims at least 47 of its supporters were killed by the military; the latter puts the death toll at nine.  Khan says 7,000 PTI workers – including much of the party’s senior leadership – have been jailed. Claims of torture are widespread. The elderly relatives and minor children of PTI members have also been arrested in an attempt to lure their relatives out of hiding.  Sharif has said he will come down with an “iron fist” against the protesters and mass arrests will now follow. The ability of Sharif and the establishment to incite fear among Pakistanis is perhaps their best chance of holding onto power.  “To me, it is clear that only one – either Mr. Khan or the army chief – can survive this crisis, politically,” argued Uzair Younus, director of the Pakistan Initiative at the Atlantic Council, a U.S.-based think tank.  “Over the next few weeks, how this situation plays out will come down to General Munir and the armed forces ability to assert themselves and then Mr. Khan and the PTI’s ability to maintain public protests and the momentum.”  Several further variables could influence events in Pakistan. First, there appear to be fractures among the country’s senior military leaders, although it is unclear as to their severity.  Many commanders remain pro-Khan from his time as premier, and it was notable that during the recent violence former army figureheads, many now living abroad, directed protesters. Several acting military commanders also refused to take a heavy-handed approach against PTI supporters.  During previous crises, foreign powers, including Saudi Arabia, the United Arab Emirates, and the United States, have also intervened to mediate. This has not occurred this time around, at least openly. But it is unlikely that China, which has invested around $65 billion in Pakistan as part of the China-Pakistan Economic Corridor, or India, which has fought four wars with its neighbor, will continue to watch on if law and order deteriorates.  One victor from the crisis is likely to be the Tehreek-e-Taliban Pakistan (TTP), an Islamic militant group allied with the Afghan Taliban, who called off their ceasefire with the Pakistani state in November.  The TTP has since launched daily attacks against the police and military. January 2023 was the deadliest month for the country’s security forces in a decade, with one such suicide attack on a mosque in Peshawar killing 83 people.  A united front will have to be presented against the emboldened TTP – otherwise Pakistan risks descending into total anarchy."
"assassination","2023-01-01","Not Discerned","{""Ganjam"", ""Orissa"", ""India""}","https://news.google.com/rss/articles/CBMibWh0dHBzOi8vd3d3LmRhaWx5cGlvbmVlci5jb20vMjAyMy9zdGF0ZS1lZGl0aW9ucy9wb2xpdGljYWwtbXVkc2xpbmdpbmctLWhvdy1nYW5qYW0tbGVhZGVyLWZpbmFsbHktc2hpbmVzLmh0bWzSAQA?oc=5&hl=en-US&gl=US&ceid=US:en","Tue 16 May 2023 09:01:56","Mudslinging is not a new phenomenon in world of politics since it is said to have appeared in some form or the other in electoral battle since 1828 in the US Presidential election; 2008 Senate race in North Carolina and the political race between the then incumbent President John Quincy Adams and challenger Andrew Jackson in 1828.  The practice of mudslinging, smear campaigning, or forming conspiracy by any political leader against his opponent with sole intention to defame a leader with probity in public life and/or to tarnish his image to take political mileage, however, can hardly succeed as ultimately truth prevails, sooner or later. Most of the politicians in India often use ‘mudslinging’ as the most powerful weapon or tool against their opponents.  Since times immemorial, it has been believed that, truth always triumphs and this dictum has been rightly emphasised by Father of the Nation Mahatma Gandhi. Gandhi who brought freedom for the country used to define political course to remain “without malice and in a strictly non violent manner,” but now malice is deeply rooted in politics of all shades in which mudslinging has substantially grown as a culture, breeding various connotations, namely, smear campaign, character assassination, dirty politics, negative campaign, defamation, outracing each other which are disastrous for the health of democracy. No political party seems to be an exception from such Machiavellian culture.  In the year 2000, a Congress worker of Poirashi GP of Ganjam block had filed a false affidavit against the then Deputy Speaker of Assembly Rama Chandra Panda, willfully dragging his name to an incident of a crime perpetuated by local Leftist elements, notwithstanding the soaring relationship Panda had with the local Leftists, which was used to orchestrate a political campaign in the Chhatrapur Assembly constituency against Panda.  As a result, Panda had informed the then Speaker of the Assembly not to chair Assembly proceedings till his name was cleared in the Crime Branch inquiry. It was also then whispered in the town that, some Congress leaders eventually had met the then DIG inquiring the matter at the IRE Guest House to raise a complaint against Panda on the basis of the false affidavit.  The catchphrase the ""Truth always triumphs"" has come true though little late. In the last week of January 2023, Panda was felicitated on completion of 50 years of his political journey from the tiny industrial town Ganjam, where he had laid country’s first and historic farmers’ movement (1970-71) against water and air pollution in which he and 400 farmers and youths were imprisoned causing visit of Parliamentary Committee headed by late MP Brahmananda Panda to the area to study the environmental problems which eventually submitted its report to the Parliament suggesting remedial measures. This impressive felicitation programme in which thousands of local people attended is understood to be a sequel to non-invitation to Panda by the local MLA earlier on the party’s foundation day held at village Kushapalli.  The success of this gathering, however, not only sent ripples to various quarters but also produced multiple side effects and one such fallout was that, the then Congress youth leader Khalli Reddy who himself participated in the ‘show of strength’ cum felicitation meeting, later called on Panda at his residence at Brahmapur in the presence of a former Councilor of Ganjam NAC Lakshmi Padhi and advocate Pramod Panda and apologised to Rama Chandra Panda for his 2000 bogus affidavit candidly confessing that he filed the same at the behest of a prominent Congress leader of Brahmapur who eventually is now in BJD. This sensitive exposure of Reddy has proved how some new breed and ambitious politicians can settle political scores against their rivals or political opponents to satisfy their political interests and can go to any extent even to defame a honest leader having probity in public life.  This writer was present during Reddy’s disclosure. In his quest for truth, the writer contacted one of the outspoken and vibrant Congress leaders of Ganjam advocate Pitabas Panda, who too expressed his regret while further attributing the incident to the invisible hand of a former Congress MLA of a neighboring district in the incident. When this writer sought reaction from former Deputy Speaker Panda he said he had already forgotten the incident and wished almighty to bless the indulgent not to repeat such act in future against any one.  There may not always be legal repercussions for mudslinging, but there can be social backfiring. If miscalculated, mudslinging often can make the mudslinger cut a sorry figure.  Now, one might ask: Shouldn't politicians or public figures, face repercussions for mudslinging? According to Joseph Comunale, it is in fact a crime to make false public accusations with knowledge that the claims are indeed false.  Such a crime can lead to libel or defamation lawsuits in the eyes of law. However, proving such a crime can be extremely difficult. i.e., it is difficult to verify that someone may have been aware that he was making a false claim and, therefore, deduce he was knowingly lying with an intent to harm.  There are a number of such incidents of political mudslinging and conspiracy, allegation and counter allegation against each other in Indian politics. Take the example of Telangana Welfare and Civil Supplies Minister, Gangula Kamalakar’s allegation against BJP State president Bandi Sanjay Kumar alleging his hand in a recent question paper leaking incident reportedly with an attempt to malign and defame the BRS Government in Telangana.    (Writer Prof Dr Panda is a correspondent of The Pioneer for Brahmapur)  "
"assassination","1985-06-01","Not Discerned","Not Discerned","https://news.google.com/rss/articles/CBMifWh0dHBzOi8vdGhlcHJpbnQuaW4vd29ybGQvcmlzZS1vZi12aW9sZW50LWhhdGUtZHJpdmVuLXBvbGl0aWNhbC1sZWFkZXJzaGlwLWNhc3RzLXNoYWRvdy1vZi1zdXNwaWNpb24tb24tc2lraHMtcmVwb3J0LzE1Nzc2MzUv0gGBAWh0dHBzOi8vdGhlcHJpbnQuaW4vd29ybGQvcmlzZS1vZi12aW9sZW50LWhhdGUtZHJpdmVuLXBvbGl0aWNhbC1sZWFkZXJzaGlwLWNhc3RzLXNoYWRvdy1vZi1zdXNwaWNpb24tb24tc2lraHMtcmVwb3J0LzE1Nzc2MzUvP2FtcA?oc=5&hl=en-US&gl=US&ceid=US:en","Tue 16 May 2023 14:14:11","Punjab [India], May 16 (ANI): The rise of violent and hate-driven political leadership has begun to cast a shadow of suspicion on Sikhs, even beyond their homeland, writes Harcharan Singh Parhar for Khalsa Vox.  Parhar writes that over the past 40 to 50 years, Sikhs have earned a highly respected position in foreign countries through their hard work and talent. Unfortunately, these achievements are now being overshadowed by the actions of those who are intent on sowing discord.  The stain of terrorism on Sikhs associated with the Air India plane incident in June 1985 has not yet been washed away, and daily fights over money boxes and control in gurudwaras, international students’ hooliganism, Sikh youths being caught in drug smuggling, killings in gang wars, unscrupulous and unconstitutional entrances into politics, and immigration fraud are bringing shame to the entire community.  These people have been suppressing the voice of the general public in the name of freedom of speech for some time now. Threats on social media, obscene language, slurs, and character assassination are being used to stop people from speaking their minds, according to Parhar in the Khalsa Vox article.  Sikh scholar Ajmer Singh in one of his videos mentioned that Amritpal Singh was involved in a troll army, which harasses people with the aforementioned actions.  “We could indeed scrutinize the violent actions and hooliganism being committed by this small section of our community in India and abroad, but how will you counter the impact it’s having on the perception of all Sikhs,” asks Parhar. (ANI)  This report is auto-generated from ANI news service. ThePrint holds no responsibility for its content."
"assassination","1986-11-23","Not Discerned","{""NewYork"", ""NewYork"", ""UnitedStates""}","https://news.google.com/rss/articles/CBMiU2h0dHBzOi8vbmV3cy5hYnMtY2JuLmNvbS9saWZlLzA1LzE2LzIzL2hlcmUtbGllcy1sb3ZlLWNhc3Qtb24tcmV0ZWxsaW5nLW1hcnRpYWwtbGF30gFXaHR0cHM6Ly9uZXdzLmFicy1jYm4uY29tL2FtcC9saWZlLzA1LzE2LzIzL2hlcmUtbGllcy1sb3ZlLWNhc3Qtb24tcmV0ZWxsaW5nLW1hcnRpYWwtbGF3?oc=5&hl=en-US&gl=US&ceid=US:en","Tue 16 May 2023 13:30:00","Watch more News on iWantTFC  Actors of the musical “Here Lies Love” have stressed the need for a retelling of the country’s Martial Law period and the 1986 EDSA People Power Revolution.  The musical by David Byrne is based on the rise and fall of former Philippine first lady Imelda Marcos.  David Byrne's Imelda Marcos musical is coming to Broadway in June  Jose Llana, who plays the role of Ferdinand Marcos Sr., said the musical is a cautionary tale for the world to see.  ""[It’s] showing people what happens when you elect popular candidates in a very popular election,” he said. “Then they have a party for 20 years. But what’s even more important is we show what happens after. Hangover comes and the lights turn on, and it’s called the People Power Revolution.”  Disney Princess Arielle Jacobs, known for her role as Princess Jasmine in Aladdin on Broadway, will step into the shoes of Imelda.  She believes this part of Philippine history is a story that needs to be told to a new generation.  “There's so many democracies at stake all around the world,” she said. “And there are countries all around the world that [want] to rewrite history.”  Jacobs added: “I think “Here Lies Love” shines a light on our history and it really shines a light more specifically on the people who led the revolution, the people who fought for democracy.”  “Here Lies Love” takes the audience back to the 70’s and the 80’s disco club scene in New York.  Bryne said the disco-driven musical brings to life Imelda’s lavish lifestyle in New York, and her endless parties with the Big Apple’s elite.  It will feature an all-Filipino cast for the first time on Broadway.  Conrad Ricamora plays the late senator Benigno “Ninoy” Aquino III, whose assassination in 1983, led to the bloodless revolt three years later.  “There’s never been an all-Filipino cast on Broadway,” he said. “We’re all energized and extra excited to tell our story in a revolutionary way.”  Playing the role of Ninoy’s mother Aurora is award-winning singer and actress Lea Salonga.  Lea Salonga joins cast of 'Here Lies Love' on Broadway  “On one level, the song is gorgeous but on a whole other level, it’s heartbreaking because this character is talking about her son,” she said.  “Here Lies Love” previews start on June 17 and opens on July 20 at the Broadway Theater in New York City."
