"topic","date"," time","place","url","date published","article text"
"birth","2023-05-04","Not Discerned","{""Delhi"", ""Delhi"", ""India""}","https://news.google.com/rss/articles/CBMiemh0dHBzOi8vd3d3LmluZGlhbmFycmF0aXZlLmNvbS9zY2llbmNlLW5ld3MvZGVsaGktem9vcy1yb3lhbC1iZW5nYWwtdGlncmVzcy1naXZlcy1iaXJ0aC10by1jdWJzLWFmdGVyLTE4LXllYXJzLTE0MzAxNC5odG1s0gF-aHR0cHM6Ly93d3cuaW5kaWFuYXJyYXRpdmUuY29tL3NjaWVuY2UtbmV3cy9kZWxoaS16b29zLXJveWFsLWJlbmdhbC10aWdyZXNzLWdpdmVzLWJpcnRoLXRvLWN1YnMtYWZ0ZXItMTgteWVhcnMtMTQzMDE0Lmh0bWwvYW1w?oc=5&hl=en-US&gl=US&ceid=US:en","Tue 16 May 2023 08:15:56","Officials of the National Zoological Park in New Delhi and wildlife enthusiasts were thrilled as after a gap of 18 long years, the golden Royal Bengal tigress Siddhi gave birth to cubs.  Of the five delivered by Siddhi on May 4 three have died and two are still alive. As per Akansha Mahajan, the Director of Delhi Zoo, Siddhi last gave birth on January 16, 2005.  Sharing details with the media, Mahajan said that while Siddhi was born in the wild and brought from Nagpur’s Gorewada Zoo, the father of the cubs, Karan was from Mysore Zoo and born in a zoo. The father is 10 years old and the mother is six.  Siddhi is attending to the two cubs and the zoo authorities are constantly monitoring their condition.  At present NZP has four adult Royal Bengal Tigers and their names are Karan, Siddhi, Aditi and Barkha. Aditi like Siddhi is of wild origin and was acquired from Gorewada.  Last year in August, three white tiger cubs were born at NZP after a gap of seven years. In December one of them died and the other two – Avani and Vyom – were released into an enclosure for public viewing last month.  Besides the six golden Royal Bengal tigers including the cubs, the Delhi Zoo houses five white tigers, taking the total number of tigers at NZP to 11.  NZP has been housing tigers since the inauguration on November 1, 1959. From then on Delhi Zoo is maintaining its population for conservation, education and display. Tigers have bred well in Delhi Zoo and also given in exchange to many zoos of the country and abroad.  The Zoo is part of the planned conservation breeding programme being run by Central Zoo Authority since 2010."
"birth","2023-10-01","10:00:00","{""Fairfield"", ""Connecticut"", ""UnitedStates""}","https://news.google.com/rss/articles/CBMisAFodHRwczovL3d3dy5lcmllbmV3c25vdy5jb20vc3RvcnkvNDg5MTgxNDkvcGZpemVycy1tYXRlcm5hbC1yc3YtdmFjY2luZS1lZmZlY3RpdmUtYXQtcHJldmVudGluZy1zZXZlcmUtaW5mZWN0aW9ucy1pbi1uZXdib3Jucy1mZGEtc2F5cy1idXQtZmxhZ3MtcG90ZW50aWFsLXJpc2stb2YtcHJldGVybS1iaXJ0aNIBAA?oc=5&hl=en-US&gl=US&ceid=US:en","Tue 16 May 2023 18:50:00","The difference between the groups was not statistically significant, meaning it could have been due to chance. Rates of preterm births in both groups were lower than the rates of early birth reported in the general population, which is about 10%. And most infants, even when born prematurely, were delivered after 34 weeks of pregnancy, just a few weeks shy of their due dates."
"birth","2023-05-19","Not Discerned","Not Discerned","https://news.google.com/rss/articles/CBMiiAFodHRwczovL3d3dy5hbW5lc3R5Lm9yZy9lbi9sYXRlc3QvbmV3cy8yMDIzLzA1L3Nsb3Zha2lhLXNsb3Zhay1wYXJsaWFtZW50LXNob3VsZC1yZWplY3QtYmlsbC1tYWtpbmctbGVnYWwtZ2VuZGVyLXJlY29nbml0aW9uLWltcG9zc2libGUv0gEA?oc=5&hl=en-US&gl=US&ceid=US:en","Tue 16 May 2023 23:04:18","Reacting to the prospect of a vote in the Slovak parliament on or before Friday 19 May on legislation that will make legal gender recognition impossible, Rado Sloboda, Director of Amnesty International Slovakia, said:  “Transgender people have been able to access legal gender recognition in Slovakia for more than 40 years but the Slovak parliament is now proposing to change legislation and remove this right.  “Amnesty International is calling on members of the Slovak parliament to reject this bill which jeopardizes the rights of transgender people and places the Slovak Republic in breach of its obligations under international human rights law.  Today is the International Day Against Homophobia, Biphobia, and Transphobia, and the Slovak government needs to be aware that the world is watching and will not be silent if the country violates people’s human rights. Rado Sloboda, Director of Amnesty International Slovakia  “Today is the International Day Against Homophobia, Biphobia, and Transphobia, and the Slovak government needs to be aware that the world is watching and will not be silent if the country violates people’s human rights.  “This law will gravely impact the rights of transgender people, forcing them to reveal their gender assigned at birth in everyday circumstances, such as signing for parcels. It will increase the risk of bullying, discrimination, or violence, and impact the right to privacy. This bill should not pass.”  Background  The National Assembly of the Slovak Republic is due to vote on Bill No. 301/1995, also known as the Birth Number Act which, if adopted, would force transgender people to prove they have the ‘correct’ set of chromosomes to have their legal gender affirmed. The act regulates birth numbers, the personal 10 digit identifier given to everyone in Slovakia on the day they are born. It includes information about the date of birth, and numbers for two genders – women are given the number 5, and men the numeral 0. The birth number must be changed to have your gender legally affirmed, but the law would effectively make this impossible, as most transgender people don’t have chromosomes matching their gender identity."
"birth","2023-04-25","Not Discerned","{""Somers"", ""NewYork"", ""UnitedStates""}","https://news.google.com/rss/articles/CBMiVWh0dHBzOi8vd3d3LmVsb24uZWR1L3UvbmV3cy8yMDIzLzA1LzE2L2pvaG4tc29tZXJzLTE0LXNldC1mb3ItcGdhLWNoYW1waW9uc2hpcC1kZWJ1dC_SAQA?oc=5&hl=en-US&gl=US&ceid=US:en","Tue 16 May 2023 19:21:06","Somers, a standout golfer during his years at Elon, secured a spot in the PGA Championship with a fourth-place finish in the PGA Professional Championship in April.  Share this page on Facebook Share this page on Twitter Share this page on LinkedIn Email this page to a friend Print this page  When John Somers arrived to compete at the PGA Professional Championship in late April, he had more than golf on his mind. In fact, just days before, Somers did not know if he would even be able to play.  Somers, who played at Elon from 2009 to 2014, became a father for the first time two days before flying to New Mexico to play in the tournament. John and wife Catherine, another Elon alumna, welcomed daughter Colbie on April 25, just five days before the event was scheduled to begin.  The due date for Colbie’s birth was May 17 but Somers said the early birth was a “blessing in disguise” as it meant he would no longer have to worry about missing her birth while competing at a tournament. After spending some time in the neonatal intensive care unit, Colbie was able to come home with no health issues, which gave Somers the peace of mind he needed to compete at the PGA Professional Championship.  “I wasn’t even expecting to play,” Somers said. “It had always been on my mind, am I going to miss the birth of my baby? It worked out where the baby came and I got to be there with my wife and then welcome my little girl knowing that my wife and the baby are healthy and she’s got a huge family support system, which made me very comfortable and know that I can go out there and play golf and not have to worry about anything.”  Somers works as the head PGA professional at the Southern Hills Plantation Club in Brooksville, Fla. Among his duties include golf shop and staff oversight and running tournaments hosted by the club.  The PGA Professional Championship is a tournament for golf club professionals and teachers who are members of the Professional Golfers’ Association of America. This year, over 300 players competed, with the top 20 finishers earning spots at the PGA Championship, one of the four major tournaments in men’s golf.  During one of his practice rounds in the leadup to the tournament, Somers wrote Colbie’s name on a golf ball to honor his first daughter. However, he quickly had to alter his tribute upon teeing off.  “I lost it on that same hole and I felt so guilty and so bad about it,” Somers said. “I was like, maybe a golf ball’s not a thing to do. So, I started writing it on my glove right below my thumb so that way I can always see it. It’s just a really great tribute for her and hopefully, I can make her proud.”  After shooting a 68 in both the second and third rounds, Somers shared the 54-hole lead. Although he did not win the tournament after a final-round 73, Somers easily secured a spot in this week’s PGA Championship by tying for fourth.  Somers said he did not have a chance to reflect on qualifying for the PGA Championship following the round due to his media obligations and thinking about seeing his family.  “I was just so focused on getting back home and being with my daughter and my wife. It wasn’t really until probably Saturday or Sunday when I started getting all the emails and I’m looking at flights and hotels,” Somers said. “That’s when it kind of hit me like, oh man, I’m actually doing this. I’m playing a major.”  A graduate of Bartlett Yancey High School, located just over 30 minutes from Elon, Somers had a prolific college career with the Phoenix. He was named the team’s most valuable player in both 2013 and 2014 and won the 2014 Coca-Cola Wofford Invitational. He credited his time at Elon for helping him develop as a player.  “College golf is always special because it’s really your last time for a lot of people to experience a team atmosphere,” Somers said. “I made lifelong friends. We played some great golf courses. I had two great coaches with Bill Morningstar and Don Hill. It definitely shaped me into the player I am today.”  Somers has played tournaments on the PGA Latinoamerica and the Korn Ferry Tour, the direct feeder tour for the PGA Tour, but this will be his first appearance at a major championship. The event will be held at Oak Hill Country Club in Rochester, New York, on May 18-21. The course has hosted six major championships, including three PGA Championships, most recently in 2013.  To prepare for the event, Somers said he has spent time watching highlights from the 2013 PGA Championship and other videos overviewing the course. Despite this being his first appearance in a major, Somers said he has high expectations for the week.  “I’d love to win it,” Somers said.”That’s the thing I always tell myself – don’t enter a tournament unless you want to win it.”  Somers will play with Christiaan Bezuidenhout and Chez Reavie, who have combined to win six tournaments on the PGA and DP World Tours, in the first two days. They will tee off in the opening round on Thursday, May 18, at 1:14 p.m. and on Friday, May 19, at 7:49 a.m. The tournament will air on ESPN, ESPN+ and CBS throughout the week."
"birth","1928-05-26","Not Discerned","{""Calcutta"", ""WestBengal"", ""India""}","https://news.google.com/rss/articles/CBMidmh0dHBzOi8vbS50aW1lc29maW5kaWEuY29tL2NpdHkva29sa2F0YS9uYXpydWxzLW9kZS10by1mcmllbmQtdG8tYmUtZGlzcGxheWVkLW9uLWJpcnRoLWFubml2L2FydGljbGVzaG93LzEwMDI5MDU2My5jbXPSAXpodHRwczovL20udGltZXNvZmluZGlhLmNvbS9jaXR5L2tvbGthdGEvbmF6cnVscy1vZGUtdG8tZnJpZW5kLXRvLWJlLWRpc3BsYXllZC1vbi1iaXJ0aC1hbm5pdi9hbXBfYXJ0aWNsZXNob3cvMTAwMjkwNTYzLmNtcw?oc=5&hl=en-US&gl=US&ceid=US:en","Wed 17 May 2023 02:41:00","KOLKATA: It was a professional relationship that transformed into a creatively enriching friendship for poet Kazi Nazrul Islam . In 1928, Nazrul’s trainer at the Gramophone Co was Dhiren Das . Over the years, their bond strengthened so much that Nazrul felt an urge to write a four-page-long poem on their relationship.The poem’s original manuscript has not come in the public domain before. Das’ son Arabinda had donated the manuscript for preservation at the Jiban Smriti Archive. On Nazrul’s birth anniversary that will be celebrated on May 26 this year, the manuscript will be on display for the public.Founder of the archive Arindam Saha Sardar said, “Das, who was an accomplished singer, was also actor Anup Kumar’s father. This year, Das family gifted this manuscript to us. I am immensely grateful to Arabinda Das for trusting us with the preservation job. This is not just a personal document but a national treasure. It has Kazi Nazrul’s own handwriting.”Das had joined as a trainer at the Gramaphone Co. in 1924. Later, the likes of Bimal Dasgupta and Tulsi Lahiri joined the music company too. “In 1928, K Mullick gained popularity by singing ‘Bagichae bulbuli tui’. When asked about the identity of the songwriter, he mentioned Kazi Nazrul Islam. One day, Mullick chanced upon Nazrul somewhere near Rajabazar and introduced the Gramophone Co. officials to him,” said Das’ son, Arabinda.On persuasion. Nazrul agreed to sign a contract with the Gramaphone Co. According to this contracts, Das’ responsibility was to learn the songs from him and then teach them to others. This process continued for long and soon the duo became great friends. What endeared Nazrul to Das further was the latter’s ability to memorize a song quickly. “He used to address Baba as ‘shrutidhor’. Kazi Jyathamoshai , as we referred him, would say: ‘If Dinu Thakur is Tagore’s ‘kandari’, Dhiren is my ‘gaandhari’ because he can retain my gaan (songs) in his memory. Baba was the first outsider to set Nazrul’s songs to his tunes. The tunes of his songs – ‘Kaalo meyer payer tolae’ and ‘Aar lukabi kothae Maa Kali ’ – that have become popular were composed by my father,” Arabinda said.Not just creative collaborations, Das also came to Nazrul’s aid when the latter had problems finding accommodation. “That was because of his religious identity. Baba got him an accommodation next to our house on Hari Ghosh Street,” Arabinda added.It was very natural for Nazrul to want posterity to know about this friendship. That’s why both decided that Nazrul would write a 14-stanza-long poem on their relationship and Das would set it to tune. But the poem never turned into a song. The untitled poem has Nazrul’s signature."
"birth","2023-02-20","Not Discerned","{""Charlotte"", ""NorthCarolina"", ""UnitedStates""}","https://news.google.com/rss/articles/CBMiQWh0dHBzOi8vdWsuc3R5bGUueWFob28uY29tL3R3by11dGVydXNlcy10d2luLWJpcnRoLTE2MzgyMjg1Ni5odG1s0gFJaHR0cHM6Ly91ay5zdHlsZS55YWhvby5jb20vYW1waHRtbC90d28tdXRlcnVzZXMtdHdpbi1iaXJ0aC0xNjM4MjI4NTYuaHRtbA?oc=5&hl=en-US&gl=US&ceid=US:en","Tue 16 May 2023 16:38:22","Madeline Kaklikos, who has two uteruses, fell pregnant naturally in her second uterus one week after conceiving a baby via IVF in her first. (Caters)  A mum has revealed how doctors called her pregnancy ‘one in 50 million’ after she conceived twin boys in two separate uteruses.  Madeline Kaklikos, 24, was diagnosed with a rare condition called uterus didelphys after she and her husband Jon, 27, spent a year trying to have a baby naturally.  Uterus didelphys – where a woman is born with two uteruses – affects just 0.3% of the population. This meant that Kaklikos had both two uteruses and two cervixes.  Read more: Mum-to-be suffered burst brain tumour which forced her to give birth while in a coma  Kaklikos began IVF at the end of 2021, and after nine unsuccessful rounds with one uterus, doctors tried using her other uterus instead, which was successful.  “When I was ten weeks pregnant, we went back for another scan to check on how our miracle baby was doing,” Kaklikos explains.  During this scan, to their astonishment, the doctor told Kakliko and her husband that there was another baby showing, but that this baby was in her other uterus.  Kaklikos gave birth to twins Nate and Cole in February this year. (Caters)  “I thought she must have been joking with us,” Kaklikos recalls. “The second baby was measuring smaller than the first, so it's suspected that we conceived another baby spontaneously the week after our transfer.  “Medics told me that this was a one in 50 million pregnancy because Nate was in one uterus and Cole was in the other, and they had also been conceived in different ways and at different times. Nate was conceived through IVF and Cole was a spontaneous pregnancy.”  Kaklikos says that she and her husband were in such shock after they were told they were having two babies, they both sat in silence for 20 minutes.  Read more: Rihanna's son's unusual name revealed – how to pick something unique for your baby  “A spontaneous pregnancy just wasn't on our radar,” she adds. “We were warned that the pregnancy would've been complicated enough with one baby, never mind two.”  However, Kaklikos says her pregnancy went ‘fairly smoothly’ as she was constantly monitored, and he waters broke when she was 34 weeks pregnant.  Story continues  Read more: What is ‘quickening’ in pregnancy after Queen Charlotte scene stirs up interest?  “On February 20, our twin boys Nate and Cole were born. We couldn't believe how perfect they were. They needed to be on oxygen for a day, and they started off on feeding tubes before they were able to start having bottles.  “They're both doing so well, and we are loving life as parents to our one in 50 million twins. I wish they knew how special they really are."""
"birth","2023-04-01","16:00:00","{""London"", ""GreaterLondon"", ""UnitedKingdom""}","https://news.google.com/rss/articles/CBMiTGh0dHBzOi8vd3d3LnRoZXN1bi5pZS90di8xMDcxOTIzMy9iaW5reS1mZWxzdGVhZC1iaXJ0aC1iYWJ5LW1hZGUtaW4tY2hlbHNlYS_SAVBodHRwczovL3d3dy50aGVzdW4uaWUvdHYvMTA3MTkyMzMvYmlua3ktZmVsc3RlYWQtYmlydGgtYmFieS1tYWRlLWluLWNoZWxzZWEvYW1wLw?oc=5&hl=en-US&gl=US&ceid=US:en","Tue 16 May 2023 10:35:46","MADE In Chelsea's Binky Felstead came under fire from a mum-shamer after posting a video on Instagram.  She was holding her tot in a carrier while she baked, and one follower said his head was ""bobbing"" around.  4 Binky was baking with her two year old Wolfie while holding newborn Wilder in a baby carrier  4 The reality TV star is a mum of three Credit: Instagram  The troll lashed out at the Made In Chelsea star: ""Why don’t you put the baby down, it’s head is bobbing all over the place.""  However their comment sparked fury from others who rushed to defend Binky.  One clapped back: ""Are we watching the same video? As I can't see the head bobbing all over the place all I can see is a happy family, happy baby all snuggled healthy, happy, and very much SAFE.""  Binky also shared a comment and tagged the troll, writing: ""If only you knew.""  Binky was cooking with her two year old son Wolfie.  She gave birth to her third child, a son called Wilder, in April.  The reality star shares her sons with husband Max Darnton, and her eldest daughter India, five, with her ex Josh Patterson.  Binky gave birth to Wilder at St Mary's Hospital in London.  She delivered the tot on the prestigious £5,900-per-night Lindo Wing, which is where the Princess of Wales had her babies.  In her book, The Making of You: A guide to finding your Identity and bossing motherhood, Binky said she was prepared to be a mum for the third time though noted there is still room for improvement.  She wrote: ""With baby number three on the way, I feel like I know what I’m doing now.  ""It’s not perfect and I think my husband Max might divorce me because I’m so grumpy. But, overall, we’re so excited to become a family of five.""  4 She rose to fame on Made In Chelsea Credit: Getty"
"birth","2023-08-18","Not Discerned","{""SaintAugustine"", ""Florida"", ""UnitedStates""}","https://news.google.com/rss/articles/CBMieGh0dHBzOi8vd3d3Lm5ld3M0amF4LmNvbS9yaXZlci1jaXR5LWxpdmUvMjAyMy8wNS8xNi9jZWxlYnJhdGluZy1pbnRlcm5hdGlvbmFsLWRvdWxhLW1vbnRoLWFuZC1hbnN3ZXJpbmctd2hhdC1pcy1hLWRvdWxhL9IBAA?oc=5&hl=en-US&gl=US&ceid=US:en","Tue 16 May 2023 17:40:02","Naomi has been serving women and families in the birthing community for several years teaching women to release their fears, trust their inner strength and create a beautiful birth story. Naomi aims to educate, elevate and empower women as they prepare for labor and birth. Creating an environment of peace, relaxation and comfort takes practice to be able to release fear, tension, and pain that often comes from an overwhelming experience such as birth. Naomi begins this journey around 30 weeks gestation then gives continuous physical and emotional support to the birthing woman and her partner through labor and birth. You can follow Naomi on Instagram @DoulaStAugustine or Facebook @St. Augustine Doula or check out her website at www.DoulaStAugustine.com."
"birth","2023-05-16","18:36:00","{""Mudigere"", ""Karnataka"", ""India""}","https://news.google.com/rss/articles/CBMiYWh0dHBzOi8vd3d3LnVkYXlhdmFuaS5jb20vZW5nbGlzaC1uZXdzL211ZGlnZXJlLXdvbWFuLWdpdmVzLWJpcnRoLXRvLWJhYnktZ2lybC1kdXJpbmctYnVzLWpvdXJuZXnSAWFodHRwczovL3d3dy51ZGF5YXZhbmkuY29tL2VuZ2xpc2gtbmV3cy9tdWRpZ2VyZS13b21hbi1naXZlcy1iaXJ0aC10by1iYWJ5LWdpcmwtZHVyaW5nLWJ1cy1qb3VybmV5?oc=5&hl=en-US&gl=US&ceid=US:en","Tue 16 May 2023 13:06:00","Mudigere: Woman gives birth to baby girl during bus journey!  A A A  Team Udayavani, May 16, 2023, 6:36 PM IST  Mudigere: In a heartwarming incident, a pregnant woman gave birth to a baby girl on a bus on the Channarayapatna-Hassan route in Mudigere. The incident unfolded on the KSRTC bus (KA-18 F-0865), operating on the route from Bengaluru to Chikkamagaluru.  An expectant mother, originally from Bihar, was on her way to Mudigere to work as a laborer. However, she began experiencing labor pains during the bus journey.  Seeing the woman in distress, the bus driver promptly pulled over to the side of the road. The bus conductor Vasatha and other women passengers on board helped the woman deliver the baby.  The mother and the newborn baby girl were shifted to the Shantigram Hospital via a 108 ambulance. Once the mother and baby were admitted to the hospital, the bus resumed its journey as scheduled.  The extraordinary efforts of Vasantha, the driver, and the passengers have garnered widespread praise from the public."
"birth","2023-05-17","Not Discerned","Not Discerned","https://news.google.com/rss/articles/CBMiXmh0dHBzOi8vd3d3LndyZXN0bGluZ2luYy5jb20vMTI4NTcyNy9taWNrLWZvbGV5LWFyZ3VlLWVyaWMtYmlzY2hvZmYtd2N3LWJpcnRoLWRhdWdodGVyLW5vZWxsZS_SAQA?oc=5&hl=en-US&gl=US&ceid=US:en","Wed 17 May 2023 04:30:00","Mick Foley Had To Argue With Eric Bischoff In WCW To Be At Birth Of Daughter Noelle  Being in the professional wrestling industry can be a selfish task at times with the focus being on winning titles, selling merchandise, and headlining PPVs. However, some things are more important than that, which was the case when Mick Foley requested some time off from WCW television.  He revealed on ""Foley Is Pod"" that his wife was having a difficult pregnancy with his daughter, Noelle, and that was something that took precedence for him. Despite being the ""Hardcore Legend,"" Foley is well-known for being a family man and someone who cares for others, which he has often been praised for over the years.  ""She had to spend most of the day resting, and so I asked Eric if I could have the time off. He said, 'Cactus, you just had time off for the Vader angle,' and I said, 'Yesterday on a house show I think I teamed up with Ice Train. You guys don't have any plans for me,'"" he said. ""He granted me the time off.""  The break was something that Foley appreciated as he made it clear that telling the story was a thank you to WCW. Being able to have a break at the time of his daughter's birth is something that a lot of professional wrestlers aren't able to have.  ""When I came back we were able to do some pretty good business,"" he said. ""And I was able to be there when Noelle was born.""  Foley was a part of WCW between 1991 and 1994, and later found fame with WWE, where he crafted a Hall of Fame career.  If you use any quotes from this article, please credit ""Foley Is Pod"" with a H/T to Wrestling Inc. for the transcription."
