"topic","date"," time","place","url","date published","article text"
"birth","2013-05-20","Not Discerned","{""Norman"", ""Oklahoma"", ""UnitedStates""}","https://news.google.com/rss/articles/CBMiVWh0dHBzOi8vd3d3LmtvY28uY29tL2FydGljbGUvb2tsYWhvbWEtbW9vcmUtbWF5LTIwLTIwMTMtdG9ybmFkby1taXJhY2xlLWJhYnkvNDM5MDUzODbSAVlodHRwczovL3d3dy5rb2NvLmNvbS9hbXAvYXJ0aWNsZS9va2xhaG9tYS1tb29yZS1tYXktMjAtMjAxMy10b3JuYWRvLW1pcmFjbGUtYmFieS80MzkwNTM4Ng?oc=5&hl=en-US&gl=US&ceid=US:en","Tue 16 May 2023 15:18:00","Oklahoma woman remembers giving birth amid chaos of May 20 tornado Even though so many people lost so much on May 20, 2013, a glimmer of hope and a miracle also took place that day – something Shayla Taylor says she'll never take for granted. Share Copy Link Copy  Hide Transcript Show Transcript  ANNIVERSARY OF THE MAY 20TH TORNADO THAT DEVASTATED MOORE AND SURROUNDING AREAS, WE’RE TAKING A LOOK BACK AT SOME OF THOSE IMPACTED BY THAT DAY. OKAY. WE’RE TALKING ABOUT JUST WEST OF I-35. THIS IS GOING TO BE ESPECIALLY JUST RIGHT AROUND THE WARREN THEATER, THE MOORE MEDICAL CENTER, ROYAL PARK, MOORE. THIS IS ALL ON THE WEST SIDE OF I-35. YOU ARE IN THE PATH OF THIS TORNADO. SO I THINK THE MORE MEDICAL CENTER LOOKING DIRECTLY INTO THIS AND WHILE THAT DAY IN 2013 WAS FILLED WITH SO MUCH TRAGEDY AND DESTRUCTION FOR AT LEAST ONE FAMILY, A MIRACLE TOOK PLACE. AMONG THAT CHAOS, KOCO ZACH RAEL SPOKE WITH SHAYLA TAYLOR. SHE WAS IN LABOR AS THE TORNADO BARRELED DOWN ON MOORE MEDICAL CENTER. HE HAS AN UPDATE TODAY ON HER SON AND HOW THAT FATEFUL DAY HAS COME FULL CIRCLE A DECADE LATER. LOOKING BACK TEN YEARS LATER, SHAYLA TAYLOR SAYS STORMS, ESPECIALLY TORNADOES, WERE THE LAST THING ON HER MIND AS SHE STARTED HER DAY ON MAY 20TH, 2013. THAT’S BECAUSE TAYLOR WAS SCHEDULED TO BE INDUCED TO GIVE BIRTH TO HER SECOND SON. THAT AFTERNOON. SEVERE WEATHER, TORNADOES, NOTHING LIKE THAT WAS ON MY MIND AT ALL, WAS GO IN, HAVE A BABY, GO HOME. AND THAT’S THE END OF IT. AS IT TURNED OUT, HER DELIVERY WAS ANYTHING BUT THAT SIMPLE. AS SHE GOT TO MOORE MEDICAL CENTER, HER DOCTORS AND NURSES KEEPING A CLOSE EYE ON THE WEATHER FORECASTS. AS IT WAS PREDICTED, STRONG STORMS COULD BE FORMING THAT AFTERNOON WHEN I GOT THERE, THE DOCTOR TOLD ME THAT SHE WAS GOING TO CHECK THE WEATHER AND SEE IF I WAS ACTUALLY IN ACTIVE LABOR OR ANYTHING LIKE THAT BECAUSE THERE WAS SUPPOSED TO BE BAD WEATHER THAT DAY. WHATEVER THE WEATHER, THE BABY WAS WELL ON ITS WAY. AND TAYLOR WAS GIVEN AN EPIDURAL, WHICH MEANS THAT SHE CAN NO LONGER MOVE HERSELF FREELY. SHORTLY AFTER, THAT’S WHEN THINGS OUTSIDE THE HOSPITAL TOOK A TURN FOR THE WORST. A TORNADO EMERGENCY WAS ISSUED AROUND MAYBE TWO OR SO. THEY COME IN AND SAY THAT WE’RE GOING TO HAVE TO TAKE COVER AND MY FAMILY IS GOING TO HAVE TO GO DOWNSTAIRS TO THE CAFETERIA. I CAN’T GO ANYWHERE BECAUSE, LIKE I SAID, I CAN’T GET OUT OF BED. A RARE F5 TORNADO WAS HEADING RIGHT TOWARDS MOORE MEDICAL CENTER. DOCTORS AND NURSES RUSHING TO GET TAYLOR TO A SAFE SPOT. THEY DECIDE THEY’RE GOING TO HAVE TO MOVE ME TO THE PLACE WHERE THERE’S NO WINDOWS AS CLOSE AWAY FROM THE OUTSIDE OF THE BUILDING AS THEY CAN, WHICH ENDED UP BEING THE OR JUST MINUTES LATER, THAT MASSIVE TORNADO HIT THE HOSPITAL HEAD ON, DESTROYING THE BUILDING AROUND HER. A LOT OF PEOPLE SAY THAT, YOU HEAR LIKE A SILENCE OR LIKE A TRAIN OR WHATEVER WHEN TORNADOES COME THROUGH. BUT IT WAS MORE OF A SILENT THING, LIKE YOU DIDN’T REALLY HEAR ANYTHING. YOU JUST SAW EVERYTHING KIND OF FALLING AROUND YOU. THIS IS A PHOTO OF WHAT WAS LEFT OF THE O.R. WHERE TAYLOR WAS HUNKERED DOWN. YOU CAN SEE THE DEBRIS AND DESTRUCTION ALL AROUND WHEN IT WAS ACTUALLY HITTING WAS WHEN I WAS THE MOST SCARED. TAYLOR AND HER FAMILY SURVIVED. BUT EVEN WITH THE DESTRUCTION AROUND THEM, THAT DIDN’T CHANGE THE FACT THAT SHE WAS GOING TO GIVE BIRTH VERY SOON. SHE NEEDED TO GET TO SAFETY. THAT WAS A TASK IN ITSELF BECAUSE I’M UPSTAIRS AND I SAID ALL THE HALLWAYS ARE DARK. EVEN WHEN THEY CARRIED ME DOWN ON THE BACKBOARD, IT WAS DARK GOING DOWN THE STAIRS. YOU KNOW, YOU’RE JUST KIND OF LOOKING AROUND. YOU CAN’T REALLY SEE MUCH OF ANYTHING. SO THE FIRST LIGHT I ACTUALLY SAW WAS ONCE WE GOT OUTSIDE OF THE HOSPITAL, ONCE SHE WAS OUTSIDE, TAYLOR SAYS, SHE STARTED TO REALIZE THE TRUE MAGNITUDE OF THE STORM. IT WAS MUDDY. THERE WAS THERE WERE TREES AND DEBRIS EVERYWHERE. THERE WERE CARS AND STUFF KIND OF EVERYWHERE. SO I KNEW THAT IT WAS PRETTY BAD. SHE WAS THEN RUSHED TO NORMAN REGIONAL HOSPITAL, WHERE SHE SUCCESSFULLY GAVE BIRTH AT 7:30 P.M. TO HER SECOND SON, BRADEN. HE WILL BE TEN AND HE HE’S DOING GOOD. HE’S IN FOURTH GRADE NOW. HE KNOWS A LOT ABOUT THE DAY HE WAS BORN. SO WE TALK ABOUT IT ALL THE TIME. A DECADE LATER. AND TAYLOR SAYS IT’S HARD TO BELIEVE THAT SO MUCH TIME HAS ALREADY PASSED. COMING UP ON TEN YEARS FEELS A LITTLE SURREAL, LIKE IT DOESN’T FEEL LIKE IT’S BEEN TEN YEARS SINCE THE TORNADO HAPPENED. OF COURSE, MY DAILY REMINDER IS MY CHILD, TAYLOR, USING HER UNIQUE DELIVERY EXPERIENCE TO HELP OTHERS SOON TO BE MOMS. TODAY, SHE’S NOW A NURSE AT THE VERY HOSPITAL WHERE SHE GAVE BIRTH AT NORMAN REGIONAL HOSPITAL. IT’S DEFINITELY COME FULL CIRCLE. I WORK IN LABOR AND DELIVERY, WHICH I ABSOLUTELY LOVE. IN FACT, SHE EVEN WORKS WITH THAT SAME DOCTOR WHO DELIVERED BRADEN. SHE DIDN’T REALIZE WHO I WAS FOR A WHILE BECAUSE I NEVER TOLD HER. AND THEN ONE DAY SHE JUST WALKS UP TO ME AND SHE’S LIKE, YOU’RE SHAYLA, AREN’T YOU? AND I WAS LIKE, YEAH. AND SO SHE STARTS SHOWING ME PICTURES THAT SHE HAD FROM THE HOSPITAL AND STUFF. AND SO WE JUST KIND OF SHARED OUR PICTURES AND I TOLD HER THANK YOU, EVEN THOUGH SO MANY PEOPLE LOST SO MUCH ON MAY 20TH, 2013, A GLIMMER OF HOPE AND A MIRACLE ALSO TOOK PLACE THAT DAY, SOMETHING TAYLOR SAYS SHE WILL NEVER TAKE FOR GRANTED. I THINK ABOUT ALL THE LIVES THAT WERE LOST THAT DAY. AND OF COURSE, I’M BLESSED TO HAVE A MIRACLE OUT OF THE SITUATION. BUT I ALWAYS REMEMBER THOSE THAT WE  GET LOCAL BREAKING NEWS ALERTS The latest breaking updates, delivered straight to your email inbox. Your Email Address Submit Privacy Notice"
"birth","2023-05-03","16:53:00","{""RockSprings"", ""Wyoming"", ""UnitedStates""}","https://news.google.com/rss/articles/CBMiS2h0dHBzOi8vd3d3LnN3ZWV0d2F0ZXJub3cuY29tL2JpcnRoLWFubm91bmNlbWVudC1lbGxhbG91aXNlLXBhdHJpY2lhLWJ1bm90L9IBAA?oc=5&hl=en-US&gl=US&ceid=US:en","Tue 16 May 2023 21:24:35","Ellalouise Patricia Bunot was born on May 3, 2023, at 4:53 p.m. at Memorial Hospital of Sweetwater County in Rock Springs.  She was welcomed into the world by proud parents Elizabeth and Jordan Bunot.  Congratulations!  Advertisement - Story continues below...  Births are sponsored by Memorial Hospital Obstetrics & Women’s health. You can submit your own birth announcement here.  Brought to you by:"
"birth","2002-07-10","Not Discerned","{""Northampton"", ""Northamptonshire"", ""UnitedKingdom""}","https://news.google.com/rss/articles/CBMiUWh0dHBzOi8vd3d3Lm55dGltZXMuY29tLzIwMjMvMDUvMTYvbW92aWVzL2dpdmluZy1iaXJ0aC10by1hLWJ1dHRlcmZseS1yZXZpZXcuaHRtbNIBAA?oc=5&hl=en-US&gl=US&ceid=US:en","Tue 16 May 2023 14:46:09","“Giving Birth to a Butterfly,” Theodore Schaefer’s beautifully peculiar debut feature, strikes a balance between tender and vaguely unsettling, an effect similarly achieved by the work of David Lynch. I hate to use “Lynchian,” a term frequently — and slovenly — invoked for films with a merely surrealist bent. But Schaefer’s film, also steeped in a distinctly American nostalgia, more than deserves the description.  In this uncanny indie, we’re plunged into an American no-place, where a suburban father, Daryl (Paul Sparks), plans to open a diner despite not having any money; and where a former actress named Monica (Constance Shulman, channeling Norma Desmond in “Sunset Boulevard”) prepares for a big interview that will never happen. Opposite these tragic figures is Daryl’s wife, Diane (Annie Parisse), and Monica’s daughter Marlene (Gus Birney) — two women worn down by the follies of their loved ones."
"birth","2009-10-25","Not Discerned","{""Dartmouth"", ""Massachusetts"", ""UnitedStates""}","https://news.google.com/rss/articles/CBMiRGh0dHBzOi8vd3d3Lm55dGltZXMuY29tLzIwMjMvMDUvMTYvaGVhbHRoL2NoaWxkYmlydGgtZmVhci13b21lbi5odG1s0gEA?oc=5&hl=en-US&gl=US&ceid=US:en","Tue 16 May 2023 21:10:31","When Zaneta Thayer, an anthropologist at Dartmouth College, asks students in her evolution class what words come to mind when they think of childbirth, almost all of them are negative: pain, screaming, blood, fear.  Then she asks if any of the students has ever seen a woman give birth. Most have not.  Curious about how cultural attitudes and expectations affect the physical experience of childbirth and its outcomes, Dr. Thayer began a study to assess the prevalence of tokophobia, the medical term for a pathological fear of childbirth.  Though tokophobia has been well studied in Scandinavian countries, some of which screen pregnant women and offer treatment for it, little research has been done in the United States. Dr. Thayer’s online survey of nearly 1,800 American women found that in the early days of the pandemic, tokophobia may have affected the majority of American women: 62 percent of pregnant respondents reported high levels of fear and worry about childbirth.  The results were published last month in the journal Evolution, Medicine, and Public Health.  Other scientists who study childbirth said the levels of fear in the United States were higher than those reported in Europe and Australia, which are lower than 20 percent. But they noted that birthing conditions in the United States are different and that pandemic circumstances may have exacerbated fears."
"birth","2021-07-10","Not Discerned","Not Discerned","https://news.google.com/rss/articles/CBMibmh0dHBzOi8vd3d3LmxvY2toYXZlbi5jb20vbmV3cy9sb2NhbC1uZXdzLzIwMjMvMDUvcmVwb3J0LXJ1cmFsLXBhLXNlZXMtZ2FpbnMtaW4tbWlncmF0aW9uLWRyb3AtaW4tYmlydGgtcmF0ZXMv0gEA?oc=5&hl=en-US&gl=US&ceid=US:en","Wed 17 May 2023 05:15:54","For the last decade, deaths have outnumbered births in rural Pennsylvania, a series of reports released on Monday found.  In addition to these findings, the reports recorded a net-gain in population to rural parts of the commonwealth through in-migration.  The reports, released by the Center for Rural Pennsylvania, a state legislative agency for rural policy, use data from the U.S. Census Bureau and the Department of Health, to better understand the commonwealth’s rural areas, including who is moving into — and out of — them.  In-Migration/Out-Migration  Data from the U.S. Census Bureau shows that in 2021, more than 144,900 people moved into rural Pennsylvania and approximately 123,300 moved out. This movement resulted in a net gain of approximately 21,600 new residents, down from 21,800 in 2019.  The report found that the majority of people (52%) moving to rural Pennsylvania, were from out-of-state.  In fact, more than 54% of the people moving to rural Pennsylvania came from neighboring states New York, New Jersey and Maryland.  Another 41% of the people who moved to rural areas of the commonwealth came from its urban areas, compared to 2019 when 38% came from urban Pennsylvania.  Lastly, 7% of the people who moved to rural Pennsylvania came from outside of the United States.  Of those who left rural Pennsylvania, 53% went to other states, compared to 61% in 2019.  Fifty-one percent of those moved to one of the following five states: Florida, New York, Maryland, North Carolina and South Carolina.  Additionally, 47% of those who moved out of rural Pennsylvania relocated to urban areas in 2021.  The report identified working adults and college students as the two largest demographic groups driving in-migration to rural areas of the commonwealth.  Working adults between the ages of 18 and 64 made up 40% of the people who moved out of rural Pennsylvania and 37% of those who moved into rural areas.  College students made up 22% of those who moved into rural Pennsylvania and 18% of those who moved out, according to the report.  Birth & Death Rates  From 2010 to 2020, deaths outnumbered births in rural Pennsylvania, accounting for the loss of nearly 85,000 residents.  Nationally, the birth rate from 2010 to 2020 was 12.13 per 1,000 residents, according to census data.  At 10.87 births per 1,000 residents, Pennsylvania had one of the nation’s lowest birth rates over the same time period with only eight states having lower birth rates.  In rural Pennsylvania, the birth rate was lower than the statewide rate at 9.17 births per 1,000 residents.  The report found that Wayne, Centre, Sullivan, Pike and Forest counties had the lowest birth rates with each having rates below 8 births per 1,000 residents.  ——  Pennsylvania Capital-Star is part of States Newsroom, a network of news bureaus supported by grants and a coalition of donors as a 501c(3) public charity. Pennsylvania Capital-Star maintains editorial independence. Contact Editor John Micek for questions: info@penncapital-star.com. Follow Pennsylvania Capital-Star on Facebook and Twitter."
"birth","2023-07-01","Not Discerned","{""Tuscaloosa"", ""Alabama"", ""UnitedStates""}","https://news.google.com/rss/articles/CBMihgFodHRwczovL3d3dy5zdGFyZGVtLmNvbS9saWZlL2JpcnRoLWRlYXRoLWNlcnRpZmljYXRlcy1hdmFpbGFibGUtYXQtaGVhbHRoLWRlcGFydG1lbnQvYXJ0aWNsZV9kMDAwYTg5ZS00Mzk3LTUxYWItOTQzYi0zODBkYzMwMWFlZjkuaHRtbNIBAA?oc=5&hl=en-US&gl=US&ceid=US:en","Wed 17 May 2023 06:30:00","State Alabama Alaska Arizona Arkansas California Colorado Connecticut Delaware Florida Georgia Hawaii Idaho Illinois Indiana Iowa Kansas Kentucky Louisiana Maine Maryland Massachusetts Michigan Minnesota Mississippi Missouri Montana Nebraska Nevada New Hampshire New Jersey New Mexico New York North Carolina North Dakota Ohio Oklahoma Oregon Pennsylvania Rhode Island South Carolina South Dakota Tennessee Texas Utah Vermont Virginia Washington Washington D.C. West Virginia Wisconsin Wyoming Puerto Rico US Virgin Islands Armed Forces Americas Armed Forces Pacific Armed Forces Europe Northern Mariana Islands Marshall Islands American Samoa Federated States of Micronesia Guam Palau Alberta, Canada British Columbia, Canada Manitoba, Canada New Brunswick, Canada Newfoundland, Canada Nova Scotia, Canada Northwest Territories, Canada Nunavut, Canada Ontario, Canada Prince Edward Island, Canada Quebec, Canada Saskatchewan, Canada Yukon Territory, Canada  Zip Code"
"birth","2023-07-01","Not Discerned","{""Tuscaloosa"", ""Alabama"", ""UnitedStates""}","https://news.google.com/rss/articles/CBMiigFodHRwczovL3d3dy5ucnRvZGF5LmNvbS9mYW1pbHkvb3VyLXBlb3BsZS1uZXctbW90aGVyLWdpdmVzLWJpcnRoLWp1c3QtYmVmb3JlLW1vdGhlcnMtZGF5L2FydGljbGVfZGU3OTI2NTAtZjA0Yy0xMWVkLTkxZTUtNjM3MzQ0N2ZlNmU5Lmh0bWzSAQA?oc=5&hl=en-US&gl=US&ceid=US:en","Tue 16 May 2023 15:00:00","State Alabama Alaska Arizona Arkansas California Colorado Connecticut Delaware Florida Georgia Hawaii Idaho Illinois Indiana Iowa Kansas Kentucky Louisiana Maine Maryland Massachusetts Michigan Minnesota Mississippi Missouri Montana Nebraska Nevada New Hampshire New Jersey New Mexico New York North Carolina North Dakota Ohio Oklahoma Oregon Pennsylvania Rhode Island South Carolina South Dakota Tennessee Texas Utah Vermont Virginia Washington Washington D.C. West Virginia Wisconsin Wyoming Puerto Rico US Virgin Islands Armed Forces Americas Armed Forces Pacific Armed Forces Europe Northern Mariana Islands Marshall Islands American Samoa Federated States of Micronesia Guam Palau Alberta, Canada British Columbia, Canada Manitoba, Canada New Brunswick, Canada Newfoundland, Canada Nova Scotia, Canada Northwest Territories, Canada Nunavut, Canada Ontario, Canada Prince Edward Island, Canada Quebec, Canada Saskatchewan, Canada Yukon Territory, Canada  Zip Code"
"birth","2023-07-01","10:00:00","{""Boston"", ""Massachusetts"", ""UnitedStates""}","https://news.google.com/rss/articles/CBMiKmh0dHBzOi8vd3d3LmJiYy5jb20vbmV3cy9idXNpbmVzcy02NTQ3ODM3NtIBLmh0dHBzOi8vd3d3LmJiYy5jb20vbmV3cy9idXNpbmVzcy02NTQ3ODM3Ni5hbXA?oc=5&hl=en-US&gl=US&ceid=US:en","Tue 16 May 2023 21:08:05","""We need to understand the underlying determinants of why women are not having children, and that is often the inability of women to be able to combine their work life with their family life,"" she added."
"birth","0272-01-01","Not Discerned","{""Alamance"", ""NorthCarolina"", ""UnitedStates""}","https://news.google.com/rss/articles/CBMiZ2h0dHBzOi8vd3d3LnRoZXRpbWVzbmV3cy5jb20vbW9vcmUtYmlydGgtYW5ub3VuY2VtZW50L2FydGljbGVfNGZjM2ZhMzQtY2ViYS01OWY1LWE4ZjktMGU4YTU4MDRkNmMyLmh0bWzSAQA?oc=5&hl=en-US&gl=US&ceid=US:en","Tue 16 May 2023 20:17:30","Alamance, NC (27215)  Today  Partly cloudy skies early will give way to cloudy skies late. Low near 55F. Winds ENE at 5 to 10 mph..  Tonight  Partly cloudy skies early will give way to cloudy skies late. Low near 55F. Winds ENE at 5 to 10 mph."
"birth","2023-01-29","Not Discerned","{""Toledo"", ""Ohio"", ""UnitedStates""}","https://news.google.com/rss/articles/CBMiQmh0dHBzOi8vd3d3Lmp1c3RpY2UuZ292L3VzYW8tc2R0eC9wci93b21hbi1hZG1pdHMtc211Z2dsaW5nLW1pbm9yc9IBAA?oc=5&hl=en-US&gl=US&ceid=US:en","Mon 15 May 2023 18:03:56","McALLEN, Texas – A 22-year-old resident of Toledo, Ohio, has pleaded guilty to transporting an undocumented alien, announced U.S. Attorney Alamdar S. Hamdani.  On Jan. 29, Maria Aguilar arrived at the Hidalgo port of entry with three minors in her vehicle. At that time, she claimed they were her relatives and presented Ohio birth certificates.  Law enforcement noticed the children appeared nervous and ultimately discovered the birth certificates were for other people.  Aguilar admitted the minors were not relatives, but undocumented aliens, and expected to be paid $4,700 to smuggle the minors into the United States.  U.S. District Judge Ricardo Hinojosa will impose sentencing Aug. 17. At that time, Aguilar faces up to 10 years in prison and a possible $250,000 maximum fine.  She was permitted to remain on bond pending that hearing.  Customs and Border Protection conducted the investigation. Assistant U.S. Attorney Theodore Parran III prosecuted the case."
"birth","1881-05-15","Not Discerned","Not Discerned","https://news.google.com/rss/articles/CBMihAFodHRwczovL3d3dy5kZWNjYW5jaHJvbmljbGUuY29tL25hdGlvbi9pbi1vdGhlci1uZXdzLzE2MDUyMy9mYXJtZXJzLXBheS10cmlidXRlLXRvLXNpci1hcnRodXItY290dG9uLW9uLTIyMHRoLWJpcnRoLWFubml2ZXJzYXJ5Lmh0bWzSAYgBaHR0cHM6Ly93d3cuZGVjY2FuY2hyb25pY2xlLmNvbS9hbXAvbmF0aW9uL2luLW90aGVyLW5ld3MvMTYwNTIzL2Zhcm1lcnMtcGF5LXRyaWJ1dGUtdG8tc2lyLWFydGh1ci1jb3R0b24tb24tMjIwdGgtYmlydGgtYW5uaXZlcnNhcnkuaHRtbA?oc=5&hl=en-US&gl=US&ceid=US:en","Mon 15 May 2023 21:33:45","Published on: May 15, 2023 | Updated on: May 15, 2023  Former Minister Vadde Sobhanadreeswara Rao, MLA Malladi Vishnu, Congress leader Kolanukonda Sivaji and CPM Leaders Kesava Rao paying floral tributes to statue of Sir Arthur Cotton. (DC Image)  KAKINADA: Public and private organisations of Dulla village in Kadiam mandal of East Godavari district on Monday paid tributes to Sir Arthur Cotton, who got the Dowleswaram Barrage constructed, on his 220th birth anniversary.  Led by farmer Sathi Bhaskara Reddy, people performed ‘abhishekam (milk bath and paddy bath)’ to a statue of Sir Arthur Cotton, amid Vedic chants, installed at Bhaskara Reddy’s residence.  Bhaskara Reddy said that before the construction of the Dowleswaram Barrage, people used to face nature’s fury, in the form of cyclones and floods.  Nekkanti Srinivas, the president of the Sir Arthur Cotton Farmers’ Association, paying tributes at Alamaru, said that the Alamuru water locks regulate Kotipalli and Korangi canals, coveri"
"birth","2017-10-01","10:00:00","{""Birmingham"", ""Alabama"", ""UnitedStates""}","https://news.google.com/rss/articles/CBMiYGh0dHBzOi8vd3d3LmJpcm1pbmdoYW1tYWlsLmNvLnVrL25ld3MvbWlkbGFuZHMtbmV3cy9ibGFjay1tdW1zLXNhbmR3ZWxsLXdlc3QtYmlybWluZ2hhbS0yNjgzMTk3MtIBZGh0dHBzOi8vd3d3LmJpcm1pbmdoYW1tYWlsLmNvLnVrL25ld3MvbWlkbGFuZHMtbmV3cy9ibGFjay1tdW1zLXNhbmR3ZWxsLXdlc3QtYmlybWluZ2hhbS0yNjgzMTk3Mi5hbXA?oc=5&hl=en-US&gl=US&ceid=US:en","Tue 16 May 2023 04:30:00","Pregnant black women in Sandwell and West Birmingham reportedly experienced 'overt racism' and were regularly 'made to feel invisible', with their fears and concerns ignored, new research has found.  One local mum claimed the late miscarriage of her baby was because her repeated worries were dismissed. Another reported being told 'all you people are the same' during an exchange with a health worker immediately after giving birth. The experiences are recorded in a new report Inequalities in Maternity Services in West Birmingham, produced by Healthwatch Birmingham.  It adds to a body of evidence highlighting the alleged unequal treatment experienced by women from ethnic minorities which is claimed to contribute to much higher rates of infant mortality, maternal death and still birth among women of colour. The statistics are particularly weighted against women from overseas, and non English speakers.  READ MORE: Baby death rates in Birmingham nearly double the national average - call for"
"birth","2023-01-01","Not Discerned","Not Discerned","https://news.google.com/rss/articles/CBMimQFodHRwczovL3d3dy5jb3R0b253b29kaG9sbGFkYXlqb3VybmFsLmNvbS8yMDIzLzA1LzE1Lzg5Mjc4L2JpcnRoaW5nLXBvb2xzLW1hcmtldC0yMDIzLW1ham9yLWRyaXZlcnMtYWN0aXZlLWJpcnRoLXBvb2xzLWVkZWwtaW1tZXJzeXMtZmVicm9tZWQtbGEtYmFzc2luZS_SAQA?oc=5&hl=en-US&gl=US&ceid=US:en","Mon 15 May 2023 12:36:08","Birthing Pools Market 2023 published by MarketsandResearch.biz is intended to present a brief introduction and market overview, in which industry is first defined before estimating its market scope and size. The report elaborates on the market scope and market size estimation. The data gathered in the report is appropriately tabulated and classified to analyze the Compound Annual Growth Rate (CAGR) of the market. The research is used to assess the market in the timeline forecast from 2023 to 2029.  The drivers, limitations, and opportunities are listed for the global Birthing Pools industry, followed by industry news and policies. The study also includes an industry overview of emerging innovations focused on growth opportunities and the competitive strategic background that can drive market growth. This is followed by an overview of the market segmentation such as type, application, and region.  DOWNLOAD FREE SAMPLE REPORT: https://www.marketsandresearch.biz/sample-request/352036  Th"
"birth","2016-05-15","Not Discerned","Not Discerned","https://news.google.com/rss/articles/CBMiP2h0dHBzOi8vMTA3OWlzaG90LmNvbS90aGUtd2Vla25kLWNoYW5nZXMtYmlydGgtbmFtZS1mYW5zLXJlYWN0L9IBAA?oc=5&hl=en-US&gl=US&ceid=US:en","Mon 15 May 2023 20:10:48","It looks like The Weeknd is forging ahead with his plans to retire his stage name and be known by his real name Abel Tesfaye.  On Monday (May 15), The Weeknd changed his Twitter and Instagram account handles to his birth name Abel Tesfaye. This comes as the R&B singer revealed in a recent W magazine cover story that he's ready to enter the next phase in his musical career and leave his Weeknd persona behind.  ""It's getting to a place and a time where I’m getting ready to close the Weeknd chapter,"" he told the publication. ""I'll still make music, maybe as Abel, maybe as The Weeknd. But I still want to kill The Weeknd. And I will. Eventually. I'm definitely trying to shed that skin and be reborn.""  Following the name switch on his social media channels, The Weeknd retweeted a follower referencing his ""disappearance"" for Abel Tesfaye.  ""@theweeknd for 12 years has watered us,nourished copiously with perfect and timeless productions,"" the tweet began. ""The sum of the masterpieces is incal"
"birth","2017-12-10","10:00:00","{""Geneva"", ""Illinois"", ""UnitedStates""}","https://news.google.com/rss/articles/CBMijgFodHRwczovL3BtbmNoLndoby5pbnQvbmV3cy1hbmQtZXZlbnRzL25ld3MvaXRlbS8xNS0wNS0yMDIzLWJvcm4tdG9vLXNvb24tYS1kZWNhZGUtb2YtY2hhbmdlLWFuZC1jaGFuZ2UtZm9yLXRoZS1uZXh0LWRlY2FkZS1zdXBwb3J0LWZyb20taGNwYS1z0gEA?oc=5&hl=en-US&gl=US&ceid=US:en","Mon 15 May 2023 09:26:20","The Born Too Soon: Decade of Action has highlighted that whilst encouraging progress has been made to prevent and protect preterm birth, much more concerted action is needed.  Every 2 seconds, a baby is born too soon. Every 40 seconds, one of those babies dies. In the last decade, preterm birth rates have not changed in any region of the world. Coverage is highly inequitable and challenges disproportionately affect those most vulnerable. For example, nearly 1 in 10 preterm babies are born in the 10 most fragile countries affected by humanitarian crises where accessing care is particularly challenging.  This is unacceptable as the majority of related deaths and disabilities are preventable. We have in our hands the cost-effective solutions to ensure that every woman has access to high-quality reproductive and maternal care, and that every baby born too soon – and other vulnerable newborns – can survive and thrive. It is our job to implement these solutions comprehensively in every sett"
