"topic","date"," time","place","url","date published","article text"
"explosion","2023-10-17","Not Discerned","{""WestPalmBeach"", ""Florida"", ""UnitedStates""}","https://news.google.com/rss/articles/CBMiV2h0dHBzOi8vd3d3LmludmVyc2UuY29tL3NjaWVuY2UvYmV0ZWxnZXVzZS1pcy10YXVudGluZy11cy1hZ2Fpbi1idXQtc3RpbGwtbm90LWV4cGxvZGluZ9IBAA?oc=5&hl=en-US&gl=US&ceid=US:en","Wed 17 May 2023 17:30:25","Bad news, space explosion fans: Betelgeuse is behaving strangely again, but it’s probably not about to explode.  Betelgeuse, the red giant best known for its starring role as the right shoulder of the constellation Orion, has brightened dramatically over the past few weeks. The star is about 50 percent brighter than usual, which has fueled a fresh wave of rumors that Betelgeuse might be on the brink of a supernova.  But astrophysicist Andrea Dupree says we shouldn’t worry — or get our hopes up. Instead, this latest strangeness from Betelgeuse is actually a sign that the star is getting back to normal.  “The star WILL go supernova,” Dupree tells Inverse, “but not in our lifetimes.”  “Where’s the Kaboom?”  This image tracks the Surface Mass Ejection that caused Betelgeuse’s infamous Great Dimming. NASA  At the moment, nuclear reactions deep in Betelgeuse’s core are busily smashing helium atoms together to form carbon atoms. When the star runs out of helium, a new set of reactions will start fusing carbon into oxygen.  Only after all the oxygen has become silicon, and all the silicon has become iron, will Betelgeuse finally run out of fuel to power the nuclear reactions that keep the star inflated against the tremendous force of its own gravity. At that point, it will collapse under its own gargantuan mass, triggering one of the most powerful explosions in the universe: a supernova.  Astronomers and skywatchers have been keeping a close eye on Betelgeuse since 2019, when its usual reddish glow faded dramatically. The Great Dimming, as it came to be called, continued through 2020 — and so did the supernova speculation. Dupree and her colleagues concluded that the dimming was part of the giant star’s normal restless activity.  Essentially, Betelgeuse belched out a cloud of gas and dust into space from an inner layer called the photosphere, which left a cool, dark patch on its southern hemisphere (which happens to be the hemisphere that’s facing Earth). Our own Sun does something similar, called a coronal mass ejection, fairly often; the only difference is that Betelgeuse’s ejection came from deeper inside the star.  Betelgeuse has always been prone to fluctuations; ancient historical records and oral histories say the star brightened and dimmed on a regular cycle, and that's continued through modern times. That cycle has been a fairly regular 420 days — up until the Great Dimming. Since then, Betelgeuse has been erratic at best. Betelgeuse’s recent brightening may be part of the star’s attempt to regain its equilibrium after its great stellar burp.  “The surface and interior of the star are trying to get back to normal after the substantial Surface Mass Ejection,” says Dupree. “Think of it as like your washing machine going off on ‘imbalance’ and sloshing around trying to get back to 'normal.’”  In other words, we can probably expect to see a few more rounds of sudden brightening and dimming from Betelgeuse before it settles back into more predictable behavior.  “Our theoretical calculations suggest that the 400-day period should return in a year or two, but Betelgeuse may surprise us,” Dupree says.  Apocalypse When?  But the real surprise would be if Betelgeuse actually went supernova within our lifetimes — or the lifetimes of the next several generations of humans. If Betelgeuse, or another red giant star, really is about to explode, it will give us some warning in the form of drastic changes that will make the Great Dimming look like nothing but a brief flicker. The star should darken abruptly, getting about 100 times dimmer in a matter of weeks or months, as it shrugs off its outer layers entirely.  When the big moment finally comes, Betelgeuse will abruptly transform from a very recognizable bright red star in the constellation Orion to a blaze of light about half as bright as a full Moon, visible even in the daytime. As the star is 650 light years away, future Earthlings will be able to observe the supernova from a safe distance, but close enough for astronomers to gather incredible data on the death of a giant star. It will be a once-in-several-thousand-lifetimes astronomical event.  Betelgeuse will get there eventually. Just give it 10,000 years or so."
"explosion","2023-10-01","10:00:00","{""Tulsa"", ""Oklahoma"", ""UnitedStates""}","https://news.google.com/rss/articles/CBMiowFodHRwczovL3d3dy5mb3gyMy5jb20vbmV3cy92aWRlby10cGQtZmluZHMtc2V2ZXJhbC1odW5kcmVkLXBvdW5kcy1vZi1leHBsb3NpdmUtbWFraW5nLW1hdGVyaWFsLWluLWhvbWUtb2YtdHVsc2EtbWFuL3ZpZGVvX2NlYTI2M2ZhLWQwMmEtNTNkNS1iMWUwLWNjZDYxOTQ4NWE2Ny5odG1s0gEA?oc=5&hl=en-US&gl=US&ceid=US:en","Thu 18 May 2023 03:14:00","FOX23 obtained the search warrant details for what was found in the home of a man who was arrested for having multiple homemade explosives in his car.  As featured on 2:25 TPD finds several hundred pounds of bomb-making material in home of Tulsa man FOX23 obtained the search warrant details for what was found in the home of a man who was arrested for having multiple homemade bombs in his truck."
"explosion","2023-01-03","Not Discerned","{""Zinder"", ""Zinder"", ""Niger""}","https://news.google.com/rss/articles/CBMiWGh0dHBzOi8vZ3VhcmRpYW4ubmcvb3Bpbmlvbi9wb3B1bGF0aW9uLWV4cGxvc2lvbi1zZXBhcmF0aW5nLWFzc2V0LWZyb20tbGlhYmlsaXR5LXBhcnQtMi_SAQA?oc=5&hl=en-US&gl=US&ceid=US:en","Thu 18 May 2023 04:10:00","More importantly, a large youth population presupposes a maximum number in the workforce, with dynamic and innovative qualities that Nigerians have routinely exemplified globally. Where it is well-harnessed, that generally implies a productive population that is the hallmark of the industrialised world. It means a lower dependent population and better standard of living. With more taxes from a large population that is productively engaged, enough revenue can be sourced to improve benefits for those in the dependent age group, thus creating a happier society.    The National Universities Commission (NUC), Small and Medium Enterprise Development Agency of Nigeria (SMEDAN), Industrial Training Fund (ITF), Nigerian Employers Consultative Association (NECA), regulatory bodies in various professions, and the Federal Ministry of Employment, Labour and Productivity should embark on critical review of different skills or knowledge being acquired in Nigeria’s schools at all levels to make them industry- focused such that graduates would be packaged to respond to the needs of employers. Furthermore, the Central Industrial Liaison and Job Placement Unit (CILPU) in various universities in-charge of Student’s Industrial Work Experience Scheme (SIWES) should be strengthened for the effective coordination, operation and management of the nation’s future labour force.    In addition, there should be a credible census and issuance of National Identity cards to all Nigerians, to determine the actual population that will form the basis of economic plans. Collectively, developing and managing Nigerian human resources will help advance humanity’s cause and reduce the number of people that live in excruciating poverty in our country and continent-wide.  Concluded.  "
"explosion","2023-07-01","Not Discerned","{""Atlanta"", ""Georgia"", ""UnitedStates""}","https://news.google.com/rss/articles/CBMilAFodHRwczovL3d3dy53c2J0di5jb20vbmV3cy9sb2NhbC9hdGxhbnRhL2RyaXZlcnMtc3RpbGwtY29tcGxhaW4tZXhwbG9kaW5nLXN1bnJvb2ZzLWRlc3BpdGUtY2xvc3VyZS1mZWRlcmFsLWludmVzdGlnYXRpb24vMkxZT0s2VlZETkdJM09BTDdXNVFTMjdXS1Uv0gGjAWh0dHBzOi8vd3d3LndzYnR2LmNvbS9uZXdzL2xvY2FsL2F0bGFudGEvZHJpdmVycy1zdGlsbC1jb21wbGFpbi1leHBsb2Rpbmctc3Vucm9vZnMtZGVzcGl0ZS1jbG9zdXJlLWZlZGVyYWwtaW52ZXN0aWdhdGlvbi8yTFlPSzZWVkROR0kzT0FMN1c1UVMyN1dLVS8_b3V0cHV0VHlwZT1hbXA?oc=5&hl=en-US&gl=US&ceid=US:en","Wed 17 May 2023 22:13:53","ATLANTA — Federal officials say they have determined that there are no serious safety risks after thousands of people reported that sunroofs were exploding in their vehicles.  Regulators have closed their investigation into these explosions, but people who have experienced this told Channel 2 consumer investigator Justin Gray that it sounds and feels like an explosion in their vehicles.  Auto safety advocates say that really puts drivers at risk of an accident.  Kate Holder said she had to pull over after hearing what she can only describe as an explosion while driving her brand-new Jeep Wagoneer to work.  “I was going 55 miles an hour, then all of a sudden, like, literally an explosion,” Holder said.  [HAVE A STORY FOR 2 INVESTIGATES?: Submit your tip here]  Then she got out of the car.  “I just stood up on the rail. Got up and saw the big hole,” Holder said.  “Truly spontaneous?” Gray asked Holder.  “Yes, the most bizarre thing ever,” she said.  But when Channel 2 Action News checked with federal regulators, we found spontaneous breakage of panoramic sunroofs have been happening with a variety of makes and model vehicles for years.  So much so that The National Highway Traffic Safety Administration launched a 7-year investigation finding, “spontaneous sunroof glass shattering is not an uncommon occurrence: More than 4,000 complaints of such occurrences were reported by the 13 manufacturers”  MORE STORIES FROM 2 INVESTIGATES:  Gray checked the NHTSA complaint database as recently as last week.  The driver of a Ford Edge wrote, “I was driving down the road when out of nowhere my sunroof started raining glass in the inside of my car!! There was no Crack or stone that hit it nothing!!”  “That type of distraction while you’re driving, you know, you’ve got tempered glass chunks all over you and you don’t know what just happened. I think any reasonable person can see that that could pose a pretty serious distraction risk,” said Michael Brooks, executive director of The Center for Auto Safety.  But in 2021, NHTSA closed its investigation into panoramic sunroofs without ever determining what’s causing them to spontaneously explode, writing it “has not identified sufficient evidence of a safety-related defect in the subject sunroof.”  “What if the glass got into my baby’s eyes, or face, or even the car seat?” Holder asked.  She told Gray that she’s just thankful she had the cover closed on the sunroof.  “Now, I don’t want to open up the sunroof … just in case,” Holder said.  NHTSA said there have been about a dozen reported minor injuries, most from cleaning up the glass.  Gray checked with NHTSA before his report on Wednesday to see if there have been any updates. A spokesman told said there is no current investigation into the sunroofs.  IN OTHER NEWS:  Officer who resigned amid excessive force investigation now working for another police agency Channel 2′s Michael Seiden learned this isn’t the first time the officer is accused of using excessive force.  ©2023 Cox Media Group"
"explosion","2023-12-01","Not Discerned","Not Discerned","https://news.google.com/rss/articles/CBMiZWh0dHBzOi8vd3d3LmNuYmMuY29tLzIwMjMvMDUvMTcvYW1hem9ucy1hbGV4YS1oZWFkLWRlZmVuZHMtY29tcGFueXMtd29yay1vbi1haS1hbWlkLWNoYXRncHQtYm9vbS5odG1s0gFpaHR0cHM6Ly93d3cuY25iYy5jb20vYW1wLzIwMjMvMDUvMTcvYW1hem9ucy1hbGV4YS1oZWFkLWRlZmVuZHMtY29tcGFueXMtd29yay1vbi1haS1hbWlkLWNoYXRncHQtYm9vbS5odG1s?oc=5&hl=en-US&gl=US&ceid=US:en","Wed 17 May 2023 14:16:20","Amazon 's Alexa head said his company is right in the middle of the boom in generative artificial intelligence, the technology that's spreading rapidly across Silicon Valley and has spurred an arms race between Microsoft and Google .  The tech world has been enamored with a new generation of chatbots since OpenAI's ChatGPT went viral late last year. That's pressured companies like Amazon to showcase their own capabilities in generative AI. Amazon's biggest entry into the market thus far has been through an AI service for cloud customers.  However, Rohit Prasad, Amazon's senior vice president and head scientist for Alexa, said it's wrong to think the e-retailer has missed out in generative AI, which allows people to convert text-based queries into creative and thorough answers.  ""Alexa has been and is at the forefront of AI for a long time,"" Prasad told CNBC in an interview. ""We've been part of the cultural zeitgeist and it hasn't slowed down.""  Prasad added that contrary to ChatGPT, which remains accessible through a web browser, Alexa is an ""instantly available, personal AI"" that people can communicate with by voice.  Amazon established an early lead in voice software after it debuted its Alexa digital assistant in 2014. More than 500 million Alexa-powered devices have been sold worldwide, the company said Wednesday. The last time Amazon gave an update on that number was in 2019, when it was at 100 million.  The Alexa assistant, now plugged into everything from smart speakers to thermostats, has long depended on machine learning technology to answer their queries by fetching relevant data.  But the rise of AI-powered chatbots, which can perform sophisticated functions like writing fiction and coding software, has highlighted the limitations of digital assistants such as Alexa. Amazon founder Jeff Bezos' sci-fi vision for Alexa to resemble an all-knowing computer from ""Star Trek"" hasn't exactly panned out.  Prasad said Amazon is working to make Alexa more conversational and intelligent. One way it hopes to do so is through a new version of its own large language model, called Alexa Teacher Model. Large language models power generative AI, and Alexa is already powered by Amazon's LLM.  The goal is for Alexa to be able to answer complex requests, and understand more about users.  ""This is where all the ambient context of who you are, what are you asking, where you are, comes in to make the best decision for you in that moment and on your behalf,"" Prasad said.  In his latest letter to investors, Amazon CEO Andy Jassy said generative AI and LLMs are areas where the company is ""investing heavily,"" noting that the technologies stand to ""transform and improve virtually every customer experience.""  The company has posted job listings suggesting it plans to implement a ChatGPT-style product in search on its online store, Bloomberg reported. Amazon may also add more generative AI-like features to Alexa focused on entertainment and storytelling, according to Insider.  WATCH: Amazon's smart home dominance and how it could grow with iRobot acquisition"
"explosion","2022-10-07","Not Discerned","Not Discerned","https://news.google.com/rss/articles/CBMifmh0dHBzOi8vd3d3LmRvbmVnYWxsaXZlLmllL25ld3MvZG9uZWdhbGxpdmUvMTE3MjgyOS9wYXJ0bmVyLW9mLWNyZWVzbG91Z2gtZXhwbG9zaW9uLXZpY3RpbS1zZWVrcy1pbmp1bmN0aW9uLW92ZXItcHJvcGVydHkuaHRtbNIBAA?oc=5&hl=en-US&gl=US&ceid=US:en","Thu 18 May 2023 06:48:54","The partner of one of the Creeslough explosion victims is seeking an interlocutory injunction against a relative of the deceased who she claims is illegally occupying a property.  The case, which came before Letterkenny Circuit Court this week, has been adjourned until next Thursday for the defendant to provide evidence of his residence at the property and of expenses he claims to have incurred in carrying out improvements.  Mr Hugh Kelly, a 59-year-old of Castledoe, Creeslough, was one of ten people tragically killed in a gas explosion at the Applegreen complex in Creeslough on October 7, 2022.  Letterkenny Circuit Court heard how the late Mr Kelly had given a lift to a man and his young daughter, who also died in the blast, to the shop on the tragic afternoon.  Ms Linda Gallagher said she was the beneficiary of the last will and testament, dated November 30, 2006 of the late Mr Kelly, which included a house, car and out office on lands known as Bishops Island at Castledoe, Creeslough, together with the residue of his estate.  An affidavit from Ms Gallagher said that she attended the property in question on October 15, 2022 and discovered that the deceased’s nephew, Mr Josie Kelly, had ‘wrongfully or illegally entered the dwelling and changed the locks’.  Ms Gallagher, who was represented by Mr Gareth McGrory BL, instructed by solicitor Mr Frank Dorian, alleged that Mr Josie Kelly had unlawfully and wrongfully trespassed and accessed the dwelling house and had also placed padlocks on the gates and placed a donkey on the lands.  The court heard that the late Mr Hugh Kelly had resided at the property - which was described as being a ‘traditional farmhouse with extension and outbuildings’ - all of his life. The court was told that the property was registered in Mr Hugh Kelly’s name having previously been in the name of his mother, Ms Sally Kelly,.  Ms Gallagher sought an injunction to restrain the defendant, his servants or agents from trespassing, entering or making use of the lands without the express authority of the plaintiff.  Mr McGrory said his client was also seeking an injunction to have the defendant, his servants or agents to repair any damage caused following the alleged illegal trespass.  Ms Gallagher is originally from Indiana in the United States and had been in a ‘loving relationship’ with the late Mr Kelly, although they maintained separate houses.  She said she was ‘completely distraught’ on learning of the explosion and the death of Hugh Kelly and the other nine victims of the tragedy.  She described the ‘shock, pain and sorrow’ she suffered in the immediate aftermath of the explosion.  Ms Gallagher said she went to America in late October and when she returned in November she found the gates were chained and padlocked and a donkey was present on the lands.  She told the court that she has sentimental property in the house, including photographs.  In an affidavit, Mr Josie Kelly, who was represented in court by barrister Mr John McCoy BL, said his late grandfather had wished the property to stay in the Kelly family. Mr Josie Kelly said he had invested over €100,000 on improvements to the property and had organised crops of hay and silage on the farmland.  He said he had lived at the property since 1984, save for the years of his marriage until 2018, since which he had been living on the property.  Mr Kelly claimed that none of the plaintiff’s possessions are in the house and that he always had a key and access to the house.  “The property is my home,” he said.  Judge John Aylmer asked why Mr Josie Kelly had not exhibited anything in support of his evidence.  “The absence is striking,” he said, noting that he expected to see evidence that he has been living there since 2018 and of the €100,000 he said he had spent.  Mr McCoy said he would take the matter back to his client for further instruction and said there were ‘parallel proceedings’ before the High Court.  Judge Aylmer said he was giving a short opportunity for the defendant to put evidence before the court ‘that one would expect to support a contention that he has been living there since 2019’.  The matter was adjourned until Carrick-On-Shannon Circuit Court on Thursday-week, May 25, with both deponents to be present."
"explosion","2023-05-17","Not Discerned","Not Discerned","https://news.google.com/rss/articles/CBMiYGh0dHBzOi8vd3d3LmRoYWthdHJpYnVuZS5jb20vYmFuZ2xhZGVzaC8yMDIzLzA1LzE3L21hbi1raWxsZWQtaW4tbGFuZG1pbmUtZXhwbG9zaW9uLWluLWJhbmRhcmJhbtIBAA?oc=5&hl=en-US&gl=US&ceid=US:en","Wed 17 May 2023 17:15:44","A man has been killed and another sustained injuries in the landmine explosion in Ruma Upazila of Bandarban, amid a special raid by joint forces in the area.  The deceased is Jewel Tripura, 27, and the injured is Abraham Tripura, 35, both hailing from Remakri-Prangsa Union of the upazila.  The incident took place in ward number 6 of Soulpi Para Wednesday afternoon.  The Kuki-Chin National Front (KNF), a separatist group, allegedly planted landmines, according to locals. Security forces have been raiding the KNF hideouts in Ruma's Maulpi neighborhood for the past several days.  Two army officers were killed and two others injured in an ambush by the armed wing of the KNF near Jarulchhari Para on Tuesday.  Md Abdullah Al Noman, a doctor at Thanchi Health Complex, said that the injured person was sent to Bandarban Sadar Hospital for better treatment.  On the other hand, Yasin Ahmed, officer-in-charge of Thanchi police station, said that the body of the deceased would be handed over to the family after a post-mortem."
"explosion","2023-05-18","10:00:00","{""Frankfurt"", ""Hesse"", ""Germany""}","https://news.google.com/rss/articles/CBMiY2h0dHBzOi8vd3d3Lm5vcnRoZXJuZXhwcmVzcy5jb20vY2FsZW5kYXIvMjAyMy8wNS8xOC9mbG9yYWwtZXhwbG9zaW9uLXBhaW50aW5ncy1ieS10aGVyZXNhLXlvdW5nbWFuL9IBAA?oc=5&hl=en-US&gl=US&ceid=US:en","Wed 17 May 2023 22:30:49","Thursday May 18  Thursday, May 18  10AM  Oliver Art Center, North Hall & Fisher Room, Frankfort  Art    Enjoy Youngman's freestyle form of painting in her colorful depictions of flowers, gardens, landscapes, & rivers. Runs April 26 - May 19. A reception for the artist will be held on May 6 from 5-7pm. Oliver Art Center is open Mon. - Sat. from 10am-4pm."
"explosion","2023-05-17","Not Discerned","Not Discerned","https://news.google.com/rss/articles/CBMie2h0dHBzOi8vdGltZXNvZmluZGlhLmluZGlhdGltZXMuY29tL2NpdHkvbWFkdXJhaS9tYW4tMzIta2lsbGVkLWluLWV4cGxvc2lvbi13aGlsZS1tYWtpbmctY3JhY2tlcnMvYXJ0aWNsZXNob3cvMTAwMzE3MTMzLmNtc9IBdmh0dHBzOi8vbS50aW1lc29maW5kaWEuY29tL2NpdHkvbWFkdXJhaS9tYW4tMzIta2lsbGVkLWluLWV4cGxvc2lvbi13aGlsZS1tYWtpbmctY3JhY2tlcnMvYW1wX2FydGljbGVzaG93LzEwMDMxNzEzMy5jbXM?oc=5&hl=en-US&gl=US&ceid=US:en","Thu 18 May 2023 02:56:00","Virudhunagar: A 32-year-old man was killed in a blast while manufacturing crackers illegally near a cracker shop at Achankulam on Wednesday.The deceased person was identified as Senthilkumar , a resident of Achankulam village. According to police sources, a cracker shop named Sri Veni is at Achankulam village near Sattur taluk in Virudhunagar district. Its owner V Vairamuthu had set up a shed adjacent to it and had engaged Senthilkumar, Dinesh and Mahesh to manufacture crackers illegally.Around 1pm, when Senthilkumar was handling chemicals, a blast was triggered due to friction. Senthilkumar sustained severe burn injuries and died on the spot. On noticing the blast, Dinesh and Mahesn escaped from the spot.Since the fire started to spread, the crackers inside the cracker shop, a car and two bikes which were parked in front of the shop were gutted in the fire. Fire and rescue services from Vembakottai and Elayirampannai put out the fire.The body of Senthilkumar was recovered and sent to the Sattur government hospital for postmortem. Police have registered a case.TNN"
