"topic","date"," time","place","url","date published","article text"
"explosion","1986-04-26","Not Discerned","Not Discerned","https://news.google.com/rss/articles/CBMiKGh0dHBzOi8vd3d3LmJiYy5jb20vbmV3cy9oZWFsdGgtNjU1OTUyNTDSASxodHRwczovL3d3dy5iYmMuY29tL25ld3MvaGVhbHRoLTY1NTk1MjUwLmFtcA?oc=5&hl=en-US&gl=US&ceid=US:en","Tue 16 May 2023 08:59:19","For decades, experts have also known that iodine tablets can be deployed to help protect people if radioactive iodine has been released into the environment; it was given to people in 1986 when a nuclear accident occurred at the Chernobyl power plant."
"explosion","2022-08-06","20:00:00","{""Newark"", ""NewJersey"", ""UnitedStates""}","https://news.google.com/rss/articles/CBMiW2h0dHBzOi8vcGFnZXNpeC5jb20vMjAyMy8wNS8xNi9sdWlzLXJ1ZWxhcy10aHJlYXRlbnMtdG8tYnVyeS1wZW9wbGUtaW4tdGVyZXNhLWdldHMtbWFycmllZC_SAV9odHRwczovL3BhZ2VzaXguY29tLzIwMjMvMDUvMTYvbHVpcy1ydWVsYXMtdGhyZWF0ZW5zLXRvLWJ1cnktcGVvcGxlLWluLXRlcmVzYS1nZXRzLW1hcnJpZWQvYW1wLw?oc=5&hl=en-US&gl=US&ceid=US:en","Tue 16 May 2023 16:00:00","Click to email a link to a friend (Opens in new window)  Click to share on Twitter (Opens in new window)  Click to share on Facebook (Opens in new window)  Luis “Louie” Ruelas threatens to “f—king bury” people amid his now-wife Teresa Giudice’s ongoing conflict with brother Joe Gorga and his wife, Melissa Gorga.  “If these f—king people put out one more message on Instagram, I swear to God I’m going to f—king bury them so bad,” Ruelas fumes in the explosive trailer for Bravo’s upcoming “Real Housewives of New Jersey” special “Teresa Gets Married.”  Although it’s unclear what social media messages Ruelas, 48, is referring to, it becomes apparent that the pre-wedding discord is because of the Gorgas.  Luis “Louie” Ruelas threatened to “f–king bury” people in the explosive trailer for Bravo’s “Teresa Gets Married” special. Bravo  The trailer sees Teresa Giudice breaking down in tears amid her drama with brother Joe Gorga and his wife, Melissa Gorga. Bravo  After breaking down in tears, a woeful Giudice, 50, seems to be talking about her estranged brother when she says, “I just don’t want his name brought up.”  Meanwhile, the “Turning the Tables” author’s eldest daughter, Gia Giudice, suggests that her entire family’s relationship with the Gorgas is all but finished.  “It’s over for everybody — including me and my sisters,” Gia, 22, says in a confessional.  The Gorgas skipped the Aug. 6, 2022, nuptials. Charles Sykes/Bravo  The drama between Teresa and the Gorgas hit its apex in the summer of 2022 after the “Real Housewives of New Jersey” OG brought up rumors that Melissa, 44, cheated on Joe, 47, with longtime friend Nick Barrotta.  A source previously told Page Six the Gorgas — who have been married since 2004 and share three children — “laughed off” the claims.  For more Page Six reality TV updates  Melissa — who, with Joe, subsequently decided to skip Teresa and Ruelas’ Aug. 6, 2022 wedding — later said on her “On Display” podcast, “Sometimes when things are too toxic and you try over and over and over again and it just keeps coming back around to the same thing, even if it’s family, you have to let it go.”  Giudice’s drama with the Gorgas hit its apex in the summer of 2022 as production for “The Real Housewives of New Jersey” Season 13 was winding down. melissagorga/Instagram  Teresa’s longtime frenemy Margaret Josephs, who is close with the Gorgas, attended the wedding, but seemingly felt uncomfortable attending — as she notes in the preview.  “All I can think of is we’re all here and Melissa and Joe are not,” she tells co-stars Jackie Goldschneider and Jennifer Fessler.  Despite the volatile turn of events, there are lighthearted moments expected to play out in “Teresa Gets Married.”  Giudice’s four daughters served as bridesmaids. Charles Sykes/Bravo  Giudice’s co-stars Dolores Catania and Jennifer Aydin were also part of the bridal party. Charles Sykes/Bravo  Several of Teresa’s “Real Housewives” friends — including “Dubai” star Chanel Ayan, “Potomac” star Ashley Darby, “New York City” star Dorinda Medley and “Atlanta” star Kenya Moore — make cameos.  “I love a Jersey wedding,” Medley, 58, says at one point.  Teresa’s infamous wedding hair is also highlighted, though her pal and bridesmaid Jennifer Aydin seems uncertain about the elaborate $10,000 style.  “Hair’s supposed to be an accent piece, not the main event,” Aydin, 46, quips in a confessional.  “Teresa Gets Married” premieres Tuesday, May 23, at 8 p.m. ET on Bravo."
"explosion","2023-07-01","Not Discerned","{""Strathroy"", ""Ontario"", ""Canada""}","https://news.google.com/rss/articles/CBMiTWh0dHBzOi8vbG9uZG9uLmN0dm5ld3MuY2EvZXhwbG9zaXZlLWZpcmUtYXQtY2FyYWRvYy1zYW5kcy1nb2xmLWNsdWItMS42NDAxNDc20gFBaHR0cHM6Ly9iZXRhLmN0dm5ld3MuY2EvbG9jYWwvbG9uZG9uLzIwMjMvNS8xNi8xXzY0MDE0NzYuYW1wLmh0bWw?oc=5&hl=en-US&gl=US&ceid=US:en","Tue 16 May 2023 23:21:00","Residents near the Caradoc Sands Golf Club in Strathroy, Ont. were startled from their homes with the sounds of explosions when a shed erupted into flames on Tuesday.  Fire crews were called to the shed around 1 p.m. when the owner discovered the fire. The structure was engulfed in flames, but crews needed to take a very defensive attack due to the presence of fertilizers, pesticides and propane tanks.  Homes in the immediate area were evacuated because of the smoke created from the materials.  There were no injuries, but damages are estimated at $1-million.  Fire officials expect crews to be battling the fire for a lengthy period due to the presence of oxidizing materials and potentially explosive tanks.  Strathroy-Caradoc Fire Chief Brent Smith asked that the public stay away from Saxton Road since it is needed to run tanker shuttles to take down the fire and because of the unknown products within the smoke that is present.  The cause of the fire has yet to be determined.  The investigation continues."
"explosion","2023-05-10","Not Discerned","Not Discerned","https://news.google.com/rss/articles/CBMiZGh0dHBzOi8vd3d3LnNvbm9tYW5ld3MuY29tL2FydGljbGUvbmV3cy9zb25vbWEtcG9saWNlLXZpZGVvLXNob3dzLXRvb2xzLXN0b2xlbi1mcm9tLXRydWNrLWluLXNvbm9tYS_SAQA?oc=5&hl=en-US&gl=US&ceid=US:en","Wed 17 May 2023 00:01:52","A suspect stole up to $2,000 in tools from a truck from the 100 block of Buena Vista Drive in Sonoma between 3 and 4 a.m. on May 13, according to Sonoma Police Chief Brandon Cutting.  The victim called police the next morning. Deputies observed video footage from the night before and saw the suspect cut open the toolbox in the truck bed, Cutting said.  Police are still investigating the incident.  ‘Explosion’ at high school  Sonoma police responded to a reported “explosion” at Sonoma Valley High School on Wednesday, May 10, likely stemming from a pyrotechnic device, Sonoma Police Chief Brandon Cutting said.  As deputies were responding to the incident, a fire alarm went off on another side of campus, but police are unsure if the two incidents were related, Cutting said. No evidence of an explosion was found on site, and no student could be identified.  No damage was reported and the incident is being handled by school officials, Cutting said.  Petty theft  As a Sonoma woman entered Whole Foods on May 10 around 4 p.m., she was confronted by a group of three strangers who worked together to steal her purse, Cutting said.  One of the suspects approached the woman and asked her for directions to Sonoma Valley Hospital while the other two took her purse, which contained credit cards and about $100 in cash, Cutting said. The cards were charged $500 shortly after at a nearby ATM.  Sonoma police believe the group is a part of a known theft ring in the Bay Area which previously stole items from Halem & Co. jewelry store, Cutting said. There are no leads at this point.  Hit and run  On May 13, Sonoma police responded to a reported hit and run on the 19000 block of Robinson Road.  Video footage near the incident showed a driver hit a parked Honda and continue driving. Deputies found the suspect’s unoccupied car near Verano Avenue and Main Street the next day, but were unable to find the driver, Cutting said.  Sonoma police are still searching for the suspect.  DUI  Police responded to a reported hit and run at 7:22 a.m. in the area of First Street West and Spain Street in downtown Sonoma on May 13.  A witness followed the suspect’s Nissan Xterra and called police, who quickly located the driver and conducted a traffic stop, Cutting said.  Deputies determined the 37-year-old Sonoma man was under the influence of alcohol. Deputies conducted a Breathalyzer test that showed the suspect had a BAC of 0.27 — more than three times the legal limit, Cutting said.  The suspect was arrested for misdemeanor DUI and hit and run, Cutting said.  Contact Chase Hunter at chase.hunter@sonomanews.com and follow @Chase_HunterB on Twitter."
"explosion","2023-09-16","Not Discerned","{""NotreDame"", ""Indiana"", ""UnitedStates""}","https://news.google.com/rss/articles/CBMifGh0dHBzOi8vMjQ3c3BvcnRzLmNvbS9jb2xsZWdlL3dhc2hpbmd0b24vYXJ0aWNsZS93YXNoaW5ndG9uLWh1c2tpZXMtZm9vdGJhbGwtcmVjcnVpdGluZy1leHBsb3NpdmUtMjAyNi1vYWtzLWNocmlzLTIxMDMwODU1Ny_SAQA?oc=5&hl=en-US&gl=US&ceid=US:en","Tue 16 May 2023 22:41:15","You don’t often see a player lock in his commitment date before setting any of his official visits, but that’s the case with Bellflower (Calif.) St. John Bosco defensive back Jason Mitchell. Mitchell has several schools on his list and plans to take at least five if not more official trips this cycle. It sounds like many of those trips will come after he makes his decision.  We had a chance to catch up with Mitchell last week at the Braves College Showcase and he updated us on where his recruitment is at right now.  “I’m still set to commit Sept. 16 at the Kahuku (Hawaii) game,” Mitchell said. “I plan to take a few official trips in June and then the rest will be during the season.  “I think I’ll be able to take a few in-season before the Kahuku game and then I’ll do a few after that. You only go through this once and I really want to enjoy the recruiting process so I want to try and take as many trips as I can.”  The schools Mitchell mentioned who he’s hoping to visit include LSU, Notre Dame, Oregon, USC, Utah and Washington. He talked about what stands out with each program:  LSU: “LSU likes me as a corner and that’s where I enjoy playing. I’ll play anywhere but I like corner and LSU is one of those schools like Oregon and USC that I would call a childhood favorite. I always liked them growing up, they produce great defensive backs every year and get them drafted. I like their style of play, the SEC is a great conference so I’m excited to visit there on a game weekend.”  Notre Dame: “Notre Dame is on me really heavy and they’re recruiting me as an athlete right now. They feel I can play corner or safety and haven’t specified exactly where they like me, they said they just me and they’ll find a spot once I get there. I know a lot will depend on my frame and how big I get but I see a lot of opportunity at Notre Dame. They have a great staff in place with a great head coach who knows defense really well. I like how they’re recruiting me, and so, I’m excited for my visit and we still need to decide if that will in June or during the season.”  Oregon: “Oregon feels a lot like L.A .(Los Angeles) to me. I don’t mean the city as much as the people there. They have a lot of coaches that are from here and when I talk to them, it feels like home for sure. I love the vibe and the way I feel when I’m with those guys. They’re good coaches and quality people and I’ve always loved the Oregon program a lot.”  USC: “I mean, it’s USC. What else can I say? It’s the school I grew up watching, my dad played there, so I’ve always followed them. It’s a childhood favorite, but still, I have to pick the best school for me, not just who I liked when I was young. It’s a business decision, but saying that, I do like USC a lot and I’m really close with (defensive backs coach and defensive passing game coordinator) Donte (Williams) and the rest of the staff.”  Utah: “I’m going to visit Utah for sure during the season and the coaches gave me their schedule and I just have to pick a game. I love that staff and they show a lot of love. I talk with (special teams coordinator and cornerbacks) coach (Sharrieff) Shah, (defensive coordinator and safeties) coach (Morgan) Scalley, (head) coach (Kyle) Whit(tingham), and everyone there is so real and genuine. There’s nothing but great people at Utah and they’re all about development, so I really like them a lot.”  Get the latest football and basketball transfer portal news from 247Sports.  Washington: “I visited Washington with California Power (7v7 team) and loved it there. I like the coaching staff and the support system they have in place. It’s a great staff with (cornerbacks) coach (Julius) Juice (Brown) and (co-defensive coordinator and safeties) coach (Chuck) Morrell and I talk with (director of player personnel) Courtney Morgan, too. (Head) coach (Kalen) DeBoer, he’s a great guy and he’s building something special. He put together a great season in his fist year there and that showed me a lot.”"
"explosion","2017-05-10","Not Discerned","{""Omaha"", ""Nebraska"", ""UnitedStates""}","https://news.google.com/rss/articles/CBMiygFodHRwczovL25vbnBhcmVpbG9ubGluZS5jb20vY29tbXVuaXR5L3NhcnB5L3Nwb3J0cy9zdGF0ZS1iYXNlYmFsbC1yZW1wZS1waXRjaGluZy1rZWVwcy1vbWFoYS1ncm9zcy1hbGl2ZS1wbGF0dGV2aWV3LWJhdHMtZXhwbG9kZS1pbi1lbGltaW5hdGlvbi1nYW1lLXdpbi9hcnRpY2xlX2E2NmJiN2VlLWY0MzEtMTFlZC04NGFlLTFmYWVkNmQ4ZTc3Yi5odG1s0gEA?oc=5&hl=en-US&gl=US&ceid=US:en","Tue 16 May 2023 23:30:00","Alex Draper had a huge day at the plate to keep Platteview alive in the Class C state tournament, while Omaha Gross had a well-balanced effort to get a win over Beatrice in B.  Omaha Gross 5, Beatrice 2  Beatrice got on the board first on an RBI single by pitcher Deagan Nelson, but the Cougars capitalized on a couple of errors to take a 3-1 lead in the second inning. Colby Duncan reached first base on an error that scored Carson Almgren as Duncan collided with the Orangemen first baseman.  Owen Brennan then drove a fly ball to deep right, as Joshua Buhr made a good adjustment in right for the out, but Alex Kosse scored easily from third, and on an error on the throw to home, Duncan also scored.  An RBI single by Colby Duncan provided an insurance run in the top of the sixth.  ""We got some big at-bats,"" Gross head coach Jim Hempel said, after the Cougars followed a 13-run performance with five on Tuesday.  ""One through nine here for these last few games, we've had guys really locked in and they've been having good ABs. We talked about if we don't strike out, we put the ball in play, and hit a few hard, we're gonna win a lot of games because our defense is good and our pitching has been really good this year.""  Starting pitcher Joseph Rempe was pulled after 5.1 innings of one-run ball for Jack Miller with two runners on and one out in the bottom of the inning.  ""We told Joe we had to have him go deep into this game,"" Hempel said. ""He hadn't thrown this whole week, and he went out and gave us everything he had, just gutted it out. (He) gave up that early run and then just settled in which, that's been his career. He's beaten a lot of big teams over the last two years.""  Using a ""very manageable"" curveball, Rempe commanded the zone and put the Cougars in a position for Miller to come in and finish the win.  After getting a strikeout, Miller induced the final out to keep the Cougars lead at 4-1.  An Almgren sacrifice fly added some room to the Gross lead, but the drama didn’t end there in the seventh.  On a play at the plate, Rempe trucked into the Beatrice catcher Noah Jobman after running through third on a single to left, and was tossed from the game, igniting some shouts from both benches but without escalating further.  Rempe will miss the first game but not the second (if necessary) against Elkhorn North tomorrow.  ""Curious to see some video of that. So I wasn't real happy about that. I understand the out call but the ejection I thought was a little questionable with the catcher coming up the line in a split second. You don't have any options. You're gonna have contact in a play like that. So it's unfortunate that we will lose him for the first game.""  Miller shut the door in the bottom of the inning for a second straight Cougars win to earn his school record-tying fourth save of the season.  ""We didn't want anybody else out there other than Joe and then Jack Miller does what Jack does. He tied coach Peters' spring record for saves, and that was his fourth one today, and he's been wanting to get on the big board up at school, so that would be able to get him on. So he's pretty excited about that.""  Omaha Gross next plays Elkhorn North on Wednesday at 10 a.m. back at Fricke Field. A loss to the Wolves would end the season, while a win would set up a win-or-go-home for both teams, the winner advancing to the Class B state championship game on Friday at Tal Anderson Field at 4 p.m.  Om. Gross (17-7) … 030 001 1 – 5 6 0  Beatrice (15-10) ….. 100 000 1 – 1 5 2  Platteview 12, Conc./BT/OCA 1 (6 inn.)  A bases-clearing double and three-run homer by Alex Draper provided the bulk of the offense for the Trojans in their second win of the state tournament to advance to face Malcolm for a second time at Millard North on Wednesday at 4 p.m.  After Draper emptied the bases in the second, Dezmond Straatman drove in two more with a single to right in the third, and the lead ballooned to seven as Draper was hit by pitch with the bases loaded.  Draper was then driven in on a sac fly by Nathan Thomas, and another from Keegan Stobbe scored the Trojans ninth run of the game.  The senior Trojan then effectively hit a walk-off three-run shot to right to earn Platteview a mercy-rule win.  Conc./BT/OCA (11-15) .. 000 001 x – 0 0 1  Platteview (15-11) …….. 133 014 x – 12 13 1"
"explosion","2019-04-15","Not Discerned","Not Discerned","https://news.google.com/rss/articles/CBMiWGh0dHBzOi8vd3d3LmZvb2wuY28udWsvMjAyMy8wNS8xNy8yLWdyb3d0aC1zdG9ja3MtdGhhdC1taWdodC1leHBsb2RlLWluLXRoZS1uZWFyLWZ1dHVyZS_SAQA?oc=5&hl=en-US&gl=US&ceid=US:en","Wed 17 May 2023 05:00:00","Growth stocks can be some of the best investments I could make for their earnings potential. Here are my two favourites at the moment.  2 growth stocks that might explode in the near future  You’re reading a free article with opinions that may differ from The Motley Fool’s Premium Investing Services. Become a Motley Fool member today to get instant access to our top analyst recommendations, in-depth research, investing resources , and more. Learn More .  Over the last 20 years, growth stocks have handed shareholders some of the best returns that the stock market has to offer.  Take Amazon, for example. A £10,000 stake in 2003 would have surged 10,079% to become over a million at today’s share price.  While that’s hardly typical, it does show what’s possible. And there are two stocks I own that I think have the potential to shoot up in the coming years.  Games Workshop  The first stock I’m excited about is tabletop gaming company Games Workshop (LSE: GW). Its share price has already grown over 20 times from £4.23 to £98.30 inside the last decade.  This growth shows what a good job it’s been doing building its brand. In fact, from 2016 to 2022:  Revenue increased from £118m to £414m  Margins increased from 11% to 31%  Net income increased from £13m to £128m  The total market cap grew to £3.2bn from only £161m  A Henry Cavill TV series  As impressive as all that is, I think it might just be the start here. As what’s really exciting is the potential of its Warhammer intellectual property.  Other fictional worlds like Star Wars, Marvel or Lord of the Rings have had outrageously successful – and lucrative – TV shows and movies.  And only last year, Amazon struck a deal with the firm to create a Warhammer series starring Henry Cavill. If that goes on to have success like those other big franchises, then I’d expect my Games Workshop shares to move much higher.  It’s worth mentioning that the show hasn’t even been filmed yet, so any success is not at all guaranteed.  Tesla  My second choice, electric vehicles (EV) manufacturer Tesla (NASDAQ: TSLA), needs little introduction.  The carmaker has already grown at a 40% compound annual growth rate (CAGR) for the last 10 years. That’s thanks to its success in producing desirable EVs, taking a 65% share of that market.  But its success does present an obvious question: is the growth phase already over?  Musk’s latest vision  Personally, I don’t think so. And the reason is its owner Elon Musk has a much grander vision. He wants Tesla to put self-driving vehicles on roads all around the world.  The company that introduces safe and effective autonomous vehicles will surely see huge growth. It’s like creating the same productivity as millions of taxis and lorry drivers in one fell swoop.  And Tesla looks well placed here. First off, the firm’s vertical integration – making its own batteries, having its own repairs, and the like – means the company trounces its competitors when it comes to margins.  Tesla Toyota Honda GM Ford Stellantis 2022 Net Margin 15.5% 6.9% 4.80% 6.20% -1.4% 9.2%  That’s a lot more cash to spend on research and testing its autonomous vehicles.  But also, Musk’s latest move was to slash thousands off the prices of his cars. By doing this, he thinks Tesla can gain further market share to give itself an untouchable advantage in self-driving technology.  For me, the biggest risk here is simply that other investors agree with me. Today’s share price of $172 bumps the price-to-earnings ratio up to an expensive-sounding 50.  But even at that price, I think Tesla can join Games Workshop on my list of stocks that I’m extremely bullish about for their future growth potential."
