"topic","date"," time","place","url","date published","article text"
"explosion","2023-05-16","09:30:00","{""Tijuana"", ""BajaCalifornia"", ""Mexico""}","https://news.google.com/rss/articles/CBMijAFodHRwczovL3d3dy5jYnM4LmNvbS92aWRlby9uZXdzL2xvY2FsL21vcmUtdGhhbi0yLWRvemVuLWluanVyZWQtYWZ0ZXItZXhwbG9zaW9uLWF0LXRpanVhbmEtYnVpbGRpbmcvNTA5LWFkMTYxODZhLWI0YTAtNGE4MS1hNWM3LWY0YjJjN2E5YTU3YtIBAA?oc=5&hl=en-US&gl=US&ceid=US:en","Wed 17 May 2023 01:26:27","More than 2 dozen injured after explosion at Tijuana building  The explosion happened at around 9:30 a.m. on Tuesday. The area surrounding the building has been blocked off due to the risk of further collapse."
"explosion","2023-05-10","Not Discerned","{""Belgium"", ""Wisconsin"", ""UnitedStates""}","https://news.google.com/rss/articles/CBMiX2h0dHBzOi8vd3d3LmZveDVueS5jb20vbmV3cy9iZWxnaXVtLWF1dGhvcml0aWVzLWNhcnJ5LW91dC1leHBsb3Npb24tb2Ytd3dpaS1ib21iLWZvdW5kLW9uLWJlYWNo0gFjaHR0cHM6Ly93d3cuZm94NW55LmNvbS9uZXdzL2JlbGdpdW0tYXV0aG9yaXRpZXMtY2Fycnktb3V0LWV4cGxvc2lvbi1vZi13d2lpLWJvbWItZm91bmQtb24tYmVhY2guYW1w?oc=5&hl=en-US&gl=US&ceid=US:en","Tue 16 May 2023 10:01:26","Watch out where you step on the beach this summer because a leftover World War II mine could be lying around somewhere.  A World War II bomb was discovered on May 10 on a beach in Belgium, prompting crews to carry out a controlled explosion of the device.  Officials said the beach in Koksijde was closed to allow crews to detonate the explosive, believed to be a British aerial bomb that contained 30 kilograms of explosives, local reports said.  The device was found amid works already underway to rid the beach of projectiles and explosives from the war, according to Koksijde Mayor Marc Vanden Bussche.  Storyful contributed to this story.    "
"explosion","2023-05-15","Not Discerned","{""UnionGrove"", ""Wisconsin"", ""UnitedStates""}","https://news.google.com/rss/articles/CBMiS2h0dHBzOi8vcmFjaW5lY291bnR5ZXllLmNvbS8yMDIzLzA1LzE2L2V4cGxvc2lvbi1ob3VzZS1maXJlLWluLXVuaW9uLWdyb3ZlL9IBAA?oc=5&hl=en-US&gl=US&ceid=US:en","Tue 16 May 2023 15:19:38","UNION GROVE — The lone resident and their pets escaped a Monday morning fire unscathed in Union Grove that may have been caused by an explosion in the garage.  According to a press release from the Racine County Sheriff’s Office, firefighters from several jurisdictions responded at 11 a.m. Monday, May 15, to a home in the 1000 block of Crabtree Lane for reports of a structure fire. The single occupant of the home and their pets were uninjured and accounted for.  Explosion heard in garage, under investigation  While the cause of the fire remains under investigation, the home’s resident and several neighbors told fire officials they heard an explosion in the garage before they saw smoke and flames. The blaze was contained to the single address, leaving adjacent buildings undamaged.  Fire safety  It’s important to remember basic fire safety within the home. Every home should have working smoke and carbon monoxide detectors on each level, as well as a known escape plan should a fire happen. Discuss the evacuation plans with all household members, including a plan for pet evacuation."
"explosion","2023-09-15","Not Discerned","{""Aurora"", ""Colorado"", ""UnitedStates""}","https://news.google.com/rss/articles/CBMie2h0dHBzOi8vd3d3LjluZXdzLmNvbS9hcnRpY2xlL25ld3MvbG9jYWwvYXBhcnRtZW50LXJlb3BlbnMtbmV3LW5hbWUtYWZ0ZXItZXhwbG9zaW9uLzczLTZhZjgyOWQxLTQ2NTEtNGEzNC04MDcyLTZlODliOGQ1ZWE2ZtIBf2h0dHBzOi8vd3d3LjluZXdzLmNvbS9hbXAvYXJ0aWNsZS9uZXdzL2xvY2FsL2FwYXJ0bWVudC1yZW9wZW5zLW5ldy1uYW1lLWFmdGVyLWV4cGxvc2lvbi83My02YWY4MjlkMS00NjUxLTRhMzQtODA3Mi02ZTg5YjhkNWVhNmY?oc=5&hl=en-US&gl=US&ceid=US:en","Wed 17 May 2023 03:25:00","The complex formerly known as Parkside Collective is now taking applications for new tenants under the name Stella on the Park.  Example video title will go here for this video  AURORA, Colo. — The former Parkside Collective in Aurora is accepting new lease applications under a new name eight months after an explosion forced hundreds of tenants to find new places to live.  The explosion punched a hole in an exterior wall of the apartment near the corner of East Alameda Avenue and Sable Boulevard in September. The fire department said it responded to reports of smoke in the building before the explosion occurred.  According to a fire investigation report released to 9NEWS Wednesday, the smoke was caused by an electrical arc that started a fire in a conduit underneath a sidewalk. Burning PVC pipe let off gases including hydrogen, which collected in the electrical room, where static electricity sparked the explosion.  ""It was just a loud combustion in my ears,"" said Ash Fox, a former tenant who witnessed the explosion. ""It was a mess for sure.""  In the days following, 300 to 400 people were forced to find new places to live. Some reported robbers had broken into their apartments in their absence and stolen their belongings.  Aurora Fire Rescue investigating explosion at apartment complex 1/11  2/11  3/11  4/11  5/11  6/11  7/11  8/11  9/11  10/11  11/11 1 / 11  ""The whole process of watching my home explode, getting robbed right after, struggling to find a place while living in a hotel, it just wasn’t fun,"" Fox said.  She said tenants were given $1,000, a partial rent refund and a couple of days in a hotel.  ""I am upset that they couldn’t do more for us, but they could rebuild the building within seven months,"" Fox said. ""Now they’re reopening it, but they couldn’t do more for us.""  Leases are available starting June 2, according to the property website. The property management company did not respond to a request for comment.  The new name and apartment availability were first reported by the Aurora Sentinel.  A City of Aurora spokesperson said final inspections on the completed repair were scheduled for this week.  ""I knew it was inevitable because otherwise it would just be a building just sitting here,"" Fox said.  She has found a new place to live and is part of a class action lawsuit against the management company. She said she wouldn't move back.  ""They are nice apartments, but I still don’t fully trust it,"" she said.  SUGGESTED VIDEOS: Latest from 9NEWS"
"explosion","2023-09-25","Not Discerned","{""Tijuana"", ""BajaCalifornia"", ""Mexico""}","https://news.google.com/rss/articles/CBMidGh0dHBzOi8vd3d3Lm5iY3NhbmRpZWdvLmNvbS9uZXdzL2xvY2FsL21vcmUtdGhhbi0yLWRvemVuLWluanVyZWQtYWZ0ZXItZXhwbG9zaW9uLWF0LXRpanVhbmEtbWV4aWNvLWJ1aWxkaW5nLzMyMjg3NTYv0gF6aHR0cHM6Ly93d3cubmJjc2FuZGllZ28uY29tL25ld3MvbG9jYWwvbW9yZS10aGFuLTItZG96ZW4taW5qdXJlZC1hZnRlci1leHBsb3Npb24tYXQtdGlqdWFuYS1tZXhpY28tYnVpbGRpbmcvMzIyODc1Ni8_YW1wPTE?oc=5&hl=en-US&gl=US&ceid=US:en","Wed 17 May 2023 02:06:02","Our sister station Telemundo 20 first reported this story and is following developments here.  More than two dozen people were injured after an explosion in Tijuana, Mexico, a few miles south of the San Ysidro Port of Entry Tuesday morning, prompting a large response from rescuers from various local agencies.  A boom shook the Blancas building in Tijuana's East Zone at around 9:35 a.m. The building houses a print shop, a furniture store, a car detailing shop and a spare parts store. Atop the businesses were apartments that were not meant to be inhabited, according to the Tijuana Civil Protection Agency.  It was not immediately clear what caused the explosion.  Get San Diego local news, weather forecasts, sports and lifestyle stories to your inbox. Sign up for NBC San Diego newsletters.  Tijuana fire crews evacuated several people from the building and began rescue work. Authorities initially reported two people were believed to be trapped at the scene. After an hour and a half of work, firefighters were able to free one person who was trapped in the basement. The individual suffered first- and second-degree burns and was one of several transported to area hospitals, the agency said.  At least 25 people were injured, according to the Tijuana Fire Department — four with serious injuries, six in moderate condition and 15 with minor injuries. Rafael Cabillo, Tijuana's fire director, told Telemundo 20 that the search for other victims continues.  ""The houses that were in the upper part were already red-tagged and the upper part should not be inhabited,"" Bernardo Villegas, director of Tijuana Civil Protection, said in Spanish. ""I think that there was a repair of these houses and they rented them. All the people who were evacuated did not leave with injuries; [they] were outside the [explosion] area.""  The owner of the building, who did not want to provide his name to Telemundo 20, confirmed that another explosion occurred a few years ago in the same place.  ""The second location has an underground gas build-up. I can't tell you why; this is the second time this has happened to us. The disaster was four times bigger than [four] years ago,"" he said in Spanish.  The Secretary of Security and Citizen Protection, the fire department, the municipal police, Civil Protection, the Red Cross and seven private ambulances responded to the incident.  Around 10 a.m., Mayor Montserrat Caballero also arrived at the scene.  This is a developing story. Details may change as information is released."
"explosion","2023-05-16","Not Discerned","{""Orio"", ""Guipuzcoa"", ""Spain""}","https://news.google.com/rss/articles/CBMiigFodHRwczovL25ld3Muc2t5LmNvbS9zdG9yeS9leHBsb3Npb24tbGlua2VkLXRvLWdlbmRlci1iYXNlZC12aW9sZW5jZS1raWxscy10d28tbmVhci1wbGF5Z3JvdW5kLWluLXNwYW5pc2gtdG93bi1uZWFyLWZyZW5jaC1ib3JkZXItMTI4ODI0NTXSAY4BaHR0cHM6Ly9uZXdzLnNreS5jb20vc3RvcnkvYW1wL2V4cGxvc2lvbi1saW5rZWQtdG8tZ2VuZGVyLWJhc2VkLXZpb2xlbmNlLWtpbGxzLXR3by1uZWFyLXBsYXlncm91bmQtaW4tc3BhbmlzaC10b3duLW5lYXItZnJlbmNoLWJvcmRlci0xMjg4MjQ1NQ?oc=5&hl=en-US&gl=US&ceid=US:en","Tue 16 May 2023 20:24:44","An explosion has killed two people in Spain, with authorities suspecting the blast was linked to ""gender-based violence"".  The blast happened near a children's playground in the town of Orio in the north of the country on Tuesday, according to local officials.  The man and woman were killed at around 5.30pm local time in the fishing town.  There was no indication any other people had been hurt.  The explosion occurred on a footpath bench.  News agency EFE, quoting police sources, reported that the preliminary investigation was looking at a package held by one of the victims as a possible source of the explosion.  Read more world news:  Before and after pictures of deadly cyclone  CIA asks Russians to share their secrets  Ukraine's 'onion ring' missile defences  The head of the Basque region, Inigo Urkullu, described the explosion as a ""tragic event supposedly caused by gender-based violence"" without giving more details.  Mr Urkullu also asked for a minute of silence during a political rally, according to several local media outlets.  Advertisement  Orio has a population of around 6,000 and lies near the border with France."
"explosion","2023-05-16","17:30:00","{""Orio"", ""Guipuzcoa"", ""Spain""}","https://news.google.com/rss/articles/CBMiYGh0dHBzOi8vd3d3LnJldXRlcnMuY29tL3dvcmxkL2V1cm9wZS90d28ta2lsbGVkLWV4cGxvc2lvbi1ub3J0aGVybi1zcGFpbi1yZXBvcnRzLXNheS0yMDIzLTA1LTE2L9IBAA?oc=5&hl=en-US&gl=US&ceid=US:en","Tue 16 May 2023 20:55:00","[1/3] Police cordon off the area where a man and a woman died in a suspected bomb blast related to gender violence, according to the Basque regional security department, in Orio, northern Spain, May 16,... Read more                MADRID, May 16 (Reuters) - Two people - a man and woman - died in an explosion in the town of Orio in northern Spain, the Basque regional security department said on Tuesday, and media cited authorities as saying the incident was being investigated as likely gender-based violence.  A department spokesperson said the blast took place around 5.30 p.m. (1530 GMT) in the fishing town of around 6,000 people near the border with France and that there was no indication at the time that any other people had been hurt.  A Reuters witness said police had cordoned off an area around a sidewalk bench where the blast occurred, next to a children's playground.  Several Spanish TV channels broadcast an image that they said was from the scene that showed two dead bodies - one sitting on a bench and one lying on the pavement - in a pool of blood. There were few signs of an explosion, with the bench, shrubs behind it and a bin nearby apparently undamaged.  The head of the Basque region, Inigo Urkullu, lamented what he described as a ""tragic event supposedly caused by gender-based violence,"" without giving more details, and asked for a minute of silence during a political rally, according to several local media outlets.  News agency EFE, quoting police sources, reported the preliminary investigation pointed toward a package held by one of the victims being the source of the explosion.  Reporting by David Latona; Editing by Andrei Khalip            Our Standards: The Thomson Reuters Trust Principles."
"explosion","2021-08-17","Not Discerned","Not Discerned","https://news.google.com/rss/articles/CBMiTWh0dHBzOi8vbmV3cy5ub3J0aGVhc3Rlcm4uZWR1LzIwMjMvMDUvMTYvbGFyZ2VzdC1jb3NtaWMtZXhwbG9zaW9uLWJsYWNrLWhvbGUv0gEA?oc=5&hl=en-US&gl=US&ceid=US:en","Tue 16 May 2023 18:44:28","Astronomers have discovered the biggest cosmic explosion ever witnessed, a massive burst of energy 2 trillion times brighter than our sun and 10 times more powerful than the most powerful supernova.  The explosion, which occurred 8 billion light years away from Earth billions of years ago, has been erupting for three years without any signs of slowing down. Although scientists at first struggled to determine the cause of the cosmic blast, which they have named AT2021lwx, they now think the culprit is a supermassive black hole that came in contact with a gargantuan cloud of gas. That’s according to findings recently published in Monthly Notices of the Royal Astronomical Society.  Stretching across a space that is 100 times the size of our solar system, the black hole formation is currently giving off 100 times more energy than the sun will emit over the course of its entire 10-billion-year lifetime.  The explosion itself is far from Earth, but its discovery could help scientists better understand black holes, which sit at the center of many galaxies, including our own.  “It really seems like, especially when they have time to do some more modeling, this will be an important step in understanding what’s happening in the middle of galaxies,” says Jonathan Blazek, a physics professor at Northeastern University.  Astronomers at the Zwicky Transient Facility in California originally discovered AT2021lwx in 2020 but struggled to suss out the exact cause of such a massive explosion. AT2021lwx was emitting too much light for too long to fit any known category of astronomical phenomenon, whether it was a supernova, aka an exploding star, or a tidal disruption, which occurs when a star has been pulled into a black hole and destroyed.  Eventually, NASA’s Neil Gehrels Swift Observatory, Chile’s New Technology Telescope and Spain’s Gran Telescopio Canarias were all brought online to aid in studying AT2021lwx. With all these telescopes pointed at AT2021lwx, astronomers eventually identified the black hole-related explanation they have settled on in their findings.  Blazek says the astrophysical qualities of a black hole definitely are primed to cause an explosion at this scale. Once a black hole gets large enough, it creates such a gravitational whirlpool that it starts sucking in anything that’s close to it, growing in the process. Anything that crosses the event horizon, the point of no return, and falls into the black hole is gone––it will never be seen or heard from again. That includes light.  So, how does a black hole cause an explosion with enough light to be seen billions of light years away by scientists on Earth?  “Because these are such big, extreme objects, you can have some pretty big, extreme things happening just outside the event horizon,” Blazek says.  The pull of a black hole is so strong that anything caught in its wake gets accelerated to the point where it’s moving near the speed of light, creating swirling, rapidly moving particles that are bumping into each other.  “You get really, really, really hot material outside the event horizon of the blackhole, and this really hot material can emit a lot of energy,” Blazek says. “It turns out the most efficient way to get energy out of mass is to drop it into a black hole.”  According to Blazek, there is a whole class of active galactic nuclei (AGNs) that are powered this way. Mass falls into a black hole, it gets shredded at high velocities and emits a ton of energy. But typically those kinds of events create a steadily increasing amount of energy and light that scientists can observe. That wasn’t the case here.  “They can find no evidence that this was active before, so their best theory is that this was a blackhole about a billion solar masses [large] that was just sitting there quietly because nothing was around to fall in,” he says. “Then, they think a big mass of gas got too close and pretty quickly got shredded and fell in.”  Blazek says this explosion has similarities to other cosmic phenomena, like AGNs, but it’s the differences that make the discovery so exciting.  Blazek says understanding more about the nature of black holes could help with his own work, which involves using galaxies and the movement of mass through the universe to map the cosmos. Black holes are instrumental in moving all kinds of matter through outer space. Although astronomers have learned a lot about black holes, there is still much that isn’t known about how supermassive black holes are created. By further studying an event like this cosmic explosion, scientists could unlock even more about these powerful cosmic forces and the nature of our galaxy as well.  “We don’t fully understand how these things grow, especially early on in their lives,” Blazek says. “If we see an event where a cloud of more than 1,000 solar masses is falling onto a black hole, in the sort of event we didn’t know could happen, that could be an important piece of this puzzle.”  Cody Mello-Klein is a Northeastern Global News reporter. Email him at c.mello-klein@northeastern.edu. Follow him on Twitter @Proelectioneer."
"explosion","2021-09-24","Not Discerned","Not Discerned","https://news.google.com/rss/articles/CBMiXWh0dHBzOi8vd3d3LnNjaWVudGlmaWNhbWVyaWNhbi5jb20vYXJ0aWNsZS9sYXJnZXN0LWV2ZXItY29zbWljLWV4cGxvc2lvbi1oYXMtcmFnZWQtZm9yLXllYXJzL9IBAA?oc=5&hl=en-US&gl=US&ceid=US:en","Tue 16 May 2023 20:00:06","Astronomers have witnessed the largest explosion in space.  The explosive event labeled AT2021lwx was observed to be ten times brighter than any known supernova, the explosions that occur as massive stars die. And whereas supernova explosions only last a few months, this explosive event has been raging for at least three years.  AT2021lwx is also three times brighter than the light that is emitted as stars are ripped apart and devoured by supermassive black holes, occurrences called ""tidal disruption events"" or ""TDEs."" The blast is around 8 billion light-years from Earth and thus occurred when the universe was just 6 billion years old.  AT2021lwx was first spotted by the Zwicky Transient Facility in California in 2020 and was then picked up by the Asteroid Terrestrial-impact Last Alert System (ATLAS) based in Hawaii. Both of these systems are designed to survey the night sky for astronomical events that rapidly change in brightness over time, also known as ""transients."" This change in brightness can indicate a supernova or a gamma-ray burst (GRB) deep in the universe or something much closer to home like a comet or an asteroid.  Though it was spotted by these facilities three years ago, the sheer scale and power of the explosion AT2021lwx were unknown until now.  ""We came upon this by chance, as it was flagged by our search algorithm when we were searching for a type of supernova,"" University of Southampton research fellow Philip Wiseman, who led the research, said in an emailed statement. ""Most supernovae and TDEs only last for a couple of months before fading away. For something to be bright for two plus years was immediately very unusual.""  Wiseman and the team of astronomers think that AT2021lwx may be the result of a black hole violently disrupting a cloud of gas with a mass thousands of times greater than the sun. As it did so, the black hole swallowed fragments of the gas cloud, sending shockwaves into both what remains of the gas and into a wider donut-shaped torus of dust surrounding it, causing them to emit bright electromagnetic radiation.  Events like this have been witnessed before, they are rare. What's more, none that have been witnessed previously have been on the scale of AT2021lwx.  While AT2021lwx isn't actually as bright as the gamma-ray burst GRB 221009A spotted by astronomers in 2022, this event that erupted from 2.4 billion light-years away lasted for just ten hours after detection. Even though that is quite long for a GRB, it means that AT2021lwx has put out far more energy over its entire lifetime than this gamma-ray burst did in its own.  Measuring the power of a cosmic explosion  Following its initial discovery, the team of researchers behind this discovery continued to examine AT2021lwx using several different telescopes including the Neil Gehrels Swift Telescope, the New Technology Telescope in Chile, and the Gran Telescopio Canarias in La Palma, Spain.  Following these observations, the researchers took the spectrum of light that was emitted from the event and split it down into its constituent wavelengths, measuring how light was emitted and absorbed around the event. This allowed the researchers to calculate the distance to the source of AT2021lwx.  ""Once you know the distance to the object and how bright it appears to us, you can calculate the brightness of the object at its source,"" team member and University of Southampton professor Sebastian Hönig said in the statement. ""Once we'd performed those calculations, we realized this is extremely bright.""  The only thing in the known universe that is as bright as AT2021lwx are supermassive black holes. When these black holes feed on stellar gases that fall into them at high velocities, they can let off incredibly bright emissions known as quasars.  ""With a quasar, we see the brightness flickering up and down over time,"" team member and University of Southampton professor Mark Sullivan added. ""But looking back over a decade there was no detection of AT2021lwx, then suddenly it appears with the brightness of the brightest things in the universe, which is unprecedented.""  Though there are other possible explanations for the explosive event, the astronomers currently favor the explanation that sees an extremely large cloud of mostly gaseous hydrogen or dust that was knocked from its orbit around the black hole and sucked into it. This will only be conclusively determined when the team has collected more data about AT2021lwx.  The team will now look at the explosion in different wavelengths of light including X-rays. Doing so could reveal the temperature of the event and what processes are driving it. They will also conduct computer simulations to discover if their model of a titanic gas cloud disrupted by a black hole could account for AT2021lwx.  ""With new facilities, like the Vera Rubin Observatory's Legacy Survey of Space and Time, coming online in the next few years, we are hoping to discover more events like this and learn more about them,"" Wiseman concluded in the statement. ""It could be that these events, although extremely rare, are so energetic that they are key processes to how the centers of galaxies change over time.""  The team's research is discussed in a paper published in the journal Monthly Notices of the Royal Astronomical Society.  Copyright 2023 Space.com, a Future company. All rights reserved. This material may not be published, broadcast, rewritten or redistributed."
"explosion","2019-01-10","15:00:00","{""SanFrancisco"", ""California"", ""UnitedStates""}","https://news.google.com/rss/articles/CBMiamh0dHBzOi8vd3d3LmNyeXB0by1uZXdzLWZsYXNoLmNvbS9ldGhlcmV1bS1yaXZhbC1wb3NpdGlvbmVkLWZvci1leHBsb3NpdmUtc3VyZ2UtY291bGQtaXQtYmUtdGhlLW5leHQtcGVwZS_SAQA?oc=5&hl=en-US&gl=US&ceid=US:en","Mon 15 May 2023 14:07:41","Ethereum Rival Positioned for Explosive Surge – Could it be the Next Pepe?  Crypto analyst Altcoin Sherpa is bullish on the native token of layer-1 blockchain Sui (SUI), expecting a significant price increase.  Sherpa suggests that Pepe (PEPE) is currently experiencing high trading volumes within a specific price range, making it a potential swing long opportunity.  Sui (SUI) Poised for Significant Price Increase  Altcoin Sherpa, a well-known crypto analyst, predicts a substantial rally for the native token of the layer-1 blockchain Sui (SUI). With a relatively small overall float compared to the total supply, Sherpa believes that market makers can easily manipulate the token, making it an attractive investment. The analyst suggests that buying SUI around $1 could yield profitable returns, although the timing of the price surge remains uncertain.  However, Sherpa cautions that if the price of Bitcoin (BTC) experiences another downward move, SUI’s value is likely to decline by over 20%"
