"topic","date"," time","place","url","date published","article text"
"fire","2023-07-01","Not Discerned","{""Attleboro"", ""Massachusetts"", ""UnitedStates""}","https://news.google.com/rss/articles/CBMiYWh0dHBzOi8vd3d3LndwcmkuY29tL2NvbW11bml0eS9lbnZpcm9ubWVudC9vZmZpY2lhbHMtdXJnZS1uby1idXJuaW5nLWR1ZS10by1maXJlLXdlYXRoZXItd2FybmluZy_SAWVodHRwczovL3d3dy53cHJpLmNvbS9jb21tdW5pdHkvZW52aXJvbm1lbnQvb2ZmaWNpYWxzLXVyZ2Utbm8tYnVybmluZy1kdWUtdG8tZmlyZS13ZWF0aGVyLXdhcm5pbmcvYW1wLw?oc=5&hl=en-US&gl=US&ceid=US:en","Tue 16 May 2023 10:35:58","PROVIDENCE, R.I. (WPRI) — All of Southern New England is under a Red Flag Warning and Fire Weather Watch due to the warm and dry conditions.  The R.I. Department of Emergency Management (DEM) is urging the public to be cautious and avoid outdoor burning since the conditions increase the chance of fires spreading more quickly. This means no campfires, charcoal or cooking fires, and using any devices that emit flames or embers.  Fire officials also believe many recent brush fires may have been started by improperly disposed cigarettes.  Crews are currently battling a brush fire in the woods off Fisher Street in Attleboro.  (Story continues below video.)  Rhode Island has seen its fair share of brush fires in the past month, including one that burned as many as 600 acres of land in Exeter.  “The last time we had the Red Flag Warnings is when we had that large fire in Exeter, so it’s definitely a ‘watch out’ situation for the fire community right now,” DEM Forest Fire Program Manager Pat MacMeekin said.  “Being so recently that we just had large fires, having this Red Flag Warning again is putting us on a high alert absolutely,” he continued.  The DEM says if you see a brush fire to remain calm and call 911.  Photo: Shiina LoSciuto/WPRI-TV  Photo: Shiina LoSciuto/WPRI-TV  Photo: Shiina LoSciuto/WPRI-TV"
"fire","2018-07-03","Not Discerned","{""Montclair"", ""California"", ""UnitedStates""}","https://news.google.com/rss/articles/CBMiY2h0dHBzOi8vYmFyaXN0YW5ldC5jb20vMjAyMy8wNS9tZmQtdW5pb24tcmVmdXRlcy1jbGFpbXMtcmVnYXJkaW5nLWZpcmUtaG91c2UtMy1hbmQtZmlyZS1kZXBhcnRtZW50L9IBAA?oc=5&hl=en-US&gl=US&ceid=US:en","Tue 16 May 2023 11:04:40","Montclair, NJ – John Fierro, president of Montclair Firefighters Mutual Benevolent Association Local 20, refutes claims made about the Montclair Fire Department equipment and conditions at Fire House #3.  “The Viking stove at headquarters was part of a $5 million dollar RFP Specification for a new building. It is 19 years old. Would you put a Home Depot stove in a commercial building? The Viking stove at Station 2 cost the town $6,300.00 in 2001,” says Fierro. “MFD has never prioritized Viking stoves and Nautilus equipment over safety. The silly conversation about Viking stoves holds no merit; they are 20 years or older and have and continue to serve the town well.”  Regarding Nautilus Gym equipment, Fierro says it was acquired by a grant awarded in the 2001-2002 years that was written by Battalion Chief Durning.  “Most of our other equipment is donated by residents that are moving away, and they offer it to the Fire Department,” he says.  Fierro also states that the radios at Station 3 “do work and always work. If a repair is made or there is an issue, every Officer and Firefighter is issued a personal radio and a radio in the Engine; the backup plan has a backup plan. Our radios are not substandard; they still do the job, just not supportive, and challenging to get parts for they have timed out.”  Regarding the request for more firefighters, Fierro says hiring more firefighters is to replace retired members and keep everyone safe.  “To state we are not a serious department on what basis, I stand behind all our members and have a diverse team of Professional Firefighters that other departments admire; our training level is above and beyond,” he adds.  Fierro responded to comments made in the lawsuit about Fire House #3 conditions and also by resident Eileen Birmingham.  “Station 3 is not a “gulag,” I was stationed there for 11 years and enjoyed every minute of it. The people in the neighborhood I met and the flowers we planted all represent that we were happy and proud to be there. Hypothetically in my opinion, if you wanted to punish someone, you would move them to the busiest rig in town, Engine 1 or Truck 1, located at headquarters,” he said.  Fierro says the stove at Station 3 is approximately six years old.  “I remember it being delivered and installed, and it functions 100%. The Sunday gravy we cook on all three stoves tastes the same; i will verify that I’ve personally been at all three Firehouses over my career.”  Fierro writes that there are four paid studies stating that Station 3 is needed.  “Dismissing the studies because they do not fit one narrative is, at best, disappointing,” says Fierro. “Eileen [Birmingham] was given these studies and is quoted ‘I choose not to accept 20-year-old data,’ even though all reports say we are understaffed at 90 Firefighters.”  Fierro says no one has mentioned that the Firefighters 100% renovated Station 2 kitchen and two bathrooms and a Station 3 Bathroom, with the town only paying for material and firefighters doing all labor.  Fierro also writes that MFD staff is full of Montclair residents. He says that information about these buildings has become false and mentions “pop-in visits from the CFO to inspect the buildings, take photos, and interview members.”  “Traditionally, this request is made to the Chief’s office, and a guided tour is scheduled. We do not let people wander around restricted areas and living quarters with personal items left about. It would be irresponsible to our members. Yes, the building is public; however, some areas are not, similar to areas of Town Hall where the public is not allowed to enter at will or sit in on meetings and ask questions. I have had multiple members call and feel uncomfortable and are exploring formal complaints.”"
"fire","2023-07-09","Not Discerned","{""Amsterdam"", ""NoordHolland"", ""Netherlands""}","https://news.google.com/rss/articles/CBMiiwFodHRwczovL2xlYWRlcmhlcmFsZC5jb20vZ2xvdmVyc3ZpbGxlLWxvY2FsLW5ld3Mtam9obnN0b3duLWxvY2FsLW5ld3MvbG9jYWwtbmV3cy8yMDIzLzA1L2Ftc3RlcmRhbS1yZXNpZGVudC00My1raWxsZWQtaW4tbW9uZGF5LW5pZ2h0LWZpcmUv0gEA?oc=5&hl=en-US&gl=US&ceid=US:en","Tue 16 May 2023 20:29:00","Site of structure fire at 42 Stewart St. in Amsterdam as seen on Tuesday.  Article Audio:  AMSTERDAM — One man was killed in a fire on Stewart Street in Amsterdam on Monday night, police said.  David L. Crandell, 43, of 42 Stewart St., was found in his second floor apartment by responding fire crews. He had succumbed to the fire.  An autopsy was expected to be performed at Albany Medical Center on Tuesday to positively determine the cause of death, Amsterdam Fire Chief Anthony Agresta said.  Another 51-year-old male resident of the second floor apartment was able to exit the building on his own and alerted police at the scene that his roommate was still inside.  Four individuals living in the first floor apartment were able to leave the building on their own and have been displaced by the fire. Five dogs and two cats were killed.  Multiple callers reported the fire around 6:48 p.m. on Monday. The second floor porch was fully involved when Amsterdam fire crews and police arrived on the scene.  The fire spread through the second floor apartment and entered the attic area of the two-family home. The first floor apartment sustained water damage.  Agresta confirmed the surviving roommate received medical attention following the fire, but declined to provide further details regarding the man’s condition or his identity.  “Unfortunately, I’m not able to confirm his identity,” Agresta said.  The cause of the fire is under investigation by the Amsterdam Fire Department and state Office of Fire Prevention and Control.  The fire is believed to have started in the area of the second floor porch. The cause of the fire does not appear to be suspicious.  Agresta declined to comment further on the cause pending the results of the investigation, which are expected within the next week.  Reach Ashley Onyon at [email protected] or @AshleyOnyon on Twitter."
"fire","2023-07-03","23:00:00","{""Brockton"", ""Massachusetts"", ""UnitedStates""}","https://news.google.com/rss/articles/CBMibmh0dHBzOi8vd3d3Lm5iY2Jvc3Rvbi5jb20vbmV3cy9sb2NhbC9wZXJzb24tanVtcHMtZnJvbS1zZWNvbmQtc3Rvcnktd2luZG93LXRvLWVzY2FwZS1maXJlLWluLWJyb2NrdG9uLzMwNDYwNjEv0gF0aHR0cHM6Ly93d3cubmJjYm9zdG9uLmNvbS9uZXdzL2xvY2FsL3BlcnNvbi1qdW1wcy1mcm9tLXNlY29uZC1zdG9yeS13aW5kb3ctdG8tZXNjYXBlLWZpcmUtaW4tYnJvY2t0b24vMzA0NjA2MS8_YW1wPTE?oc=5&hl=en-US&gl=US&ceid=US:en","DateString[Failure[""ServerFailure"", <|""MessageTemplate"" :> Interpreter::noknow, ""MessageParameters"" -> <|""Input"" -> ""Tue, 16 May 2023 13:44:55 GMT""|>, ""Input"" -> ""Tue, 16 May 2023 13:44:55 GMT""|>]]","Heavy fire ripped through three floors of a multi-use building in Brockton, Massachusetts, overnight, sending smoke billowing into the sky as flames emerged over the building's roof.  When crews with the Brockton Fire Department arrived, someone was jumping off the second floor of the building to escape the flames, Brockton Fire Chief Brian Nardelli said while speaking to reporters on scene early Tuesday morning.  First responders were first called to the fire on Warren Avenue shortly after 11 p.m., and had to battle heavy fire throughout three floors.  ""Quite a bit of fire,"" Chief Nardelli said. ""Heavy heat on the third floor, but we got most of the fire, heavy body of fire knocked down, we're chasing hot spots now.""  Get Boston local news, weather forecasts, lifestyle and entertainment stories to your inbox. Sign up for NBC Boston’s newsletters.  One adult was taken to Good Samaritan Medical Center. All of the eight people who were inside the home made it out.  The top two floors are apartments, which were heavily damaged in the fire.  The first floor is Bud’s Variety Convenience Store, which the chief said sustained mostly smoke and water damage.  Chief Nardelli said it can be really tricky getting at the pockets of fire in two and a half story wood frame buildings like this one – which is part of the reason they struck four alarms.  “There’s a lot of void spaces in them, in the two and a halfs, you’ve got knee walls, you’ve got attic spaces, it gets in there, that super-heated smoke, expands, expands, expands,"" you saw the fire,"" the chief said. ""We cut a hole in the roof, we had basically a blow torch coming out of there, that’s what we want to relieve the crews, so they can get in and fight the fire, but it just takes a while.""  “I feel something like a boom, so I just come outside, I see her standing on the top floor, so as soon her I look in her eyes, she just fell down,” said Antonio Santos, who lives next door.  Santos said with the fire growing, his neighbor fell or jumped through the roof of the second floor porch and then jumped to the ground below.  The owner of Bud’s Variety on the first floor says his business is likely a total loss.  “Fire, flames, smoke…we lost everything, we lost our business, we lost our everything,"" Owner Mohammad Uddin said.  The cause of the fire has not been determined, and an investigation is underway."
"fire","2023-05-15","Not Discerned","{""Columbus"", ""Indiana"", ""UnitedStates""}","https://news.google.com/rss/articles/CBMiamh0dHBzOi8vd3d3LnRoZXJlcHVibGljLmNvbS8yMDIzLzA1LzE2L2NmZC1pbXByb3Blcmx5LWRpc2NhcmRlZC1jaWdhcmV0dGUtbGVhZHMtdG8tYXBhcnRtZW50LWJhbGNvbnktZmlyZS_SAQA?oc=5&hl=en-US&gl=US&ceid=US:en","Tue 16 May 2023 17:45:29","COLUMBUS, Ind. — An improperly discarded cigarette on a second story balcony led to a fire at the Canterbury Place Apartments on Monday night. A fast response by firefighters confined the fire to the exterior balcony.  Columbus firefighters were sent to the apartment complex at 9:43 p.m. Monday on a report of an apartment fire at 3586 Nicholas Lane after a fire was reported on a second story balcony, said Capt. Mike Wilson, Columbus Fire Department spokesman.  Firefighters arrived on the scene in less than five minutes of the dispatch and reported a working fire with flames showing. Columbus police, also on the scene, assisted firefighters by notifying neighboring apartment occupants of the fire and aiding in the evacuation of the building, Wilson said. With an evacuation underway and additional firefighters enroute to the scene, the first arriving engine company charged a hose line and advanced into the second floor apartment. As crews entered the apartment, they found the interior of the apartment was clear of fire. Crews pushed to the balcony where they found fire burning up a vinyl sided wall. Firefighters extinguished the flames within seconds of their arrival on the balcony, Wilson said.  Firefighters removed a section of the balcony ceiling and confirmed that that fire was confined to the exterior balcony and did not extend into the apartment’s attic space or apartment’s interior living space.  Fire department investigators learned from the tenant that a family member had been smoking a cigarette on the balcony earlier in the evening and discarded it in a cardboard box that was being used to collect cigarette butts, Wilson said. Investigators said that the cardboard box had completely burned away but a large amount of cigarette butts were located in that location. Investigators ruled the fire accidental as a result of improper cigarette disposal.  Captain Troy Todd, Columbus Fire Department fire investigator, said that the department sees fires similar to this incident each year. “We have seen a number of significant-damage fires occur in the city from improper cigarette disposal. This type of fire is easily preventable if proper disposal takes place,” he said.  Damage from the fire is estimated at approximately $5,000.  Agencies that assisted at the scene include the Columbus Police Department and Columbus Regional Health Emergency Medical Services. No injuries were reported at the scene.  The Columbus Fire Department recommends that all smoking material be disposed of in a noncombustible container. The container should also be periodically emptied to prevent a collection of material within the container. Materials may be doused with water to confirm that the smoking materials are completely extinguished."
"fire","2023-12-01","19:00:00","{""Williamsburg"", ""Virginia"", ""UnitedStates""}","https://news.google.com/rss/articles/CBMiS2h0dHBzOi8vd3d3LndreXQuY29tLzIwMjMvMDUvMTcvbW90b3Itb2lsLWZ1ZWxzLWZpcmUta2VudHVja3ktdHJ1Y2stZ2FyYWdlL9IBAA?oc=5&hl=en-US&gl=US&ceid=US:en","Wed 17 May 2023 01:13:00","WHITLEY COUNTY, Ky. (WKYT) - A truck garage caught fire in Williamsburg Tuesday evening.  Emergency management officials tell us it happened on Highway 92 West, and multiple departments responded.  They say tractor-trailers on the property had motor oil inside, which fueled the fire.  There was also some runoff, so the EPA was called to the scene as well.  Luckily, no one was hurt.  Copyright 2023 WKYT. All rights reserved."
"fire","2023-07-03","Not Discerned","{""Worcester"", ""Massachusetts"", ""UnitedStates""}","https://news.google.com/rss/articles/CBMia2h0dHBzOi8vd3d3Lm5iY2Jvc3Rvbi5jb20vd2VhdGhlci9yYXJlLXZlcnktaGlnaC1icnVzaC1maXJlLWRhbmdlci1wcm9tcHRzLXdhcm5pbmdzLWluLW5ldy1lbmdsYW5kLzMwNDYxMzgv0gFxaHR0cHM6Ly93d3cubmJjYm9zdG9uLmNvbS93ZWF0aGVyL3JhcmUtdmVyeS1oaWdoLWJydXNoLWZpcmUtZGFuZ2VyLXByb21wdHMtd2FybmluZ3MtaW4tbmV3LWVuZ2xhbmQvMzA0NjEzOC8_YW1wPTE?oc=5&hl=en-US&gl=US&ceid=US:en","Tue 16 May 2023 16:59:19","It’s rare for very high fire danger classification in New England, especially over a large area, but Tuesday brings exactly that – from central Vermont and New Hampshire to just south of the Massachusetts Turnpike, including Worcester and Boston. The threat for brush fire development and growth is very high, owing to recent dry conditions, dry brush and dry air with warming temperatures.  Additionally, a gusty westerly wind to 30 mph for many and up to 40 mph on Cape Cod, becoming southwest late in the day, will contribute to fire spread and this can apply to both brush fires and building fires, as any type of fire thrives on wind to grow and spread. Though Tuesday morning clouds have been thinning for strengthening sun, wildfire smoke from distant fires in western Canada will thicken in our New England sky Tuesday, carried thousands of feet above our heads by the jet stream winds aloft, contributing to a colorful Tuesday evening sunset and Wednesday morning sunrise.  Though that smoke doesn’t directly make it to the ground, there’s just enough pollution in southern New England air for moderate air quality – noticed only by those with respiratory problems – and pollen continues to fill the air. A cold front dropping south from Canada will carry scattered showers from north to south Tuesday late evening and overnight, not arriving to southeastern New England until predawn Wednesday, dropping only hundredths of an inch of rain for communities that see them, and perhaps not surviving the trip at all for the southwest quarter of New England.  Get Boston local news, weather forecasts, lifestyle and entertainment stories to your inbox. Sign up for NBC Boston’s newsletters.  So, fire danger and pollen continues Wednesday, though a drop of about 20 degrees in daytime high temperature owing to the new, cooler air from Canada should mean the relative humidity of the air isn’t quite as dry. The busy, northerly breeze Wednesday will gust to 30 mph at times and will ensure high temperatures near 60 feel like the 50s even at the warmest time of day – a big drop from one day prior! As dry and fair weather continues, temperatures climb incrementally to the mid 60s, then around 70 degrees, respectively, on Thursday and Friday. A sluggish cold front will approach New England this weekend, though timing has been somewhat variable in the forecast. 24 hours ago, it looked like the front may arrive with scattered rain showers on Sunday. That timing has since sped up to later Saturday into early Sunday morning, so we clearly still have some work to do firming this up.  That said, whatever showers arrive shouldn’t stay more than about 12 to 15 hours, which means the entire weekend isn’t expected to be marred by them. We could use some meaningful rain, but our First Alert Team isn’t sold on just how much these showers will deliver, with current estimates from our exclusive NBC Forecast System having dropped to around half an inch due to the increasing forecast speed of the system.  For now, we continue to carry highs in the 60s and 70s next week in our exclusive 10-day forecast, just as long as a northeast wind off the cool ocean doesn’t set up, which we’ll be keeping an eye out for signals of."
"fire","2023-05-15","Not Discerned","{""Farmington"", ""NewMexico"", ""UnitedStates""}","https://news.google.com/rss/articles/CBMiXGh0dHBzOi8vZGFpbHlidWxsZG9nLmNvbS9uZXdzL2ZpcmUtb2ZmLXdoaXN0bGVzdG9wLXRyYWlsLWNhdXNlZC1ieS1hcnNvbi1hdXRob3JpdGllcy1yZXBvcnQv0gEA?oc=5&hl=en-US&gl=US&ceid=US:en","Wed 17 May 2023 00:31:46","FARMINGTON – Approximately 45 firefighters from around Franklin County responded to a woods fire that impacted half an acre of forest in a remote location between the Whistle Stop Trail and Wilton Road on Monday evening. The fire has since been determined arson by the Maine Forest Service, Farmington Fire Chief Timothy Hardy reported.  The Farmington Fire Department received the call around 6:30 p.m. on Monday evening, but it took time before they arrived at the scene due to the difficult location. Chief Hardy stated that the challenge was accessing the fire in order to put it out due to a lack of roads or trails in the area. It was impossible to get firetrucks directly to the fire, and Red Schoolhouse Road was blocked off for over two hours to allow firetrucks to reach as close to the scene as possible. Even so, the responding departments had to cut a trail through the trees to the fire.  There was also difficulty with water access. Firefighters used backpack pumps and hand tools to bring water to the remote site. ATVs with water tanks and pumps from the Farmington, Kingfield, and Jay Fire Departments were used to shuttle equipment and water back and forth.  Leaf litter and small trees were burned, although nothing large was reached by the fire, which was completely doused by around 9:30 p.m. when the responders left the site.  The Farmington Fire Department returned to the scene early Tuesday morning and saw that the fire was still out. The Maine Forest Service also returned on Tuesday to conduct investigations into the origins of the fire, which are still on-going. It has been officially determined that the fire was caused by arson.  Mutual aid partners from several surrounding towns were on the scene to assist Farmington, including the Jay Fire Department, Wilton Fire Department, Industry Volunteer Fire and Rescue, Temple Fire Department, New Sharon Fire Department and Kingfield Fire Department, as well as the Maine Forest Service. Mutual aid partners began to leave the scene between 8:30 and 9:30 p.m., as darkness began to set in."
"fire","2023-05-16","02:00:00","{""Danville"", ""Illinois"", ""UnitedStates""}","https://news.google.com/rss/articles/CBMidWh0dHBzOi8vdmVybWlsaW9uY291bnR5Zmlyc3QuY29tLzIwMjMvMDUvMTYvZmFtaWx5LXRoYW5rcy1maXZlLW9mZmljZXJzLXdoby1zYXZlZC10aGVpci1saXZlcy1kdXJpbmctbWFyY2gtMjZ0aC1maXJlL9IBAA?oc=5&hl=en-US&gl=US&ceid=US:en","Wed 17 May 2023 03:07:47","It was a very special moment at the start of Tuesday’s (May 16th) Danville City Council meeting when five police officers, four Danville and one Vermilion County, were honored for heroic efforts during the early morning darkness when a fire broke out in a building in the Vermilion Gardens apartments. Two officers had arrived to check on reports of a noise, and realized there was an active fire.  After calling for help, other officers joined in to form a human tower of top of an air conditioning register and passed Rebecca Dampier’s two children, Andrew Dampier and Alexandria Carter, down to safety. Rebecca then jumped and was caught by the officers.  Vermilion County Deputy Seth Moody received honors from Danville Police Chief Christopher Yates, along with Danville officers Jered Greer, Ayden Lamar, Scott Showers, and Damon Bellik.  Ironically, Rebecca’s father was a Chicago Firefighter for years, knew the movie Backdraft very well, and had passed some of that knowledge on to Rebecca. She heard something that sounded like knocking. And that reminded her.  AUDIO: And in the Backdraft movie, this guy hears something that sounds like knocking. So he goes and goes to open it out of curiosity, and it was the last thing he ever sees. So for me, if I don’t see anything, and there’s nothing but blackness, I just knew not to open that door.  Eleven-year-old Andrew received a special certificate from Chief Yates for alerting the family. What he did was especially heroic, because he and his mom are hard of hearing. Andrew told Neuhoff Media it all began when he could smell the smoke.  AUDIO: So I stayed calm like anybody would do. I went to my mom, told her what happened. I got my sister up super fast and carefully. I went to the window and looked for anybody who could help us to evacuate. Then a I the Danville Police Officers that were nearby, and then I asked them for help.  All the officers and the family received a standing ovation from a full council chambers at the end of the ceremony."
"fire","2023-05-13","19:19:00","{""Pittsburgh"", ""Pennsylvania"", ""UnitedStates""}","https://news.google.com/rss/articles/CBMiYmh0dHBzOi8vd3d3LnBpdHRrcy5vcmcvbmV3cy9waXR0c2J1cmctZmlyZS1kZXBhcnRtZW50LXJlc3BvbmRzLXRvLXN0cnVjdHVyZS1maXJlLTEzMDctbm9ydGgtZ3JhbmQv0gEA?oc=5&hl=en-US&gl=US&ceid=US:en","Tue 16 May 2023 20:36:42","Facebook Twitter LinkedIn  PITTSBURG, KS – On Saturday, May 13, at approximately 7:19 pm the Pittsburg Fire Department responded to a residential structure fire at 1307 North Grand.  Upon arrival at the scene, the fire department found the front porch engulfed in flames. Fire personnel immediately began an exterior attack, and disconnected electric and gas utilities.  Once the exterior fire was under control, firefighters worked to extinguish fire that spread into the structural part of the house, extending to the attic. Firefighters were able to enter the house and begin the interior attack.  Once inside, fire personnel reported the home unoccupied. A hole was cut into the roof to allow for ventilation. Once the fire was reported to be under control, with only a few smoldering areas remaining, firefighters conducted a secondary search. A small dog was found deceased in the house.  Interior crews then exited the house and firefighters continued to extinguish smoldering areas, and hot spots. Smoke continued to emanate from underneath the metal roof, so a portion of the roof was pulled back to extinguish the remaining embers.  The house sustained heavy damage. The fire department was able to protect all of the nearby exposures, and no civilian or firefighter injuries were reported.  The Pittsburg Fire Department, Pittsburg Police Department, Crawford County EMS, Kansas Gas Service, and Evergy responded to the scene.  The cause of the fire remains undetermined at this time. The Kansas Fire Marshal’s office is investigating.  ###  The mission of the City of Pittsburg is to provide exceptional services, facilities and activities with integrity, professionalism, excellent customer service and a commitment to economic vitality."
