"topic","date"," time","place","url","date published","article text"
"fire","2023-05-15","15:00:00","Not Discerned","https://news.google.com/rss/articles/CBMiWGh0dHBzOi8vd3d3LnNlcXVpbWdhemV0dGUuY29tL25ld3MvZmlyZWZpZ2h0ZXJzLWV4dGluZ3Vpc2gtcnYtZmlyZS1uZWFyLXUtcy1oaWdod2F5LTEwMS_SAQA?oc=5&hl=en-US&gl=US&ceid=US:en","Tue 16 May 2023 17:30:00","Crews from Clallam County Fire District 3 (Sequim) extinguished a recreational vehicle fire in the early afternoon on Monday, May 15.  The PenCom dispatch center received a radio report from a Washington State Patrol Trooper that a mobile home was on fire, and the first arriving crew reported a working fire of an RV with access issues, fire district officials report.  Crews pulled a hose line and lobbed water onto the fire while they were able to forcibly remove a locked gate. Firefighters then controlled the fire within minutes, protecting a passenger vehicle and several exposure buildings nearby.  Crews then overhauled and completed a search of the area. The owner of the property confirmed no one was living in the recreational vehicle; no one was hurt during this incident.  From the fire district, eight units and 17 staffers responded to the scene. PUD crews also arrived and secured power as powerlines were involved from above."
"fire","2023-12-04","Not Discerned","{""Roswell"", ""NewMexico"", ""UnitedStates""}","https://news.google.com/rss/articles/CBMijwFodHRwczovL3d3dy53c2J0di5jb20vbmV3cy9sb2NhbC92YXJzaXR5LXByZXNpZGVudC1mYW1pbHktZXNjYXBlLWFmdGVyLWZpcmUtaGVhdmlseS1kYW1hZ2VzLXRoZWlyLW5vcnRoLWZ1bHRvbi1ob21lL1lIMlhSSVhCSFJCMlhQSk5MNDNHVU9NS1dZL9IBngFodHRwczovL3d3dy53c2J0di5jb20vbmV3cy9sb2NhbC92YXJzaXR5LXByZXNpZGVudC1mYW1pbHktZXNjYXBlLWFmdGVyLWZpcmUtaGVhdmlseS1kYW1hZ2VzLXRoZWlyLW5vcnRoLWZ1bHRvbi1ob21lL1lIMlhSSVhCSFJCMlhQSk5MNDNHVU9NS1dZLz9vdXRwdXRUeXBlPWFtcA?oc=5&hl=en-US&gl=US&ceid=US:en","Tue 16 May 2023 13:09:26","ROSWELL, Ga. — The family who owns The Varsity escaped a house fire that happened overnight at their Roswell home.  The fire happened late Monday night off Prado Terrace in the Lakeside at Ansley subdivision just before midnight.  [DOWNLOAD: Free WSB-TV News app for alerts as news breaks]  Fulton County property records show the 8,000 square foot house belongs to Gordon Muir, the president of the group that runs the iconic Varsity restaurants. Muir’s grandparents founded the original location off Spring Street nearly 95 years ago.  Channel 2′s Steve Gehlbach received the following statement from Muir.  “We are heartbroken by the tragic loss of our family home. Fortunately, our entire family emerged safely from the fire. We greatly appreciate everyone’s concern in this difficult time.”  TRENDING STORIES:  Neighbors called 911 after they spotted smoke and flames coming from the home.  A Roswell fire spokesman said it only took the department minutes to arrive. When firefighters arrived, they said all nine family members had already made it out of the house.  Two people had to be treated at the scene for smoke inhalation. Their injuries were non-life threatening, according to officials.  The home had significant damage with firefighters battling hotspots throughout Tuesday morning. The cause of the fire remains under investigation.  [SIGN UP: WSB-TV Daily Headlines Newsletter]  IN OTHER NEWS  DeKalb Avenue closed for road work, neighbors say they've been waiting on this for years      ©2022 Cox Media Group"
"fire","2023-05-01","10:00:00","Not Discerned","https://news.google.com/rss/articles/CBMiVGh0dHBzOi8vd3d3Lm1hcnNoYWxsaW5kZXBlbmRlbnQuY29tL29waW5pb24vbG9jYWwtY29sdW1ucy8yMDIzLzA1L3BsYXlpbmctd2l0aC1maXJlL9IBAA?oc=5&hl=en-US&gl=US&ceid=US:en","Wed 17 May 2023 06:06:47","Fire can be a force for either good or bad. For instance, the words “all fired up!” usually connotes positive feelings whereas the phrase “you’re fired!” can mean that you have been involuntarily deselected from the workforce.  Fire can destroy or renew. A little of both took place at our farm recently.  A year ago last May an unpredicted and unpredictable derecho struck our region. Our farmstead, like many others, lost dozens of trees. The number of trees in our shelterbelt that were busted off or uprooted could officially be classified as “more than you can shake a stick at.”  Like many homeowners in our region, I quickly formed a close personal relationship with my chainsaw. We are eternally grateful for all the help we received from neighbors and friends who pitched in with the cleanup. The downed trees were pitched into a brush pile that grew to approximately the same size and tonnage as a house.  Last week I decided that it was time to burn the brush pile. It seemed fitting that it was almost a year to the day after the derecho.  One cannot simply conduct a major burn on a whim nowadays. One must alert the authorities so that they can be prepared in case things get out of hand. Another factor is that people who live hereabouts become nervous whenever they see a large plume of smoke rising into the sky. Such a thing is likely to be reported to the authorities, causing enormous amounts of undue consternation and perhaps a visit from your local fire department.  I watched the weather forecast closely and chose a day that promised light winds. Early on the morning of the burn I strolled down to the brush pile accompanied by our faithful farm dog, Bella.  “Don’t play with fire!” is an admonishment that’s often issued to little boys. This only serves to make fire seem all the more fascinating to the boy. Our family incinerated our household refuse when I was a kid and I frequently volunteered to tend the burn barrel. I thus acquired a deep respect for the way fire can behave. Liquid accelerants cost me more than one set of eyebrows.  A few well-placed wadded-up newspapers were all that was needed to ignite the brush pile. Within seconds the fire had leaped from twig to branch, roaring greedily as it gobbled the desiccated wood.  The heat quickly became surprisingly intense. Even at 50 feet away, Bella and I were beginning to feel quite toasty. We probably could have roasted weenies right where we stood.  Bella sat at my feet and peered up at me with an anxious expression that seemed to say, “Dad? Don’t you see what’s happening? Are you sure that everything is OK?”  I assured her that things were going exactly as planned. “But maybe we should back up a few yards,” I told her. “If we stand this close much longer, we’ll both soon be hot dogs.”  It was one of those rare mornings here on the prairie when the wind was virtually nonexistent. This happens about as often as a visit from Halley’s Comet.  Some of the trees in the brush pile were absolutely huge. One of them had a trunk that appeared to be the same diameter as a rear tractor tire. There could be no doubt that this tree was more than 100 years old. This meant there could also be no doubt that it had been planted by my great-grandfather Charlie Sveen, who homesteaded our farm.  Glancing at the garden hose at my feet, I thought about how Charlie had probably carried buckets of water to that tree to nurse it through long, hot summers. The tree had returned the favor by providing shelter from our relentless winds for multiple generations of my family.  And now it was going back to the atmosphere from whence it came via the rapacious flames of an ignoble brush pile fire.  Like a passionate new romance, a brush pile fire throws off tremendous amounts of heat and drama at the start. And like a romance, things eventually settle down to a slow smolder. That is when the real work begins.  I used a long-handled shovel to push wayward deadwood onto the glowing heap of coals as a fickle breeze pushed the lazy smoke in random directions. By the end of the day, I had absorbed more smoke than a side of bacon.  “Phew!” exclaimed my wife when I walked into the house, “You smell like you’re on fire!”  It’s gratifying to know that the spark is still there after more than 40 years.  — Jerry’s book, Dear County Agent Guy, is available at http://Workman.com and in bookstores nationwide"
"fire","2020-07-12","Not Discerned","{""Ohio"", ""NewYork"", ""UnitedStates""}","https://news.google.com/rss/articles/CBMihAFodHRwczovL3d3dy5jYW50b25yZXAuY29tL3N0b3J5L25ld3MvbG9jYWwvY2FudG9uLzIwMjMvMDUvMTYvYWtyb24tY2FudG9uLW9oaW8tbGlzdC1ob21lcy1jaXRpZXMtaGlnaGVzdC1ob21lLWZpcmUtcmlzay83MDIxNDcwNTAwNy_SAQA?oc=5&hl=en-US&gl=US&ceid=US:en","Tue 16 May 2023 09:24:15","Being ranked among the top 150 cities in the U.S. with highest home fire risk will get you a $10,000 fire education grant from the Hartford.  Ohio has eight cities on highest home fire risk index.  Canton and Akron have made Hartford insurance company's index of ""top 150 U.S. cities with highest home fire risk.""  The insurer ranked Canton as No. 41 and Akron as No. 40 on its list.  The city it considered with the highest home fire risk was Modesto, California. Ohio had six other cities among the 150. Cincinnati was ranked No. 8 in the index. Youngstown was No. 16. Columbus was No. 39. Cleveland was No. 98, Dayton No. 113 and Toledo No. 122.  The Hartford said it each of the cities on its list of 150 will get $10,000 each to fund fire safety education for children.  More:Deadly rash of house fires in Ohio: 'We know that so many of these fires are preventable.'  Jeff Welch, an assistant director of media and public relations for the Hartford, says the company releases its index of 150 cities with the highest home fire risk once every three years as part of its Junior Fire Marshal Program to educate kids about fire risks. The first was in 2017 and the second in 2020.  Welch said the index covers all residential structures, including single-family homes, duplexes and multi-family units like apartment complexes. It doesn't include vehicle fires or fires at businesses.  Data crunched over three years  In the 2017 index, Welch said, Akron ranked 54th and Canton was not on the list. In the 2020 index, Canton was No. 72 and Akron was No. 33.  Messages seeking comment were left with the Canton and Akron fire departments.  Welch stressed that the index only indicates home fire risk for a particular city in relation to the others on the index.  “The ranking itself is all relative. You could be a safe city but (the) 109 cities below you are a little safer (in terms of home fire risk). It’s not saying (a city on the list) is a dangerous city. I wouldn't frame it that way and that's not how we frame it.”  Welch said, “It’s not an indication of anything to do with the fire department or response times ... or training."" He said the purpose of the index was to generate interest and support for fire safety education and to help educate people on what to do in the event of a fire.  Welch said the Hartford's data analysts come up with the rankings looking at the number of home fires in zip codes for a particular city per a certain number of people who live there according to Census data. They then contract with a polling firm to reach people around the country online and poll them on their behavior that may increase or reduce the risk of a fire. Welch said at least 100 people in each of the 150 cities on the list were surveyed.  Questions on the survey asked people if they engaged in behaviors that raised the risk of fires or mitigated the risk or impact of fires. Had they left something cooking on the stove for too long? Did they have a working fire extinguisher? Did they regularly replace the batteries of their smoke detectors? Did members of the household have an emergency escape plan?  Welch said the goal of the program was to identity the cities where children best need fire education that the Hartford's Junior Fire Marshal program could target with the $10,000 grants.  ""We’re trying to identify where the fire safety gaps are through this index,"" he said, adding that the Junior Fire Marshal program has educated 112 million children the past 76 years. ”Really the goal is to educate these kids so they become fire safe adults.""  Reach Robert at robert.wang@cantonrep.com. Twitter: @rwangREP."
"fire","2023-07-10","01:00:00","Not Discerned","https://news.google.com/rss/articles/CBMiW2h0dHBzOi8vd3d3LmZveDM1b3JsYW5kby5jb20vbmV3cy8xLWRlYWQtaW4tb3Zlcm5pZ2h0LWhvdXNlLWZpcmUtaW4ta2lzc2ltbWVlLW9mZmljaWFscy1zYXnSAV9odHRwczovL3d3dy5mb3gzNW9ybGFuZG8uY29tL25ld3MvMS1kZWFkLWluLW92ZXJuaWdodC1ob3VzZS1maXJlLWluLWtpc3NpbW1lZS1vZmZpY2lhbHMtc2F5LmFtcA?oc=5&hl=en-US&gl=US&ceid=US:en","Tue 16 May 2023 09:29:29","One man is dead and another man is being treated for smoke inhalation after a house fire in Osceola County early Tuesday, according to officials.  The fire broke out shortly before 1 a.m. at a home on Hidden Springs Circle off Waters Edge Drive.  The state fire marshal told FOX 35 News the fire is believed to be accidental. Crews are working to learn what part of the home the fire started in."
"fire","2023-07-10","Not Discerned","{""Paterson"", ""NewJersey"", ""UnitedStates""}","https://news.google.com/rss/articles/CBMiSWh0dHBzOi8vd3d3LmNic25ld3MuY29tL25ld3lvcmsvbmV3cy9wYXRlcnNvbi1rbmlja2VyYm9ja2VyLWF2ZW51ZS1maXJlcy_SAU1odHRwczovL3d3dy5jYnNuZXdzLmNvbS9hbXAvbmV3eW9yay9uZXdzL3BhdGVyc29uLWtuaWNrZXJib2NrZXItYXZlbnVlLWZpcmVzLw?oc=5&hl=en-US&gl=US&ceid=US:en","Tue 16 May 2023 21:23:00","At least 2 homes damaged by fire in Paterson  At least 2 homes damaged by fire in Paterson  At least 2 homes damaged by fire in Paterson  PATERSON, N.J. -- At least two homes were damaged by fire in Paterson on Tuesday.  The fire broke out Tuesday afternoon on Knickerbocker Avenue.  One firefighter had to be rescued from a roof. He was taken to a local hospital with smoke inhalation.  Paterson's fire chief explained the difficult conditions that firefighters faced.  ""A couple things were happening here. It's very dry, so the fire really moves quick, as well as it's fairly windy. It was blowing right in the front windows and out the back and just pushing the fire around,"" Paterson Fire Chief Brian McDermott said.  The fire chief says one rescue was made from a basement.  It's unknown if any residents were injured.  The cause of the fire remains under investigation."
"fire","2023-05-16","21:00:00","{""Sacramento"", ""California"", ""UnitedStates""}","https://news.google.com/rss/articles/CBMiVGh0dHBzOi8vd3d3LmtjcmEuY29tL2FydGljbGUvc2FjcmFtZW50by1maXJlLWRhbWFnZXMtMi1ob21lcy1kYXJ0Zm9yZC1kcml2ZS80MzkxMjMzMdIBWGh0dHBzOi8vd3d3LmtjcmEuY29tL2FtcC9hcnRpY2xlL3NhY3JhbWVudG8tZmlyZS1kYW1hZ2VzLTItaG9tZXMtZGFydGZvcmQtZHJpdmUvNDM5MTIzMzE?oc=5&hl=en-US&gl=US&ceid=US:en","Wed 17 May 2023 05:16:00","A fire Tuesday evening damaged two homes in the south Sacramento area, officials said.The fire was reported around 9 p.m. in the 8400 block of Dartford Drive, located off of Center Parkway near Calvine Road, according to the Sacramento Fire Department. It started when a fence between two houses caught fire, extending into both homes.The fire department said no injuries were reported and that its firefighters were able to quickly put out the fire. The extension into both homes was also described as limited.Video shared by the fire department shows firefighters spraying water into large, bright flames.Crews are still looking into what caused the fire.No other details were released.Stay with KCRA 3 for the latest.  A fire Tuesday evening damaged two homes in the south Sacramento area, officials said.  The fire was reported around 9 p.m. in the 8400 block of Dartford Drive, located off of Center Parkway near Calvine Road, according to the Sacramento Fire Department. It started when a fence between two houses caught fire, extending into both homes.  Advertisement  The fire department said no injuries were reported and that its firefighters were able to quickly put out the fire. The extension into both homes was also described as limited.  Video shared by the fire department shows firefighters spraying water into large, bright flames.  This content is imported from Twitter. You may be able to find the same content in another format, or you may be able to find more information, at their web site.  Crews are still looking into what caused the fire.  No other details were released.  Stay with KCRA 3 for the latest."
"fire","2023-05-15","18:30:00","{""Elsie"", ""Michigan"", ""UnitedStates""}","https://news.google.com/rss/articles/CBMiRmh0dHBzOi8vd3d3LndsbnMuY29tL25ld3MvZmlyZWZpZ2h0ZXItaW5qdXJlZC1hdC1lbHNpZS1hcGFydG1lbnQtZmlyZS_SAUpodHRwczovL3d3dy53bG5zLmNvbS9uZXdzL2ZpcmVmaWdodGVyLWluanVyZWQtYXQtZWxzaWUtYXBhcnRtZW50LWZpcmUvYW1wLw?oc=5&hl=en-US&gl=US&ceid=US:en","Tue 16 May 2023 15:30:40","ELSIE, Mich. (WLNS) — Families are wondering what’s next after a fire tore through their apartments Monday, causing them to lose everything.  The Elsie Area Fire Department said they arrived to the 3000 block of South Hollister Road in Ovid and saw smoke billowing in the air.  People who lived at the complex say it was filled with joy, laughter — memories that are now charred.  “To watch it go up in flames like that, it just breaks my heart,” said Dylan Peru, whose unit was damaged by the fire.  Officials with the Elsie Area Fire Department report that the fire began around 6:30 p.m. on Monday. Upon arrival, fire crews were notified that all people were evacuated but not all of the animals.  Witnesses said, the response was almost immediate from across the area.  “We just sat there and watched it,” Irene Jonassen said. “And first was two or three engines, it ended up between ambulances, the rescue trucks, the fire engines, there was over 15 vehicles lined up here.”  Firefighters made several attempts to rescue all the dogs and cats in the building, some crewmembers were injured in the process.  Three firefighters received treatment from an on scene ambulance, with one of them being taken to a local hospital for minor injuries.  The family who lives in the unit reports losing eight animals total, and they aren’t sure where to go from here.  “I seen the smoke rolling from Elsie, and that’s a good four miles. I seen the smoke and I knew that was too close to where my house was,” said Dylan Peru, whose unit was damaged by the fire.  “I followed the fire trucks and I pulled into my yard, and I got a lot of family in the fire department and they said, ‘You can’t go in there, they’re gone.'”  The cause of the fire is still under investigation, families said four units were damaged along with eight people affected."
"fire","2023-05-16","Not Discerned","{""Anchorage"", ""Alaska"", ""UnitedStates""}","https://news.google.com/rss/articles/CBMieWh0dHBzOi8vd3d3LmFkbi5jb20vYWxhc2thLW5ld3MvYW5jaG9yYWdlLzIwMjMvMDUvMTYvYWZkLWNyZXdzLXJlc3BvbmRpbmctdG8tZmlyZS1uZWFyLXBvcHVsYXItZG93bnRvd24tYW5jaG9yYWdlLWxvdW5nZS_SAQA?oc=5&hl=en-US&gl=US&ceid=US:en","Tue 16 May 2023 18:27:34","Anchorage fire fighters work a situation at Bernie's Bungalow in downtown Anchorage Tuesday, May 16, 2023. (Loren Holmes / ADN)  A gas meter fire Tuesday morning in downtown Anchorage between Bernie’s Bungalow Lounge and a parking garage prompted a large response but did not spread to either building, Anchorage Fire Department officials say.  The fire was reported just before 9:50 a.m., according to Assistant Chief Alex Boyd. About a dozen fire department units were on scene as of 10:15 a.m. The lounge is located on D Street between Sixth and Seventh avenues.  The flames were “to the rear of the building, crews are keeping the fire out of the building,” Boyd said in a message. Firefighters controlled the flames along with Enstar crews, he said.  Anchorage fire fighters work a situation at Bernie's Bungalow in downtown Anchorage Tuesday, May 16, 2023. (Loren Holmes / ADN)  The cause of the fire was under investigation.  • • •"
"fire","0202-01-01","Not Discerned","{""Gatineau"", ""Quebec"", ""Canada""}","https://news.google.com/rss/articles/CBMihAFodHRwOi8vd3d3Lmh1bGx0aW1lcy5jb20vaHQtb25saW5lLzIwMjMvNS8xNi90aHJlZS1hbGFybS1maXJlLWRlc3Ryb3lzLWJheWZyb250LWhvbWUtc2VuZGluZy1zbW9rZS1wb3VyaW5nLXRocm91Z2gtdGhlLWFsbGVydG9uLWFyZWHSAZABaHR0cHM6Ly93d3cuaHVsbHRpbWVzLmNvbS9odC1vbmxpbmUvMjAyMy81LzE2L3RocmVlLWFsYXJtLWZpcmUtZGVzdHJveXMtYmF5ZnJvbnQtaG9tZS1zZW5kaW5nLXNtb2tlLXBvdXJpbmctdGhyb3VnaC10aGUtYWxsZXJ0b24tYXJlYT9mb3JtYXQ9YW1w?oc=5&hl=en-US&gl=US&ceid=US:en","Tue 16 May 2023 20:01:06","• Best Educational Use of School Facilities Study & Updates  • Town Departments at Work: The role of each part of your local government  • Summer Guide 2022  TELL US ABOUT IT  Use the links below to submit your news to us or email: news@hulltimes.com  Send sports news and photos to: sports@hulltimes.com    Press Release  Letter to the Editor  Community Calendar  Obituary  Announcements  Submit a Photo  Classified Ad  To reach the advertising department: office@hulltimes.com"
"fire","2017-07-03","Not Discerned","{""Tuscaloosa"", ""Alabama"", ""UnitedStates""}","https://news.google.com/rss/articles/CBMilgFodHRwczovL3d3dy5uZXdzODAwMC5jb20vbmV3cy9sb2NhbC1uZXdzL29uYWxhc2thL3VwZGF0ZS1sYXRlLW5pZ2h0LWZpcmUtZGVzdHJveXMtYnJpY2UtcHJhaXJpZS1ob21lL2FydGljbGVfMWI4N2M2MDgtZjQ2NC0xMWVkLTkzMzItNWIxMTliZmVlYmRhLmh0bWzSAQA?oc=5&hl=en-US&gl=US&ceid=US:en","Wed 17 May 2023 03:37:00","State Alabama Alaska Arizona Arkansas California Colorado Connecticut Delaware Florida Georgia Hawaii Idaho Illinois Indiana Iowa Kansas Kentucky Louisiana Maine Maryland Massachusetts Michigan Minnesota Mississippi Missouri Montana Nebraska Nevada New Hampshire New Jersey New Mexico New York North Carolina North Dakota Ohio Oklahoma Oregon Pennsylvania Rhode Island South Carolina South Dakota Tennessee Texas Utah Vermont Virginia Washington Washington D.C. West Virginia Wisconsin Wyoming Puerto Rico US Virgin Islands Armed Forces Americas Armed Forces Pacific Armed Forces Europe Northern Mariana Islands Marshall Islands American Samoa Federated States of Micronesia Guam Palau Alberta, Canada British Columbia, Canada Manitoba, Canada New Brunswick, Canada Newfoundland, Canada Nova Scotia, Canada Northwest Territories, Canada Nunavut, Canada Ontario, Canada Prince Edward Island, Canada Quebec, Canada Saskatchewan, Canada Yukon Territory, Canada  Zip Code"
"fire","2023-07-01","Not Discerned","Not Discerned","https://news.google.com/rss/articles/CBMibmh0dHBzOi8vd3d3Lm5ld3NhbmRzZW50aW5lbC5jb20vbmV3cy9sb2NhbC1uZXdzLzIwMjMvMDUvbG9ja21hc3RlcnMtaG91c2UtYS10YXJnZXQtZm9yLWRlbW9saXRpb24tYmVmb3JlLWZpcmUv0gEA?oc=5&hl=en-US&gl=US&ceid=US:en","Wed 17 May 2023 06:18:56","WASHINGTON, W.Va. — A former lockmaster’s house was likely headed for demolition even before it burned over the weekend, a West Virginia Division of Natural Resources representative said Tuesday.  “It’s been a vacant building going on probably over 10 years, I would suspect,” said Jerry Westfall, District 6 wildlife biologist for the DNR.  The house at 556 Northwest Drive off DuPont Road caught fire Saturday evening and was so badly damaged firefighters were unable to enter it to completely extinguish the blaze.  Smoke was seen at the site Sunday and Monday as well.  The cause of the fire is undetermined due to the extent of the damage but it remains under investigation, said Jason Baltic, deputy state fire marshal and chief investigator for the Fire Marshal’s office.  Washington Bottom Volunteer Fire Chief Garry Freed said Monday the fire appeared suspicious because there were no utilities on at the house.  It’s one of two structures owned by the DNR at the site, after it was transferred to the state by the U.S. Army Corps of Engineers in the late ’60s or early ’70s.  Westfall said the DNR used to allow people to stay there in exchange for maintaining the property but it has moved away from that model. Both buildings were dilapidated before Saturday’s fire, he said.  “The agency has wanted to demolish the buildings for quite some time,” Westfall said.  The sticking point has been the demolition of the larger lockhouse along the river as well.  “It’s likely to be expensive,” he said.  Evan Bevins can be reached at ebevins@newsandsentinel.com."
