"topic","date"," time","place","url","date published","article text"
"fire","2019-07-09","Not Discerned","{""FortWayne"", ""Indiana"", ""UnitedStates""}","https://news.google.com/rss/articles/CBMiVWh0dHBzOi8vd3d3LndhbmUuY29tL3RvcC1zdG9yaWVzL2NyZXdzLWludmVzdGlnYXRlLWZpcmUtc291dGgtb2YtZG93bnRvd24tZm9ydC13YXluZS_SAVlodHRwczovL3d3dy53YW5lLmNvbS90b3Atc3Rvcmllcy9jcmV3cy1pbnZlc3RpZ2F0ZS1maXJlLXNvdXRoLW9mLWRvd250b3duLWZvcnQtd2F5bmUvYW1wLw?oc=5&hl=en-US&gl=US&ceid=US:en","Mon 15 May 2023 19:08:00","FORT WAYNE, Ind. (WANE) — What started as a car fire spread in a storage facility south of downtown Fort Wayne on Monday, and the Fort Wayne Fire Department (FWFD) is investigating.  Crews were spotted just before 2:30 p.m. in the area of 2206 Broadway at BTE Storage. The video above shared by WANE 15 viewer Chad Schlatter shows smoke coming from the building.  According to the FWFD, a vehicle was on fire in one of the storage units, which then spread through the attic to seven other storage units.  The FWFD said the first firefighters to arrive at the scene saw black smoke coming from a structure. It took more than 30 minutes to contain the flames, according to a release from the FWFD.  A firefighter at the scene said the damage to the storage units was “pretty significant.” The release said there was heavy damage at the facility due to the fire, smoke, and water.  No injuries were reported, according to the release.  Drew Bogs sent WANE 15 photos that provided an aerial view of the "
"fire","2023-05-22","Not Discerned","{""Winchester"", ""Nevada"", ""UnitedStates""}","https://news.google.com/rss/articles/CBMiVmh0dHBzOi8va3Flbm5ld3NyYWRpby5jb20vMjAyMy8wNS8xNS9maXJlLWRpc3RyaWN0LW5vLTItdG8tZmx1c2gtdGVzdC1maXJlLWh5ZHJhbnRzLTIv0gFaaHR0cHM6Ly9rcWVubmV3c3JhZGlvLmNvbS8yMDIzLzA1LzE1L2ZpcmUtZGlzdHJpY3Qtbm8tMi10by1mbHVzaC10ZXN0LWZpcmUtaHlkcmFudHMtMi9hbXAv?oc=5&hl=en-US&gl=US&ceid=US:en","Mon 15 May 2023 22:15:17","May 15, 2023 3:00 a.m.  Starting Monday, May 22nd, firefighters with Douglas County Fire District No. 2 will be flushing and maintaining fire hydrants throughout the district.  That area includes the communities of Dixonville, Green, Melrose, Winchester, Wilbur, Garden Valley, Umpqua, and unincorporated areas near the City of Roseburg. Testing will be conducted from 9:00 a.m. to 4:00 p.m. daily.  Water discoloration is possible throughout this process depending on how bad the sediment on the mains is and how long the hydrant must flow. A District No. 2 release said regardless of how it may appear, the water is still safe to drink.  Anyone with questions or seeking more information can call 673-5503 or go to www.dcfd.org"
"fire","2023-10-18","15:00:00","{""Derby"", ""Colorado"", ""UnitedStates""}","https://news.google.com/rss/articles/CBMiXmh0dHBzOi8vd3d3Lm5ocmVnaXN0ZXIuY29tL25ld3MvYXJ0aWNsZS9kZXJieS1ob3VzZS1maXJlLWhhd2tpbnMtc3RyZWV0LXJlZC1jcm9zcy0xODA5OTQzNC5waHDSAQA?oc=5&hl=en-US&gl=US&ceid=US:en","Tue 16 May 2023 02:15:00","DERBY — A fire in a multifamily home displaced four people Sunday night, according to local fire officials.  Firefighters responded to the 1 block of Hawkins Street around 10:10 p.m. Sunday for a report of a possible structure fire, Thomas Biggs, an assistant chief of the Derby Fire Department, said Monday night. Flames were showing from a third-floor window of the affected house when the first chief arrived on the scene, Biggs said.  In a Facebook post a little before 11:10 p.m. Sunday, fire officials asked people to avoid the area due to a ""structure fire,"" but didn't specify the location.  Crews searched the building for trapped victims as others extinguished the blaze, according to Biggs. Units operated for approximately one hour, Biggs said.  The cause of the fire is under investigation by the Derby fire marshal’s office, according to Biggs. No injuries were reported.  The American Red Cross identified the four displaced residents as two families consisting of three adults and a "
"fire","2023-05-20","Not Discerned","{""Turin"", ""Piemonte"", ""Italy""}","https://news.google.com/rss/articles/CBMiQGh0dHBzOi8vd3d3Lnd3bnl0di5jb20vMjAyMy8wNS8xNS9maXJlLWRlc3Ryb3lzLXRvd24tdHVyaW4taG9tZS_SAU9odHRwczovL3d3dy53d255dHYuY29tLzIwMjMvMDUvMTUvZmlyZS1kZXN0cm95cy10b3duLXR1cmluLWhvbWUvP291dHB1dFR5cGU9YW1w?oc=5&hl=en-US&gl=US&ceid=US:en","Mon 15 May 2023 17:16:00","TURIN, New York (WWNY) - A town of Turin home is a total loss following a fire on Saturday.  Lewis County dispatchers say the fire at 5819 Main Street, Glenfield, was called in by a neighbor shortly after 9 p.m.  Despite efforts, the home sustained significant fire damage to the south end of the building with smoke and water damage to the rest.  Two people were treated for smoke inhalation at the scene.  The family — two adults and three children — are being helped by the Red Cross.  The cause is believed to be electrical and is under investigation.  3G, Turin, and Martinsburg firefighters battled the blaze.  Copyright 2023 WWNY. All rights reserved."
"fire","2023-05-15","Not Discerned","{""SaintGeorge"", ""Utah"", ""UnitedStates""}","https://news.google.com/rss/articles/CBMieGh0dHBzOi8vd3d3LnN0Z2VvcmdldXRhaC5jb20vbmV3cy9hcmNoaXZlLzIwMjMvMDUvMTUvbWdrLWxpZ2h0aW5nLXN0cmlrZS1wb3NzaWJsZS1jYXVzZS1vZi1kb3dudG93bi1zdC1nZW9yZ2UtdHJlZS1maXJlL9IBAA?oc=5&hl=en-US&gl=US&ceid=US:en","Tue 16 May 2023 03:20:18","A fire smoldering inside an old mulberry tree in the backyard of a home on Main Street was quickly doused by firefighters once the fire was detected by neighbors, St. George, Utah. May 15, 2023 | Photo by Joseph Witham, St. George News  ST. GEORGE — A lightning strike is considered the likely cause of a fire typically seen in the wild rather than in the middle of downtown St. George.  The St. George Fire Department responded to the report of a fire Monday afternoon that had ignited the rotting inside of an old mulberry tree. The old tree is located in the backyard of a home at 333 N. Main Street and was quickly attacked and extinguished by firefighters.  The inside of the mulberry tree appeared to have been smoldering for a few days until part of the fire broke out and neighbors began to smell smoke, St. George Fire Chief Robert Stoker told St. George News.  “It looks like it’s been burning for a while,” he said, adding that he suspects a lightning strike as the cause of the smolderin"
"fire","2023-05-15","Not Discerned","{""CumruTownship"", ""Pennsylvania"", ""UnitedStates""}","https://news.google.com/rss/articles/CBMiPWh0dHBzOi8vbmV3cy55YWhvby5jb20vZmlyZS1raWxsZWQtMS1vbGQtYmVya3MtMDM1NDAwNjkxLmh0bWzSAUVodHRwczovL25ld3MueWFob28uY29tL2FtcGh0bWwvZmlyZS1raWxsZWQtMS1vbGQtYmVya3MtMDM1NDAwNjkxLmh0bWw?oc=5&hl=en-US&gl=US&ceid=US:en","Tue 16 May 2023 03:54:00","May 15—Fire investigators said they are confident the fire that claimed the life of a 1-year-old girl on the third floor of her Cumru Township residence started as a result of an electrical problem in an adjoining home.  The fire was discovered about 4:30 a.m. Saturday in the residence of a couple at 715 Philadelphia Ave., which is at one end of a row of four, three-story homes that rise close to the road near Mountain View Road, investigators said.  Cumru police Lt. George G. Kuriger Jr. said Trooper Janssen Herb, a state police fire marshal, will probably need a few weeks to finalize his report with his determination of the cause and classification of the fire. But all indications are that it is electrical and accidental in nature, Kuriger said.  Kuriger gave the following account:  The couple at 715 were awakened by smoke alarms and got out safely before firefighters arrived.  The occupants of the adjoining unit at 717 heard smoke alarms. The occupants included the father of the 1-"
"fire","2018-08-05","19:00:00","{""Augusta"", ""Georgia"", ""UnitedStates""}","https://news.google.com/rss/articles/CBMiXWh0dHBzOi8vd3d3LndyZHcuY29tLzIwMjMvMDUvMTUvZmlyZS12ZWhpY2xlLXJ1bnMtb3Zlci1ib2R5LWFmdGVybWF0aC1hdWd1c3RhLWRvdWJsZS1zbGF5aW5nL9IBbGh0dHBzOi8vd3d3LndyZHcuY29tLzIwMjMvMDUvMTUvZmlyZS12ZWhpY2xlLXJ1bnMtb3Zlci1ib2R5LWFmdGVybWF0aC1hdWd1c3RhLWRvdWJsZS1zbGF5aW5nLz9vdXRwdXRUeXBlPWFtcA?oc=5&hl=en-US&gl=US&ceid=US:en","Mon 15 May 2023 20:14:00","AUGUSTA, Ga. (WRDW/WAGT) - An Augusta Fire Department vehicle ran over a body on the scene of a weekend shooting that left two dead and four others injured Saturday evening.  The body of Germayne Farrell, 51, of Daytona Beach, Fla., was dragged 51 feet and 10 inches by the 2008 red Ford Expedition, according to a traffic report from the Richmond County Sheriff’s Office.  Sheriff Richard Roundtree discussed the incident during a news conference Monday about the double homicide . Roundtree noted that victims were pronounced dead before the “freak accident.”  A video of the incident is circulating on Facebook after a shoot-out at Outcast motorcycle club that left two people dead.  Officials say while responding to the scene of the intersections of Ellis Street, Prep Phillips Drive, and Sand Bar Ferry Road; the driver was leaving to go to East Boundary at Broad for other injuries. He was traveling north from Ellis Street, crossing through the parking lot of Prep Phillips Drive, when he di"
"fire","2023-05-15","Not Discerned","{""Lafayette"", ""Colorado"", ""UnitedStates""}","https://news.google.com/rss/articles/CBMiWmh0dHBzOi8vd3d3Lm94Zm9yZGVhZ2xlLmNvbS8yMDIzLzA1LzE1L2ZpcmUtZGVwYXJ0bWVudC1yZXNwb25kLXRvLWZpcmUtYXQtdW5vY2N1cGllZC1ob21lL9IBAA?oc=5&hl=en-US&gl=US&ceid=US:en","Mon 15 May 2023 19:27:48","Fire Department respond to fire at unoccupied home Published 2:25 pm Monday, May 15, 2023  Lafayette County 911 received a call on Sunday at 3:50 p.m. reporting a structure on fire at 425 A Hwy 6 East. Lafayette County Fire Department responded immediately, arriving at 3:53 p.m. to find an unoccupied house on fire.  Fire department found 100% of the structure on fire when they arrived and took a defensive tactic to prevent the fire from spreading. The unit remained on the scene until 6:45 p.m."
"fire","2023-10-01","22:00:00","{""Danville"", ""California"", ""UnitedStates""}","https://news.google.com/rss/articles/CBMihgFodHRwczovL3d3dy5yZWRjcm9zcy5vcmcvbG9jYWwvaWxsaW5vaXMvYWJvdXQtdXMvbmV3cy1hbmQtZXZlbnRzL2NpbC11cGRhdGUtLXJlZC1jcm9zcy12b2x1bnRlZXJzLWFzc2lzdGVkLTI1LXBlb3BsZS1pbXBhY3RlZC1ieS0uaHRtbNIBAA?oc=5&hl=en-US&gl=US&ceid=US:en","Mon 15 May 2023 18:50:47","Red Cross volunteers responded to six home fires Danville, Sheldon, Peoria, North Pekin, and Gibson City in the past week.    Red Cross Disaster Action Team volunteers provided assistance to 25 people by supplying them with items to meet immediate needs after a fire, and additional support in the form of health and mental health services and one-on-one support as the families involved work through next steps after experiencing a home fire.    If you or someone you know needs assistance after a home fire or local disaster, please call our dispatch line: (800) Red Cross (800-733-2767).    Home fires are our country’s most frequent disaster and claim seven lives every day in the U.S. To help protect your household, test your smoke alarms each month and practice your escape plan until everyone can get out in less than two minutes.    Visit redcross.org/fire for more information. Download our free Emergency app by searching for “American Red Cross” in app stores. Free resources are availab"
"fire","2023-05-21","Not Discerned","Not Discerned","https://news.google.com/rss/articles/CBMiWGh0dHBzOi8va3BxLmNvbS9maXJlLWF0LXRoYWktcmVzdGF1cmFudC1saWtlbHktY2F1c2VkLWJ5LXR3by1kcnVuay1lbXBsb3llZXMtcG9saWNlLXNheS_SAQA?oc=5&hl=en-US&gl=US&ceid=US:en","Mon 15 May 2023 17:50:39","Police say a fire inside a restaurant in Wenatchee early Sunday was likely caused by two intoxicated employees.  The blaze occurred in the kitchen area of The Thai on North Mission Street just before 1 a.m.  Wenatchee Police Department Capt. Edgar Reinfeld says officers had to rescue both men as the fire raged, including the need to physically carry one of them from the building.  ""Officers arrived and immediately found one male just inside the building. Then, they discovered there was a second man in the structure and got them both out safely. Through an investigation it was learned that these two were cooking inside the restaurant after hours and that both were intoxicated while doing so.""  Police say the restaurant's owners told officers the pair were not authorized to be inside the restaurant, which was closed at the time of the fire.  Reinfeld says the employee's actions caused the fire but its exact source is still under investigation and that charges against the men are unlikel"
"fire","2023-05-15","12:10:00","{""Mecca"", ""Mecca"", ""SaudiArabia""}","https://news.google.com/rss/articles/CBMicmh0dHBzOi8vd3d3LmNic25ld3MuY29tL2xvc2FuZ2VsZXMvbmV3cy9maXJlZmlnaHRlcnMtYmF0dGxlLXNwcmVhZGluZy01MC1hY3JlLWZpcmUtaW4tbWVjY2Etcm9hZC1jbG9zdXJlLWV4dGVuZGVkL9IBdmh0dHBzOi8vd3d3LmNic25ld3MuY29tL2FtcC9sb3NhbmdlbGVzL25ld3MvZmlyZWZpZ2h0ZXJzLWJhdHRsZS1zcHJlYWRpbmctNTAtYWNyZS1maXJlLWluLW1lY2NhLXJvYWQtY2xvc3VyZS1leHRlbmRlZC8?oc=5&hl=en-US&gl=US&ceid=US:en","Mon 15 May 2023 22:31:26","A vegetation fire burning in the Mecca has jumped to 127 acres and is now 50% contained as of 10 a.m. on Tuesday.  Crews responded near Avenue 66 and Highway 86 Expressway around noon on Monday to a well-established vegetation fire, according to the Riverside County Fire Department.  The blaze was between three and five acres shortly after breaking out and posed a threat to nearby power lines, a department official said. Imperial Irrigation District personnel responded to the scene to assist.  By 2:45 p.m., the fire had grown to 50 acres and department officials said it had the potential of spreading to 200 acres.  ""Firefighting operations (are) being hampered by winds,"" the fire department said. Firefighters from the Palm Springs, Hemet, Riverside and Cathedral City departments assisted in the effort.  Additional engines were requested to the scene by 4:50 p.m. Monday as the fire grew to 110 acres. By Monday night it had grown to 127 acres and was 15% contained.  ""Firefighters worked"
"fire","2023-07-01","14:15:00","{""Brooklyn"", ""Ohio"", ""UnitedStates""}","https://news.google.com/rss/articles/CBMiXmh0dHBzOi8vd3d3Lm5iY25ld3lvcmsuY29tL25ld3MvbG9jYWwvYnJvb2tseW4tcGFya2luZy1nYXJhZ2UtZmlyZS1kZXZvdXJzLTgtdmVoaWNsZXMvNDMzNDQ0My_SAWRodHRwczovL3d3dy5uYmNuZXd5b3JrLmNvbS9uZXdzL2xvY2FsL2Jyb29rbHluLXBhcmtpbmctZ2FyYWdlLWZpcmUtZGV2b3Vycy04LXZlaGljbGVzLzQzMzQ0NDMvP2FtcD0x?oc=5&hl=en-US&gl=US&ceid=US:en","Mon 15 May 2023 17:11:42","More than a half-dozen vehicles were believed destroyed in a fire that overtook a parking garage in Brooklyn early Monday, authorities say.  Fire officials say they got the call about eight cars ablaze on the top floor of a two-story East New York parking garage just after 2:15 a.m. The fire was out within about 90 minutes.  No injuries were immediately reported.  Video posted to the Citizen app showed intense flames.  Get Tri-state area news and weather forecasts to your inbox. Sign up for NBC New York newsletters.  The cause of the fire is under investigation."
"fire","2023-05-20","Not Discerned","Not Discerned","https://news.google.com/rss/articles/CBMiQGh0dHBzOi8vd3d3Lm5iYzExbmV3cy5jb20vMjAyMy8wNS8xNS9namZkLXJlc3BvbmRzLWZpcmUtc3VwZXItOC_SAU9odHRwczovL3d3dy5uYmMxMW5ld3MuY29tLzIwMjMvMDUvMTUvZ2pmZC1yZXNwb25kcy1maXJlLXN1cGVyLTgvP291dHB1dFR5cGU9YW1w?oc=5&hl=en-US&gl=US&ceid=US:en","Mon 15 May 2023 22:40:00","GRAND JUNCTION, Colo. (KKCO) - On Saturday, Grand Junction Fire Department responded to a commercial structure fire at the Super 8 hotel at 728 horizon drive at 3:38 a.m.  Arriving fire crews found an active fire in the laundry room and extinguished the flames before they spread to other parts of the hotel.  Firefighters searched the building to ensure all guests and staff were evacuated and to verify the fire had not spread.  There are no known injuries. The origin and cause of the fire are under investigation.  Copyright 2023 KKCO. All rights reserved."
"fire","2017-11-02","22:00:00","{""Austin"", ""Texas"", ""UnitedStates""}","https://news.google.com/rss/articles/CBMiYWh0dHBzOi8vcm9iYnJlcG9ydC5jb20vZm9vZC1kcmluay9kaW5pbmcvZnJhbmtsaW4tYmJxLWZpcmUtbWFuYWdlbWVudC1zbW9raW5nLWJyaXNrZXQtMTIzNDg0MzQxMS_SAWVodHRwczovL3JvYmJyZXBvcnQuY29tL2Zvb2QtZHJpbmsvZGluaW5nL2ZyYW5rbGluLWJicS1maXJlLW1hbmFnZW1lbnQtc21va2luZy1icmlza2V0LTEyMzQ4NDM0MTEvYW1wLw?oc=5&hl=en-US&gl=US&ceid=US:en","Mon 15 May 2023 13:00:00","Your parents may have told you not to play with fire, but Aaron Franklin is here to encourage it.  The pitmaster behind Austin’s beloved Franklin Barbecue has long been willing to share his secrets to better brisket, as evidenced by his 213-page manifesto on the subject of making excellent barbecue. Now he’s released a video about how to effectively build and maintain a fire.  Since he started his eponymous Austin spot with his wife, Stacy, in 2009, Franklin has become meticulous about every step of the barbecue process, to the point where he’s fabricating his own pits. That means people are always asking him for advice how they can smoke their own meats too. Franklin says that when people do approach him, their questions most frequently focus on fire. Of course, there’s no one set procedure for getting this right, because as Franklin says, “a fire is a living, breathing thing.” But there are some best practices.  The key is to make sure you have a consistent bed of coals, and that wi"
"fire","2023-05-22","Not Discerned","{""Weathersfield"", ""Vermont"", ""UnitedStates""}","https://news.google.com/rss/articles/CBMiVmh0dHBzOi8vd3d3LnRyaWJ0b2RheS5jb20vbmV3cy9sb2NhbC1uZXdzLzIwMjMvMDUvbm8taW5qdXJpZXMtaW4tbW9ybmluZy10cmFpbGVyLWZpcmUv0gEA?oc=5&hl=en-US&gl=US&ceid=US:en","Tue 16 May 2023 04:05:08","WEATHERSFIELD — The state fire marshal’s office has been called to determine the cause of an early Monday mobile home fire in Weathersfield.  The Weathersfield Fire Department arrived about 3:30 a.m. to the blaze in the 3000 block of Judyth Street. After the fire was extinguished, crews began salvage work and did an overhaul of the scene to ensure no hotspots remained.  No injuries were reported.  Mutual aid was provided by Howland and Lordstown fire departments. Weathersfield police and Trumbull County 911 also provided assistance on the call."
"fire","2023-05-22","Not Discerned","{""Center"", ""Colorado"", ""UnitedStates""}","https://news.google.com/rss/articles/CBMiYWh0dHBzOi8vd3d3LmlucXVpcmVyLmNvbS9uZXdzL2NlbnRlci1jaXR5LWZpcmUtMTJ0aC1hbmQtc2Fuc29tLXN0cmVldHMtcGhpbGFkZWxwaGlhLTIwMjMwNTE1Lmh0bWzSAXBodHRwczovL3d3dy5pbnF1aXJlci5jb20vbmV3cy9jZW50ZXItY2l0eS1maXJlLTEydGgtYW5kLXNhbnNvbS1zdHJlZXRzLXBoaWxhZGVscGhpYS0yMDIzMDUxNS5odG1sP291dHB1dFR5cGU9YW1w?oc=5&hl=en-US&gl=US&ceid=US:en","Mon 15 May 2023 17:24:23","The Philadelphia Fire Department at work on a fire at 12th and Sansom Streets on Monday. Read more  About 100 members of the Philadelphia Fire Department rushed to 12th and Sansom Streets Monday afternoon in response to a fire on a high rise roof.  A fire department spokesperson said the involved insulation, roofing materials, and propane tanks. No injuries were reported.  Dark plumes of smoke wafted over Center City around 12:45 p.m., prompting several social media posts. One user who captured video of the smoke from below said there were also “several loud explosions.”  Shortly after 1 p.m., the fire department announced on social media that it had placed the blaze under control. A fire department spokesperson said it took about 30 minutes to do so.  The cause and origin of the fire are being investigated by the Fire Marshal’s Office."
"fire","2019-07-08","Not Discerned","{""Providence"", ""RhodeIsland"", ""UnitedStates""}","https://news.google.com/rss/articles/CBMidmh0dHBzOi8vd3d3LndwcmkuY29tL25ld3MvbG9jYWwtbmV3cy9wcm92aWRlbmNlL25ld2VzdC1tb3N0LWV4cGVuc2l2ZS1wcm92aWRlbmNlLWZpcmUtdHJ1Y2stZGFtYWdlZC1kdXJpbmctaG91c2UtZmlyZS_SAXpodHRwczovL3d3dy53cHJpLmNvbS9uZXdzL2xvY2FsLW5ld3MvcHJvdmlkZW5jZS9uZXdlc3QtbW9zdC1leHBlbnNpdmUtcHJvdmlkZW5jZS1maXJlLXRydWNrLWRhbWFnZWQtZHVyaW5nLWhvdXNlLWZpcmUvYW1wLw?oc=5&hl=en-US&gl=US&ceid=US:en","Mon 15 May 2023 22:35:51","PROVIDENCE, R.I. (WPRI) — The newest and most expensive truck in the Providence Fire Department’s fleet is out of service after a partial roof collapse caused significant damage.  The city’s fire chief says Tower Ladder One is primarily used for its 100-foot extendable ladder and bucket.  Crews responded Saturday afternoon to a fire at a three-story, multi-family home on Stanwood Street. They used Tower Ladder One to reach a third-story window and search for people inside.  Once it was in place, a portion of the burning roof fell onto the truck’s bucket.  “When it was extended in the air, that roof came down into the bucket and effectively turned the inside of this bucket into a fire pit,” Chief Derek Silva told 12 News.  The interior of the bucket was burned and its cables and controls melted, according to Silva.  Photo credit: Scott Marcinko (Shield Photography)  Crews attempted to extinguish the fire inside the bucket, but were then ordered to evacuate the home. The firefighters wh"
"fire","2023-07-01","23:00:00","{""Montclair"", ""California"", ""UnitedStates""}","https://news.google.com/rss/articles/CBMiYGh0dHBzOi8vYmFyaXN0YW5ldC5jb20vMjAyMy8wNS9sYXdzdWl0LXB1dHMtbW9udGNsYWlyLWZpcmUtZGVwdC1hbmQtZmlyZS1ob3VzZS0zLXVuZGVyLXNjcnV0aW55L9IBAA?oc=5&hl=en-US&gl=US&ceid=US:en","Tue 16 May 2023 01:38:26","UPDATE: John Fierro, president of Montclair Firefighters Mutual Benevolent Association Local 20, refutes claims made about the Montclair Fire Department equipment and conditions at Fire House #3.  Montclair, NJ – Residents who challenged the fire services deal with Glen Ridge are now calling on Montclair’s Town Council to look more closely at the Fire Department expenses as well as Chief Hermann’s most recent budget request for 13 more firefighters.  “I find the lack of responsiveness and detailed information from the Fire Dept. to be a reason to not support any requests for additional staff or funding,” said Councilor Bob Russo in an email. “I have never seen this arrogance from any Dept. heads in 23 years on the Council. I continue to support the Fire union leaders, but not the requests for 14 additional staff by the Chief. What are these numbers based upon? How can we not spend money on the essential communications equipment, but allow the purchase of non-essential items for some o"
"fire","2023-05-22","15:00:00","{""ColonialHeights"", ""Virginia"", ""UnitedStates""}","https://news.google.com/rss/articles/CBMif2h0dHBzOi8vd3d3LnByb2dyZXNzLWluZGV4LmNvbS9zdG9yeS9uZXdzL2ZpcmUvMjAyMy8wNS8xNS93b21hbi10d28tc21hbGwta2lkcy1odXJ0LWluLWNvbG9uaWFsLWhlaWdodHMtaG91c2UtZmlyZS83MDIyMTMwNDAwNy_SAQA?oc=5&hl=en-US&gl=US&ceid=US:en","Tue 16 May 2023 00:52:00","COLONIAL HEIGHTS – A great-grandmother and two of her great-grandchildren are in critical condition at a Richmond hospital after they were injured in an afternoon house fire Monday near Colonial Heights High School.  The victim’s granddaughter identified her as Sharon Davis, 72, who has lived in the 1100 block of Covington Road for many years and is well-known to many of her neighbors for looking after children and walking wherever she needed to go, including the grocery store. Destiny Davis, who was raised by her grandmother, said she got a message from one of her cousins about the fire, which started around 3:50 p.m.  All the children inside the house were under 5 years old.  “I don’t think anybody knows, not even the fire department can tell us what happened yet,” Davis said.  Fire Chief Wayne Hoover confirmed that investigators still are unsure about the cause. The initial call indicated that children were trapped inside the house.  “Our first arriving units immediately went into "
"fire","2023-05-15","10:00:00","{""Orlando"", ""Florida"", ""UnitedStates""}","https://news.google.com/rss/articles/CBMiQGh0dHBzOi8vd3d3Lndlc2guY29tL2FydGljbGUvcmVkbWFuLXN0cmVldC1vcmxhbmRvLWZpcmUvNDM4OTMzNTnSAURodHRwczovL3d3dy53ZXNoLmNvbS9hbXAvYXJ0aWNsZS9yZWRtYW4tc3RyZWV0LW9ybGFuZG8tZmlyZS80Mzg5MzM1OQ?oc=5&hl=en-US&gl=US&ceid=US:en","Tue 16 May 2023 01:55:00","Two families have been displaced after an electrical fire at an apartment complex in Orlando Monday morning.It happened around 10 a.m. at the Beverly at Lake Side apartment complex in Orlando off the Orange Blossom Trail. The fire was discovered in a most unusual way.Inside Tyler Henson’s apartment, the bathroom is a collection of charred rubble. ""If I wasn't home, my place would be gone,” Henson said. Henson said he woke up Monday morning to the smell of smoke–the kind you smell when plastic is on fire. He ran to his bathroom and discovered the smell was his toilet on fire. ""And there was debris that was coming down, glowing embers coming down and it melted a hole in it,” Henson said. Every apartment in that building was evacuated at the Beverly at Lake Side. Angelia Eugene grabbed her baby and ran. ""I was scared. I started crying,” Eugene said.Orange County Fire Rescue says they believe the cause of the fire was an electrical issue between two bathrooms. One person was taken to the "
