"topic","date"," time","place","url","date published","article text"
"game","2023-05-15","19:00:00","{""Toronto"", ""Ontario"", ""Canada""}","https://news.google.com/rss/articles/CBMiSGh0dHBzOi8vd3d3LmFtZXJrcy5jb20vbmV3cy9kZXRhaWwvYW1lcmtzLW1haW50YWluLWZvY3VzLWFoZWFkLW9mLWdhbWUtM9IBAA?oc=5&hl=en-US&gl=US&ceid=US:en","Tue 16 May 2023 21:33:51","AMERKS MAINTAIN FOCUS AHEAD OF GAME 3  When the Amerks returned to Rochester in Round 2, they were trailing the series by two games. Now, as the Amerks return to Rochester in Round 3, they’re leading the series by two games. While the situations are in stark opposition, the focus is still the exact same.  Just win one game.  That’s been the message from the coaching staff — and from the leadership group in the locker room — for the last five games. As the Amerks faced elimination in three-straight games, the mindset stayed the same: just win one game. And the Amerks did.  They won one game.  And then they won one game, again.  And then they won one game to advance to the North Division finals.  Tomorrow, in front of the home crowd, the Amerks will try to win one game. And they’ll try to eliminate the Marlies from the Calder Cup Playoffs as they do so. It won’t be an easy task against the top-seeded Toronto team, even with a 2-0 series lead.  “Our guys know how hard it is to end someone’s season,” Amerks head coach Seth Appert said after practice on Tuesday. “We have a tremendous amount of respect for Toronto, but our focus is just preparing to just win a game.”  The preparation for the game comes in having good habits at practice, it comes in productive video sessions, and it comes with rest, too. “What can we do today, on a Tuesday, to get ready, to put ourselves mentally and physically in the best position to win one game,” Appert said.  There have been adjustments since the two games in Toronto, aimed at finding ways to exploit Toronto’s weak spots and take away their strengths. There have also been adjustments made to the Amerks’ game, and a focus on tweaking the penalty kill.  Before assessing the PK, though, Appert made sure to give credit to Toronto, who had the second-best power play in the league throughout the regular season. “At the end of the day, it’s really important you stay out of the box,” he explained. “You can kill off two or three, but if you’re giving them four, five, or six, usually a good power play like Toronto is going to get you.”  Rochester is also seeing a good power play during the playoffs so far. The Amerks’ unit ranks second in the league, converting on 34.6% of power plays in seven games. Rookie Jiri Kulich has scored four of his five postseason goals on the power play.  Jiri Kulich has scored a goal in every playoff game he’s played in…    The rookie is HOT 🔥 pic.twitter.com/anldTns8GR — x-Rochester Americans (@AmerksHockey) May 13, 2023  In fact, he has a goal in every playoff game he’s suited up for. Kulich’s 5-game goal streak matches the longest in an AHL postseason since Peter Holland for Toronto in 2014.  “We’re all extremely impressed with Jiri,” Appert said. “I think that it’s just a biproduct of the work he’s been putting in, especially in the second half of the season.""  ""His habits, the maturity to his game, competing for the puck, those things started to take off at a high level and his offensive numbers went with it.”  Kulich led the Rochester squad with 24 goals, and 17 of those came in the second-half of the season. His nine power play goals were also best on the team. “A player of his caliber, when you have the puck, good things can happen,” Appert said.  The Amerks are hoping for a few good things tomorrow night, but one thing is certain: the crowd is going to be electric. Wednesday night’s game is very quickly approaching a sellout, with over 9,500 tickets out.  The team is excited to play in front of the rowdy home crowd and to use the home ice to their advantage. “I thought in the Syracuse series, we did a great job of bringing the fans into the fight,” Appert said. Big hits, fights, and early goals: “Those are things that really get a crowd going. Let’s make sure we do those things early and often.”  And just win one game.  Only a handful of tickets remain for Game 3 at Blue Cross Arena on Wednesday night. The first 5,000 fans will receive a red Round 3 rally towel, and fans can enjoy Pregame Happy Hour, presented by the Genesee Brewery: get $2 beers until puck drop at the Genesee Brewhouse inside Blue Cross Arena.  Fans can also get the playoff party started early at the Genesee Brewhouse: Sabres Live will be broadcasting live from 12-1pm and then Marty & Duffer will be hanging out until 2pm! They'll have Amerks x Genny t-shirts to give away... and maybe a pair of tickets, too."
"game","2023-05-25","Not Discerned","{""Graz"", ""Styria"", ""Austria""}","https://news.google.com/rss/articles/CBMiN2h0dHBzOi8vdGVhbXVzYS51c2Fob2NrZXkuY29tL25ld3NfYXJ0aWNsZS9zaG93LzEyNzMyNzLSAQA?oc=5&hl=en-US&gl=US&ceid=US:en","Wed 17 May 2023 00:55:00","The U.S. has wins over host Finland, Hungary and Germany to its credit to date. Team USA is seeking to be just the fifth team in U.S. history to win its first four games of the world championship. All four teams that have done it previously have earned a medal in the event.  Austria, who played this afternoon and dropped a 6-2 decision to Denmark, is winless in its first three outings but does have one point in the standings from its overtime loss to France this past Saturday (May 13).  The U.S. and Austria will play for the 15th time ever in the world championship with the U.S. having won 12 times. In their last meeting, Luke Hughes scored 3:07 into overtime from Sean Farrell to lift the U.S. to a 3-2 come-from-behind victory in preliminary round play of the 2022 IIHF Men’s World Championship. Team USA outshot Austria, 39-16, but had to rally from a 2-0 second-period deficit.  U.S. head coach David Quinn has two new players available in defenseman Tyler Kleven and forward Patrick Brown. Kleven played his third college season at the University of North Dakota this year and signed with the Ottawa Senators after the season where he played eight games. Brown, who is a Boston College graduate, has spent parts of eight seasons in the NHL and this year finished his season with Ottawa after starting the year with Philadelphia.  Through three games, Team USA currently sits atop the eight-team Group B with nine points, while Denmark and Sweden are next, each with eight points. The top four teams in each of the two eight-team groups advance to the quarterfinals, which will be played on May 25."
"game","2023-05-11","Not Discerned","Not Discerned","https://news.google.com/rss/articles/CBMiUmh0dHBzOi8vd3d3LnBjZ2FtZXIuY29tL25mdC1jb2NrZmlnaHRpbmctZ2FtZS1jYW5uZWQtYnV0LXdpbGwtYnV5LWJhY2steW91ci1jb2Nrcy_SAQA?oc=5&hl=en-US&gl=US&ceid=US:en","Tue 16 May 2023 18:52:16","An NFT-based cockfighting game that's been in development for a year has been unceremoniously canned ( thanks, Kotaku (opens in new tab)). Or in the words of its developers Irreverent Labs, entered ""indefinite hibernation"". The game would have starred 'mechabots': Robotic chickens that were being sold as NFTs to verify each chicken's uniqueness. It was intended as a so-called ""play-to-earn"" game where players would level the chickens and theoretically sell them on at a higher price. I'm not making this up.  This hype video shows (opens in new tab) the production values weren't too bad, though as soon as the fighting starts it's pretty clear this wouldn't have been a good game. But then the game's cancellation is probably the least bizarre thing about this whole story. The studio behind the game has one of the most irritating websites I've ever used (opens in new tab) and has pivoted away from NFTs onto a new area of focus: AI. That may seem like swapping one grift for another, but it's even more astonishing in the light of the fact it raised $40 million in private funding to make MechaFightClub (opens in new tab), disclosed in an SEC filing.  At least some of the cash still remains. The one silver lining for fans of MechaFightClub (presuming there are any) is that Irrereverent Labs announced the cancellation alongside a buyback program called, and again I'm not making this up, Sol 4 Cocks.  It’s time for Sol 4 Cocks: we’re repurchasing your Mechabots and putting MFC into indefinite hibernation. This was a tough decision. For more details, visit our official announcement here: https://t.co/TPfb1VP2C7 pic.twitter.com/6YnO4g50T4May 11, 2023 See more  Sol refers to the popular cryptocurrency Solana, which is currently trading at around $21 per unit. So the buyback offer values each robot chicken at $378. Look, I just work here.  Irreverent Labs' official statement on what's happened reads as equal parts misleading and delusional (opens in new tab). It also says absolutely everything about this corner of the industry that the first two pages (of four) are dedicated to the risk of scams around Sol 4 Cocks, before going on to moan about those pesky regulators and how they made the NFT cockfighting dream impossible.  ""The theme, culture, art, story and underpinning goals of MFC remain with us, but we can’t continue to develop it as a blockchain game,"" says Irreverent Labs. ""Unfortunately, the regulatory and operations environment around blockchain within the USA has drastically changed in the last two years.  ""We are an American company, and a lack of clarity is making it difficult for blockchain companies to operate here. In the current regulatory confusion, we simply couldn’t create an in-game economy without concern about the regulatory ramifications. We have no way to know how long this will continue, or when it will get better. We simply can’t ask you to wait any longer.""  It's not that the bottom is falling out of the crypto market or people have completely lost whatever confidence there ever was in NFTs, then. It's the government! It does make you wonder where that $40 million came from, and how much more money is sloshing around in lunatic projects like this: Probably more than one would like to imagine. At least, in this case, it didn't end up in a total rug-pull."
"game","2023-05-12","Not Discerned","Not Discerned","https://news.google.com/rss/articles/CBMiXmh0dHBzOi8vd3d3LmxpZmV3aXJlLmNvbS95ZXMtemVsZGEtdGVhcnMtb2YtdGhlLWtpbmdkb20tcHJvYmFibHktaXMtdGhlLWJlc3QtZ2FtZS1ldmVyLTc0OTg2NTbSAQA?oc=5&hl=en-US&gl=US&ceid=US:en","Tue 16 May 2023 13:37:00","The Legend of Zelda: Tears of the Kingdom is the sequel to 2017's Breath of the Wild.  It's so inviting that even non-gamers should try it.  The new Ultrahand tool is leading to some unexpectedly weird player behavior.  Nintendo  Nintendo's The Legend of Zelda: Tears of the Kingdom (TotK) might not technically be the best game ever made—how would you even measure that anyway, between this and Tetris? But it is already becoming a cultural phenomenon.  The new Zelda (for Switch) came out last Friday, and many of us have been unable to stop playing it ever since. It's the latest in a long line of Zelda games, and a direct sequel to 2017's 'Breath of the Wild', sharing the same game map, control system, and overall art style. Breath of the Wild was already regarded as (another one of) Nintendo's masterpieces, and yet the consensus is that Tears of the Kingdome improves on the original in almost every way.  ""I personally think even this early on, it is by far the best Legend Of Zelda game by a long shot. Is it the best game ever made, however? Honestly, I can’t really say yet,"" Mark Cruz, proprietor of the retro-gaming YouTube channel The Retro Mark Cruz, told Lifewire via email.  Do Literally Anything in 'Tears of the Kingdom'  I grew up playing video games that you loaded into a computer from a tape, and I always dreamed of a game where you could wander the world and interact with pretty much anything. In Zelda, that's exactly what you can do. In fact, you could pretty much make up your own game within a game, building a house, keeping a horse, and foraging for dinner every day. But that's getting ahead of ourselves.  Everything in Tears of the Kingdom has been upgraded. The basic contours of the world are the same, but the world itself has grown and changed. New characters join existing ones, and of course, there are new missions to complete. The world has also expanded up into a shoal of Sky Islands and down into underground cave systems. The visuals are better, the character dialog improved, and the world feels more populated and real.  But the biggest change, and the one that takes this game over the edge, compared to any other game, and will turn Zelda from a game into a meme machine, is the Ultrahand.  TotK Ultrahand and Korok Torture  The Ultrahand is an update to BotW's Magnesis, a special power that lets you use a magnetic beam to lift and toss around metallic objects of any size. The Ultrahand extends this ability to pretty much everything around you. Use the beam to lift, turn, and otherwise manipulate fallen tree trunks, apples, swords, boats, and more. And here's the neat part. You can use the Ultrahand to glue things together.  Nintendo  The Ultrahand is essential to completing some puzzles, and you can use it to do practical things like sticking wheels to an old wooden board and attaching a fan to make a car or repairing broken machinery.  But the possibilities are endless. I built a wooden screen on wheels that I rolled past a huge creature sleeping on a bridge, so it wouldn't see me behind it. And other players have gotten a little darker with their creations. One created a giant phallus from a tree trunk and a pair of rocks and used it to beat a creature to death. Another popular pastime, apparently, is torturing Koroks.  Koroks are cute little woodland creatures, and in Tears of the Kingdom, one diversion has you reuniting separated Koroks. Usually, this involves the Ultrahand, which can grab Koroks because they are wearing backpacks. And players are torturing them, crucifying them, tying them up and dragging them behind horses, cooking them on automatic (player-built) rotisseries, and attaching them to rockets.  It's grim stuff, but it shows the creativity possible inside the game. You could literally build a hut by a lake, go fishing, and start obsessively counting things, like in Henry David Thoreau's Walden. In some ways, it's like a basic version of Minecraft, set inside an existing game world. Although given that one person has recreated 'Breath of the Wild' in Minecraft, it seems that Minecraft will still have the edge.  Nintendo  ""My daughter is mostly about taming all kinds of horses. She also finds out glitches to lead her horse into deep water and stuff,"" said Zelda player and parent Dr. K in a forum thread participated in by Lifewire.  Even if you're not into building things for the sake of building them, this single new dynamic totally changes how you inhabit the world in Tears of the Kingdom. Now, if you'll excuse me, I have some shelves to put up."
"game","2023-10-19","Not Discerned","Not Discerned","https://news.google.com/rss/articles/CBMia2h0dHBzOi8vdmFyaWV0eS5jb20vMjAyMy9maWxtL3RyYWlsZXJzL2ZpdmUtbmlnaHRzLWF0LWZyZWRkeXMtdHJhaWxlci1ibHVtaG91c2Utam9zaC1odXRjaGVyc29uLTEyMzUzMTgxMzMv0gFvaHR0cHM6Ly92YXJpZXR5LmNvbS8yMDIzL2ZpbG0vdHJhaWxlcnMvZml2ZS1uaWdodHMtYXQtZnJlZGR5cy10cmFpbGVyLWJsdW1ob3VzZS1qb3NoLWh1dGNoZXJzb24tMTIzNTMxODEzMy9hbXAv?oc=5&hl=en-US&gl=US&ceid=US:en","Wed 17 May 2023 02:09:00","After first being announced in 2015, the “Five Nights at Freddy’s” movie is finally pulling back the curtain. Universal has released the first teaser for the Blumhouse horror film, giving viewers their first look at how the popular survival horror video game’s terrifying animatronics will be brought to life.  “Five Nights at Freddy’s” is based on the video game franchise created by Scott Cawthon, which released its first entry in 2014 and quickly rocketed to massive popularity. Throughout the different games, players are tasked with surviving the onslaught of hostile animatronic characters inside the haunted Freddy Fazbear’s Pizza restaurant, using security cameras, lights and doors to survey the area.  The new teaser reveals how those game mechanics have been incorporated into the adaptation, with film starring Josh Hutcherson as a hapless security guard.  Cawthon first announced the film adaptation in 2015 to much excitement from fans. But from there, it was a rocky road. Warner Bros. acquired the rights, but, after two years of silence, Cawthon announced that the project was “back to square one.” After losing a series of directors, Jason Blum announced he would be adapting the project through his Blumhouse production company in 2017.  Earlier this year, Universal announced that “Five Nights at Freddy’s” would debut on the streaming service Peacock on the same day of its theatrical release, replicating the day-and-date release strategy by other high-profile Blumhouse productions such as “Halloween Kills” and “Halloween Ends”  Directed by Emma Tammi, “Five Nights at Freddy’s” also stars Elizabeth Lail, Piper Rubio, Kat Conner Sterling, Mary Stuart Masterson and Matthew Lillard, as well as animatronic designs and technology by Jim Henson’s Creature Shop.  Watch the teaser for the film below."
"game","2023-05-16","Not Discerned","{""Rudyard"", ""Montana"", ""UnitedStates""}","https://news.google.com/rss/articles/CBMifWh0dHBzOi8vd3d3LnBldG9za2V5bmV3cy5jb20vc3Rvcnkvc3BvcnRzLzIwMjMvMDUvMTYvbm9ydGhtZW4tZWFybi1hbm90aGVyLXNwbGl0LWxlYW4tb24tZmVycmlucy1nZW0taW4tZ2FtZS10d28vNzAyMjYwMDcwMDcv0gEA?oc=5&hl=en-US&gl=US&ceid=US:en","Wed 17 May 2023 02:20:41","PETOSKEY — You win some, you lose some.  That’s how it goes from game to game and season to season.  Whether they like it or not, that’s also been especially true for the Petoskey baseball team this season.  Splits have been a common occurrence for the Northmen throughout the year and it’s been reflected honestly in their 2023 record.  When they welcomed in Alpena for a Big North Conference doubleheader Tuesday at Turcott Field, another split came their way.  The Northmen dropped a 2-1 opener, then leaned on the pitching of senior Max Ferrin to collect a 3-0 victory in game two.  The split moved Petoskey to 11-11 overall and 4-4 within the Big North, with one matchup vs. TC West left on the schedule.  While they've collected 11 losses on the season, the margin for error has been razor thin for Petoskey. They've dropped eight of those 11 games by a single run, including three of their last four and three of their four BNC defeats have come by a lone run.  In the opener Tuesday, both sides found opportunities on the base paths, though runs were tougher to come by.  Grant Slater went seven innings with seven hits and no walks allowed, while striking out six batters.  Both teams plated a run in the sixth, before Alpena then put one on unanswered in the seventh.  Slater also singled twice and Peyton Harmon also added a single for the Northmen. Tyler Goeldel also had an RBI.  In game two, Petoskey spread runs across the first, third and sixth innings and that was plenty for what Ferrin was dealing to the dish.  The senior went all seven innings with one hit and no walks allowed, while also striking out six.  Ferrin allowed a first inning double to the Wildcats, then didn’t allow an Alpena base runner over the next six innings, as the Wildcats went three up, three down the rest of the way.  It dropped Ferrin’s season ERA to 2.10, with 41 strikeouts across 33 and a third.  Petoskey’s run production came behind just four hits, with Ferrin, Harmon, Haden Janes and Kam Horn all singling on.  The Northmen hit a busy stretch ahead to try to pull away from the .500 mark, as they head to Rudyard on Wednesday, May 17, then down to Bay City Western on Saturday, May 20.  They’ll also wrap up BNC play with a visit from Traverse City West on Monday, May 22."
"game","2023-10-01","19:00:00","{""Springfield"", ""Missouri"", ""UnitedStates""}","https://news.google.com/rss/articles/CBMihAFodHRwczovL3d3dy5rZHJ2LmNvbS9zcG9ydHMvbGFkeS1vd2xzLXJlYWNoLW9wZW5pbmctcm91bmQtdGl0bGUtZ2FtZS13aXRoLTEwLTItd2luL2FydGljbGVfMTVlOGIwNzYtZjQ3NC0xMWVkLTliMjktZjNjZTcxZmJjMTlmLmh0bWzSAQA?oc=5&hl=en-US&gl=US&ceid=US:en","Wed 17 May 2023 05:35:00","You have permission to edit this article.  Edit Close"
"game","2023-01-16","Not Discerned","{""Tampa"", ""Florida"", ""UnitedStates""}","https://news.google.com/rss/articles/CBMiT2h0dHBzOi8vdGhlcGV3dGVycGxhbmsuY29tLzIwMjMvMDUvMTYvYnVjY2FuZWVycy1zY2hlZHVsZS0yMDIzLW11c3Qtd2F0Y2gtZ2FtZS_SAVNodHRwczovL3RoZXBld3RlcnBsYW5rLmNvbS8yMDIzLzA1LzE2L2J1Y2NhbmVlcnMtc2NoZWR1bGUtMjAyMy1tdXN0LXdhdGNoLWdhbWUvYW1wLw?oc=5&hl=en-US&gl=US&ceid=US:en","Tue 16 May 2023 11:10:40","TAMPA, FLORIDA - JANUARY 16: Mike Evans #13 of the Tampa Bay Buccaneers carries the ball against the Dallas Cowboys during the third quarter in the NFC Wild Card playoff game at Raymond James Stadium on January 16, 2023 in Tampa, Florida. (Photo by Mike Ehrmann/Getty Images)  Todd Bowles admits he only looks at three things on Bucs schedule by Josh Hill  While listing each NFL team’s one must-watch game this upcoming season, The Athletic missed the mark on its pick for the Buccaneers.  Now that the NFL schedule has finally been released, we can fill the upcoming dead period on the football calendar with rampant speculation about how games four months out will go.  That’s not a knock, either. Despite what Todd Bowles says, part of what makes the schedule so much fun to look at is the blank slate of promise and hope it represents. Who looked at the Cincinnati Bengals 2022 schedule and had them in the Super Bowl? Did anyone outside of Philly look at the Eagles schedule and predict an 8-0 start?  Hitting a bit closer to home, so many folks had the Bucs as a 12-win team this time last year, only to watch the team finish under .500 and limp into the playoffs.  Breaking down the schedule is fun because there’s no way to actually be right. Is there a more Extremely Online thing than that?  While it’s impossible to be right about predicting a team’s schedule this time of year, it is possible to be wrong — or at least misguided — about how it’s interpreted.  The Athletic lists one must-watch game for Buccaneers in 2023  A recent piece in The Athletic picked one must-watch game for each team in the NFL, selecting the Week 3 game against the Eagles for Tampa Bay. While the game is one of the Buccaneers two primetime matchups this year — assuming they don’t get flexed later in the season — it’s not the one must-watch game on the schedule.  Dan Pompeii argues the intrigue revolves around what it will tell us about kind of team Tampa Bay will be this season.  Pompeii writes:  The Bucs’ first prime-time game in 2023 will tell us everything we need to know. After opening up at Minnesota and hosting Chicago, they play the defending NFC champions on a Monday night. If the Bucs can give the Eagles a game, it will be an indication that the obituaries were premature.  He’s not entirely wrong, but the Buccaneers will not be making or breaking their season three weeks in.  There’s a chance the Bucs get their doors blown off by a vastly superior team, which would tell us in the moment that they’re not contenders. Writing off a team in September is foolish, even a team with seemingly as little to look forward to as Tampa Bay.  How many times have teams encountered early season turbulence only to later turn it around. Last year Tom Brady navigated a season full of turbulence before crashing out in the playoffs, and we’ve seen teams find ways to turn it around after slow starts.  It’s fair to question whether the Bucs have the right pieces to pull that off, but to suggest a what could be an 0-3 start means the season is over is simply wrong. If that’s the case, why even play the remaining 14 games on the schedule and skip right to picking No. 1 overall in April?  Week 3 will border on a must-watch if the Buccaneers come into the game with one or more wins, but it’s certainly not the hinge on which the season will swing."
