"topic","date"," time","place","url","date published","article text"
"game","2023-05-16","Not Discerned","{""Kasson"", ""Minnesota"", ""UnitedStates""}","https://news.google.com/rss/articles/CBMiYmh0dHBzOi8vd3d3LmthYWx0di5jb20vbmV3cy9rYXNzb24tYnJld2VyeS1wdXRzLXBlcnNvbmFsLXR3aXN0LW9uLWR1bmdlb25zLWFuZC1kcmFnb25zLWdhbWUtbmlnaHQv0gEA?oc=5&hl=en-US&gl=US&ceid=US:en","Tue 16 May 2023 12:36:00","(ABC 6 News) – It’s a game that’s been played for decades and is popular because of its fantasy role-playing premise. Chaotic Good Brewing Company in Kasson is putting a personal twist on the game during its monthly “D & D” nights.  David Sklenicka, a physics teacher in Austin is also a “Dragon Master.” A good friend of Chaotic Good owner Scott Stroh, he helps arrange these monthly game nights and writes a storyline based on the brewery.  For May, the theme is Orc-tober Fest. Characters will be invited to join a journey to a big Beer Festival and enter a competition. Along the way, there will be challenges to overcome.  “I get the ideas off of my considerate, but also my wife and daughter both play. I love bouncing ideas off of them. I like to keep it in the family,” said Sklenicka.  “I like the influence from other people but I don’t want to ruin any of the surprises my later players might have. I spend 15-20 hours typing it out.”  Credit: MGN  Outside of Chaotic Good, Sklenicka hosts gaming sessions at parties and events. If you’re interested, you can contact him here.  Game night for May is Tuesday, May 16th from 7 to 10 p.m. and you do need to register. You can register by emailing Stroh by 7 p.m."
"game","2023-05-16","Not Discerned","{""PhnumPenh"", ""PhnumPenh"", ""Cambodia""}","https://news.google.com/rss/articles/CBMibGh0dHBzOi8vd3d3LnJldXRlcnMuY29tL3Nwb3J0cy9zb2NjZXIvaW5kb25lc2lhLWRvd24tdGhhaWxhbmQtYnJlYWstc2VhLWdhbWVzLWdvbGQtbWVkYWwtZHJvdWdodC0yMDIzLTA1LTE2L9IBAA?oc=5&hl=en-US&gl=US&ceid=US:en","Tue 16 May 2023 16:14:00","              May 16 (Reuters) - Extra-time goals from Irfan Jauhari, Fajar Rahman and Beckman Putra earned Indonesia the Southeast Asian Games gold medal for the first time since 1991 with a 5-2 win over a Thailand side that finished the game with nine men in Phnom Penh on Tuesday.  Jauhari struck a minute into the first additional period after Yotsakorn Burapha had netted in the dying seconds of normal time to take the game into extra time with Rahman and Putra adding the gloss on a dramatic victory.  Ramadhan Sananta's first-half double had looked set to earn Indonesia the gold medal, the 20-year-old opening the scoring in the 21st minute when he steered a long throw by Alfeandra Dewangga beyond Thai goalkeeper Soponwit Rakyart.  The 20-year-old doubled the lead in first half stoppage time in spectacular fashion, lobbing home from 25 yards with Soponwit stranded on the edge of his penalty area.  Thailand, looking to claim the title for a record-extending 17th time, halved the deficit when Anan Yodsangwal headed in a 65th minute corner and then dramatically pulled level deep into stoppage time through Yotsakorn.  However, Jauhari put Indonesia back in front when he deftly lifted the ball over Soponwit before a bench-clearing brawl on the touchline raised tensions further.  Soponwit and Indonesia's Komang Teguh were sent off for their involvement in the altercation while the Thais were reduced to nine men in the 101st minute when defender Jonathan Khemdee received a second yellow card.  Rahman hit his side's fourth two minutes into the second period of extra time and Putra put the result beyond all doubt in the final minute to earn Indonesia gold for the fourth time.  Reporting by Michael Church, Editing by Christian Radnedge            Our Standards: The Thomson Reuters Trust Principles."
"game","2019-05-15","Not Discerned","{""Worcester"", ""Massachusetts"", ""UnitedStates""}","https://news.google.com/rss/articles/CBMiQmh0dHBzOi8vd3d3Lm1pbGIuY29tL3dvcmNlc3Rlci9uZXdzL2dhbWUtNDAtdnMtbGVoaWdoLXZhbGxleS14NjI4NNIBAA?oc=5&hl=en-US&gl=US&ceid=US:en","Wed 17 May 2023 01:47:31","WORCESTER, M.A. — A pair of rehabbers on the mound and a trio of home runs gave the Worcester Red Sox (20-20) a 9-4 win over the Lehigh Valley IronPigs (19-20) on Tuesday night at Polar Park. Garrett Whitlock got the start for the WooSox, posting the following line: 4  WORCESTER, M.A. — A pair of rehabbers on the mound and a trio of home runs gave the Worcester Red Sox (20-20) a 9-4 win over the Lehigh Valley IronPigs (19-20) on Tuesday night at Polar Park.  Garrett Whitlock got the start for the WooSox, posting the following line: 4 IP, 5 H 1 ER, 0 BB, 4 K on 49 pitches (35 strikes). The lone run allowed against him came in the third, a solo shot to Jake Cave. Whitlock reached 95-miles-per-hour on his sinker and recorded four swing-and-misses on his changeup.  Kutter Crawford followed, also on rehab, and delivered a strong outing in relief: 3.0 IP, 3 H, 1 ER, 0 BB, 4 K over 41 pitches (26 strikes). Lehigh Valley’s run against the right-hander also came on a long ball, a solo home run by Jordan Qsar in the sixth. Crawford's four-seamer topped out at 95.6 miles-per-hour, as he mixed in all five of his pitches. He recorded eight swing-and-misses, including three with his changeup.  Offensively, the WooSox scored in five consecutive offensive innings to take a stranglehold on the game.  Bobby Dalbec opened the scoring in the second, smashing a 112 mile-per-hour, 471-foot home run to center for his fifth of the Triple-A season. Dalbec now has 11 extra-base-hits in 23 games with Worcester.  In a 1-1 game in the third, David Hamilton delivered his team-leading eighth homer, a solo blast to right. Including tonight, Hamilton has 19 RBI in 35 games.  In the fourth, Greg Allen doubled off the Worcester Wall in right, plating Jorge Alfaro. After a walk, Nick Sogard came up with two in scoring position and drove both runners home with a single to center, putting the WooSox up 5-1.  Ryan Fitzgerald drove home two in the fifth with a moonshot of his own, his seventh of the season. Six of Fitzgerald’s seven home runs have come in the month of May, and he has 16 total hits in 12 games.  Worcester made it 8-1 on a wild pitch in the sixth that allowed Sogard to score. Manager Chad Tracy was also ejected in the inning, arguing a foul tip call with Hamilton at the plate.  In the eighth, Hamilton made it his sixth multi-RBI game of the season with a run-scoring groundout.  Out of the bullpen, Cam Booser allowed a run in the eighth on an RBI double play, while A.J. Politi got the final four outs while allowing one run to seal the home team's win.  The WooSox continue the homestand on Wednesday afternoon at 12:15 p.m. against the Lehigh Valley IronPigs, affiliate of the Philadelphia Phillies. On the mound, Matt Dermody (1-1, 4.34) faces Cristopher Sanchez (0-2, 6.14). Television coverage is live on NESN, while radio coverage is live at 11:55 a.m. on 100.1 FM The Pike, 98.9 Nash Icon and the WooSox Radio Network."
"game","2023-11-25","Not Discerned","{""Fayetteville"", ""Arkansas"", ""UnitedStates""}","https://news.google.com/rss/articles/CBMiX2h0dHBzOi8vMjQ3c3BvcnRzLmNvbS9jb2xsZWdlL2Fya2Fuc2FzL2FydGljbGUvYXJrYW5zYXMtcmF6b3JiYWNrcy1mb290YmFsbC1zY2hlZHVsZS0yMTAzMTc5MDUv0gEA?oc=5&hl=en-US&gl=US&ceid=US:en","Tue 16 May 2023 15:07:17","Join HawgSports recruiting analyst Danny West as he overviews Arkansas' transfer additions, looks at upcoming dates of note, and speaks with Razorback targets D'Angelo Barber, Jeremy Cook and signee Ian Geffrard.  HAWGSPORTS IS JUST $1 THE FIRST MONTH!! Or, get an annual subscription for 30% off!! Get insider Razorback coverage from the No. 1 independent source on Arkansas sports and recruiting with interactive coverage from the best in the business for a fraction of the regular rate! There is no promo code required for this offer, just HIT THIS LINK, and you'll get the deal!  CLICK HERE TO SIGN UP!!  NO. 1 IN RAZORBACK COVERAGE  You'll get unparalleled, in-depth and overanalyzed Razorback coverage that more than satisfies from the market leader in Razorback team sites, led by Trey Biddy, Danny West and Curtis Wilkerson -- complete with analysis, videos, photos, breaking news and insider information from our team. In addition, you'll get complete and intensive coverage of all three major sports, football, basketball and baseball. We have a combined 30 years covering Razorback athletics professionally at HawgSports.com.  You'll get the very best late-breaking recruiting coverage from the top man in the business in West. Not only will you know what is going on with features like our Big Red Recruiting Board, our Crystal Ball predictions, prospect updates, big picture stories, inside information on the Razor's Edge Premium Forum and and more, you'll know where things are headed before everyone else. West has over a decade of experience covering Razorback recruiting and has spent his life following the Razorbacks, as well.  The legendary Razor's Edge Forum is now better than ever with the newly released state of the art design with easy to use features like dark mode, notifications, follow features and easy-to-access gifs and photos that just enhance the experience. You'll interact with our experts as well as knowledgable fans, many of whom bring insider information themselves. You'll get your questions answered directly by our team, a great cast of moderators and our members. Interact in our regular recruiting chats, our VIP recruiting podcast, game threads, live updates from press conferences and events, regular discussion among like-minded Razorback fans and more.  CLICK HERE TO START YOUR SUBSCRIPTION  MORE REASONS TO SUBSCRIBE:  1) Scoop. From team news, to recruiting scoop to expert analysis, HawgSports is the unquestioned leader for insider Razorback sports information. No publication breaks more stories or has the reputation for trusted coverage like HawgSports. And there's no slowdown in the offseason with live updates from the recruiting trail, camp scoop and unmatched team coverage.  2) Exclusive Content. There are a countless number of features that are member favorites, including the Big Red Recruiting Board for football and basketball to keep you up to speed on the latest developments in recruiting, the Crystal Ball to let you know who we feel will be the next Razorback commitment, the Transfer Portal and more.  3) Danny. Danny West has been covering the Razorbacks and recruiting for a decade and quickly established himself as the leader in the field. Nobody breaks recruiting news, paints the big picture or has a better reputation than Danny West when it comes to Hog recruiting. HawgSports members get a direct line to the No. 1 recruiting man in Arkansas, and nobody nationally covers their respective beat better. West has deep connections within the Razorback program.  4) Trey. For over 17 years, Trey Biddy has been the publisher of the most trusted and successful Razorback subscription site in the industry. Not only has he been first to break stories like the Chad Morris hire or the dismissals of John Pelphrey and Mike Anderson, he has accurately guided you through the weeds with the last two coaching searches, along with breaking one assistant coach hire after another. Nobody provides better insight or has closer connections to Razorback football.  5.) Curtis. Curtis Wilkerson is the newest addition to the HawgSports Team. After working for Busting Brackets and Prep Hoops with a background as a player, recruiter, coach and administrator, along with a background in sports medicine on the NAIA level, Wilkerson brings in-depth analysis on Razorback hoops and recruiting. The McCrory (Ark.) native also covers all aspects of the major Razorback sports, including football and baseball.  6) Community. The legendary Razor's Edge VIP forum is the most popular Arkansas subscriber message board because it not only is the most informative but also the best place for Razorback discussion among the eager, the in-the-know and the insightful Hog fan. The forum is moderated to keep the information fun and the conversation flowing without an overwhelming amount of bickering and infighting. In addition, major enhancements to improve user experience are on the horizon. Get exclusive content and info, connect with Hog fans from around the globe and discuss news as it breaks.  7) 2000. The site produces over 2,000 unique articles a year, including roughly 750 VIP stories - a pace of nearly 170 articles per month and over 60 VIP articles per month - and that doesn't include the insight and opinion posted on the Razor's Edge Forum or other Razorback related content produced from from the 247Sports Network.  8) More. In addition to the staff at HawgSports, the 247Sports has the best group of analysts in the country, like National Director of Recruiting Steve Wiltfong and regional recruiting analyst Gabe Brooks who regularly drop in to contribute important Razorback news from around the country and the region. 247Sports has the largest recruiting team spanned across the country.  9) 247Sports and CBS. HawgSports made the jump to 247Sports a year ago to be with the industry's top innovator. With the power of CBS behind them and the recent acquisition of the Scout.com network, the new 247Sports super network is always on the cutting edge to improve user experience. The best independent Razorback team site is now with the best company.  10) Fewer Ads. Annual subscribers get a significantly reduced ad experience on the site. On the forums, the interspersed ads between messages are removed for subscribers.  11) 247Sports' recruiting database and all features. The database is updated constantly and complete with updated timelines for each prospect and includes 247Sports' exclusive CRYSTAL BALL feature with updated expert predictions on where each prospect is headed with more inside information on why we made the pick.  12) Access to all the 247Sports Network. In addition to HawgSports premium content, you can read articles on every site in the network. That means you get insider access to not just one, but ALL of the schools you care about and their foes. If you choose the annual package. BONUS: You can check out every team's VIP message boards with an annual VIP membership.  13) A fresh, clean look. You not only have access to all the scoop, news, and features listed above, but you get it all on a platform that is fast and user friendly, complete with the newest, most feature-rich and easy to navigate message boards in the industry, complete with the new 'dark mode' option. We also have the best and most user-friendly mobile platform in the business. If you’re away from your computer, don’t worry – 247Sports offers full access on tablets and smartphones. So, you get your Razorback team and recruiting news anytime, anywhere.  14) Text Alerts. HawgSports not only reports the news first but makes sure you get the news first by texting you when there's a commitment or huge team story.  15) CBS All-Access After Promo Ends. Commercial free CBS All-Access is a $99 annual value that you get absolutely free for as long as you're subscribed to HawgSports.com once your promotional period ends!! Watch movies, commercial free shows, sports and other live programing at home or on the go at no charge.  CLICK HERE TO START YOUR SUBSCRIPTION  Terms: This deal will end soon. This promotion is for new members only. Paramount+ Access? -After the promotional period when the VIP member renews. 247Sports.com reserves the right to alter or cancel this promotion at any time. Please write support@247sports.com with any questions you have."
"game","2023-05-20","Not Discerned","{""Boston"", ""Massachusetts"", ""UnitedStates""}","https://news.google.com/rss/articles/CBMiX2h0dHBzOi8vd3d3LmJvc3Rvbi5jb20vc3BvcnRzL2Jvc3Rvbi1jZWx0aWNzLzIwMjMvMDUvMTYvY2VsdGljcy1zaXhlcnMtZ2FtZS03LWNvbHVtbi1jaGFkLWZpbm4v0gFlaHR0cHM6Ly93d3cuYm9zdG9uLmNvbS9zcG9ydHMvYm9zdG9uLWNlbHRpY3MvMjAyMy8wNS8xNi9jZWx0aWNzLXNpeGVycy1nYW1lLTctY29sdW1uLWNoYWQtZmlubi8_YW1wPTE?oc=5&hl=en-US&gl=US&ceid=US:en","Tue 16 May 2023 14:38:00","Celtics Redemptive Game 7 rout put to rest some misconceptions about the Celtics Any discussion of redemption must begin in one place: with Jayson Tatum’s career-defining, climb-on-my-back-boys tour de force. Jayson Tatum went 4 for 4 on 3-pointers when guarded by 76ers big man Joel Embiid. Barry Chin/Globe Staff      The shriveling Sixers weren’t the only thing the Celtics put to rest with their rousing 112-88 rout Sunday in Game 7 of their Eastern Conference semifinal.  They also buried an assortment of negative narratives and perceptions — some fair, some never fair at all — about themselves. And that’s another fulfilling victory in itself.  Any discussion of redemption must begin in one place: with Jayson Tatum’s career-defining, climb-on-my-back-boys tour de force.  You may know the stats by heart now: 51 points, the most in a Game 7 ever. (Even more impressive, Tatum scored 67 points since the start of the fourth quarter in Game 6.) A game-high 13 rebounds. A team-high 5 assists. Tatum knocked down 17 of 28 shots, including 6 of 10 threes, and that latter stat felt more like 9 of 10.  Advertisement:  Beyond the breathtaking numbers, Tatum played a remarkably poised and intelligent game. He did not commit a turnover in 41:40 of action. For parts of the series, he would become flummoxed when coming face to face with Joel Embiid in the lane, leading to altered and awkward shots.  Sunday, he put Embiid in the blender, blowing past him at will and going 4 for 4 from three when the big man was his primary defender, including a pair of threes within about a minute of each other early in the third that put the Celtics up, 65-55, and planted the seed that this might be a runaway. It was, largely because Tatum solved the Embiid mystery.  Tatum struggled mightily at points in this series, including shooting a combined 1 of 24 — that’s 4.2 percent — from the field in the first quarters of Games 4-6. He is long proven as a superb player, having made first-team NBA two years running, but his struggles (particularly in the Finals against the Warriors last season) tended to overshadow his big-moment success (46 points on Game 6 on the road against the defending champion Bucks in last year’s East semis).  It got so tiring hearing from fans that called him soft or said he was, to paraphrase, dispassionate. But it was tough to push back on that when he was essentially absent from the first quarter in multiple games in this series.  Advertisement:  Tatum is just 25, works relentlessly on his game, and there’s still room to grow (Paul Pierce didn’t become a champion until he was 30), but as the weight on his shoulders got heavier as this series went on, it began to feel like a referendum on his status among the NBA elite and his place in Celtics lore.  Let’s just say the referendum passed in a landslide. I saw Larry Bird’s entire career, and Pierce’s too, and I’m not sure I ever saw either of them dominate a game quite like this, and that’s even without considering how Tatum’s reputation was at stake.  There’s no perfect comparison for his performance, but it reminded me of various spectacular moments in Celtics lore. It was a little bit of the Bird-Dominique Wilkins shootout in Game 7 of the ‘88 Eastern Conference semifinals … and a little of Larry’s 60-point game against the Hawks in March 1985 … and a little of Pierce’s 41-point gem in Game 7 against the Cavaliers in 2008 … and, in a team sense, of the Celtics’ 36-6 run in the third quarter against Atlanta in the clinching Game 5 of the 1986 conference semis.  Whenever you’re reminding someone of the 1985-86 Celtics — the best single-season team I’ve ever seen — you’re doing something extraordinary.  Advertisement:  (There is a common thread through those aforementioned games, by the way. Doc Rivers was involved in all of them. Isn’t that wild?)  Funny, but no one has texted or messaged me today that Tatum is soft. Hopefully that nonsense is over for good.  As for other perceptions that were proven to be either misguided or no longer existent during this series, how about this one, the notion that Tatum and Jaylen Brown don’t bring out the best in each other. I thought Game 7 was the best they have ever played in tandem, with Brown setting the tone early, scoring 25 points in total, and tormenting first-ballot Hall of Fame quitter James Harden up and down the court.  The energy, as they say, shifted when Harden whacked Brown in his unmasked face with 8½ minutes left in the second quarter and the Sixers up, 35-27. The Celtics tore off an 8-0 run after that, playing with a relentless pace that you knew would eventually wear down the Sixers. (The Celtics were the far better- conditioned team.)  I thought it was telling in all the right ways at the end of Game 6 when no one was happier for Tatum after his breakout 16-point fourth quarter than Brown. Some stars would be annoyed that their teammate kept shooting through a miserable slump with the season on the line. But Brown, who would have had every right to want the ball down the stretch, greeted Tatum with a grin, an elaborate handshake, and a big hug afterward. There is no doubt. Those two are in this together.  Advertisement:  We’ll save the discussion of Joe Mazzulla’s standing after this series for another day, and just note one more change in perception for now.  It seemed at times during the season, and even in the first-round series against the Hawks, that both Al Horford and Marcus Smart had lost a step defensively. I don’t know if they were aching or pacing themselves or what, but it became clear in this series that both remain forces on the defensive end.  I’m not sure there’s another player in the league who enjoys beating a specific team the way Horford enjoys beating the Sixers, and the 36-year-old wore down and wore out Embiid. And Smart seemed to pester, agitate, and lock down every Sixer at one time or another; he was back in his Defensive Player of the Year form from a season ago.  If Horford, Smart, and Brown too continue to set the tone with their defensive intensity, and Tatum can keep playing like a Celtics legend in his own time, anything isn’t just possible with this team. It might just be probable."
