"topic","date"," time","place","url","date published","article text"
"game","2006-01-01","Not Discerned","Not Discerned","https://news.google.com/rss/articles/CBMiOmh0dHBzOi8vd3d3LnNwYWNlLmNvbS9iZXN0LXdhcmhhbW1lci00MGstZ2FtZXMtb2YtYWxsLXRpbWXSAQA?oc=5&hl=en-US&gl=US&ceid=US:en","Tue 16 May 2023 14:00:08","Games Workshop’s Warhammer 40K is the most popular miniature wargame in the world, and its gothic science fiction setting – much more unique than Warhammer Fantasy’s – is greatly responsible for that. Unsurprisingly, it’s also nurtured tons of video games over the decades.  40K models are typically gorgeous, and its tabletop qualities are enticing for anyone willing to learn the ropes, but its universe gradually became attractive on its own as well. In the distant future, a dogmatic human civilization is under siege from all sides, fighting off armies of hostile aliens and terrifying supernatural forces. It’s grand and gritty in equal measure, and despite the many franchises it’s influenced over the years, there’s nothing quite like it.  (Image credit: Focus Entertainment)  Many Warhammer fans are familiar with 40K’s large body of novels, but it was video games that truly started to advance on soon-to-be Warhammer diehards. The medium’s unparalleled interactive possibilities have allowed the IP to flourish in both traditional and unexpected ways. With Warhammer 40K: Boltgun (opens in new tab)'s imminent release, we thought now would be a good time to look back at the best Warhammer 40K games from across the years.  If you’re looking for other specific gaming picks, you might want to check out our list of the best space exploration games or maybe the all-spooky best space horror games list. And, if you want to get into Warhammer 40K but don’t know how to cut down costs, we’ve got you covered with some recommendations on how to save money on Warhammer 40K too. For the Emperor!  10. Warhammer 40K: Darktide  (Image credit: Fatshark)  Platforms: PC  PC Developer: Fatshark  Warhammer 40K really lends itself to first-person shooters filled with bullets and blood, and we’re surprised Games Workshop hasn’t explored that genre more often, but we’re getting there. Darktide launched only a few months ago, and it’s already caused a strong impression despite an overall lack of polish that’s being fixed as we speak.  The key here is that Fatshark’s natural talent for punchy and brutal combat is all there, brought over from the two Warhammer: Vermintide games they made before. Darktide follows the watertight four-player co-op FPS formula that was popularized by Valve’s Left 4 Dead back in the day, so you know what you’re getting into. Just make sure your PC is up to par or wait for the (delayed) current-gen Xbox release.  9. Space Hulk: Tactics  (Image credit: Focus Entertainment)  Platforms: PC, PS4, Xbox One  PC, PS4, Xbox One Developer: Cyanide Studio  2018 brought us a pretty solid adaptation of the tabletop miniatures board game Space Hulk. This is a two-player versus game that distills Warhammer 40K into a cheaper, quicker, and tighter experience set in derelict spaceships and other pieces of space junk floating adrift and run over by Tyranids.  The game features two single-player campaigns, competitive multiplayer, and a skirmish mode. Moreover, it packs an impressive map builder that allows players to cook up and share their own maps. Just be aware that this one is very punishing.  8. Warhammer 40K: Battlesector  (Image credit: Slitherine Ltd.)  Platforms: PC, PS4, Xbox One/Series X/S  PC, PS4, Xbox One/Series X/S Developer: Black Lab Games  Battlesector is another recent 40K game release that flew under the radar. However, both veteran gamers and fans have praised its take on turn-based tactics on a larger scale than usual, which results in a slower-paced and more meditative approach too.  The mission design can often be monotonous, but the moment-to-moment gameplay and the systems gluing everything together work well enough to achieve one of the best digital representations of the miniature wargame around. We’d love to see a bigger and better sequel of this one.  7. Warhammer 40K: Gladius – Relics of War  (Image credit: Slitherine Ltd.)  Platforms: PC, Linux  PC, Linux Developer: Proxy Studios  Gladius – Relics of War mixes Warhammer 40K and 4X (explore, expand, exploit, exterminate) systems. On paper this sounds like a match made in heaven and it largely succeeds at doing Sid Meier’s Civilization but 40K. If that sounds attractive, give it a fair shake.  While its older 4X brothers are far more addicting, Gladius’ more fast-paced nature and strong commitment to the 40K universe (diplomacy ain’t an option) make it an oddly relaxing – and unsurprisingly darker – take on a well-trodden formula.  6. Battlefleet Gothic: Armada 2  (Image credit: Focus Entertainment)  Platforms: PC  PC Developer: Tindalos Interactive  If you like spaceships (which is likely if you’re an avid reader of our site) and real-time tactics in your games, then Battlefield Gothic: Armada 2 is a safe bet. It adapts the 40K miniature wargame of the same name, and it does so with style.  This one features three narrative campaigns and 12 playable factions, with the option of doing co-op multiplayer as well. Even if you’re not well-versed in the Warhammer 40K universe, anyone into space strategy games should check this one out.  5. Warhammer 40K: Mechanicus  (Image credit: Kasedo Games)  Platforms: PC, macOS, Linux, Android, PS4, Xbox One, Nintendo Switch  PC, macOS, Linux, Android, PS4, Xbox One, Nintendo Switch Developer: Bulwark Studios  Mechanicus is yet another turn-based video game that follows a very specific faction of the human Imperium. This time around it’s all about the Adeptus Mechanicus, a group of cybernetically enhanced warrior priests. That sounds rad, and we promise that the game is rad too.  It’s also one of the few turn-based 40K titles that stick more closely to the obvious XCOM inspiration, so it might be an easier recommendation for players who are looking for that specific take on tactical battles. On top of the solid gameplay, the flexible customization and notable worldbuilding are highlights.  4. Warhammer 40K: Chaos Gate – Daemonhunters  (Image credit: Frontier Foundry)  Platforms: PC  PC Developer: Complex Games  Warhammer 40K: Chaos Gate – Daemonhunters was released in 2022, but it’s already become a favorite among fans thanks to its strong focus on the Grey Knights, a chapter of Space Marines composed of psychics whose purpose is the combat and eradication of the daemonic forces of Chaos.  Daemonhunters is a single-player, turn-based strategy game that does way more than just replicating XCOM with Space Marines; it’s largely unforgiving and deceptively deep. The audiovisual presentation is also top notch, making the (at times) seemingly impossible battles a blast to watch play out.  3. Warhammer 40K: Dawn of War II  (Image credit: SEGA)  Platforms: PC, macOS, Linux  PC, macOS, Linux Developers: Relic Entertainment  Dawn of War diehards never fully embraced Dawn of War II, but it’s still one of the franchise’s finest gaming efforts and deserves its own spot in the list. It can’t be denied that it cemented itself as a sequel that can stand on its own thanks to a heavier focus on RPG elements.  Dawn of War II received two major expansion packs plus a fair amount of DLC that rounded out the experience, eventually nullifying complaints about the removal of the base-building element and the repetition found in some missions of the campaign. If you’ve exhausted the first Dawn of War’s options, give its first sequel a chance. We don’t talk about the third one though.  2. Warhammer 40K: Space Marine  (Image credit: SEGA)  Platforms: PC, PS3, Xbox 360  PC, PS3, Xbox 360 Developer: Relic Entertainment  With Space Marine 2 (opens in new tab) slated to release later this year, there’s never been a better time to play (or replay) the 2011 original, especially after the free anniversary upgrade (opens in new tab) it got on PC in 2021.  Even before the announcement of a sequel, Space Marine has always had many fans. This was with good reason as it perfectly represents the brutality of the Space Marines up close and personal through a third-person view and visceral melee and ranged combat. Some of the Imperium’s biggest enemies are featured heavily in this one, and the plot is easy to follow, so it’s a nice entry point for newcomers too.  1. Warhammer 40K: Dawn of War  (Image credit: SEGA)  Platforms: PC  PC Developers: Relic Entertainment  40K fans and real-time strategy veterans alike agree that the original Dawn of War is one of the best PC games ever, period. Relic Entertainment once cracked the code and delivered an all-timer which is both accessible and unique. It perfectly adapts many of the miniature game and its universe’s nuances into a modern classic that nailed both the base-building aspect and the relentless combat across desolate scenarios.  Furthermore, Dawn of War packed spectacular story campaigns, a solid roster of units for all factions, and the option to customize the armies’ colors plus basic aesthetics. And, since it was a massive commercial hit, it received three chunky expansion packs which we 100% recommend. More specifically, the second expansions, Dark Crusade, which still to this day feels like a high point for the RTS genre."
"game","2020-10-18","Not Discerned","{""Minneapolis"", ""Minnesota"", ""UnitedStates""}","https://news.google.com/rss/articles/CBMiaGh0dHBzOi8vd3d3LmhvdXN0b25keW5hbW9mYy5jb20vbmV3cy9ob3VzdG9uLWR5bmFtby1mYy1vcGVuLXR3by1nYW1lLXJvYWQtdHJpcC1vbi13ZWRuZXNkYXktaW4tbWlubmVzb3Rh0gEA?oc=5&hl=en-US&gl=US&ceid=US:en","Tue 16 May 2023 18:30:50","The Dynamo look to bounce back after allowing their first goal at home in more than 530 minutes of league play this season. The Dynamo played with 10 men for 57 minutes against the Sounders following a video review of a challenge by forward Amine Bassi. The Dynamo played the final 12 minutes with nine players after midfielder Héctor Herrera received his second yellow card of the match. Seattle scored the game-winning goal in the 87th minute, and Houston closed a three-game home stand with a 1-1-1 record in league and Open Cup play.  Both Bassi and Herrera will miss Wednesday’s game due to a one-game suspension following Saturday’s game. This is the second red card suspension for Herrera, who missed Houston’s last road trip, a 1-1 draw with the New York Red Bulls on April 15. This is the first suspension for Bassi and the first game he will miss since the season opener on Feb. 25. The 25-year-old missed the match against Cincinnati due to injury.  Houston looks to snap a five-game losing streak against the Loons. Minnesota won both matches in 2022 and swept the series in 2021. Houston enters the series with a 4-7-4 record (WLD) against Minnesota and the Dynamo last secured a point away from home in a 2-2 draw with the Loons on Oct. 18, 2020."
"game","2023-09-26","19:05:00","{""Baltimore"", ""Maryland"", ""UnitedStates""}","https://news.google.com/rss/articles/CBMiSGh0dHBzOi8vd3d3LmNhbWRlbmNoYXQuY29tLzIwMjMvNS8xNi8yMzcyNTg4NC9vcmlvbGVzLWFuZ2Vscy1nYW1lLXRocmVhZNIBVWh0dHBzOi8vd3d3LmNhbWRlbmNoYXQuY29tL3BsYXRmb3JtL2FtcC8yMDIzLzUvMTYvMjM3MjU4ODQvb3Jpb2xlcy1hbmdlbHMtZ2FtZS10aHJlYWQ?oc=5&hl=en-US&gl=US&ceid=US:en","Tue 16 May 2023 22:05:00","The Orioles continue to have a pretty darn good record. This is not enough to stop people from getting grumpy after losses like last night’s. I get it. The Grayson Rodriguez outing was a real downer, and added to that, it feels like quite a waste to have scored five runs off of Shohei Ohtani and still lost the game by a grand slam. I hope they can halt the losing before dropping a third straight game.  As is true of every game, the starting pitcher will have a lot to do with the chances of the Orioles winning. That’s Dean Kremer tonight. His last two games have been pretty good, with just one run allowed combined across 12 innings pitched against the Braves and Rays. Those are two great offenses so far this season. Kremer has had some rocky outings this year but we can hope, not unreasonably, that the last couple are a sign he’s heading in a more positive direction.  For another game in a row, the Orioles have made a move to summon fresh bullpen reinforcements. After Rodriguez didn’t go deep into the game last night and a number of relievers needed to be used, they wanted some long relief insurance. That’s turned out to be Cole Irvin, erstwhile starting rotation member, who’s done better with his control after a demotion to Norfolk. I hope he’s not needed, like they didn’t end up needing Drew Rom over the weekend, but it’s good they brought him in case.  Orioles lineup  Cedric Mullins - CF Adley Rutschman - C Anthony Santander - 1B Austin Hays - LF Gunnar Henderson - 3B Adam Frazier - 2B Terrin Vavra - RF Jorge Mateo - SS Ryan O’Hearn - DH  A lot of days I’ve looked at the Orioles lineup this season, I’ve thought to myself, “Is this really the best they can do?” They’ve won a number of those games, so it’s been working out. Still, here’s that reaction again. Vavra in right field, really? If this is going to happen - and this is now the second straight game it has - it is a lot tougher to defend, say, Colton Cowser remaining in Norfolk with his 1.044 OPS.  Also, O’Hearn had a nice spring training but that’s not carrying over into the regular season in the slightest, so, you know. It would be nice to do something different there. Ryan Mountcastle getting a game off is part of why the lineup looks like this, of course.  Angels lineup  Mickey Moniak - RF Mike Trout - CF Shohei Ohtani - DH Taylor Ward - LF Matt Thaiss - C Brandon Drury - 1B Gio Urshela - 3B Luis Rengifo - 2B Zach Neto - SS  The Angels starting pitcher is Chase Silseth, who has pitched in four games this year but yet to make a start. Though Trout and Ohtani are fearsome presences in this lineup, it feels like the Orioles lineup ought to be better than these guys. They weren’t last night, so, you know, hopefully they can change that today."
"game","2023-12-03","Not Discerned","{""London"", ""GreaterLondon"", ""UnitedKingdom""}","https://news.google.com/rss/articles/CBMiaWh0dHBzOi8vd3d3LmdhbWVzcG90LmNvbS9hcnRpY2xlcy91Ymlzb2Z0LWhhcy1hbi11bmFubm91bmNlZC1sYXJnZS1nYW1lLWNvbWluZy1pbi1uZXh0LXllYXIvMTEwMC02NTE0MjMzL9IBbWh0dHBzOi8vd3d3LmdhbWVzcG90LmNvbS9hbXAtYXJ0aWNsZXMvdWJpc29mdC1oYXMtYW4tdW5hbm5vdW5jZWQtbGFyZ2UtZ2FtZS1jb21pbmctaW4tbmV4dC15ZWFyLzExMDAtNjUxNDIzMy8?oc=5&hl=en-US&gl=US&ceid=US:en","Tue 16 May 2023 19:14:40","Ubisoft has begun to announce its upcoming games lineup, and in addition to titles that have already been announced, one ""large game"" is on the schedule, too.  The lineup of titles launching during Ubisoft's current fiscal year ending March 31, 2024 includes Assassin's Creed Mirage, Avatar: Frontiers of Pandora, Rainbow Six Mobile, Skull and Bones, The Crew Motorfest, The Division Resurgence, XDefiant, and ""another large game.""  Reporter Ethan Gach of Kotaku said on Twitter that this ""large game"" could be Ubisoft's Star Wars game from the makers of The Division. Gach reported that development is ""going well and the company is eager to get it out asap."" A spokesperson for Ubisoft told GameSpot, ""We don't comment on rumors or speculation.""  Ubisoft presumably has plenty of games in the works that could be considered ""large,"" so if it's not Star Wars, it could be something else. In any event, Ubisoft management said on an earnings call that it will have more news to share about its upcoming release slate during Ubisoft Forward in June.  The creative director on Ubisoft's Star Wars game has said 2023 will be a ""huge year"" for the team, but this doesn't necessarily mean the game is going to launch this year.  Ubisoft's new Star Wars game is a ""story-driven, open-world experience within the Star Wars galaxy that will also utilize the studio's cutting-edge technology and advancements, including the Snowdrop engine,"" according to the publisher.  In other Ubisoft news, the company just announced that it plans to ramp up its Assassin's Creed development team sizes, from 2,000 to about 2,800 in the coming years."
"game","2019-05-22","Not Discerned","Not Discerned","https://news.google.com/rss/articles/CBMiTWh0dHBzOi8vd3d3LmdhbWVpbmZvcm1lci5jb20vZmVhdHVyZS8yMDIzLzA1LzE2L2NvdmVyLXJldmVhbC1maW5hbC1mYW50YXN5LTE20gFRaHR0cHM6Ly93d3cuZ2FtZWluZm9ybWVyLmNvbS9mZWF0dXJlLzIwMjMvMDUvMTYvY292ZXItcmV2ZWFsLWZpbmFsLWZhbnRhc3ktMTY_YW1w?oc=5&hl=en-US&gl=US&ceid=US:en","Tue 16 May 2023 16:00:00","Final Fantasy XVI arrives exclusively on PlayStation 5 next month, but before that, it’s getting the Game Informer spotlight on our latest cover! We traveled to Japan and spoke with several of the leads within developer Creative Business Unit III of Square Enix to talk about combat, story, art, lore, and so much more, and we played hours of the game we can’t wait to tell you about. This cover story and our exclusive coverage going live on the site starting soon will bring you all the FFXVI information you need before finally jumping in to play it next month.  Welcoming you into our deep dive into FFXVI’s world of Valisthea, its lore, its characters, and of course, its Eikons, is the beautiful art adorning this issue of Game Informer. Our standard cover showcases protagonist Clive Rosfield and the hellacious Ifrit Eikon, and on the back, Clive’s brother Joshua joins him with the fiery Phoenix Eikon.  The Game Informer Gold cover features the two Rosfields and Eikons swapped, with Joshua and Phoenix on the front and Clive and Ifrit on the back. And like every Game Informer Gold cover before it, you’ll see “Game Informer” in flashy, metallic gold. Each Gold issue is numbered, too, making it even more special for collectors.  But FFXVI is just the start of Issue 356. Within its pages, you’ll find our biggest look yet at Immortals of Aveum, a new FPS that’s Call of Duty meets magic, as well as a feature about representation in video games and how character creation tools can do better. Elsewhere in this issue, you can read about Red Candle Games’ journey through horror success after Devotion, and if that’s not spooky enough for you, we spoke to some of our favorite horror developers to find out what scares them.  As usual, you’ll find plenty of previews, including new looks at Ubisoft’s XDefiant, Disney Illusion Island, Street Fighter 6, Lies of P, and more. Plus, you can read our reviews of Star Wars Jedi: Survivor, The Legend of Zelda: Tears of the Kingdom, and more to find out our thoughts on the latest releases.  Here's a closer look at the two covers for this issue:  You can also try to nab a Game Informer Gold version of the issue. Limited to a numbered print run per issue, this premium version of Game Informer isn't available for sale. To learn about places where you might be able to get a copy, check out our official Twitter, Facebook, TikTok, and Instagram, and stay tuned for more details in the coming weeks. Click here to read more about Game Informer Gold.  Print subscribers can expect their issues to arrive in the coming weeks. The digital edition of this issue launches May 22 for PC/Mac, iOS, and Google Play. To subscribe to either the digital or print version, click here."
"game","2023-04-28","Not Discerned","{""Tampa"", ""Florida"", ""UnitedStates""}","https://news.google.com/rss/articles/CBMiYWh0dHBzOi8vZ291c2ZidWxscy5jb20vbmV3cy8yMDIzLzUvMTYvYmFzZWJhbGwtdXNmLWRvd25lZC1ieS1zdGV0c29uLWluLWZpbmFsLW5vbi1jb25mZXJlbmNlLWdhbWXSAQA?oc=5&hl=en-US&gl=US&ceid=US:en","Wed 17 May 2023 01:57:05","Next Game: ECU 5/18/2023 | 6:30 P.M. ESPN+ Bulls Unlimited (TuneIn) Next Game Full Schedule May. 18 (Thu) / 6:30 P.M. ECU History  TAMPA (May 16, 2023) – The Stetson Hatters (31-21) scored nine unanswered runs on Tuesday night before the University of South Florida (19-34) got on the scoreboard and outlasted the Bulls for an 11-5 road victory at USF Baseball Stadium. The start of the game was delayed 44 minutes due to lightning in the area.  Jackson Mayo (St. Johns) went 3-for-4 with a home run in the loss for South Florida.  Stetson broke the scoring seal and took a 1-0 lead with a solo homer in the top of the third inning. The Hatters added two to their lead with a handful of seeing-eye singles in the top of the fourth for a 3-0 advantage.  The Hatters plated four more runs in the top of the fifth inning to pad their lead to 7-0 and made it a 9-0 affair with two more in the sixth frame.  After being limited to just two hits through the first five innings, USF finally put together a rally to scratch the plate in the bottom of the sixth. Drew Brutcher (Lakeland) walked with one out, and two batters later with two outs, Rafael Betancourt (Deltona) extended the inning with a base hit. John Montes (Toa Alto, Puerto Rico) then drove in Brutcher with an RBI-single.  Travis Sankovich (Uniontown, Pa.) added a run-scoring double by the Bulls in the bottom of the seventh inning.  The Hatters hit back-to-back solo homers in the top of the ninth inning before the Bulls tacked on three runs in the bottom half of the frame.  Mayo tagged a solo home run, Bobby Boser (Wesley Chapel) drilled an RBI-triple to the gap in right-center field, just missing his 16th homer of the year, and Brutcher added a sac fly to chase home Boser and account for the final score.  Notable  Boser extended his hitting streak (11) and on-base streak (15) on Tuesday night.  Ethan Brown (Winter Garden), who has made only one appearance since suffering a shoulder injury on April 14th, face three batters in the sixth inning and recorded one strikeout.  (Winter Garden), who has made only one appearance since suffering a shoulder injury on April 14th, face three batters in the sixth inning and recorded one strikeout. Austin Grause (Tampa) produced USF's only 1-2-3 inning of work on the mound in the seventh frame.  Up Next  The Bulls wrap up the regular season with a three-game series against No. 15 ECU on May 18-20 at USF Baseball Stadium in Tampa.  About USF Baseball  The USF Baseball program played its first season in 1966 and is entering its 58th season in 2023 under head coach Billy Mohl (sixth season). The Bulls have made 14 NCAA Tournament appearances, including four since 2015, and earned their first-ever Super Regional berth in 2021. USF was ranked in the Top 25 by five different publications in the final 2021 polls, checking in as high as No. 16. The Bulls have won five conference tournament titles (3 Sun Belt, 1 Metro and 1 American) and six regular season championships (3 Sun Belt, 2 Metro and 1 C-USA). USF baseball players have been recognized with All-America honors 12 times, most recently with third baseman David Villar in 2018, and 18 have earned Freshman All-America accolades, most recently Drew Brutcher and Carmine Lane in 2021. Four Bulls were selected in the 2022 MLB Draft. Former 2018 first-round selection, Shane McClanahan, became the program's first-ever MLB All-Star in 2022 and was the starting pitcher for the American League.  – #GoBulls –"
"game","2019-02-26","15:00:00","{""Auburn"", ""California"", ""UnitedStates""}","https://news.google.com/rss/articles/CBMiT2h0dHBzOi8vd3d3LmV4dHJlbWV0ZWNoLmNvbS9nYW1pbmcvc3RlYW0tdG95aW5nLXdpdGgtZnJlZS05MC1taW51dGUtZ2FtZS10cmlhbHPSAQA?oc=5&hl=en-US&gl=US&ceid=US:en","Tue 16 May 2023 19:00:00","Credit: Adrianna Nine  Steam users who have recently navigated to the Dead Space page might have noticed something new. The game distributor appears to be mulling the idea of a free 90-minute trial, beginning with this popular new remake.  Just below the thumbnail carousel and the “Add to Wishlist” button sits a narrow box titled “Try Dead Space - Free Trial.” From there, it’s clear this is an experimental feature for Steam: The box says you can “Play this title for up to 1 hours” but also that you have “1 hour 30 minutes remaining.” Clicking the “Play Now” button kicks off a full-game download, but once your 90 minutes are up, you must either purchase the game or get out.  Many Steam games offer demos—the Steam Store has an entire section for them. But demos typically contain in-game restrictions rather than time restrictions. You might only get to complete a couple of objectives or explore a small section of the game’s world before being invited to purchase the game. Although this is still a brilliant way to ensure you want a title before committing (an invaluable opportunity, given game prices nowadays), it doesn’t always offer a full picture of what a playthrough experience will look like.  Credit: Adrianna Nine  Steam has toyed with several free trial formulas, offering entire weekends where users could play games like Crusader Kings III for free. Models like this only work for games you’d conceivably play over and over, though; story-driven games like Dead Space aren’t a great fit, as players could complete a full playthrough within that free weekend. From Steam’s perspective, 90 minutes is enough to offer curious users an enticing taste without giving away the whole story.  As of writing, it appears that Dead Space is the only game offering a timed free trial; other major titles lack the box entirely. It could be that Steam is testing the feature before conducting a wider rollout, or Dead Space publisher Electronic Arts just wants people to get into this title. (EA also announced that Dead Space would be 20% off through May 29.)"
