"topic","date"," time","place","url","date published","article text"
"game","2018-01-01","17:00:00","{""SanDiego"", ""California"", ""UnitedStates""}","https://news.google.com/rss/articles/CBMiRGh0dHBzOi8vd3d3Lm1sYi5jb20vcmVkcy9uZXdzL21heS1waXBlbGluZS1nYW1lLW9mLXRoZS1tb250aC1wcmV2aWV30gFIaHR0cHM6Ly93d3cubWxiLmNvbS9hbXAvbmV3cy9tYXktcGlwZWxpbmUtZ2FtZS1vZi10aGUtbW9udGgtcHJldmlldy5odG1s?oc=5&hl=en-US&gl=US&ceid=US:en","Mon 15 May 2023 23:45:34","After missing the start of the season with a left hamstring strain, De La Cruz has a .278/.369/.589 line with six homers in 21 games. His power, run and arm tools all grade out as at least plus, and he has the Statcast numbers to back it up. Last Tuesday, he recorded three batted-ball exit velocities above 116 mph – something no team (never mind individual) had ever recorded in a single game in the Statcast era. His 99.2 mph seed from third base on May 5 remains the highest Statcast-measured velo on an infield throw by anyone in the Majors or Triple-A this season."
"game","1991-11-21","Not Discerned","Not Discerned","https://news.google.com/rss/articles/CBMiTWh0dHBzOi8vd3d3LmJ1enpmZWVkLmNvbS9yYXZlbmlzaGFrL2Jlc3QtdmlkZW8tZ2FtZXMtZnJvbS1jaGlsZGhvb2QtYWRkLXlvdXJz0gEA?oc=5&hl=en-US&gl=US&ceid=US:en","Tue 16 May 2023 04:31:02","While the newest Legend of Zelda: Tears of the Kingdom just came out, maybe you loved the Legend of Zelda: A Link to the Past as a kid when it first came out on SNES (aka Super Nintendo Entertainment System) because it was the first time you felt transported into another world."
"game","2019-01-16","Not Discerned","Not Discerned","https://news.google.com/rss/articles/CBMib2h0dHBzOi8vd3d3LmNoaWNvZXIuY29tLzIwMjMvMDUvMTUvc3VuYnJlYWstbWFrZXMtbW9uc3Rlci1odW50ZXItcmlzZS1hLW11c3QtcGxheS1leHBlcmllbmNlLXZpZGVvLWdhbWUtb2R5c3NledIBdGh0dHBzOi8vd3d3LmNoaWNvZXIuY29tLzIwMjMvMDUvMTUvc3VuYnJlYWstbWFrZXMtbW9uc3Rlci1odW50ZXItcmlzZS1hLW11c3QtcGxheS1leHBlcmllbmNlLXZpZGVvLWdhbWUtb2R5c3NleS9hbXAv?oc=5&hl=en-US&gl=US&ceid=US:en","Mon 15 May 2023 22:32:40","While “Monster Hunter Rise” created a great foundation it is the expansion, “Sunbreak” that has launched the game onto a new level. With an expanded roster and much deeper endgame “Sunbreak” is a complete display of what makes the series one of the absolute best in gaming.  A new threat has emerged in the form of Malzeno, a vampire-like dragon that has created a frenzy among the monsters leading to a wave of destruction. While the series still hasn’t been able to deliver a truly compelling story with these games the callbacks to “Monster Hunter 4” will be appreciated by longtime fans. While the story can be more of a roadblock than something to enjoy the plethora of new monster designs are great and make for an intimidating roster of beasts and behemoths to fight.  The expansion also comes with a new set of skills for every weapon type and the ability to change between two sets of skills on the fly. These new skills make the weapons feel fresher and add enticing options for players wh"
"game","2017-01-01","Not Discerned","Not Discerned","https://news.google.com/rss/articles/CBMicWh0dHBzOi8vd3d3LnJldXRlcnMuY29tL3Nwb3J0cy9zb2NjZXIvaW4tZ2FtZS1hdWRpby12YXItY2FsbHMtYmUtcmVsZWFzZWQtbW9yZS1vZnRlbi1uZXh0LXNlYXNvbi13ZWJiLTIwMjMtMDUtMTYv0gEA?oc=5&hl=en-US&gl=US&ceid=US:en","Tue 16 May 2023 04:59:00","              May 16 (Reuters) - Releasing in-game audio recordings of VAR decisions concerning key incidents in Premier League matches is likely to become more common next season, referees' chief Howard Webb has said.  In-game audio from key decisions was released for the first time when Webb joined Sky Sports pundits Gary Neville and Jamie Carragher on the Monday Night Football programme to discuss incidents from this season.  Webb showed video and audio recordings of interactions between on-field referees and VAR officials discussing in-game situations and explained how the decisions were made.  ""We're looking to do this (release audio) as much as we possibly can,"" Professional Game Match Officials Limited chief Webb said on the show, noting that FIFA would not allow them to play the audio live during the game. ""Tonight is obviously something new. We're making a small step forward. Going forward into next season we will look to do more of the same.""  VAR was introduced to the Premi"
"game","2019-10-12","Not Discerned","{""LosAngeles"", ""California"", ""UnitedStates""}","https://news.google.com/rss/articles/CBMijwFodHRwczovL3d3dy5jYnNzcG9ydHMuY29tL3duYmEvbmV3cy9tZXJjdXJ5cy1icml0dG5leS1ncmluZXItc2F5cy1uYXRpb25hbC1hbnRoZW0taGl0LWRpZmZlcmVudC1pbi1maXJzdC13bmJhLWdhbWUtc2luY2UtcmV0dXJuaW5nLWZyb20tcnVzc2lhL9IBAA?oc=5&hl=en-US&gl=US&ceid=US:en","Tue 16 May 2023 00:36:00","Phoenix Mercury star Brittney Griner recently returned to the court for the first time since her detention in Russia, playing 17 minutes in a preseason game against the Los Angeles Sparks. She finished with 10 points and three rebounds in a loss, but the outcome was irrelevant considering the circumstances.  It was encouraging to see Griner playing basketball again after missing the entire 2022 season and spending almost 300 days in Russian custody. She only returned to the United States in December via a prisoner swap, and has had little time to try and find some normalcy and get back in playing shape before the season.  Getting a chance to suit up again meant a lot to the eight-time All-Star, as did hearing the national anthem.  ""I'm grateful to be here, that's for sure. I'm not going to take a day for granted,"" Griner said after the game. ""Hearing the national anthem, it definitely hit different,"" Griner said. ""It's like when you go for the Olympics, you're sitting there, about to "
"game","2023-07-10","Not Discerned","{""Arizona"", ""Atlantida"", ""Honduras""}","https://news.google.com/rss/articles/CBMiTGh0dHBzOi8vY29taWNib29rLmNvbS9nYW1pbmcvbmV3cy9zdGVhbS1kZWNrLXBjLWdhbWUtcG9zdGFsLTItZG93bmxvYWQtc2FsZS_SAVBodHRwczovL2NvbWljYm9vay5jb20vZ2FtaW5nL2FtcC9uZXdzL3N0ZWFtLWRlY2stcGMtZ2FtZS1wb3N0YWwtMi1kb3dubG9hZC1zYWxlLw?oc=5&hl=en-US&gl=US&ceid=US:en","Mon 15 May 2023 12:29:00","Steam users can now play one of the most controversial games ever released for practically free, and by practically free, we mean for only $0.99. Normally to download and play the game on Steam you need to fork over $9.99, but the game is currently on sale and discounted 90 percent. The catch is this deal expires later today. In other words, by the time you're reading this, it may have very well expired.  As for the game, it's Postal 2, an open-world first-person shooter from 2003 and Arizona-based developer Running with Scissors. And if you were around in 2003, you will remember this game for all the controversey it casued when it was released. For example, the Office of Film and Literature Classification in New Zealand banned the game, citing its over-the-top violent content among other things. In fact, distribution or purchase of the game was illegal and could land you 10 years in prison and a fine of $50,000. In addition to New Zealand, Australia also banned the game while the Ger"
"game","2023-09-10","22:00:00","{""Philadelphia"", ""Pennsylvania"", ""UnitedStates""}","https://news.google.com/rss/articles/CBMiY2h0dHBzOi8vZ2lhbnRzd2lyZS51c2F0b2RheS5jb20vbGlzdHMvbmV3LXlvcmstZ2lhbnRzLWdhbWUtYnktZ2FtZS1wcmVkaWN0aW9ucy0yMDIzLXJlZ3VsYXItc2Vhc29uL9IBAA?oc=5&hl=en-US&gl=US&ceid=US:en","Mon 15 May 2023 14:55:00","The 2023 regular season schedule is officially out and the New York Giants got the raw end of the deal.  By every metric and measure, the Giants were handed the league’s most difficult schedule — especially early on. They will play three games in 11 days to start, four prime time games over their first six, and seven of their first 11 games will come on the road.  That’s a tough challenge for anyone, but don’t expect head coach Brian Daboll to complain about it. He’ll have his guys focused and ready to go from the jump.  But how will the Giants do facing such an unrelenting schedule? Let’s try to predict it.  Here are the way-too-early game-by-game predictions from those of us at Giants Wire."
"game","2023-05-12","Not Discerned","Not Discerned","https://news.google.com/rss/articles/CBMiaGh0dHBzOi8vbmV3cy5zdG9ueWJyb29rLmVkdS91bml2ZXJzaXR5L2dhbWUtb24taW5ub3ZhdGlvbi1jb2xsYWJvcmF0aW9uLWF0LWdhbWUtcHJvZ3JhbW1pbmctY29tcGV0aXRpb24v0gEA?oc=5&hl=en-US&gl=US&ceid=US:en","Mon 15 May 2023 15:19:55","Computer science students leveled up their skills in this year’s annual Game Programming Competition.  The 19th annual competition, presented by the Department of Computer Science in the College of Engineering and Applied Sciences, showcased the work of student teams who created innovative 2D or 3D video games. This year’s event on May 12 was offered in-person in the Student Activities Center auditorium and live-streamed on the competition’s Twitch channel.  The 12 finalists were selected by computer science faculty from more than 40 games developed in computer science courses CSE 380 2D Game Programming and CSE 381 3D Game Programming. Teams of finalists presented their games to an audience of more than 100 students, family and community members.  Games were judged based on programming skills and creativity. Some teams developed original music scores to accompany the game, changing music tempo based on the level. The competition allows students to engage in experiential learning whil"
"game","2023-05-15","Not Discerned","{""Jacksonville"", ""Florida"", ""UnitedStates""}","https://news.google.com/rss/articles/CBMiggFodHRwczovL3d3dy5qYWNrc29udmlsbGUuY29tL3N0b3J5L3Nwb3J0cy9uaGwvMjAyMy8wNS8xNS9lY2hsLWhvY2tleS1wbGF5b2Zmcy0yMDIzLWV2ZXJibGFkZXMtZWxpbWluYXRlLWljZW1lbi1nYW1lLTYvNzAyMTU4MTAwMDcv0gEA?oc=5&hl=en-US&gl=US&ceid=US:en","Tue 16 May 2023 03:45:01","Florida Times-Union  Turning point: Tyler Irvine scored the opening goal at 9:13 of the first period and the Florida Everblades led the rest of the way, defeating the Jacksonville Icemen 5-2 in Monday night's Game 6 and eliminating them from the second round of ECHL hockey's Kelly Cup playoffs at VyStar Veterans Memorial Arena.  Three stars: 1. Irvine, Florida (three goals). 2. Cam Johnson, Florida (17 saves). 3. Ara Nazarian, Jacksonville (one goal).  Penalty box: After Nazarian's goal had given Jacksonville hope at the end of the second period, Irvine scored a back-breaker at 11:19 of the third . He exited the box once his high-sticking minor expired, reached a pass from Levko Koper and notched his second goal for a 3-1 Everblades lead.  Around the rink: Derek Lodermeier scored for Jacksonville with a minute and a half to go, but Florida put the game away with empty-netters from Koper and Irvine. ... Goalie Parker Gahagen saved 23 shots for the Icemen. ... Christopher Brown assisted"
"game","2019-05-27","Not Discerned","{""Boston"", ""Massachusetts"", ""UnitedStates""}","https://news.google.com/rss/articles/CBMiPGh0dHBzOi8vd3d3LnZhbml0eWZhaXIuY29tL3N0eWxlLzIwMjMvMDUvamF5bGVuLWJyb3duLWdhbWUtN9IBQGh0dHBzOi8vd3d3LnZhbml0eWZhaXIuY29tL3N0eWxlLzIwMjMvMDUvamF5bGVuLWJyb3duLWdhbWUtNy9hbXA?oc=5&hl=en-US&gl=US&ceid=US:en","Mon 15 May 2023 20:58:30","At least eight hours of sleep, a plate of pasta, fresh braids, and a look that’s reflective of his mood and penchant for luxury-meets-casual style. They’re all part of Boston Celtic Jaylen Brown’s game-day preparation. “I like to dress up and down at the same time, if that makes sense,” Brown told Vanity Fair ahead of Sunday’s matchup against the Philadelphia 76ers. “So, it’s like you take something luxury—a nice piece that makes [your outfit] look formal—and then wear some sweatpants with it.”  By Shawn Clarke, Medulla Media Company  Born and raised in Atlanta, where he says fashion “has always been a thing,” Brown’s personal style further developed as a student athlete at the University of California, Berkeley. “I’d see somebody wearing an Alexander McQueen skirt, but then [they’d] have on a regular crew neck or a hoodie, with dress shoes and high socks or something. To me, that was dope.”  Brown’s Game 7 look struck the balance of understated and elevated he’s drawn to: a Realtakai"
"game","2023-06-19","Not Discerned","{""Irvine"", ""California"", ""UnitedStates""}","https://news.google.com/rss/articles/CBMiZ2h0dHBzOi8vd3d3LmxhdGltZXMuY29tL2VudGVydGFpbm1lbnQtYXJ0cy9zdG9yeS8yMDIzLTA1LTE1L3RoZS1nYW1lcy13ZXJlLW1vc3QtZXhjaXRlZC1mb3ItdGhpcy1zdW1tZXLSAQA?oc=5&hl=en-US&gl=US&ceid=US:en","Mon 15 May 2023 14:10:23","Prepare to stay indoors this summer.  Already in 2023 we’ve seen the arrival of a number of major, lengthy games including “Star Wars Jedi: Survivor” and “The Legend of Zelda: Tears of the Kingdom”— and the release slate isn’t letting up. Whether you want to battle hellish demons — both literal ones and the more existential kind — or take part in an interactive Mickey Mouse film, games this summer will have you covered. And this just scratches the surface.  Here are five games we can’t wait to play.  “Diablo IV” promises hours of metaphorical hellish action. (Activision Blizzard)  ‘Diablo IV’  Release date: June 5  Platforms: PlayStation consoles, Xbox consoles, PC  Look, life can be stressful. Sometimes the best relief is to escape into a metaphorical hell-world and slash at demons and battle with the dead. “Diablo IV,” from Irvine’s Blizzard Entertainment, promises plenty of necromancy action as we explore the elegantly gloomy world of the Sanctuary, a realm between heaven and hell "
"game","2023-05-16","Not Discerned","{""Omaha"", ""Nebraska"", ""UnitedStates""}","https://news.google.com/rss/articles/CBMiVWh0dHBzOi8vZ29jcmVpZ2h0b24uY29tL25ld3MvMjAyMy81LzE1L2Jhc2ViYWxsLWZhY2VzLW9tYWhhLWluLWNveC1raWRzLWRheS1nYW1lLmFzcHjSAQA?oc=5&hl=en-US&gl=US&ceid=US:en","Mon 15 May 2023 20:14:25","Omaha, Neb. --  Probable Pitching Matchups (2023 Stats)  Tuesday, May 16 ERA W-L App GS CG SHO IP H R ER BB SO  Anthony Watts (RHP) 5.18 2-3 12 7 0 0/0 40.0 39 23 23 22 25 CU -(RHP) 5.18 2-3 12 7 0 0/0 40.0 39 23 23 22 25  Series History: Creighton Leads Omaha 58-35  Scouting the Mavericks: 20-23  Scouting the Bluejays: 23-22  In-State Rivalries Have Intensified of Late  2023 Records (Omaha and Creighton play on May 16)  Creighton: 2-2 (.500)  In-state D1 Baseball Standings since 2018  Creighton: 15-7 (.682)  Creighton Baseball begins the final week of the regular season on Tuesday, May 16 as the Bluejays host Omaha. The game is Creighton's Annual Cox Kids Day at the Ballpark. Elementary schools from throughout the Omaha area bus in children for the contest.Omaha - Alex Potter (RHP) 7.40 1-0 9 2 0 0/0 20.2 38 25 17 16 11Creighton holds a significant edge on the Mavericks, but Omaha has won the last four contests. Since Omaha moved to Division I in 2012, the Bluejays at 13-8 against th"
"game","2023-05-22","Not Discerned","{""China"", ""NuevoLeon"", ""Mexico""}","https://news.google.com/rss/articles/CBMiM2h0dHBzOi8vd3d3LnRlbmNlbnQuY29tL2VuLXVzL2FydGljbGVzLzIyMDE1OTIuaHRtbNIBAA?oc=5&hl=en-US&gl=US&ceid=US:en","Tue 16 May 2023 06:16:27","Comprehensive product line-up demonstrates commitment to company values  Tencent Games is focused on strengthening its underlying technologies and enhancing its teams’ expertise, the company said on Monday.  A focus on the future underpinned Tencent Games' unveiling of upcoming projects aimed at the China market at its annual SPARK conference held on the same day.  During the online conference, Tencent Senior Vice President Steven Ma discussed the emergence of ChatGPT and the potential the technology represents. He likened it to the ever-growing and symbiotic relationship between game development and the latest technology that has made it possible for innovative leaps.  Tencent Senior Vice President Steven Ma speaks at SPARK 2023  “Driven by the growing and evolving needs of users, games have always embraced and applied the most cutting-edge scientific and technological advancements in a timely manner. The flipside is also true: Games represent a powerful driving force for AI and tech"
"game","2023-05-16","17:00:00","{""Corvallis"", ""Oregon"", ""UnitedStates""}","https://news.google.com/rss/articles/CBMiemh0dHBzOi8vb3N1YmVhdmVycy5jb20vbmV3cy8yMDIzLzUvMTUvYmFzZWJhbGwtYmVhdmVycy1vcGVuLWZvdXItZ2FtZS1ob21lc3RhbmQtd2l0aC10dWVzZGF5LW1pZHdlZWstYWdhaW5zdC1wb3J0bGFuZC5hc3B40gEA?oc=5&hl=en-US&gl=US&ceid=US:en","Mon 15 May 2023 22:36:02","Oregon State (36-15) vs. Portland (26-20)May 16, 2023 • 5:35 p.m. PT • Corvallis, Ore. • Goss Stadium at Coleman FieldRHP(3-1, 5.26) vs. RHP Brock Gillis (3-3, 5.83)The GameOregon State plays its third and final game of the regular season against Portland when the teams square off Tuesday night at Goss Stadium at Coleman Field. First pitch is slated for 5:35 p.m. PT.RadioThe game will be carried live on the Beaver Sports Network throughout the state of Oregon. Mike Parker will call the action.Listen OnlineCatch the game online by visiting osubeavers.com, and find the live broadcast on the Oregon State baseball schedule page. The games can be heard via the Varsity Network, which is available for users with smartphones and tablets. Download the free Varsity Network application for live games and archived broadcasts.TelevisionThe game will not be televised.Live VideoLive video of the game is available, via a live stream produced by Oregon State, by visiting osubeavers.com. It can also be"
"game","2023-05-12","Not Discerned","{""LosAngeles"", ""California"", ""UnitedStates""}","https://news.google.com/rss/articles/CBMiqwFodHRwczovL2VzcG5wcmVzc3Jvb20uY29tL3VzL3ByZXNzLXJlbGVhc2VzLzIwMjMvMDUvbG9zLWFuZ2VsZXMtbGFrZXJzLXZzLWdvbGRlbi1zdGF0ZS13YXJyaW9ycy1nYW1lLTYtb24tZXNwbi13YXMtbW9zdC13YXRjaGVkLW5iYS1jb25mZXJlbmNlLXNlbWlmaW5hbHMtZ2FtZS1pbi0xMi15ZWFycy_SAa8BaHR0cHM6Ly9lc3BucHJlc3Nyb29tLmNvbS91cy9wcmVzcy1yZWxlYXNlcy8yMDIzLzA1L2xvcy1hbmdlbGVzLWxha2Vycy12cy1nb2xkZW4tc3RhdGUtd2FycmlvcnMtZ2FtZS02LW9uLWVzcG4td2FzLW1vc3Qtd2F0Y2hlZC1uYmEtY29uZmVyZW5jZS1zZW1pZmluYWxzLWdhbWUtaW4tMTIteWVhcnMvYW1wLw?oc=5&hl=en-US&gl=US&ceid=US:en","Mon 15 May 2023 09:52:44","Game 6 of the Los Angeles Lakers vs. Golden State Warriors NBA Western Conference Semifinals series on ESPN was the most-watched Conference Semifinals game broadcast in 12 years (since 2011), according to Nielsen.  The ESPN broadcast delivered an average of 8,640,000 viewers, peaking with 9,295,000 viewers at 11 p.m. ET. This was the most-watched program of the day for May 12 across all of television and in all key demographics.  The Game 6 viewership was up 38 percent from last year’s comparable game – Golden State Warriors vs. Memphis Grizzlies – which averaged 6,282,000 viewers.  ESPN’s coverage of the NBA Playoffs continues on Tuesday, May 16, with exclusive coverage of the NBA Western Conference Finals: ESPN Press Room.  -30-  ESPN media contacts:  [email protected];  [email protected]"
"game","2017-01-01","Not Discerned","{""Kyoto"", ""Kyoto"", ""Japan""}","https://news.google.com/rss/articles/CBMidGh0dHBzOi8vd3d3LnRoZWd1YXJkaWFuLmNvbS9nYW1lcy8yMDIzL21heS8xNS9tYWtlcnMtbWVnYS1oaXQtdmlkZW8tZ2FtZS1sZWdlbmQtb2YtemVsZGEtdGVhcnMtb2YtdGhlLWtpbmdkb20taHlydWxl0gF0aHR0cHM6Ly9hbXAudGhlZ3VhcmRpYW4uY29tL2dhbWVzLzIwMjMvbWF5LzE1L21ha2Vycy1tZWdhLWhpdC12aWRlby1nYW1lLWxlZ2VuZC1vZi16ZWxkYS10ZWFycy1vZi10aGUta2luZ2RvbS1oeXJ1bGU?oc=5&hl=en-US&gl=US&ceid=US:en","Mon 15 May 2023 16:00:00","The release of a new Zelda game is always a major event worldwide. Ever since 1986, when famed Japanese game designer Shigeru Miyamoto first attempted to capture in code some of the wonder he experienced exploring the Kyoto countryside as a child, Zelda games have been pushing the boundaries of what’s possible in virtual worlds. Look at any best-games-of-all-time list and you’ll see Zelda in the Top 10, often more than once.  But 2017’s The Legend of Zelda: Breath of the Wild was particularly special. Launching alongside the Nintendo Switch console, which has since sold more than 125m units, it was perhaps the best realisation yet of the promise of boundless freedom and adventure that video games have been dangling in front of players’ noses for decades. It got rave reviews and sales hit 30m, many millions of those buyers new to the fantasy world of Hyrule. Pretty much everyone loved it. Soon, indie-pop star St Vincent was confessing to putting 300 hours into it.  Gaaahh, how do I do "
"game","2023-05-15","Not Discerned","{""Oakland"", ""California"", ""UnitedStates""}","https://news.google.com/rss/articles/CBMiSWh0dHBzOi8vdGhlamVvcGFyZHlmYW4uY29tLzIwMjMvMDUvamVvcGFyZHktbWFzdGVycy01LTE1LTIwMjMtZ2FtZS0xLmh0bWzSAU1odHRwczovL3RoZWplb3BhcmR5ZmFuLmNvbS8yMDIzLzA1L2plb3BhcmR5LW1hc3RlcnMtNS0xNS0yMDIzLWdhbWUtMS5odG1sL2FtcA?oc=5&hl=en-US&gl=US&ceid=US:en","Mon 15 May 2023 21:01:11","Are you looking for today’s regular-game recap? Find it here!  Are you looking for the recap for tonight’s second Masters game? Find it here!  Warning: This page contains spoilers for the May 15, 2023, first game of Jeopardy! Masters — please do not scroll down if you wish to avoid being spoiled. It will be updated alongside the Eastern Time airing of the show, beginning at about 8:00 PM Eastern.  This game’s Jeopardy! Masters contestants:  Amy Schneider, a writer from Oakland, California (3 points)  Matt Amodio, a postdoctoral researcher from Cambridge, Massachusetts (3 points)  Mattea Roach, a writer & podcaster from Toronto, Ontario, Canada (7 points)    Andy’s Pregame Thoughts:  Today’s first game features Mattea Roach, Matt Amodio, and Amy Schneider. Matt and Amy are on 3 points, 4 points behind Mattea in third; this is a must-win game for both Matt and Amy. We’re nearing the end of the quarterfinals, and it’s becoming more likely that only one of Matt and Amy will make it throug"
"game","2017-07-25","Not Discerned","{""SanFrancisco"", ""California"", ""UnitedStates""}","https://news.google.com/rss/articles/CBMiRWh0dHBzOi8vd3d3LmdhbWVpbmZvcm1lci5jb20vcmV2aWV3L2h1bWFuaXR5L2JlY29taW5nLWEtcGVvcGxlLXBlcnNvbtIBSWh0dHBzOi8vd3d3LmdhbWVpbmZvcm1lci5jb20vcmV2aWV3L2h1bWFuaXR5L2JlY29taW5nLWEtcGVvcGxlLXBlcnNvbj9hbXA?oc=5&hl=en-US&gl=US&ceid=US:en","Mon 15 May 2023 17:27:00","Playing god is a familiar feeling for many video game genres, like action titles where your character is unstoppable or sims where you control everything. Roleplaying a god is rarely something I feel while playing puzzle games, but Humanity provides it in new and surprising ways. The unique style of puzzle solving uses directional signs and commands to guide droves of miniature people to an endpoint. The puzzles start simple, but Humanity builds on this core system throughout its 100-plus stages in exciting and challenging ways, pushing me to my limit while telling a heartfelt story about human nature.  Humanity is an immediately striking game. Its visual style is minimalistic, focusing squarely on the 3D puzzle area. But soft and beautiful backgrounds spotlight my actions as I guide colorful hordes of humans across various challenges. I begin with one simple command: a direction. I place it on the ground, and when the line of humans crosses it, they follow that direction. My journey "
"game","2023-05-16","Not Discerned","{""Portland"", ""Oregon"", ""UnitedStates""}","https://news.google.com/rss/articles/CBMicGh0dHBzOi8vcG9ydGxhbmRwaWxvdHMuY29tL25ld3MvMjAyMy81LzE1L2Jhc2ViYWxsLXBpbG90cy1zZXQtZm9yLWZpbmFsLW5vbmNvbmZlcmVuY2UtZ2FtZS1hZ2FpbnN0LW5vLTEwLWJlYXZlcnPSAQA?oc=5&hl=en-US&gl=US&ceid=US:en","Mon 15 May 2023 22:02:35","PROBABLE STARTERS  (2023 W-L, ERA)  THIS WEEK IN PILOTS BASEBALL  NEXT UP IN PILOTS BASEBALL  ABOUT THE PILOTS  LAST SEASON IN PILOT BASEBALL  ABOUT THE OPPONENT  Tuesday, May 15Corvallis, Ore.Goss StadiumOSU Leads 162-59-1POR 2, OSU 4 (5/9/23)RHP Brock Gillis (3-3, 5.83)RHP Aiden Jimenez (301, 5.26)• The Portland Pilots travel to Corvallis for their final nonconference game against the No. 10 Oregon State Beavers.• The two teams will play on Tuesday, May 16 at 5:35 p.m.• Check PortlandPilots.com for a live stream and stats as well.• The Pilots finish the regular season this weekend against the San Francisco Dons down in the Bay Area.• The two teams will play Thursday through Saturday, with all three games starting at 1 p.m.• Check PortlandPilots.com for a live stream and stats as well.• The Pilots are 26-20 overall and 15-9 in WCC play after winning their series against the Santa Clara Broncos.• The series win was the sixth of the season for the Pilots over a WCC team. They have now "
"game","2020-09-15","Not Discerned","{""SanFrancisco"", ""California"", ""UnitedStates""}","https://news.google.com/rss/articles/CBMiQGh0dHBzOi8vd3d3LmdyZWVubWFuZ2FtaW5nLmNvbS9ibG9nL2luZGllLWdhbWUtcm91bmR1cC1tYXktMjAyMy_SAQA?oc=5&hl=en-US&gl=US&ceid=US:en","Mon 15 May 2023 14:37:15","BEEP BOOP ROBOTS DETECTED  You have run afoul of our high-tech bot-busting defence system. This could be because:"
