"topic","date"," time","place","date published","article text","url"
"miracle","1995-10-14","Not Discerned","{""SanFrancisco"", ""California"", ""UnitedStates""}","Tue 16 May 2023 18:53:00","Mara Wilson was a fixture in several films of the 1990s that are widely considered to be modern classics: in a span of three years, she appeared in Mrs. Doubtfire, Matilda, and Miracle on 34th Street. She was barely six when she was cast in her first role as Natalie Hillard in Mrs. Doubtfire, and in a new interview with The Guardian, she revealed that even though her experiences on the sets of her films were generally positive, being in the public eye caused her lasting damage and trauma.  “I don’t think you can be a child star without there being some kind of lasting damage,” Wilson told the outlet. “The thing that people assume is that Hollywood is inherently corrupt, and there’s something about being on film sets that destroys you.”  She continued, “For me, that was not necessarily true. I always felt safe on film sets…I worked with a lot of really wonderful directors, who were used to working with children.”  But, she said, the media was not as compassionate, and the internet was not a safe place for her: “I was still sexualized,” she said. “I had people sending me inappropriate letters and posting things about me online… I made the mistake of Googling myself when I was 12 and saw things that I couldn’t unsee.”  After appearing the the 1996 film Matilda, she said things were difficult because people conflated her with her character, something she didn’t know how to handle at such a young age.  “I saw that [fans] were disappointed that I wasn’t as smart, pretty, nice, as they expect you to be. I think they were expecting me to be Matilda, and she’s wonderful, but she’s not real,” Wilson explained. “She’s brilliant in every single way. She’s smart, and kind and powerful. Then they met me, this nerdy, awkward teenager who got angry sometimes, but couldn’t even channel her anger into powers. I was never going to live up to that.”  Photo: Everett Collection  As she got older and she became less in-demand as an actor, she said she “had this Hollywood idea that if you’re not cute any more, if you’re not beautiful, then you are worthless… I directly tied that to the demise of my career. Even though I was sort of burned out on it, and Hollywood was burned out on me, it still doesn’t feel good to be rejected.”  Though she still works as an actor, Wilson has also become an advocate for child stars. In the past few years she has detailed her experiences in a 2016 book as well as in the HBO Max documentary Showbiz Kids. Wilson has a new book out now called Good Girls Don’t.","https://news.google.com/rss/articles/CBMiaGh0dHBzOi8vZGVjaWRlci5jb20vMjAyMy8wNS8xNi9tYXRpbGRhLWFjdHJlc3MtbWFyYS13aWxzb24tZGlzY3Vzc2VzLXRyYXVtYS1iZWluZy1zZXh1YWxpemVkLWNoaWxkLXN0YXIv0gFsaHR0cHM6Ly9kZWNpZGVyLmNvbS8yMDIzLzA1LzE2L21hdGlsZGEtYWN0cmVzcy1tYXJhLXdpbHNvbi1kaXNjdXNzZXMtdHJhdW1hLWJlaW5nLXNleHVhbGl6ZWQtY2hpbGQtc3Rhci9hbXAv?oc=5&hl=en-US&gl=US&ceid=US:en"
"miracle","2023-05-13","Not Discerned","{""Webster"", ""Texas"", ""UnitedStates""}","Tue 16 May 2023 18:27:14","ROCHESTER, N.Y. – Jason Jipson is a U.S. Marine Corps veteran who continues to help pull his brothers and sisters in arms up and out of the trenches.  And that’s why he is a recipient of a 2023 ESL Jefferson Award.  Jipson enlisted in the Marines straight out of high school, just a few years after 9/11.  “The first four years I was in Camp Lejeune. Deployed twice to Iraq in those 4 years,” he said.  During his eight years of service to our country, Jipson went through a lot physically, mentally, and emotionally.  Jason Jipson (WHEC) photo)  At times, he considered taking his own life.  “There was one point when I thought, ‘Tonight’s the night’ and then I was like, ‘I’ll wait until tomorrow’ and the next morning I woke up and I was like, ‘This isn’t okay. The way this feels is not okay.'”  That was the beginning of a decades-long mental health journey. Jipson was one of the first veterans here in Monroe County to take part in Trybe Ecotherapy, an outdoor program designed specifically for veterans to manage the effects of stress, anxiety, depression, or trauma.  When he completed the program, he became a peer mentor to help those vets in line behind him.  “I am not a veteran. I never had military service. I’m a clinician and there’s a level of connection that Jason had with these folks, that I just will never have,” Lindsay Cray, chief program officer of Trybe Ecotherapy.  “He sees people struggling and he’s not afraid to go in where it’s a little dark sometimes and we all need people to grab us by the ears and drag us out of the rabbit hole when we go down there and Jason has been a big part of that for me,” said Thomas Borden, a U.S. Navy veteran.  “He’s always willing to get in the ditch with you. Jason is like, ‘It’s alright. I’m going to get in there and dig with you because I’ve been there before,'” Alan Bartlo, a Marine Corps veteran, said.  His work has helped veterans live better lives.  “I feel like it’s my purpose. It’s why I’ve been put on this earth is to do exactly what I’m doing and I couldn’t be able to do that unless all of that stuff happened,” Jipson said.  And this is not where Jason’s dedication to the community ends.  He’s also a coach for children with special needs at Miracle Field in Webster.  Children like Julian Munoz.  “He spoke to the president of the league and was able to get Julian on the team. We were shedding tears because we never thought Julian would be able to play on a ‘regular’ team,” his father, Dan Munoz, said about Jipson.  It’s brought so much joy to Julian, who thinks Jipson is pretty special.  “Fun, funny, hard worker, determined, helping others,” Julian said.  Lewke: Every part of your life touches other people.  Jipson, teary-eyed: “Yeah. It’s hard. I don’t think about it that way.”  But the countless veterans and children he has helped do.  Learn more about the 2023 ESL Jefferson Award winners during a special program airing at 7:30 p.m. Saturday, June 3 on News10NBC.","https://news.google.com/rss/articles/CBMiW2h0dHBzOi8vd3d3LndoZWMuY29tL3RvcC1uZXdzL2l0cy1teS1wdXJwb3NlLWphc29uLWppcHNvbi1oZWxwcy12ZXRlcmFucy1saXZlLWJldHRlci1saXZlcy_SAQA?oc=5&hl=en-US&gl=US&ceid=US:en"
"miracle","1984-09-25","10:00:00","{""Mesa"", ""Arizona"", ""UnitedStates""}","DateString[Failure[""InterpretationFailure"", <|""MessageTemplate"" :> Interpreter::semantictype, ""MessageParameters"" -> <|""Type"" -> ""date with time"", ""Input"" -> ""Tue, 16 May 2023 07:00:00 GMT""|>, ""Type"" -> ""DateTime"", ""Input"" -> ""Tue, 16 May 2023 07:00:00 GMT""|>]]","Sunshine Acres in Mesa would lease 36 acres of its 110-acre campus, which includes a farm, living quarters for dozens of children, a chapel and other facilities. (Facebook)","https://news.google.com/rss/articles/CBMigQFodHRwczovL3d3dy5lYXN0dmFsbGV5dHJpYnVuZS5jb20vZWFzdC12YWxsZXkta2lkcy1ob21lLXBpdGNoZXMtaHVnZS1ob3RlbC1wbGFuL2FydGljbGVfMWU2ZWYzNWYtMDdkMy01MWE0LTk3MzktODM4Yzc4ZjA2YmFkLmh0bWzSAQA?oc=5&hl=en-US&gl=US&ceid=US:en"
"miracle","2023-05-15","19:00:00","{""Lagos"", ""Lagos"", ""Nigeria""}","Tue 16 May 2023 20:10:00","A Nigerian chef cooked up a storm — about 100 hours straight — trying to set a new world record for the longest culinary marathon by an individual.  Hilda Bassey, 27, known on social media as Hilda Baci, began cooking in her kitchen Thursday and continued till Monday evening, preparing more than 100 meals in all.  Baci is hoping to beat the Guinness World Record set by Lata Tondon, an Indian chef who cooked for 87 hours and 45 minutes straight in 2019.  Guinness World Records said it will have to review the evidence to ensure Baci didn’t cook the books.  “We are aware of the record attempt and are looking forward to receiving the evidence for our Records Management Team to review before we can confirm the record is official,” a rep said.  Thousands of Baci’s supporters gathered in the Lekki area of Lagos, Nigeria’s commercial hub, on Monday as she was finishing up her cooking marathon.  Nigerian chef Hilda Bassey, known on social media as Hilda Baci, began cooking Thursday. Twitter / @TheHildaBaci  The renowned Nigerian chef said she hopes her efforts will showcase how hardworking Nigerian women are and shine a spotlight on Nigerian food.  “Nigerian cuisine is the best out there,” she told CNN.  “The more recipes are propagated, the more people will be willing to try it. Nigerian food is such comfort food,” she added.  Baci began cooking Thursday and continued through Monday evening. AP  The chef said she nearly gave up on her first day of cooking but that once she surpassed the previous record, she felt inspired to continue, setting a goal for herself to hit 100 hours.  Tondon, the previous record holder, shared a heartfelt message of support for Baci as she proceeded with her attempt.  “The first day was the most difficult,” Baci said. “I was ready to give up six hours in. I feel like a miracle happened and somehow I got to this. The support has been incredible.”  Baci said she nearly dropped out after six hours of cooking. AP  Crowds gathered in support of Baci as she cooked, and despite forgoing sleep, she remained positive, oftentimes dancing and waving at the many fans who showed up in droves to support her, according to CNN.  Celebrities including Nigerian musician Tiwa Savage and local politicians also came to support Baci.  The determined chef only took 5-minute breaks every hour or accumulated one hour after a stretch of 12 hours.  Thousands of people turned out to support Baci as she attempted to break the record. AP  After Baci surpassed the previous record, President Muhammadu Buhari tweeted that it was a great night for Nigeria.  “Hilda’s drive, ambition and resilience have brought great interest and insight into the uniqueness of Nigerian food,” the president wrote.  With Post wires","https://news.google.com/rss/articles/CBMiWWh0dHBzOi8vbnlwb3N0LmNvbS8yMDIzLzA1LzE2L25pZ2VyaWFuLWNoZWYtc2V0cy13b3JsZC1yZWNvcmQtY29va2luZy0xMDAtaG91cnMtbm9uLXN0b3Av0gFdaHR0cHM6Ly9ueXBvc3QuY29tLzIwMjMvMDUvMTYvbmlnZXJpYW4tY2hlZi1zZXRzLXdvcmxkLXJlY29yZC1jb29raW5nLTEwMC1ob3Vycy1ub24tc3RvcC9hbXAv?oc=5&hl=en-US&gl=US&ceid=US:en"
"miracle","2001-09-11","Not Discerned","{""NewYork"", ""NewYork"", ""UnitedStates""}","Tue 16 May 2023 23:04:00","State Alabama Alaska Arizona Arkansas California Colorado Connecticut Delaware Florida Georgia Hawaii Idaho Illinois Indiana Iowa Kansas Kentucky Louisiana Maine Maryland Massachusetts Michigan Minnesota Mississippi Missouri Montana Nebraska Nevada New Hampshire New Jersey New Mexico New York North Carolina North Dakota Ohio Oklahoma Oregon Pennsylvania Rhode Island South Carolina South Dakota Tennessee Texas Utah Vermont Virginia Washington Washington D.C. West Virginia Wisconsin Wyoming Puerto Rico US Virgin Islands Armed Forces Americas Armed Forces Pacific Armed Forces Europe Northern Mariana Islands Marshall Islands American Samoa Federated States of Micronesia Guam Palau Alberta, Canada British Columbia, Canada Manitoba, Canada New Brunswick, Canada Newfoundland, Canada Nova Scotia, Canada Northwest Territories, Canada Nunavut, Canada Ontario, Canada Prince Edward Island, Canada Quebec, Canada Saskatchewan, Canada Yukon Territory, Canada  Zip Code","https://news.google.com/rss/articles/CBMivQFodHRwczovL3d3dy5pZGFob3N0YXRlam91cm5hbC5jb20vbmV3cy9sb2NhbC9iZXlvbmQtdGhhbmtmdWwteW91bmctd29tYW4tbWFraW5nLW1pcmFjdWxvdXMtcmVjb3ZlcnktYWZ0ZXItYmVpbmctc3RydWNrLWJ5LWNhci13aGlsZS1qb2dnaW5nL2FydGljbGVfZjU2OGFjNmEtZjQzZC0xMWVkLTgxMzctNTc2ZWE5OWQ1MzZhLmh0bWzSAcEBaHR0cHM6Ly93d3cuaWRhaG9zdGF0ZWpvdXJuYWwuY29tL25ld3MvbG9jYWwvYmV5b25kLXRoYW5rZnVsLXlvdW5nLXdvbWFuLW1ha2luZy1taXJhY3Vsb3VzLXJlY292ZXJ5LWFmdGVyLWJlaW5nLXN0cnVjay1ieS1jYXItd2hpbGUtam9nZ2luZy9hcnRpY2xlX2Y1NjhhYzZhLWY0M2QtMTFlZC04MTM3LTU3NmVhOTlkNTM2YS5hbXAuaHRtbA?oc=5&hl=en-US&gl=US&ceid=US:en"
"miracle","2014-10-14","10:00:00","{""SanFrancisco"", ""California"", ""UnitedStates""}","Tue 16 May 2023 08:18:05","Cookies on FT Sites  We use cookies and other data for a number of reasons, such as keeping FT Sites reliable and secure, personalising content and ads, providing social media features and to analyse how our Sites are used.","https://news.google.com/rss/articles/CBMiP2h0dHBzOi8vd3d3LmZ0LmNvbS9jb250ZW50LzI4OTZjY2U0LWU5MjQtNDgxMC1iNjM5LWNlMzg1YmI2YWIzZtIBAA?oc=5&hl=en-US&gl=US&ceid=US:en"
"miracle","2023-05-10","Not Discerned","{""Sheffield"", ""Sheffield"", ""UnitedKingdom""}","Tue 16 May 2023 09:00:00","Something went wrong, please try again later.  Invalid email Something went wrong, please try again later.  Get the latest Sheffield Wednesday news and updates to your inbox  Former Sheffield Wednesday defender Mark Beevers is back in England - and hopes to witness first-hand a play-off miracle.  Two of his old clubs face off on Thursday night when the Owls attempt to overturn a monumental 4-0 first leg loss against Peterborough United at Hillsborough.  Beevers, 33, is now plying his trade the other side of the world in Australia. But he's back on these shores after making a surprise return. He landed back in the UK just in time to shake off jetlag and play a part in the Steel City Derby legends game last weekend.  Read more: Jamie O'Hara questions play-off system as Sheffield Wednesday require miracle to reach Wembley  The match was held as a fundraiser for Rio Spurr, the son of former Wednesday player Tommy, who is recovering from cancer. Ex-players from both sides of the Steel City divide turned out and more than 1,400 supporters turned out to watch an entertaining charity match end 4-3 in the favour of the Blades.  Beevers progressed through Wednesday's youth ranks before making more than 150 appearances for the Owls. He then had a three-year spell with Posh prior to departing for A-League side Perth Glory last summer.  No side has ever overturned a three-goal deficit never mind a four-goal handicap but the former England under-19 international refuses to rule anything out.  Speaking to Yorkshire Live, the 33-year-old said: ""I'm going to go down. I would have liked it to be tighter to be honest!  ""Look, you never know. Looking at it I think Wednesday need to score a couple of early goals before half-time. It's a tall order of course it is, but if they get that early goal they could potentially put them on the back foot. Hopefully it'll be a good night of football.  ""Stranger things have happened. I'm sure there'll be a massive crowd there which can be intimidating for the away side. Hopefully they can make it a good tie.""  READ NEXT:","https://news.google.com/rss/articles/CBMiZ2h0dHBzOi8vd3d3LmV4YW1pbmVybGl2ZS5jby51ay9zcG9ydC9mb290YmFsbC9uZXdzL2JlZXZlcnMtc2hlZmZpZWxkLXdlZG5lc2RheS1wbGF5b2ZmLW1pcmFjbGUtMjY5MTYzMDXSAWtodHRwczovL3d3dy5leGFtaW5lcmxpdmUuY28udWsvc3BvcnQvZm9vdGJhbGwvbmV3cy9iZWV2ZXJzLXNoZWZmaWVsZC13ZWRuZXNkYXktcGxheW9mZi1taXJhY2xlLTI2OTE2MzA1LmFtcA?oc=5&hl=en-US&gl=US&ceid=US:en"
"miracle","2023-05-16","Not Discerned","{""Lincolnton"", ""NorthCarolina"", ""UnitedStates""}","Tue 16 May 2023 10:00:00","Lincolnton, NC, May 16, 2023 --( PR.com )-- “A Journey Of Miracles”: a potent reminder of God’s hand upon each of our lives. “A Journey Of Miracles” is the creation of published author Christopher Greeson, who married his high school sweetheart right after graduating from college. They have now been married for over fifty-one years. He has two daughters and four grandchildren.Greeson shares, “How do you define the words journey and miracle? What do you base your definition on? Many times, these are defined by what’s happening in an individual’s life or simply by an emotional response to a particular situation. Sometimes, these words are used so often that their meaning and their impact on our lives are actually diminished and can even become inaccurate.“These wide varieties of definitions can make for great discussions and good learning experiences when conducted respectfully and with open minds. In A Journey of Miracles, I share my thoughts on what these two words mean to me. It is written to honor what God has done, and continues to do, in my life. I am not a professional writer, so I know through the whole writing process, I was helped and inspired by the Holy Spirit. I pray they encourage, remind, renew, and engage each of you.“God created you. God knows each of you. God loves you. You are significant to him. You are his miracle. He longs for you to join him on the journey he has for you. Trust God. You are never alone. God has never made a mistake with a life. You have a purpose in his world.”Published by Christian Faith Publishing, Christopher Greeson’s new book will engage the spirit as readers reflect and consider their own blessings.Greeson shares in hope of offering an encouraging hand to anyone struggling with their purpose or personal connection to God.Consumers can purchase “A Journey Of Miracles” at traditional brick & mortar bookstores, or online at Amazon.com, Apple iTunes store, or Barnes and Noble.For additional information or inquiries about “A Journey Of Miracles,” contact the Christian Faith Publishing media department at 866-554-0919.","https://news.google.com/rss/articles/CBMiJ2h0dHBzOi8vd3d3LnByLmNvbS9wcmVzcy1yZWxlYXNlLzg4NjUxN9IBAA?oc=5&hl=en-US&gl=US&ceid=US:en"
