"topic","date"," time","place","date published","article text","url"
"miracle","2023-05-17","Not Discerned","Not Discerned","Wed 17 May 2023 23:02:43","On Wednesday, StockNews.com issued a research report that upgraded Scotts Miracle-Gro (NYSE:SMG) from a “sell” rating to a “hold” rating. The basic materials company recently released its quarterly earnings data on May 3rd, beating the consensus estimate by $0.58, with an earnings per share of $3.78. Though the return on equity is impressive at 81.02%, Scotts Miracle-Gro did have a negative net margin of 16.57%. The business earned $1.53 billion in revenue for the quarter, falling short of analysts’ predictions of $1.61 billion and experiencing an 8.8% year-over-year decrease in revenue.  Scotts Miracle-Gro Co specializes in the production, marketing, and distribution of products and services for lawn care, gardening and landscape, hydroponic hardware and growing environments, lighting controls, and marketing agreements. With this wide array of offerings available under its umbrella brand name Scotts Miracle-Gro has grown into a household name synonymous with successful gardening techniques.  The recent upgrade from a “sell” to a “hold” rating comes as welcome news to both investors in the company and those who rely on Scotts Miracle-Gro’s products for their own lawn care needs. As predicted by analysts, the basic materials company is set to post an EPS of 2.8 for the current year.  Overall it is clear that Scotts Miracle-Gro remains a leader in its industry but also continues to work towards improvement despite fantastic returns on equity year after year while delivering excellent service as well as top-of-the-line products.    SMG Updated on: 17/05/2023 Financial Health Neutral Debt to equity ratio: Price to earnings ratio: Price to book ratio: Show more Price Target Current $0.00 Concensus $0.00 Low $0.00 Median $0.00 High $0.00 Show more Social Sentiments We did not find social sentiment data for this stock Analyst Ratings There are no analysts data to display  Scotts Miracle-Gro Co’s Target Price Decrease and Insider Selling Raises Instability Concerns Among Investors  Scotts Miracle-Gro Co, a company that deals in the manufacturing, marketing and sale of products for lawn and garden care and indoor gardening has recently experienced a decrease in target price by several investment analysts. On Friday, May 5th, UBS Group lowered their target price from $80.00 to $70.00. Raymond James had also lowered the target price from $92.00 to $86.00 on Thursday, May 4th while Stifel Nicolaus had lowered it from $80.00 to $78.00 on the same day with Barclays following suit on Wednesday, April 26th when they too reduced Scotts Miracle-Gro from an “overweight” rating to an “equal weight” rating thereby bringing down their price objective for the company from $105.00 to $70.00. Furthermore, Truist Financial had decreased their price objective on Scotts Miracle-Gro from $70.00 to $65.00 on Thursday, May 4th.  Interestingly though, four investment analysts have given Scotts Miracle-Gro’s stock a hold rating while three gave it a buy rating with one offering it a strong buy rating delivering it with overall Moderate Buy consensus ratings coupled with a consensus price target of $76.29 as stated by Bloomberg.  Scotts Miracle-Gro’s stock opened at $65.53 on Wednesday with its fifty-day simple moving average located at $70.88 and its two-hundred-day simple moving average situated at $65.38 as observed by financial indicators.This type of behavior is scaring some investors since this indicates an uncertainty about future revenue since the value has continually being adjusted downwards despite previous optimism.  However,it is important to note that Scotts Miracle-Gro has continued to demonstrate its resilience within its field of specialization;with major areas of focus including lawn care products,gardening services both for indoors spaces and landscape as well as hydroponic hardware and growing environments. The company has consistently offered valuable products and services to meet consumers’ needs.  Looking deeper into the recent news, it is observed that on Thursday, February 16th, EVP Denise Stump sold 2,503 shares of the stock at an average price of $86.51 thereby attaining a total transaction of $216,534.53. Following the sale,the executive vice president now directly owns 39,875 shares in the company valued approximately at $3,449,586.25.On Friday May 12,Ceo James Hagedorn sold 25,000 shares of Scotts Miracle-Gro’s stock price at an average value of $67 amounting to a net worth of $1,675,000.00.The Chief Executive Officer now directly owns 179,899 shares in the company equating to approximarely $12 million dollars.The transaction was disclosed in a document filed with the Securities & Exchange Commission through which valuable information can be obtained.Also,during this timeframe,EVP Denise Stump had sold an additional number of stocks.  The above data depicts instability since there is no statistical constant variation between value purchased or resold by executives,and its analysis reveals that insiders own 27.28% of the enterprise’s Shares.  Institutional investors and Hedge funds made several acquisitions and dispositions respectively in recent times.Subsequently,hedge fund owners have initiated series of negotiations leading to possible transactions with Scotts Miracle-Gro Co.  Overall,it is important investors need to weigh various factors before making investment choices ,however it’s advisable not make any rush decisions solely upon seeing information about target pricing.A good understanding should be reached as pertaining to all relevant factors before any decision making thereby edifying one from mistakes that could culminate into financial loss.At last count around 69% percent ownership belonged to institutional investors and hedge funds,speaking volumes for vested interests in the stability of this stock.","https://news.google.com/rss/articles/CBMiSGh0dHBzOi8vYmVzdHN0b2Nrcy5jb20vc2NvdHRzLW1pcmFjbGUtZ3JvLXVwZ3JhZGVkLXRvLWhvbGQtcmF0aW5nLWFuZC1jL9IBAA?oc=5&hl=en-US&gl=US&ceid=US:en"
"miracle","2023-10-01","19:00:00","{""Lourdes"", ""MidiPyrenees"", ""France""}","Wed 17 May 2023 10:00:15","Why did this happen?  Please make sure your browser supports JavaScript and cookies and that you are not blocking them from loading. For more information you can review our Terms of Service and Cookie Policy.","https://news.google.com/rss/articles/CBMiX2h0dHBzOi8vd3d3LmJsb29tYmVyZy5jb20vbmV3cy9uZXdzbGV0dGVycy8yMDIzLTA1LTE3L3JlbWVtYmVyLXdoZXJlLW1lZGljYWwtbWlyYWNsZXMtY29tZS1mcm9t0gEA?oc=5&hl=en-US&gl=US&ceid=US:en"
"miracle","2019-07-25","Not Discerned","{""Minneapolis"", ""Minnesota"", ""UnitedStates""}","Wed 17 May 2023 22:00:46","Experts warn children could be taking it for life to avoid gaining weight  Children as young as 12 could receive the appetite-suppressing medicine  Obese teenagers should be prescribed new weight loss jabs for the rest of their lives, scientists have said.  Weekly injections of semaglutide were found to significantly reduce the weight of adolescents in a major trial of the new drug.  Experts said the findings support calls for children as young as 12 to be given the appetite-suppressing medicine, in a bid to drive down childhood obesity levels.  Researchers described the results of the treatment - which saw children lose an average of three stone - as ‘transformational for many teenagers.’  Almost half of 12 to 18-year-olds using the drug dropped below the clinical cut-off for obesity, according to the research involving 201 youngsters  They suggested early intervention could help protect children from a lifetime of obesity and its associated health complications.  But they warned it was likely children would pile on the pounds once they stopped using the treatment, meaning they would potentially be taking it ‘for life.’  Almost half of 12 to 18-year-olds using the drug dropped below the clinical cut-off for obesity, according to the research involving 201 youngsters.  On average, those taking part weighed 17 stone and lost 3 stone during the 16-month trial.  Three-quarters (74 per cent) of those taking semaglutide had an improvement of one or more BMI categories compared to fewer than one in five (19 per cent) taking a placebo.  Overall, it was found to reduce the proportion of children with the most severe degree of obesity from 37 to 14 per cent.  Presenting his findings at the European Congress on Obesity in Dublin, Dr Aaron Kelly, from University of Minnesota Medical School, said semaglutide should be available on the NHS for all teenagers with obesity ‘as part of a comprehensive treatment approach’ including lifestyle advice.  It was found to reduce the proportion of children with the most severe degree of obesity from 37 to 14 per cent  He said: ‘Semaglutide is transformative for many children who are able to get access. It can be lifechanging.  ‘Nothing brings me more pleasure than hearing the stories from adolescents who have been struggling their entire life to manage their weight of it. This gives them a tool to help take control of their weight, it’s transformational for many teenagers.’  The earlier children started taking the medication the better their outcome would be, he added, ideally tackling obesity before it could fully progress.  But he admitted those given the ‘lifechanging’ drug would likely need to stay on it for life, or risk the weight piling back on.  He added: ‘Obesity is a chronic disease. So chronic diseases require chronic treatments. You have to stay on that medication probably for the rest of your life.  ‘If you take that treatment away, it's like a rubber band, the weight goes right back to where it started.’  Going under the brand name of Wegovy, the weight loss drug has recently been given the go-ahead for use in adults on the NHS.  Regulators have yet to decide whether to grant its use - alongside a programme of diet and exercise - for obese teenagers.  A spokesperson for Novo Nordisk said: ‘Following clinical trials and a formal review by the MHRA, our medicines are granted a licence which will outline the approved indication and recommended dosage for UK adolescent patients.’  Commenting on the study findings, Professor Alex Miras, Professor of Endocrinology, Ulster University, said he was keen to see the drug approved by NICE but suggested delays in its availability could slow proceedings.  ‘Children in this trial have lost a very significant amount of weight. What is interesting is that so many achieved normal BMI which is a remarkable achievement,’ he said.  ‘We were expecting the medication to become available for adults in May but this has been postponed yet again. We don’t even know whether it will become available this year.  ‘I think that NICE is unlikely to move forward, unless it has got more certainty that the medication will be available.’","https://news.google.com/rss/articles/CBMigAFodHRwczovL3d3dy5kYWlseW1haWwuY28udWsvaGVhbHRoL2FydGljbGUtMTIwOTQ4NzUvRmF0LVRFRU5BR0VSUy1naXZlbi1taXJhY2xlLW5ldy13ZWlnaHQtbG9zcy1qYWJzLXJlc3QtbGl2ZXMtZG9jdG9ycy1zYXkuaHRtbNIBhAFodHRwczovL3d3dy5kYWlseW1haWwuY28udWsvaGVhbHRoL2FydGljbGUtMTIwOTQ4NzUvYW1wL0ZhdC1URUVOQUdFUlMtZ2l2ZW4tbWlyYWNsZS1uZXctd2VpZ2h0LWxvc3MtamFicy1yZXN0LWxpdmVzLWRvY3RvcnMtc2F5Lmh0bWw?oc=5&hl=en-US&gl=US&ceid=US:en"
"miracle","2023-07-12","Not Discerned","Not Discerned","Wed 17 May 2023 09:46:31","A cursory look at the standings three rounds into the inaugural FIA GT Championship would give little indication of what was to come over the remainder of the 1997 season. An 18-point advantage for Schnitzer McLaren-BMW drivers JJ Lehto and Steve Soper over Mercedes CLK-GTR pairing Bernd Schneider and Alex Wurz didn’t tell the true story either.  The new Mercedes run by the works AMG operation was clearly the quicker car and, once its teething troubles were ironed out for round four at the Nurburgring, it would be beaten only twice more that year. By the time it was replaced by the CLK-LM for the third round of the 1998 campaign, it had earned eight wins including five 1-2 finishes (from 13 attempts), eight pole positions (including four top-three lockouts) and truly moved the goalposts in GT racing. Not bad for a car that was conceived, built and given its race debut within the space of 128 days.","https://news.google.com/rss/articles/CBMiYWh0dHBzOi8vd3d3LmF1dG9zcG9ydC5jb20vZ3QvbmV3cy9ob3ctYS0xMjgtZGF5LW1lcmNlZGVzLW1pcmFjbGUtY3J1c2hlZC1pdHMtb3Bwb3NpdGlvbi8xMDQ3MDEwMy_SAQA?oc=5&hl=en-US&gl=US&ceid=US:en"
"miracle","2023-05-17","Not Discerned","{""Tennessee"", ""Illinois"", ""UnitedStates""}","Wed 17 May 2023 11:55:00","NEW ORLEANS (AP) — It’s a cliché that Kymyona Burk heard a little too often: “Thank God for Mississippi.”  As the state’s literacy director, she knew politicians in other states would say it when their reading test scores were down — because at least they weren’t ranked as low as Mississippi. Or Louisiana. Or Alabama.  Lately, the way people talk about those states has started to change. Instead of looking down on the Gulf South, they’re seeing it as a model.  Mississippi went from being ranked the second-worst state in 2013 for fourth-grade reading to 21st in 2022. Louisiana and Alabama, meanwhile, were among only three states to see modest gains in fourth-grade reading during the pandemic, which saw massive learning setbacks in most other states.  The turnaround in these three states has grabbed the attention of educators nationally, showing rapid progress is possible anywhere, even in areas that have struggled for decades with poverty and dismal literacy rates. The states have passed laws adopting similar reforms that emphasize phonics and early screenings for struggling kids.  “In this region, we have decided to go big,” said Burk, now a senior policy fellow at ExcelinEd, a national advocacy group.  Second grader Demi Hill, 8, listens during class at Schaumburg Elementary, part of the ReNEW charter network, in New Orleans, Wednesday, April 19, 2023. (AP Photo/Gerald Herbert) (AP)  These Deep South states were not the first to pass major literacy laws; in fact, much of Mississippi’s legislation was based on a 2002 law in Florida that saw the Sunshine State achieve some of the country’s highest reading scores. The states also still have far to go to make sure every child can read.  But the country has taken notice of what some have called the Mississippi miracle. Tennessee, North Carolina, Georgia, Kentucky and Virginia are among the states that have recently adopted some of the same policies. As Mississippi climbed the rankings, the Barksdale Institute, an influential organization in literacy policy in the state, got phone calls from about two dozen states.  The institute’s CEO, Kelly Butler, said she tells them there’s no secret to the strategy.  “We know how to teach reading,” she said. “We just have to do it everywhere.”  All three states have trained thousands of teachers in the so-called science of reading, which refers to the most proven, research-backed methods of teaching reading. They’ve dispatched literacy coaches to help teachers implement that training, especially in low-performing schools.  They also aim to catch problems early. That means screening for signs of reading deficiencies or dyslexia as early as kindergarten, informing parents if a problem is found and giving those kids extra support.  The states have consequences in place if schools don’t teach kids how to read, but also offer help to keep kids on track.  Mississippi, for one, holds students back in third grade if they cannot pass a reading test but also gives them multiple chances to pass after intensive tutoring and summer literacy camps. Alabama will adopt a similar retention policy next school year. It also sent over 30,000 struggling readers to summer literacy camps last year. Half of those students tested at grade level by the end of the summer.  At schools like Schaumburg Elementary, part of the ReNEW charter network in New Orleans, the new training has helped teachers zero in on what students need to read better. The share of kindergarteners reading at grade level at the charter network grew from 38% in December 2021 to 55% this spring; first-graders grew from 19% to 43%.  The state requires every K-3 teacher, elementary principal and assistant principal to take a 55-hour training course in the science of reading. It’s well worth the time, according to Assistant Principal Erika Brown, who said that in college she didn’t learn a thing about teaching kids to read.  “I was winging it,” she said of her early years in teaching.  During a recent session with four second-grade girls, Brown had the girls spell “crib,” asking, “What are the sounds you hear?”  Like a choir, they chanted back four individual sounds, counting them with their fingers: “c-rrr-i-buh.” This was one of the techniques Brown had learned in the training; counting four sounds, or phonemes, gave students a clue that the word had four letters. Increased screening also helped the school identify these girls as needing extra help.  “Are y’all ready for a challenge word?” Brown asked, and the girls shouted, “Yeah!” Their faces fell when Brown revealed the word: bedbug. They had no idea what the word even meant. But with Brown’s gentle guidance, the girls broke down the word into six phonemes. They were even ready for another challenge.  “Can we spell cock-a-roach?” one of the girls asked.  A second-grader in the school, Joshua Lastie, said he likes how his teacher helps him if he trips over a hard word, like “happened” or “suddenly.”  “The school is trying to make the words way easier for kids,” said Joshua, 7.  One challenge that comes with the emphasis on small-group intervention is the strain on scheduling and staffing. Literacy coaches from the state are helping the charter network strategize on how to reach all students. One resource the state can’t provide, says Lisa Giarratano, the chief academic officer at ReNEW, is time.  Literacy interventionist Liz Snapp talks with third grader Jakeem Henderson, 8, at Schaumburg Elementary, part of the ReNEW charter network, in New Orleans, Wednesday, April 19, 2023. (AP Photo/Gerald Herbert) Literacy interventionist Liz Snapp Jakeem Henderson, 8, 3rd grade (AP)  In a national climate where education debates are often polarizing, the three Gulf states passed their sweeping education reforms with bipartisan support, starting with Mississippi’s in 2013. Louisiana state Rep. Richard Nelson, a Republican who has championed literacy reform, said pointing to laws passed in other Deep South states made it easier for him to introduce legislation and “sell across party lines.”  “Every time I present a bill, I say, ‘Look, Mississippi has very similar challenges to what we have in Louisiana, and they’ve been able to make this work,’” Nelson said.  There is still far to go for children in the Gulf South, especially considering the disruptions to schooling from the pandemic and several major hurricanes and tornadoes. Mississippi, after stellar gains in the 2019 National Assessment of Education Progress, saw reading scores drop in 2022, although they are still at the national average. Around two out of five Louisiana third-graders, a particularly hard-hit age group, could not read at grade level at the end of last year. The same goes for over one-fifth of third-graders in Alabama.  Still, evidence suggests these states have made promising gains for low-income kids in particular. In 2019, Alabama ranked 49th in NAEP reading scores for low-income fourth-graders; in 2022, it ranked 27th. Amid the pandemic that saw most states lose ground, Louisiana soared from 42nd to 11th. Mississippi ranks second-highest in the country, after Florida.  Alabama’s state superintendent of education, Eric Mackey, says he has confidence in the reforms — in part because they’ve worked before. Alabama invested heavily in training on the science of reading, then known as phonics, in the early 2000s, and scores rose. Then the Great Recession hit, teachers and literacy coaches got laid off, and the state lost its gains.  Alabama has learned its lesson, Mackey said.  “We have to break that cycle of generational poverty. One of the best ways to do that is to make multiple generations of readers,” Mackey said. “This is something that we have to be in for the long haul.”  ___  The Associated Press education team receives support from the Carnegie Corporation of New York. The AP is solely responsible for all content.  Copyright 2023 The Associated Press. All rights reserved.","https://news.google.com/rss/articles/CBMiaGh0dHBzOi8vd3d3LjE0bmV3cy5jb20vMjAyMy8wNS8xNy9taXNzaXNzaXBwaS1taXJhY2xlLWtpZHMtcmVhZGluZy1zY29yZXMtaGF2ZS1zb2FyZWQtZGVlcC1zb3V0aC1zdGF0ZXMv0gF3aHR0cHM6Ly93d3cuMTRuZXdzLmNvbS8yMDIzLzA1LzE3L21pc3Npc3NpcHBpLW1pcmFjbGUta2lkcy1yZWFkaW5nLXNjb3Jlcy1oYXZlLXNvYXJlZC1kZWVwLXNvdXRoLXN0YXRlcy8_b3V0cHV0VHlwZT1hbXA?oc=5&hl=en-US&gl=US&ceid=US:en"
"miracle","2014-10-14","19:00:00","{""Stockbridge"", ""Georgia"", ""UnitedStates""}","Wed 17 May 2023 10:00:00","We attempted to send a notification to your email address but we were unable to verify that you provided a valid email address. Please click here to update your email address if you wish to receive notifications. Otherwise, you may click here to disable notifications and hide this message.","https://news.google.com/rss/articles/CBMifGh0dHBzOi8vbWVkaW5hLWdhemV0dGUuY29tL25ld3MvMzUyMjYyL21lZGluYS1zdW5yaXNlLXJvdGFyeS1kb25hdGVzLW5ldy1hbm5vdW5jZXJzLWJvb3RoLWZvci1taXJhY2xlLWxlYWd1ZS1iYXNlYmFsbC1nYW1lcy_SAQA?oc=5&hl=en-US&gl=US&ceid=US:en"
"miracle","2023-05-18","11:15:00","{""SanJose"", ""California"", ""UnitedStates""}","Thu 18 May 2023 05:45:49","May 18, 2023, 11:15AM IST  Source: TOI.in  Four children who were missing for more than two weeks after the plane they were traveling in crashed in a jungle in Colombia were found alive on Wednesday, May 17. The children, aged 13, 9, 4, and 11 months, were found in thick jungle in Caqueta province, local media reported. The plane, a Cessna 206, was carrying seven people on a route between Araracuara and San Jose del Guaviare, and went missing on May 1. Colombia's military said the two pilots of the plane and the children's mother were found dead on May 16. Footage and images released by the Colombian Military Forces shows the downed aircraft, soldiers searching for the children with canines, as well as traces left behind by the children, such as a bottle and fruit peels. The military said its canine units were able to track an improvised shelter made by the children along with other elements that gave them clues to the trail of the missing minors. The children were found in good health and were taken to a hospital in San Jose del Guaviare. They are expected to be reunited with their families soon. The discovery of the children is a miracle, and it is a testament to the resilience of the human spirit. It is also a reminder of the dangers of flying in remote areas, and the importance of safety precautions.","https://news.google.com/rss/articles/CBMikwFodHRwczovL20udGltZXNvZmluZGlhLmNvbS92aWRlb3MvdmlyYWwtdmlkZW9zL21pcmFjbGUtNC1jaGlsZHJlbi1mb3VuZC1hbGl2ZS1pbi1jb2xvbWJpYW4tanVuZ2xlLTItd2Vla3MtYWZ0ZXItcGxhbmUtY3Jhc2gvdmlkZW9zaG93LzEwMDMyMDc1NS5jbXPSAZcBaHR0cHM6Ly9tLnRpbWVzb2ZpbmRpYS5jb20vdmlkZW9zL3ZpcmFsLXZpZGVvcy9taXJhY2xlLTQtY2hpbGRyZW4tZm91bmQtYWxpdmUtaW4tY29sb21iaWFuLWp1bmdsZS0yLXdlZWtzLWFmdGVyLXBsYW5lLWNyYXNoL2FtcF92aWRlb3Nob3cvMTAwMzIwNzU1LmNtcw?oc=5&hl=en-US&gl=US&ceid=US:en"
