"topic","date"," time","place","date published","article text","url"
"miracle","2023-05-15","Not Discerned","{""London"", ""GreaterLondon"", ""UnitedKingdom""}","Fri 19 May 2023 06:22:00","An at-home skincare solution loved by A-list stars including Kim Kardashian, Gwyneth Paltrow, Meghan Markle and Hailey Bieber is winning rave reviews from the public for winding back the clock and getting rid of wrinkles.  When Kardashian recently appeared on Paltrow’s Goop podcast, and was complimented on her “flawless skin”, she revealed she swears by a magic LYMA laser recommended by her facialist Joanna Czech.  The Kardashian sister is the latest in a long string of celebrities who can’t get enough of the British-made magic tool that promises it is the ultimate skincare investment.  For more Sponsored Content related news and videos check out Sponsored Content >>  So what exactly is this buzzy - and pricey - device that retails for a cool $A3,486?  The LYMA Laser claims to be the world’s first medical-grade at-home laser device.  It combines four high-powered anti-bacterial blue LED lights with a laser beam to regenerate skin at cellular level, rather than just skimming over the surface.  An at-home skincare solution beloved by A-list stars including Kim Kardashian (pictured) is winning rave reviews. Credit: Instagram/Kim Kardashian  It targets wrinkles, ageing, skin tone and texture and general elasticity by getting to the deepest layers of skin and rebuilding them from the base up.  And it promises results in as little as 12 weeks.  Unlike many lasers, LYMA Laser has two lights.  The first is a blue LED light that aims to help eliminate bacteria that causes breakouts on the skin’s upper layers.  The second is a single “cold” laser that penetrates the skin’s deeper layers to repair signs of sun damage, pigmentation, and ageing at a cellular level.  The LYMA Laser claims to be the world’s first medical-grade at-home laser device, combining four high-powered anti-bacterial blue LED lights with a laser beam. Credit: LYMA  LYMA claims the laser is 100 times more powerful than LED.  And it doesn’t cause any harmful cell damage in the process, meaning there is no downtime and it’s suitable for all skin types.  Since the device launched in 2020, it has repeatedly sold out and been labelled the “at home skincare product of the decade”.  It is a staple in Hollywood, where it was recently used by A-list facialist Joanna Czech before the Oscars and the Met Gala.  It targets wrinkles, ageing, skin tone and texture and general elasticity by getting to the deepest layers of skin (before and after pictured). Credit: LYMA  Many have shared before and after pictures of the device and heralded it the “beauty buy of the decade”. Credit: LYMA  “I truly believe that good skin is based on 70 per cent of your lifestyle and 30 per cent of your skincare,” she tells 7Life.  “I like using the LYMA Laser because it tackles all major skin concerns and helps my clients achieve their skin goals.  “There are billions of cells in the dermis which de-generate over time and the LYMA Laser reverses this process by repairing the cells.”  She adds: “It reaches the deepest layers of the skin, including fat and muscle, which is why I recommend it for all my clients no matter their age”.  Celebrity facialist Joanna Czech uses it on all her A-list clients before the Oscars and the Met (Lily Aldridge pictured). Credit: Instagram/Lyma Life  But it’s not just celebrities who have seen incredible results (before and after pictured). Credit: LYMA  But it’s not just celebrities who swear by LYMA.  One woman recently wrote: “Just thought I would let you know that I have been using the LYMA Laser religiously and what a difference it makes!  “I am turning 50 on Monday and have people complimenting me on how good my skin is. So, big thank you to LYMA for guiding me on the usage”.  Another added: “I’ve been using the LYMA Laser for about two months now. I am so pleased with the results I’m seeing on cystic acne and scarring! It is the only thing that has ever helped”.  Others have shared incredible before and after pictures showing just how well - and how quickly - the laser has worked, with some describing it as a “miracle buy”.  Gwyneth Paltrow is one of a host of fans. Credit: Instagram/Lyma Life  LYMA Laser is proud of the fact it is the only laser that works on people with darker skin tones, who have previously had to stay away from laser treatments due to increased risk of scarring.  The nifty laser can also be used to reduce redness and inflammation, fade bruising, and reduce the appearance of cellulite and stretch marks.  For the first three months, LYMA recommends you use it every night.  After this, you can go down to a couple of times a week to maintain your results.  For more information about LYMA, click here.","https://news.google.com/rss/articles/CBMikgFodHRwczovLzduZXdzLmNvbS5hdS9saWZlc3R5bGUvc3BvbnNvcmVkL2tpbS1rYXJkYXNoaWFuLXN3ZWFycy1ieS1taXJhY2xlLWJ1eS1seW1hLWxhc2VyLWZvci1mbGF3bGVzcy1za2luLWhlcmVzLWhvdy15b3UtY2FuLWdldC1pdC10b28tYy0xMDcwMTM5M9IBlgFodHRwczovLzduZXdzLmNvbS5hdS9saWZlc3R5bGUvc3BvbnNvcmVkL2tpbS1rYXJkYXNoaWFuLXN3ZWFycy1ieS1taXJhY2xlLWJ1eS1seW1hLWxhc2VyLWZvci1mbGF3bGVzcy1za2luLWhlcmVzLWhvdy15b3UtY2FuLWdldC1pdC10b28tYy0xMDcwMTM5My5hbXA?oc=5&hl=en-US&gl=US&ceid=US:en"
"miracle","2023-05-18","Not Discerned","Not Discerned","Thu 18 May 2023 23:35:57","After an incredible series against FURIA on May 18, Sentinels still have a chance to make it to the VALORANT Champions Tour Americas playoffs—but their hopes have now been placed in the hands of three other teams.  In order for Sentinels to break into the VCT postseason, the team must cheer for three upsets to occur over the course of this weekend, starting with an Evil Geniuses victory over NRG. EG currently sits in fifth place with a 4-4 record, while NRG is in third, ahead of EG by a full series and two more map wins.  In order for @Sentinels to earn a spot for the #VCTAmericas playoffs, we have to see three upsets this week.    EG wins vs. NRG  LEV wins vs. LOUD  MIBR wins vs. 100T — VALORANT Esports NA (@valesports_na) May 18, 2023  The next upset victory needed might be one of the most unlikely ones of the weekend, with Sentinels cheering for Leviatán against the top squad of the split in LOUD. With a 14-7 map record and a single series loss, LOUD has established itself as a true championship contender. LEV, on the other hand, is coming off of a lopsided 2-0 loss to Cloud9 and has tumbled down the ladder recently, sitting in sixth place just above Sentinels and barely in the playoff picture themselves.  Related: Coach Kaplan on Sentinels’ VALORANT comms: ‘It went from a want to a need for players to step up and have a voice’  Lastly, Sentinels fans will be rooting for MIBR as they collide with 100 Thieves in the final matchup to watch this weekend. If this ninth-placed roster can pull together a series win to stop the Heist, then Sentinels’ miracle run will be complete, and one of North America’s most popular teams will have broken into the playoff picture.  This season has been a roller coaster for Sentinels fans after the roster struggled to find early success, on top of a handful of roster changes that made viewers doubtful of their postseason dreams.  But after some superheroic efforts from Zachary “zekken” Patrone and the return of Tyson “TenZ” Ngo, an incredible comeback story could be blossoming in front of our eyes—but only if they can get to the playoffs first.  About the author","https://news.google.com/rss/articles/CBMibGh0dHBzOi8vZG90ZXNwb3J0cy5jb20vdmFsb3JhbnQvbmV3cy9zZW50aW5lbHMtbWlyYWNsZS1ydW4tdG8tdmN0LXBsYXlvZmZzLXJlbGllcy1vbi10aHJlZS1pbXByb2JhYmxlLXVwc2V0c9IBAA?oc=5&hl=en-US&gl=US&ceid=US:en"
"miracle","2023-05-13","Not Discerned","{""Milan"", ""Lombardy"", ""Italy""}","Thu 18 May 2023 08:30:00","GRAND RAPIDS, Mich. (WOOD) — A new exhibit is coming to the Grand Rapids Public Museum, and there are plenty of outdoor activities to partake in now that the weather has shaped up nicely.  Here’s a look at what you can do the weekend of May 19:  Mastodon exhibit at the Grand Rapids Public Museum  A mastodon skeleton was unearthed last summer by a Kent County Drain Commission crew in Grant Township. Now, it will be displayed at the Grand Rapids Public Museum.  The Clapp Family Mastodon will officially be on exhibit starting Saturday and will pair with other items in the museum’s “Ice Age: Michigan’s Frozen Secrets” exhibit.  You can purchase your tickets to the museum by clicking here.  Eighth annual Milan Miracle Tournament  Hudsonville High School is hosting the eighth annual Milan Miracle Baseball and Softball Tournament this Saturday.  Schools from across the area will be there competing in a family-friendly environment. Proceeds raised will go towards the Milan Miracle Foundation, which funds childhood cancer research.  The tournament starts at 10 a.m. You can find more information by emailing Jlanphe@hpseagles.net or by calling 616.669.1500 ext. 2462.  Prom with a Purpose  The Momentum Center is holding the sixth annual Prom with a Purpose this Saturday from 5 p.m. to 9 p.m.  The event is designed to give everyone a chance at going to prom in a welcoming and inclusive environment. Along with the prom, there will be food, music and a silent auction.  Tickets are $25 per person and can be bought by clicking here.  Roll’N Out Food Truck Fest  This Sunday, head on down to the largest food truck festival in all of West Michigan for the fifth annual Roll’N Out Food Truck Fest.  From 11 a.m. to 8 p.m., enjoy tastings from dozens of trucks and enjoy some live music as well. You can also earn $5 in Food Truck Bucks by bringing in items needed at Kids’ Food Basket.  You can find more information on the event right now by clicking here.  Sneaker Nutz Shoe Convention  DeVos Place is the site of the Sneaker Nutz Shoe Convention this weekend.  Enjoy shopping or browsing a long list of one-of-a-kind footwear. Live music and raffles will also keep the energy going.  Tickets can be found by clicking here. The show will take place from noon to 6 p.m. on Saturday.  Parents’ Night Out at Fowling Warehouse  Looking for a night off from the kids? You may want to check out the Fowling Warehouse this Friday.  For $15, parents can enjoy pizza and a salad bar while engaging in conversations with other parents. If you’re in need of a sitter, there is a conjoined Kids’ Night Out as well.  All the information you need can be found here.  Local Spins Fest at Studio Park  The Local Spins Fest returns to Grand Rapids this Saturday at Studio Park.  Six bands will take over the stage as part of the festivities to honor the music website’s 11th anniversary. From every ticket sold, $1 will go toward supporting anti-poverty programs in the Grand Rapids area.  You can find the full lineup and purchase tickets here.  Lanterns on the Lake  The city of Portage is hosting Lanterns on the Lake this Saturday night.  It’s a way for people to honor their loved ones with a lamp that contains a special message and will be placed on the water at Ramona Park. There will also be live music.  More information can be found here.  Grand Haven Kite Festival  The Grand Haven Kite Festival is this weekend at the Grand Haven State Park.  Enjoy two days at the beach and a sky full of kites. You will even have the chance to try out your own kite while larger ones fly overhead.  Learn more about the festival and plan your trip by clicking here.  Kalamazoo Reptile Expo  The Kalamazoo Reptile Expo returns to the Kalamazoo County Expo Center this Saturday.  Starting at 10 a.m., enjoy looking at, petting or even purchasing a long line of exotic reptiles and other pets.  Tickets are just $5. You can find more information here.  Girls on the Run 5K  Girls on the Run West Michigan will be holding its annual Kent County Celebration 5K in downtown Grand Rapids this Saturday.  The race kicks off at 8:30 a.m. at Calder Plaza with more than 5,000 people expected to either race or show their support. You must be at least 16 years to race and registration costs $35.  You can find more information by clicking here.","https://news.google.com/rss/articles/CBMifWh0dHBzOi8vd3d3Lndvb2R0di5jb20vbmV3cy9uZXdzLTgtZGlnaXRhbC1zZXJpZXMvbXVzaWMtbWFzdG9kb25zLWFuZC1taWxhbi1taXJhY2xlLXdoYXQtdG8tZG8taW4td2VzdC1taWNoaWdhbi10aGlzLXdlZWtlbmQv0gGBAWh0dHBzOi8vd3d3Lndvb2R0di5jb20vbmV3cy9uZXdzLTgtZGlnaXRhbC1zZXJpZXMvbXVzaWMtbWFzdG9kb25zLWFuZC1taWxhbi1taXJhY2xlLXdoYXQtdG8tZG8taW4td2VzdC1taWNoaWdhbi10aGlzLXdlZWtlbmQvYW1wLw?oc=5&hl=en-US&gl=US&ceid=US:en"
"miracle","2023-05-20","Not Discerned","{""SanFrancisco"", ""California"", ""UnitedStates""}","Thu 18 May 2023 17:56:36","Calvin Harris claims the mark for the most No. 1s in the history of Billboard’s Dance/Mix Show Airplay chart all to himself, as “Miracle,” with Ellie Goulding, rises to the top of the tally dated May 20. Harris adds his 13th leader on the list, which began in August 2003, moving one ahead of both David Guetta and Rihanna.  The trancey “Miracle” is Goulding’s sixth topper and second with Harris, after “Outside” in 2015. Here’s a look at Calvin Harris’s record 13 Dance/Mix Show Airplay No. 1s.  Title, Weeks at No. 1, Year(s):  “Miracle,” with Ellie Goulding, one to-date, 2023  “Promises,” with Sam Smith, two, 2018  “One Kiss,” with Dua Lipa, 10, 2018  “This Is What You Came For,” feat. Rihanna, 12, 2016  “How Deep Is Your Love,” with Disciples, four, 2015  “Outside,” feat. Ellie Goulding, six, 2015  “Blame,” feat. John Newman, six, 2014  “Summer,” 13, 2014  “Thinking About You,” feat. Ayah Marar, one, 2013  “Sweet Nothing,” feat. Florence Welch, nine, 2013  “Let’s Go,” feat. Ne-Yo, 10, 2012  “We Found Love,” Rihanna feat. Harris, 14, 2011-12  “Feel So Close,” eight weeks at No. 1, 2012  “Miracle” is drawing core-dance airplay on KMVQ-HD2 San Francisco, Music Choice’s Dance/EDM channel and WCPY (Dance Factory FM) Chicago in the May 5-11 tracking week, according to Luminate. (The Dance/Mix Show Airplay chart measures radio airplay on a select group of full-time dance stations, along with plays during mix shows on around 60 top 40-formatted reporters.)  Additionally on Dance/Mix Show Airplay, Steve Aoki, Galantis and Hayley Kiyoko bound 16-10 with “Hungry Heart,” the sixth, 10th and first top 10 for each respective act.  Shifting to the multi-metric Hot Dance/Electronic Songs chart, David Guetta, Anne-Marie and Coi Leray lock in top Streaming Gainer honors with “Baby Don’t Hurt Me” (5-4), after the song’s official video premiered May 5. The track, a reworking of Haddaway’s 1993 hit “What Is Love,” earned 3.6 million official streams in the United States in the week ending May 11, up 15%. It also drew 7.3 million radio airplay audience impressions, up 13%, and sold 1,000 downloads, up 20%.  Concurrently, “Baby” bumps 13-6 on the Dance/Electronic Streaming Songs chart, giving Guetta his ninth top 10, Anne-Marie her second and Leray her first. It also pushes 5-3 on Dance/Electronic Digital Song Sales.  Sticking with Hot Dance/Electronic Songs, viral sensation Odetari debuts at No. 8 with “Good Loyal Thots.” His second top 10 in quick succession, after “Narcissistic Personality” (No. 10, May 6), garnered 3.4 million streams in its opening frame. That figure also sparks a No. 11 start on Dance/Electronic Streaming Songs.  Meanwhile, Depeche Mode claims the Hot Dance/Electronic Songs chart’s top Sales Gainer award for “Ghosts Again” (30-19). The lead single from the act’s LP Memento Mori is up 103%, following the May 5 release of official remixes by Chris Liebing and Luke Slater, Miss Grit, Davide Rossi and more. “Ghosts” also gathered 542,000 streams, up 52%.","https://news.google.com/rss/articles/CBMiZWh0dHBzOi8vd3d3LmJpbGxib2FyZC5jb20vcHJvL2NhbHZpbi1oYXJyaXMtbW9zdC1uby0xcy1kYW5jZS1taXgtc2hvdy1haXJwbGF5LW1pcmFjbGUtZWxsaWUtZ291bGRpbmcv0gEA?oc=5&hl=en-US&gl=US&ceid=US:en"
"miracle","2023-05-01","Not Discerned","{""May"", ""Oklahoma"", ""UnitedStates""}","Thu 18 May 2023 14:00:00","Miracle Touch Nails Spa coming soon to FM 2920 in Spring  In late May, Miracle Touch Nails Spa will begin offering manicure and pedicure services in Spring. (Courtesy Miracle Touch Nails Spa)  In late May, Miracle Touch Nails Spa will begin offering manicure and pedicure services in Spring. (Courtesy Miracle Touch Nails Spa)","https://news.google.com/rss/articles/CBMifmh0dHBzOi8vY29tbXVuaXR5aW1wYWN0LmNvbS9ob3VzdG9uL3NwcmluZy1rbGVpbi9idXNpbmVzcy8yMDIzLzA1LzE4L21pcmFjbGUtdG91Y2gtbmFpbHMtc3BhLWNvbWluZy1zb29uLXRvLWZtLTI5MjAtaW4tc3ByaW5nL9IBAA?oc=5&hl=en-US&gl=US&ceid=US:en"
"miracle","2017-10-14","15:00:00","Not Discerned","Fri 19 May 2023 02:03:02","Yoon Hee Keun, commissioner general of the Korea National Police Agency    [Photo provided by Korea National Police Agency]  I recently visited the U.S. to meet with the director of the Federal Bureau of Investigation to discuss comprehensive security cooperation, including action plans against cybercrime and terrorist threats. During the business trip, I visited the Korean War Veterans Memorial in Washington, D.C. to express respect and gratitude to them. Many Americans watched me in police uniform raising my hand in salute. They might have wondered who I was and why an Asian showed this honor and respect for fallen American soldiers. In truth, I was contemplating why the U.S. government built the memorial for those who shed blood for another country in the middle of the capital and people continued visiting to remember fallen military veterans. Then I realized the “ethos of this society” that remembers and honors those who sacrificed themselves for the community.The American people are well aware that, though war veterans risked their lives on behalf of other countries, they simultaneously sacrificed for freedom and peace - the universal values of humankind. They are very conscious that “remembering and honoring” the fallen soldiers is the backbone to safeguard a peaceful daily life and future prosperity.All U.S. citizens know the value of reward for patriotism better than anyone, I believe, and that has enabled the country to be the world’s most dominant economic and military power. It is said that there is a strong belief among American soldiers and law enforcement officials that “if I dedicate my life for the community and my country, the people will remember me and take care of my family.”It is unique in every developed country, including the U.S., to go all out to remember and honor those who sacrificed themselves for the public good. The elements of the state are the population, territory and sovereignty. Reward for patriotism, in particular, can be a key factor that makes it possible to protect the territory and nation and exercise the sovereignty.There is a saying that “a nation that forgets its past has no future.” As a law enforcement officer, I would like to put that in this way, “if we don’t remember those who devoted themselves for our nation, there will be no peace and prosperity for the country.” In this respect, it is greatly encouraging to see the new veterans’ ministry, being upgraded to a cabinet-level body from its sub-ministry status.The police recently launched a campaign of “the miracle of 100 KRW.” It is a fund-raising campaign for the children of police officers who died in service. I personally hope that this will be an opportunity for the children losing a parent to feel our deep affection for them. Hopefully, they recognize that we are proud of their parents and will never forget the ultimate sacrifice in service to our nation.This small but heartfelt action will bring hope and courage to the children of fallen heroes. It also serves as an opportunity for us to be proud of who we are. The idea that small but meaningful efforts can make a big difference has grabbed the attention of huge number of police officers.I floated this idea with a calculation that if all police officers across the country join the drive, I could raise and deliver roughly 13.85 million won ($10,600) per month to children who lost a parent, but I was wrong. The idea has brought us more than 40 million won ($30,000) in just two months since it began. It would help the children, particularly those having medical needs, to relieve the financial burden caused by the death of a parent.I reasonably call this campaign a small miracle for three reasons. First, this has driven 140,000 police officers together. Secondly, a salary statement showing the deducted 1000 won reminds us of their sacrifices. And last but not least, this small donation could give hope and courage to the children of fallen heroes. The inscription on the wall of the National Academy training FBI agents epitomizes the sentiment shared by us, law enforcement officials.“May we never forget.”(With 32 years of service, Yoon is the commissioner general of the Korea National Police Agency and has worked in various policing areas including the police administration and management, intelligence and public safety.)  By Yoon Hee Keun, commissioner general of the Korea National Police Agency  [ⓒ Pulse by Maeil Business News Korea & mk.co.kr, All rights reserved]","https://news.google.com/rss/articles/CBMiNGh0dHBzOi8vcHVsc2VuZXdzLmNvLmtyL3ZpZXcucGhwP3llYXI9MjAyMyZubz0zODQwMTHSAQA?oc=5&hl=en-US&gl=US&ceid=US:en"
"miracle","2023-05-19","Not Discerned","Not Discerned","Fri 19 May 2023 06:38:00","BasketNews expert Augustas Suliauskas argues that this year Barcelona have such an advantage that Real Madrid will need a miracle in the upcoming semifinal. Barca have a big advantage in the paint and seemed to learn from the last year's mistakes, which could be crucial in Friday's matchup.  Credit: Tolga Adanali/Euroleague Basketball via Getty Images  No Guerschon Yabusele, no Gabriel Deck, no Vincent Poirier. The frontcourt of Real Madrid is bleeding, and so are the chances of them moving forward.  Oh, but we are back to single-elimination format again, and if there's a team that might go on a crazy run to steal the game, look no further than Chus Mateo's squad. Partizan Belgrade fans could co-sign on this.  However, Barcelona look like a clear favorite here after sweeping Zalgiris Kaunas in the quarterfinals. Madrid, on the other hand, has many questions to answer.  Who is going to guard Nikola Mirotic? Should they double him, knowing that his primary defender will probably be lighter and not as strong as him? How to answer Barca's counters against Edy Tavares protecting the paint?  For Sarunas Jasikevicius, the key factors are clear. They must limit transition opportunities, solve Tavares' catches inside the paint & slow down Madrid's pick-and-rolls with Sergio Rodriguez, Sergio Llull, and Dzanan Musa.  Let's look at examples from the most recent El Classico's to understand how tomorrow's semifinal will shape up.  Stopping Nikola Mirotic  Everybody in Europe knows that post-ups are a huge part of Barcelona's offense. According to InStat play type data, in 14 head-to-head matchups during these two seasons, the Catalans used it on almost 12% of their possessions, while other teams against Madrid used it for only 6% of the time.  Their best player, Mirotic, excels there as well. Expect Saras to","https://news.google.com/rss/articles/CBMiWGh0dHBzOi8vYmFza2V0bmV3cy5jb20vbmV3cy0xODk2Nzctd2h5LXJlYWwtbWFkcmlkLW5lZWQtYS1taXJhY2xlLXRvLWJlYXQtYmFyY2Vsb25hLmh0bWzSAQA?oc=5&hl=en-US&gl=US&ceid=US:en"
"miracle","1954-10-14","Not Discerned","{""Eufaula"", ""Alabama"", ""UnitedStates""}","Fri 19 May 2023 06:30:00","State Alabama Alaska Arizona Arkansas California Colorado Connecticut Delaware Florida Georgia Hawaii Idaho Illinois Indiana Iowa Kansas Kentucky Louisiana Maine Maryland Massachusetts Michigan Minnesota Mississippi Missouri Montana Nebraska Nevada New Hampshire New Jersey New Mexico New York North Carolina North Dakota Ohio Oklahoma Oregon Pennsylvania Rhode Island South Carolina South Dakota Tennessee Texas Utah Vermont Virginia Washington Washington D.C. West Virginia Wisconsin Wyoming Puerto Rico US Virgin Islands Armed Forces Americas Armed Forces Pacific Armed Forces Europe Northern Mariana Islands Marshall Islands American Samoa Federated States of Micronesia Guam Palau Alberta, Canada British Columbia, Canada Manitoba, Canada New Brunswick, Canada Newfoundland, Canada Nova Scotia, Canada Northwest Territories, Canada Nunavut, Canada Ontario, Canada Prince Edward Island, Canada Quebec, Canada Saskatchewan, Canada Yukon Territory, Canada  Zip Code","https://news.google.com/rss/articles/CBMifWh0dHBzOi8vd3d3LnN0YXJkZW0uY29tL29waW5pb24vY29sdW1ucy9zaWNrLWdpcmwtdGhlLW1pcmFjbGUtb2YtdHJhbnNwbGFudC9hcnRpY2xlXzAwNGMxMjA2LTk5YzUtNTZhOS04M2M0LTAyNjIyNWNiNmQ4NS5odG1s0gEA?oc=5&hl=en-US&gl=US&ceid=US:en"
